,Name,Review Rate,Review Time,Review Text
0,De blauwe Hollander, 4 stars ,4 months ago,"Small space with a cosy atmosphere. The waiters are very friendly and attentive. The food was delicious, and it's a great occasion to taste traditional Dutch food."
1,De blauwe Hollander, 3 stars ,5 months ago,Honest restaurant in a crossing of streets overloaded with touristy restaurants. …
2,De blauwe Hollander, 5 stars ,3 months ago,"The place has a pretty nice interior, well arranged, cozy corners and big tables if needed.  We were immediately welcomed by the staff which was nice and helpful all along. We went for some mixed appetizers followed by a couple of local …"
3,De blauwe Hollander, 5 stars ,3 months ago,This place serves proper authentic dutch food. The waiters there are super friendly and we had great service by this guy who was a somewhat polyglot. I had the beef.. the photo doesnt do it justice. I had already dug in.
4,De blauwe Hollander, 5 stars ,3 weeks ago,Very tasty samppot with fast service and friendly staff . Perfect for a dutch stop
5,De blauwe Hollander, 5 stars ,5 months ago,"Amazing food, wonderful service, great setting, the Stamppot with onions carrots and beef was fantastic! The ribs were excellent! Highly recommended!"
6,De blauwe Hollander, 5 stars ,2 months ago,Amazing Dutch food and friendly service. Definitely reccomend this restaurant. Sauerkraut Stamppot and Slavinken were utterly delicious.
7,De blauwe Hollander, 5 stars ,3 weeks ago,"Great food and the staff was so kind and sociable!! Highly recommended,prices are nice!!"
8,De blauwe Hollander, 5 stars ,a month ago,Such a welcoming experience ! My girlfriend and I ate there today and the waiter was extremely kind and friendly (come to Paris again) ! We were sad to not be able to say goodbye to him directly. Definitely recommend to anyone who would love to eat LOCAL Dutch food.
9,De blauwe Hollander, 5 stars ,6 months ago,"Delicious food and wonderful staff, definitely recommended if you're in the area and are looking for a filling meal with local dishes."
10,De blauwe Hollander, 5 stars ,6 months ago,"The service has been excellent, the food was even better.

It has been difficult for us to find a place with typical Dutch food, I think this is the perfect place to try it."
11,De blauwe Hollander, 5 stars ,a month ago,Very friendly people. Feeling comfortable inside this place. After first visit we decided to get back the other day. Food is good and I think traditional. …
12,De blauwe Hollander, 5 stars ,6 months ago,"Great food, fair prices. Good service.

Tradicional Dutch food. Right in front of ""the Pantry"" which by the look of the place and the food I think we made the right choice."
13,De blauwe Hollander, 5 stars ,8 months ago,"Delicious food, typical Dutch cuisine, great service, very professional, friendly staff. They really go the extra mile. I would Definitely recommend this restaurant. Deja definitely made our experience a memorable one."
14,De blauwe Hollander, 5 stars ,4 months ago,"Splendid dutch food, awesome service, cozy atmosphere. Definitely recommended."
15,De blauwe Hollander, 5 stars ,3 months ago,"We had a really good time. The waiter as was nice, food was delicious!
I would recommend booking a table if you want to come, it was full the night we were there."
16,De blauwe Hollander, 5 stars ,6 months ago,Delicious food and  super friendly staff!! Can recommend!!
17,De blauwe Hollander, 4 stars ,2 years ago,"Cozy, charming and delicious food! We ate here on a Thursday evening and the restaurant was very busy, even for a weeknight. I had the Schnitzel and it was amazing. Reminded me of my mom making it when I was growing up. Loved sitting near …"
18,De blauwe Hollander, 5 stars ,2 years ago,The best restaurant all over the Amsterdam area. A small place but with a warm welcome makes you feel really comfortable. Something that I really like is the softness and lightness of the food that the chef prepared at the moment. They give …
19,De blauwe Hollander, 5 stars ,4 months ago,Excellent food in a lovely restaurant with friendly staff. It was thanks to this restaurant that I was able to complete my checklist of traditional Dutch food to try. I would recommend this place to anyone visiting Amsterdam.
20,De blauwe Hollander, 3 stars ,2 years ago,We wanted to try Dutch cuisine on the last day of our stay in Amsterdam. This restaurant was suggested by our tour guide as an authentic Dutch restaurant frequented by locals. We had to wait despite booking a table over the phone. Service …
21,De blauwe Hollander, 5 stars ,2 years ago,"Delicious and authentic Dutch food. I had  Stampottje (meat like sausage or meatball on mash potatoes mixed with vegetables and gravy), Heineken and apple pie. Everything was delicious. Service was pretty good, I did wait a bit to order but other than that it was great. Would love to go again!"
22,De blauwe Hollander, 5 stars ,2 years ago,"The food was very good. We took the pea soup, the pumpkin soup, the spare ribs and the liver. Everything was very tasty, but the ribs were more than that - they were amazing! …"
23,De blauwe Hollander, 2 stars ,4 months ago,"Food was ok. I have had better Stamppot before and also the soup was fine (no bread is served with it). Coffee is Lavazza coffee which is good, but they failed to prepare it in the real Italian way. …"
24,De blauwe Hollander, 5 stars ,4 years ago,One of the best meals that I had in Amsterdam. They had amazing local food. We tried the stramppot which was to die for and the croquettes were delicious. Must visit for anyone wanting to try some authentic Dutch food.
25,De blauwe Hollander, 4 stars ,5 months ago,"Good service, and good food.
It was a good experience for the first time we tried the bitterballen and local bier. …"
26,De blauwe Hollander, 5 stars ,3 months ago,My all time favorite Dutch Food Restaurant for more then 3 decades.. Proud to have worked there in the early days. The amazing Quality never changed.. 😘
27,De blauwe Hollander, 5 stars ,3 years ago,This place is great!! We were looking for a place to try some traditional Dutch food and came across this gem! Aggie (sp?) Made several food and wine recommendations and because it was a slower night was able to talk with us about Dutch …
28,De blauwe Hollander, 5 stars ,3 years ago,Great authentic Dutch cuisine. I had the traditional Meatball Stamppot that comes with their homemade mash potato. We also had the bitterballen that was equally tasty. Would definitely recommend to make a reservations as it is rather popular for tourist and locals alike.
29,De blauwe Hollander, 5 stars ,3 months ago,"The food is very local and delicious, the restaurant is warm, welcoming and well decorated above all during Christmas period. …"
30,De blauwe Hollander, 5 stars ,3 years ago,"thanks to tripadvisor , we had 50% discount on our bill. 79€ for 6 ppl. is great. food was also very tasty and staff very nice. would definitely recommend."
31,De blauwe Hollander, 5 stars ,2 years ago,"A local recommended us this place for the stamppot and it was a great idea to come and visit it. The food was delicious, very tasty, the portions were good. We got the menu (soup, stamppot and dessert) Everything was lovely. The waitress …"
32,De blauwe Hollander, 5 stars ,a year ago,Great stuff! And the food: one of the best restaurants I've ever been to!! The authentic dutch food isn't expensive And it is delicious!! Highly recommended!!!
33,De blauwe Hollander, 5 stars ,5 months ago,"Sunday, 1.Okt. 21, I stayed with a girfriend for dinner in this restaurant. A smart young man, he told us he comes from the northnetherlands, served in a perfect way, was so friendly, that a farewell was hard. Thanks a lot for this good time in this restaurant Christian K. / Frankfurt/M."
34,De blauwe Hollander, 4 stars ,a year ago,Enjoyed our visit here. The food was tasty and well prepared and the staff were friendly and welcoming. Booked using 'the fork' app and got 50% discount making it superb value. Definitely recommend.
35,De blauwe Hollander, 5 stars ,2 years ago,Great food with great price. The attendant was really amazing and gave great attention with explanation for the dishes and trying to suggest the best option.
36,De blauwe Hollander, 5 stars ,3 years ago,Very nice atmosphere and kind staff. Loved the pea soup and the homemade chocolate cake.
37,De blauwe Hollander, 5 stars ,2 weeks ago,"Very delicious food, nice personal and very beautiful place."
38,De blauwe Hollander, 5 stars ,6 months ago,Really nice and traditional dutch restaurant. The food was simple yet delicious and the staff was really welcoming and kind!
39,De blauwe Hollander, 4 stars ,4 years ago,"come here on sunday night. No reservations need and there are table available immediately luckily. Ordered carrot & curry soup, quite salty. For main, we had halibut and dutch beefsteak. You must try the fish as it tasty very soft. The beefsteak was nice too. Will definitely come back for the first next time."
40,De blauwe Hollander, 5 stars ,2 years ago,"Traditional Dutch cuisine. Delicious food with a friendly and helpful staff that happily answered all our questions about the menu. Online reservations possible and while there were plenty of tables at 18:00 when we arrived by the time we left the restaurant, it was packed and people had to wait for an available table."
41,De blauwe Hollander, 5 stars ,a month ago,"It’s not often to have a warm welcome like this, waiters & waitresses are so kind, food is really tasty, I really recommand it!"
42,De blauwe Hollander, 5 stars ,4 months ago,The Stamppot was simply delicious! Impecable service. Friendly and helpful waiter. Definitely recommendable.
43,De blauwe Hollander, 5 stars ,8 months ago,Very good typical dutch cuisine. Bonus points for the fine spirits.
44,De blauwe Hollander, 5 stars ,3 years ago,"Food was delicious. Staff super friendly  highly recommend this place to anyone wanting to try Dutch food The Hutspot is great, no need for a knife to cut the beef. The potato with carrots & onion is wow."
45,De blauwe Hollander, 5 stars ,4 months ago,"beautiful, place. if you want delicious national food for reasonable price and comfort"
46,De blauwe Hollander, 3 stars ,5 years ago,"If you want Dutch food amidst the tourist-serving commercialised restaurants in Leidseplein, this is probably the only one! Have brought my guests here, and usually ordered the stamppot and croquette. The soup while very thick tasted more …"
47,De blauwe Hollander, 5 stars ,6 months ago,Delicious and authentic Dutch cuisine. Staff are very friendly as well. Very recommended place for any traveller that wants to enjoy the Dutch culture
48,De blauwe Hollander, 5 stars ,a year ago,Excellent dutch mix starters!!! And the bitter lemon is a different drink (non alcoholic) to try.
49,De blauwe Hollander, 5 stars ,2 years ago,A must if you want to try the traditional Dutch cuisine! The staff was very nice and the food was delicious
50,De blauwe Hollander, 4 stars ,5 months ago,"Food was great, but it was an hour until the food was served, and almost another hour until dessert was served."
51,De blauwe Hollander, 5 stars ,4 years ago,"Great atmosphere, and love the portions. The restaurant is in a great location, and service is very good."
52,De blauwe Hollander, 5 stars ,2 years ago,Great Netherland traditional dishes. Nice mood and service. Hope to visit there again.
53,De blauwe Hollander, 5 stars ,3 months ago,Very friendly staff and good food. We had a great time there!
54,De blauwe Hollander, 3 stars ,3 years ago,"Inattentive staff, and a bit pricey for what you get. The veggie pie with goats cheese was very good, but small, ""lunch/snack-sized"". Also had the Hotch potch (the same as a Stammpott, only without meat) with endive and cheese croquettes. A …"
55,De blauwe Hollander, 4 stars ,5 years ago,"Nice restaurant, cosy and warm feeling. Good menu with some typical Dutch meals. It was well prepared and the service was good and always with a smile"
56,De blauwe Hollander, 5 stars ,a year ago,"Comfort food! Very good service, great music!"
57,De blauwe Hollander, 5 stars ,2 years ago,"Lovely staff, great food, best restaurant in Amsterdam (try the ribs) 🥂"
58,De blauwe Hollander, 5 stars ,6 months ago,"Big portions, friendly staff and the meals were tasty. Recommend!"
59,De blauwe Hollander, 5 stars ,3 years ago,Lovely little place and not too expensive. Great to try Dutch cuisine. Tried the kale and sausage Stampott and it was great. Would reccommend.
60,De blauwe Hollander, 3 stars ,3 years ago,"Dutch food experience, roast pork belly is good . Snert not to my liking . Poefertjes just ok we have tried better in the market.  Staff so so not too friendly not too rude. Just an ok experience."
61,De blauwe Hollander, 4 stars ,3 years ago,"Very tasty with dutch speciality ! Homemade meatballs were great !!!!! And the starter too, i cant remember the name ! Spicy and very tasty !!!!"
62,De blauwe Hollander, 5 stars ,5 months ago,"Lovely place with friendly service, and great typical Dutch food."
63,De blauwe Hollander, 5 stars ,2 years ago,"Quite an authentic experience, with great service, comfy decor, and relaxing ambiance. Food seems to be very traditional, but then again we are foreigners so this is our best guess."
64,De blauwe Hollander, 4 stars ,3 years ago,"Excellent food and polite service. However, for our group of eight it took over an hour to receive our food after ordering."
65,De blauwe Hollander, 5 stars ,6 months ago,"With my familly we spent an excellent moment there with good dutch specialities, very nice staff and high value for money. I will probably come back when in Amsterdam."
66,De blauwe Hollander, 4 stars ,5 months ago,"Cozy place, average dish but the dessert was great!"
67,De blauwe Hollander, 5 stars ,4 years ago,"Top notch Dutch fare. Bitterballen, Vlammetjes, pancakes etc. Pretty full at lunch so be prepared to wait for a short while. But it's worth it!"
68,De blauwe Hollander, 5 stars ,5 months ago,Good food and very good service. Nice atmosphere in the restaurant
69,De blauwe Hollander, 5 stars ,8 months ago,Very tasty and warm staff
70,De blauwe Hollander, 5 stars ,4 years ago,We have eaten in this great Dutch restaurant many times over the last 7 years!!  By far one the best Dutch restaurants in the area!!
71,De blauwe Hollander, 5 stars ,7 months ago,"The food was so tasty, and the two girls working there were very friendly and they made sure that everything is good. Thank you, will certainly come again"
72,De blauwe Hollander, 5 stars ,2 years ago,Meatball with mashed potatoes (sorry I don't know the exact name) was delicious. Excellent beer and service.
73,De blauwe Hollander, 3 stars ,4 years ago,Dinner was so-so but dessert was great! Highly recommend the poffertjes (mini pancakes)!
74,De blauwe Hollander, 4 stars ,3 years ago,"Very nice restaurant with actually pretty authentic Dutch food! There's a broad variety of things to choose from. Great craft beer on offer from a local brewery. Staff was friendly and surprisingly efficient. Tables right at the street if you like that. That street is a pedestrian zone, so quiet and great for people watching."
75,De blauwe Hollander, 5 stars ,2 years ago,"We choose the place for sentimental reason (been here 20-ish years ago when we were, well...younger) and we proved right once again! Personal considerations aside, you will enjoy it a lot because they don't make you feel a mere tourist or a …"
76,De blauwe Hollander, 5 stars ,6 months ago,"What a great food!!! Very kind, friendly and helpful stuff!!!
We will come again for sure!!!"
77,De blauwe Hollander, 5 stars ,4 years ago,Unpretentious restaurant that serves delicious food at a reasonable price. Very good experience!
78,De blauwe Hollander, 5 stars ,2 years ago,"The food was extremely tasty and was an excellent way for my friend and I to further experience Dutch culture. The owner and our waitress were very welcoming and friendly - we ended up speaking with them for a while over our lunch. Awesome atmosphere, awesome food! Highly recommended!"
79,De blauwe Hollander, 5 stars ,2 years ago,"It's been a while since I went here, but it was a fantastic place to try traditional Dutch cuisine.  I had the pea soup and hutspot, if I remember correctly, and it tasted amazing.  It seems hard to find restaurants serving this kind of food so it's an excellent place for a meal in Amsterdam."
80,De blauwe Hollander, 5 stars ,2 years ago,"Great dutch gastro experience, friendly staff  and moderate prices!"
81,De blauwe Hollander, 5 stars ,6 months ago,Loved the Dutch food and they served Dutch dessert liquor on the house
82,De blauwe Hollander, 5 stars ,2 years ago,"Great decor and service, reasonably priced food and drinks"
83,De blauwe Hollander, 5 stars ,a year ago,"I ate at this place with my brother and friend who had never been to amsterdam, definitely a great choice of typically dutch food which was what we were looking for. Staff was very friendly and professional. Will come back! Tot gauw"
84,De blauwe Hollander, 4 stars ,3 years ago,This is one of cafes lined up on the road and right opposite to an Italian restaurant. I wanted to have some local food so decided to order something from here. Being a vegetarian I was not sure if I would find something good. I ordered for …
85,De blauwe Hollander, 4 stars ,a year ago,"Great dinner in a cozy and very friendly environment with a super kind host.
Portions are super generous, quality is very good and the overall price was definitely adequate!
I strongly recommend it!"
86,De blauwe Hollander, 1 star ,3 years ago,"More like “De Bland Hollander”! Amateur and unfriendly staff took 10 minutes just to prepare a table for us, and took a further 5 minutes to give us our menus. The waiter didn’t know anything about the wines or drinks on their menu when we …"
87,De blauwe Hollander, 5 stars ,3 years ago,"My wife and I wandered into this restaurant our first day in Amsterdam . In case it wasn't obvious, were Americans and struggle with other languages (thanks public school) . The waiter came out just to greet us. He was incredibly friendly …"
88,De blauwe Hollander, 5 stars ,a year ago,"Bitterballen, herring with onion and beetroot (particularly fine!), Stampots galore, chicken & sate sauce, liver with onion and mash, apple cake, poffertjes - all served with good cheer and good beer in a busy and sometimes crowded room, …"
89,De blauwe Hollander, 5 stars ,8 months ago,Awesome customer service. Best i have had in Europe. The food was delicious.
90,De blauwe Hollander, 5 stars ,3 years ago,"Amazing staff, hosts and food. Location is great too."
91,De blauwe Hollander, 5 stars ,3 years ago,Good local food and nice selection of beer. The price price/portion ratio was preaty good to.
92,De blauwe Hollander, 5 stars ,a year ago,Very nice stuff!! We went there around 10pm and were very warmly welcomed by the stuff. We got excellent food (Dutch meatball) . I highly recommend this restaurant 👌
93,De blauwe Hollander, 4 stars ,2 years ago,A small restaurant that serves traditional dutch dishes. Their set menu can be a good deal for those looking to try out various traditional dutch dishes at a reasonable price. It was a bit noisy from the floor upstairs but overall the service was friendly and we had a good time there
94,De blauwe Hollander, 4 stars ,2 years ago,"If you're after a menu as close to what you can classify as Dutch, this is it. The waiters were friendly, the food was really good and comparatively priced. The area can be a bit of a tourist trap, but then again, the restaurant is what you're there for."
95,De blauwe Hollander, 2 stars ,2 years ago,The staff was not friendly but not entirely rude. I had a vegetable pie which was terrible. (I could not finish it.) My spouse had the beef staampot which was okay. I wish we had eaten again at Antonio’s which is next door. The food there was great!
96,De blauwe Hollander, 5 stars ,2 years ago,"Bitterballen, herring with onion and beetroot (particularly fine!), Stampots galore, chicken & sate sauce, liver with onion and mash, apple cake, poffertjes - all served with good cheer and good beer in a busy and sometimes crowded room, …"
97,De blauwe Hollander, 5 stars ,a year ago,Great place! Here you have a choice for Dutch traditional food and also other types if you like. The staff is just amazing!
98,De blauwe Hollander, 4 stars ,4 years ago,"Very Tasty Dutch food. The prices are okay, for food with this quality . We ate a  Häring with beetroot as a Starter, mussels and the Boillabaise as primr, both was perfektly cooked and Super delicious. They have good Beer from a local …"
99,De blauwe Hollander, 1 star ,3 years ago,"We had lunch in this restaurant yesterday !! Two of my friends, my boyfriend and I ... Everything was going well: nice atmosphere, good food... Until the end of the meal, when our server made quite unpleasant questions and comments …"
100,De blauwe Hollander, 3 stars ,3 years ago,Dutch comfort food . The service was not rushed and the food was basic but hearty .
101,De blauwe Hollander, 4 stars ,3 years ago,Waited long for the food. Overall good
102,De blauwe Hollander, 4 stars ,5 years ago,"Fair atmosphere, staff was reasonably friendly, food seems authentic.

For starters we had the homemade cheese croquet: yummy. For mains I had the …"
103,De blauwe Hollander, 5 stars ,3 years ago,"Nice restaurant with Dutch cuisine. Didn't really have a clue about Dutch dishes, but was positively surprised. The service is very friendly and willing to help. The place can get pretty crowded, so I'd recommend to reserve a table in advance."
104,De blauwe Hollander, 3 stars ,3 years ago,"It is a good place in which you can find typical dutch dishes, both meat and fish. It is close to Leidseplein and this means that you can easily reach the Centrum or the Museum- Kwartier. The service is quite good as the food quality. If you are a group, I recommend booking the table first!"
105,De blauwe Hollander, 5 stars ,6 years ago,"The food can't be more Dutch. But it's done in a perfect way. I still can't get my head around it... As I'm used to eat this at grandma's or my mother's. But these dishes are spot on. I just loved the haring with beetroot, but highly …"
106,De blauwe Hollander, 5 stars ,4 years ago,Food in this restaurant was fantastic.  We stumbled at this restaurant by chance and were very pleased with it. Food was tasty and ingredients seemed  super fresh. If you want a tasty Dutch cuisine do visit this restaurant!
107,De blauwe Hollander, 5 stars ,2 years ago,Always a great choice for great traditional Dutch food. Has plenty of vegetarian options as well. Can be crowded though so best to make a reservation if you have the time.
108,De blauwe Hollander, 1 star ,4 years ago,I loved dutch food so the last night before flight back home we decided to go for stroppot  and traditional soup. This place was not far from our hotel and reviews were ok so we went there. The food was very tasty. BUT. I’ve got food …
109,De blauwe Hollander, 4 stars ,5 months ago,Nice if you want to have some Dutch food
110,De blauwe Hollander, 5 stars ,4 years ago,"OK, this is not your typical touristy restaurant!!!
This is another locals place and you have to stop in and have a meatball...yes, a meat ball!!! …"
111,De blauwe Hollander, 1 star ,3 years ago,"One star for consistency. Consistently BAD. We ordered two starters and a main and the food took one hour to arrive. The bitterballen was mediocre. The potato spring onion soup weekly 'special' was overseasoned. The main, halibut, was bland …"
112,De blauwe Hollander, 4 stars ,6 years ago,Definitely the place if you want authentic Dutch food - which is more hearty than refined.  I would warn all however to come with a very empty stomach as it is very filling. We would have appreciated smaller servings so we could enjoy a …
113,De blauwe Hollander, 5 stars ,2 years ago,"The food was very good, they serve very traditional Dutch food with that home flavour. The service is very friendly and efficient. My congratulations to all the girls serving that night"
114,De blauwe Hollander, 5 stars ,3 years ago,"It’s really hard to find a local restaurant in the city. There’s not much restaurants of that kind, but De Blauwe is the one! Menus are cheap, food is great and you won’t be hungry at the end of the meal. The staff is welcoming. A lovely discovery!"
115,De blauwe Hollander, 5 stars ,2 years ago,Excellent food! And the service was great. It is tight quarters so I wouldn't go to have a private talk. Attractive and yummy!
116,De blauwe Hollander, 4 stars ,2 years ago,Best of most tourist meals offer downtown fast food rest in crowded Amsterdam July 2019. Dutch cuisine they said. Good and kind service.
117,De blauwe Hollander, 4 stars ,3 years ago,Nice and cozy place to dine in. Food is some Dutch basic but hearty and generous. The staffs and service are very friendly. Would love to recommand this restaurant ✌🏻
118,De blauwe Hollander, 5 stars ,3 years ago,"Had a lovely Stampot here, would highly recommend, nice friendly welcoming staff too!"
119,De blauwe Hollander, 3 stars ,4 years ago,"Mixed feelings. We had a mussels pan and a vegetarian dish with cheese croquetes. The mussels were fine, fresh and tasty. But the vegetarian dish felt like an afterthought. Bland and boring in taste. But most importantly, poorly reheated …"
120,De blauwe Hollander, 5 stars ,4 years ago,"Doesn't look like much from the outside however this restaurant is a little gem! Friendly and helpful staff and amazing local cuisine. Checkout the good local beers too. If you only have time to visit one restaurant in Amsterdam, make it this one!"
