,Name,Review Rate,Review Time,Review Text
0,GlouGlou, 5 stars ,4 months ago,Great place which is always busy with crowd of happy people both inside and outside. Never disappointing selection of natural wines by glass. You can also buy a bottle to go with a discount of 15Eur off the menu price. …
1,GlouGlou, 5 stars ,3 weeks ago,A good place to drink some wine and do some people-watching. Service is friendly but you won’t find many things to eat. I enjoyed the atmosphere.
2,GlouGlou, 4 stars ,8 months ago,It's a very good natural wine bar in Amsterdam. We tried some amazing orange wines. The service was also good. They offered to let us taste some wines on the menu before ordering. A good place to hangout on a nice afternoon.
3,GlouGlou, 4 stars ,a month ago,"Small but nice wine list, good snacks, cute space. Staff was a little slow and inattentive, but I'd expect that from most places after being shut and opened repeatedly over two years. Will definitely be back."
4,GlouGlou, 5 stars ,2 years ago,"A fantastic wine bar with lots of character and a great selection of wine, at very reasonable prices. It's located a little away from the really touristy center of Amsterdam and is better for that. There's a good mix here of locals and …"
5,GlouGlou, 3 stars ,3 weeks ago,"My neighborhood wine lounge. Love love love it. Besides the wines and the ambiance, my be favorite is le confit de canard, yummmm"
6,GlouGlou, 5 stars ,6 months ago,Great natural wine bar. We loved it
7,GlouGlou, 5 stars ,2 years ago,The place is located in the de pijpe region of Amsterdam which is by far the coolest part of town with great food choices. Another benefit is that it's away from the central area when there is way too much pot smell.  This place is a great …
8,GlouGlou, 5 stars ,3 weeks ago,"Lovely team, great wines, good atmosphere and crowd.
Don‘t skip the Bread with olive oil!"
9,GlouGlou, 5 stars ,2 years ago,"Glou glou is my fav Neighbourhood wine bar. Get a spot outside and enjoy multiple glasses and the cheese board and olives while you people watch and enjoy the blissful European summer evenings 👌🏻
they also do take away wine!"
10,GlouGlou, 5 stars ,2 years ago,"Natural wines and comfort food. Try their sardines with something bubbly! Cool outdoor seating, interior looks a bit too grunge."
11,GlouGlou, 5 stars ,a week ago,"Super nice place, great environment and superb service!

Thank you Stella!! We had a lovely time!"
12,GlouGlou, 5 stars ,2 years ago,Great wine selection.  Great funky friendly atmosphere.  Fantastic cheese board. Little more so say.  Enjoy!
13,GlouGlou, 5 stars ,6 months ago,"Good wine, good food, good times."
14,GlouGlou, 5 stars ,4 months ago,Great service and awesome extended selection of wines! The interior is very nicely decorated and the bathrooms are unisex 😀
15,GlouGlou, 5 stars ,5 months ago,"Lovely straff, very Nice selection of wines on bottle, ask to go see what they have. Outdoor seating in autumn sun, very happy."
16,GlouGlou, 5 stars ,3 years ago,"Great place for Wine & Cheese. Staff is fantastic, recommendations on point. The cheese platter and the snails, in particular, were top notch. Wine selection is great, wide variety and excellent pairings, thanks to the aforementioned staff. …"
17,GlouGlou, 4 stars ,3 years ago,"Nice little corner natural wine bar. Staff were friendly, into the wine and actually knowledgable about what they serve. Menu is very pretty large but sadly very European focussed . Would love to see a bit more diversity creep on and a few more ""cloudy"" wines."
18,GlouGlou, 4 stars ,4 months ago,"Tasty wines and friendly personnel, very popular/crowded, leading to long waiting times. …"
19,GlouGlou, 5 stars ,7 months ago,"Great natural wine place!

Although I enjoy their beers as well, you can chose from their wide range of …"
20,GlouGlou, 5 stars ,3 years ago,"We had such a great night there! We came and the place was full. The owner came straight to us and talked to us. He immediately found us two seats in a shared table with another group. After a few minutes we had a bottle of wine, and our …"
21,GlouGlou, 5 stars ,4 years ago,Lovely place in De Pijp with a variety of natural wines from Europe. The food is great too and the service is very good.
22,GlouGlou, 5 stars ,4 months ago,"Best wines, friendly staff, welcoming and cozy corner!"
23,GlouGlou, 5 stars ,8 months ago,Hands down best wine bar in de Pijp! Auke is my BFF (I hope)!
24,GlouGlou, 5 stars ,4 months ago,"Quaint natural wine bar in De Pijp, Amsterdam! Such a vibrant little spot away from the masses."
25,GlouGlou, 2 stars ,7 months ago,"Well, ""Charcuterie"" and wine was lovely. The service and the toilet (I hope the kitchen was cleaner than this) really 😕 terrible. There is not understanding of customer service, which is very typical in Amsterdam."
26,GlouGlou, 1 star ,9 months ago,"Horrible place. Circus. EXTREMELY inattentive, unprofessional rude and arrogant staff. After waiting around to even get to order we had to wait 30 min to get our glasses poured with wine. I don’t really see/ understand the difficulty …"
27,GlouGlou, 5 stars ,3 years ago,"Had a wonderful evening here! We had the pleasure of an impromptu mini white wine tasting when we were undecided. Very dedicated, caring, and knowledgeable staff!"
28,GlouGlou, 4 stars ,2 years ago,This cosy local shines in summer with helpful service to pick from their wine list - winter is cosy but can be tough to get a spot - the snacks go well with the drinks but don’t expect a meal
29,GlouGlou, 5 stars ,4 months ago,"Friendly staff, great atmosphere and really good wines!"
30,GlouGlou, 5 stars ,2 years ago,"The best wine place in Amsterdam. Super nice staff, great environment and above all... great natural wines! A must."
31,GlouGlou, 4 stars ,3 years ago,"Great place to buy bio and orange wines. It's a wine bar first, and a shop later. They have an awesome selection but don't expect to spend too much time receiving recommendations."
32,GlouGlou, 5 stars ,a year ago,"A lovely wine bar in the Pijp. They have a wide selection of natural wines. I am an absolute fan of their orange wine, which you can order by the glass. Their terrace is lovely when it’s sunny. Inside its more like a “brown bar”. There are …"
33,GlouGlou, 5 stars ,3 years ago,Very friendly and helpful staff and a good selection of natural wines and small dishes. The icing on the cake would have been some orange wine from Georgia ;)
34,GlouGlou, 5 stars ,2 years ago,"Best place to go for  excellent natural wines, relaxed and laid back atmosphere, cozy, outdoor space to enjoy the sunset during summer nights. The manager, Laurent, knows the wine business and is super friendly and takes really good care of …"
35,GlouGlou, 5 stars ,2 years ago,Love this wine bar! Extensive natural wine list with knowledgeable staff. I gave them a very vague description of what I wanted and they came back with two excellent options. …
36,GlouGlou, 5 stars ,2 years ago,"Great wines, good prices, super cozy in any season. Some food that looks good, but I never quite get around to ordering. Tables fill up fast in the evening, but make some new friends and share a bottle and a fantastic night is guaranteed."
37,GlouGlou, 4 stars ,6 months ago,"Good wine, outdoor seating not so great."
38,GlouGlou, 5 stars ,5 years ago,"This place played my favourite song right when I entered, so I instantly liked it. Had a great glass of wine. And there's disco lights in the bathroom 😄"
39,GlouGlou, 5 stars ,4 months ago,"I like the vibe, you just sit there with dimmed light and drink wine. Amazing."
40,GlouGlou, 5 stars ,2 years ago,"Chilled atmosphere, great wine selection and nibbles. You can also play cards and other games"
41,GlouGlou, 5 stars ,2 years ago,"A fantastic wine bar with a great selection of wines! We ordered the cheese board and loved the selection as well. It's a small and cosy place, and the service is amazing. We were just 2 of us, and didn't have to wait too long to find a place, but if you're a bigger group, there may be a bit of a wait."
42,GlouGlou, 5 stars ,7 months ago,Super friendly staff & awesome selection of very fine and special wines 🍷✨ A must-go!
43,GlouGlou, 5 stars ,a year ago,"The co-owner is very friendly and happy to share his knowledge, especially if you know nothing about wine yourself. The descriptions of the wines on the menu are fun!"
44,GlouGlou, 5 stars ,2 years ago,"The cutest little French wine bar that will still any Parisian cravings you might have! A lovely selection of natural wines, and some tasty small bites of food to accompany the liquids. Knowledgeable staff that is more than happy to help you navigating their wine collection. All in all just a place that will make you very very happy!"
45,GlouGlou, 4 stars ,2 years ago,"Beautiful place with some very good wines. Bit expensive, but I guess that's what you're paying for in terms of quality. The water served with the wine is a nice and simple gesture often missed in Amsterdam. Recommendable place if you're in for a good wine (and that's the only thing they serve!)."
46,GlouGlou, 5 stars ,2 years ago,"One of my favourite spots in Dam, fills up quickly but can lose hours here getting loose on a great selection of natural wine. The staff always provide friendly service and are happy to help with explaining their wines. Really good to have the option to buy bottles cheaper to takeaway too."
47,GlouGlou, 1 star ,a year ago,"The menu was full of stains and the table was sticky. Under this COVID-19 crisis, I believe cleanliness should be a top priority at all locations, especially restaurants and bars. 2 out of 3 staff members were very rude. Perhaps one of them …"
48,GlouGlou, 4 stars ,3 years ago,"Very cute wine bar/wine shop in the Pijp with outdoor seating.
Its small place, so if you want to be seated, make sure you arrive a bit early since they don't accept reservations. …"
49,GlouGlou, 4 stars ,2 years ago,Nice selection of wines but the shop is really overpriced. You can find the same bottles in the Netherlands for 10/15 euro less. + the guy in the shop didn't have the right knowledge and was not able to present the wines. So it is a nice place if you go there to drink wine at the bar but please avoid the shop.
50,GlouGlou, 5 stars ,3 years ago,Amazing place! Went here & it is very cosy. The guy who served us let us try a few wines first before we purchased a whole bottle. (You don’t have to buy a bottle obviously) & he was very well educated on the different type of wines!
51,GlouGlou, 2 stars ,a year ago,"Nice selection of wines, pricey. Very slow service, didn’t remember our order, wrong bill and charged the most expensive wines without asking. Rude."
52,GlouGlou, 5 stars ,2 years ago,"Perfect stop for natural wine lovers. Nice wine selection and great service. Many thanks to wonderful Fleur, she is very helpful, made perfect recommendations for our taste."
53,GlouGlou, 5 stars ,3 years ago,"Great place to go here for having some small bites and great wine. They let us taste 4 wines, so that we could decide which wine we would like to have with our cheese plate. Really loved that."
54,GlouGlou, 5 stars ,3 years ago,"Cute, cozy little wine bar.  It was very crowded when we went, but they were very accommodating and shuffled people around to make room for us (and others) as the space filled up.  Great service, great atmosphere, and great wine :)"
55,GlouGlou, 5 stars ,4 years ago,"A great wine bar with a perfect atmosphere. Wines are excellently tasty, staff is helping customers out if they need so. I'll regularly go and enjoy there."
56,GlouGlou, 4 stars ,3 years ago,"Great little wine bar.  Not a lot of selection, but good wines.  Great cheese plate but could have used some form if blue cheese.  Staff are very attentive."
57,GlouGlou, 5 stars ,5 years ago,"Great place for wines and snacks in De Pipje. Relaxed atmosphere in a space with personality, perfect for long conversations with friends or a romantic date. Beautiful wine posters on the walls, friendly staff and cool terrace. …"
58,GlouGlou, 4 stars ,3 years ago,Good natural wines !! Always worth a visit when in de pijp
59,GlouGlou, 5 stars ,3 years ago,"Loved it, the friendly service, how they bring the bottle to pour the wine into your glass and you can hear the sound it makes; glou glou which is the name of the bar. The sharing tables create a cosy ambience. The logo reminds me of ten …"
60,GlouGlou, 5 stars ,3 years ago,Possibility to drink plenty of different wine outside or inside. People are super nice there and the choice of drinks is really wide. Special mention about the toilets: you will feel like being in a disco club!
61,GlouGlou, 5 stars ,3 years ago,Great wine bar - wonderful selections of different types of wine. Great service... always tricky trying to find a spot - so get there early!
62,GlouGlou, 5 stars ,4 years ago,"One of the best wine bars in Amsterdam. No pretense, just great juice. Lots of natural and biodynamic on the list and the staff know their stuff. Food is good, but you're there for the wine."
63,GlouGlou, 5 stars ,5 years ago,"When you want unique,  delicious wines, Glou Glou is the place to go. Experiment on your tastebuds with their extensive selection of natural wines. The staff is extremely knowledgeable, and quite excited about the wines they offer. Ask them questions, and they will help set you up with the right wines."
64,GlouGlou, 2 stars ,a year ago,"Lovely service and wine.

Unfortunately my friend as well as myself managed to eat something bad from …"
65,GlouGlou, 5 stars ,4 years ago,"Those guys know what's up. probably the best selection of natural wines in Amsterdam. Drink there or take a cheaper bottle home. Food choices are limited and peculiar. Which is a good thing I guess, if you're looking for something a little bit different."
66,GlouGlou, 5 stars ,2 years ago,"So many wines to choose from that I wasn't sure where to start, but the bar staff were super friendly and let me try a few different ones. Excellent wine bar."
67,GlouGlou, 5 stars ,2 years ago,"Love the Glou Glou vibe, especially the service, our bartender Emma really made us feel at home and recommended us wines which we would have never tried before! Thank you Emma, my husband and I will make sure that we visit again next time we are in Amsterdam!"
68,GlouGlou, 1 star ,a year ago,"The website doesn't explain the measures during coronavirus pandemic. They only accept people from the same household to sit together. There is no proposition to offer people from different household to sit at the same table, but keeping the distance. The website could be more informative."
69,GlouGlou, 5 stars ,7 months ago,"Lovely place, nice service and great wine!"
70,GlouGlou, 4 stars ,2 years ago,"Nice bar, natural wines, service is ok."
71,GlouGlou, 5 stars ,2 years ago,"Delightful wine bar serving natural wines, many by the glass, served by passionate people. Nice space outside too that soaks up the sun."
72,GlouGlou, 5 stars ,2 years ago,"A lovely wine bar with a nice atmosphere, and a friendly staff, who gave accurate recommendations on the wine after hearing out what we'd like. I would like to come back for a second visit."
73,GlouGlou, 4 stars ,4 years ago,"Nice cosy wine bar with good range of natural wines. Be warned though all the wines tasty quite ""earthy"" as they are natural and less processed, which is not to everyone's taste"
74,GlouGlou, 5 stars ,4 years ago,Love love this pace! Gets crowded but is still worth it!
75,GlouGlou, 5 stars ,2 years ago,A wide range of wine selection. The staffs are really friendly. One of my favourite place in Ams.
76,GlouGlou, 4 stars ,2 years ago,"Great wines, good prices, cosy atmosphere. It's always busy so you will most likely share a table"
77,GlouGlou, 5 stars ,6 years ago,"Glouglou is a winebar like no other.
Specialized in french natural wine, be prepared to throw your preconceptions about wine out of the window alltogether. No wine tastes alike, and they all taste …"
78,GlouGlou, 5 stars ,4 years ago,Got in for a quick sip of wine and got the perfectly funky sour light tart white wine. Easy to order a good wine that you like even though you don't know anything about wine.
79,GlouGlou, 5 stars ,3 years ago,"Wide variety of wines, good service. You can taste before ordering. One of the top wine bars in Amsterdam."
80,GlouGlou, 5 stars ,6 years ago,Funky looking wine bar. The waiter came with some great recommendations for us. Relatively small place so less suitable for groups.
81,GlouGlou, 5 stars ,5 months ago,"Natural wine Bar , cool ambience"
82,GlouGlou, 5 stars ,5 years ago,Really nice atmosphere and super knowledgable service. Great place to figure out what kind of wine you like or pick up a few new favourites
83,GlouGlou, 5 stars ,5 years ago,Unique and very enjoyable natural wines by the glass. The staff are super friendly and they have outside seating in the summer.
84,GlouGlou, 5 stars ,6 years ago,"Awesome French interior styled, Vin nature wine place with at least 30 by the glass and fine Italian salamis, prosciutto, and cheeses."
85,GlouGlou, 4 stars ,5 years ago,"Great selection of organic wine, knowledgeable staff"
86,GlouGlou, 5 stars ,3 years ago,"Good ambiance, simple and good food, great place to taste original wines, perfect place to have a long long drink. Just seat and enjoy."
87,GlouGlou, 5 stars ,3 years ago,"Great place to be, Very good wine, the staff is also good, very friendly, they can always advice you if you do not know wich wine you want."
88,GlouGlou, 5 stars ,3 years ago,Awesome wine bar with a solid selection and great small bites. Great atmosphere for drinks after work or a date.
89,GlouGlou, 5 stars ,2 years ago,Funky wines. Great staff. Perfect snacky things to have with wine. Love this natural wine bar
90,GlouGlou, 5 stars ,3 years ago,Cool wine bar and people who know and can explain some the the best organic wines we've tasted. Worth a look just for the people watching.
91,GlouGlou, 2 stars ,6 years ago,"hit and miss ...sometime good crew sometime and more often not....overall disappointed with wine quality . out of 4 times, one decent experience ... will stick to Vyne or Ijbreker has better wine !!!"
92,GlouGlou, 5 stars ,3 years ago,Love this place. Great environment to hang out with friends and try out some wine. Prices are ver reasonable and the service is good.
93,GlouGlou, 5 stars ,5 years ago,This is the place where we fell in love w Amsterdam. My girlfriend and I stumbled upon it while walking around De Pijp. The staff invited us back the next night to the Nuevo wine celebration. We went back almost every night of our trip and …
94,GlouGlou, 5 stars ,4 years ago,"If you appreciate natural wine, please try Glou Glou. Hard enough to find real natural wine specialty bars, and these folks really deliver. You won't be disappointed."
95,GlouGlou, 5 stars ,3 years ago,"Place is a bit small so they can be packed, but there is good wine and the service was good and welcoming for a next time, which makes the difference in most cases!"
96,GlouGlou, 1 star ,2 years ago,"Great wine, horrible service.  We tried waving a server down for a second glass but gave up after 20 minutes."
97,GlouGlou, 4 stars ,5 years ago,Better wine quality than someone would expect in NL for such cozy casual place. Arriving after 7 during weekends will mean the place is crowded.
98,GlouGlou, 5 stars ,2 years ago,Cute place to drink unfiltered wine! They will discount your bottle if you buy from them!
99,GlouGlou, 5 stars ,2 years ago,"Great atmosphere,  wines and maybe most of all,  service and explanation about the offer of their, 'nature' wines"
100,GlouGlou, 4 stars ,2 years ago,"Good wine, tasty but a bit pricey snacks. French atmosphere, super busy on weekends!"
101,GlouGlou, 4 stars ,2 years ago,"Very good wine choices, nice environment, (although service is reallyyyy slow)"
102,GlouGlou, 5 stars ,4 years ago,I loved this bar. All organic wine at a great price. Nice atmosphere. I would love to end every evening at GlouGlou!
103,GlouGlou, 5 stars ,7 months ago,"Very nice cotes du Rhone by the glass, chilled place"
104,GlouGlou, 4 stars ,5 years ago,Great place drink wines with menu changing quite rapidly. Bit more expensive bit well worth given the wine quality.
105,GlouGlou, 5 stars ,2 years ago,A must-visit wine bar. Delicious food and unique wine selection you just won't find anywhere else.
106,GlouGlou, 5 stars ,2 years ago,We had a very nice cheese plate and some cool natural wines. Love the purpur
107,GlouGlou, 4 stars ,3 years ago,Great bar! Lovely atmosphere in a beautiful section of the city. It was recommended to me by several people and it did not disappoint.
108,GlouGlou, 5 stars ,4 years ago,"Be careful--nothing will ever taste as good as the wine you'll find here. Special place, 100% recommended if you're visiting Amsterdam."
109,GlouGlou, 4 stars ,4 years ago,If you like wine you will totally love this place! Be careful good wine does not come cheap.
110,GlouGlou, 1 star ,9 months ago,"Horrible service, the most rude and inattentive waiters and waitresses I've ever experienced in Amsterdam, and that is to say a lot."
111,GlouGlou, 5 stars ,7 months ago,Epic wine! Great service!
112,GlouGlou, 5 stars ,2 years ago,"I love this place. Good little wine bar, reasonable prices, outdoor seating and the staff are lovely."
113,GlouGlou, 5 stars ,a year ago,Amazing selection of wines. Parisian style with a great terrace
114,GlouGlou, 5 stars ,3 years ago,Killer joint with an awesome selection of organic wines. 10/10 would recommend. Try the snails too.
115,GlouGlou, 5 stars ,5 years ago,"Beautiful atmosphere, nice selection of wines from Italy, Spain, France. You can have a real Italian espresso"
116,GlouGlou, 5 stars ,5 years ago,"Great French bar that offers only natural wines. Try to get a place on a terrace and feel the vibe of the neighbourhood, priceless."
117,GlouGlou, 5 stars ,3 years ago,"Best wine bar in NL!! A great passion for quality service and amazing, unique natural wines!"
118,GlouGlou, 5 stars ,2 years ago,"The rose wines they have are of another world! Cute location, pro staff and great  atmosphere."
119,GlouGlou, 5 stars ,3 years ago,This wine bar is seductive with a funky twist.
120,GlouGlou, 5 stars ,3 years ago,"Great wine bar, food think first natural wine bar in Amsterdam. Even improved from my last visit."
121,GlouGlou, 5 stars ,a year ago,Best special wines in Amsterdam. Super cute cafe in the best neighborhood.
122,GlouGlou, 5 stars ,5 years ago,"Nice place to have a biological wine and some bites. The place is small though, and probably crowded on weekends, be open to share a table with some Dutch people."
123,GlouGlou, 3 stars ,5 years ago,Very interesting selection of wines you'll probably never find anywhere else. Just the place if you want to experiment with wine.
124,GlouGlou, 4 stars ,4 years ago,"Good service, nice ambience, great street terrace. Fun organic and unfiltered wine list, good beers too."
125,GlouGlou, 4 stars ,2 years ago,"Really nice busy small wine bar, good vibe, attentive staff and delicious wine"
126,GlouGlou, 3 stars ,3 years ago,Nice little winebar in the Pijp district. Vast assortment and a limited menu with snacks. Perfect for a quick getogether.
127,GlouGlou, 5 stars ,5 years ago,Fantastic wine at great prices; friendly and knowledgeable staff; also great options for snacks.
128,GlouGlou, 5 stars ,a year ago,Best place to drink natural wine. Always busy though
129,GlouGlou, 5 stars ,3 years ago,"This place is amazing. Great wines, great snacks. Very cool and unpretentious."
130,GlouGlou, 5 stars ,a year ago,"really great Parisian neighbourhood bar ambience, nice crowd, great selection of beers as well!"
131,GlouGlou, 5 stars ,5 years ago,"Very nice French place with a good selection of wines and cheese, staff is very friendly. Absolute must go if near de pijp area"
132,GlouGlou, 2 stars ,4 years ago,"Decent place, not a wine bar, basically a dumpy bar with better marketing, nice staff though"
133,GlouGlou, 5 stars ,7 months ago,Excellent spot for natural wines
134,GlouGlou, 5 stars ,a year ago,Trendy wine bar with interesting wines and stories to go with them
135,GlouGlou, 5 stars ,3 years ago,Great wine bar for me wine natural addicted. Great service and nice people!
136,GlouGlou, 5 stars ,3 years ago,Great little place with a welcome atmosphere. Ideal for a quick glass of wine.
137,GlouGlou, 5 stars ,2 years ago,"Really nice winebar, with a superb selection and knowledgeable staff"
138,GlouGlou, 4 stars ,2 years ago,Great place with interesting selection of wines. No food though.
139,GlouGlou, 4 stars ,4 years ago,Good selection of wine - they serve very good charcuterie for snacks as well
140,GlouGlou, 1 star ,2 years ago,Not a place for Natural wine lovers. Overpriced wines and limited stock availability.
141,GlouGlou, 5 stars ,4 years ago,"Good wine, very pleasant staff and a wonderful atmosphere."
142,GlouGlou, 5 stars ,2 years ago,"Great Natural wine bar with a great location, snacks and staff!"
143,GlouGlou, 5 stars ,3 years ago,Good atmosphere and great selection of natural wines
144,GlouGlou, 5 stars ,3 years ago,Top place. Excellent selection. Try orange wine and awesome bread 😍
145,GlouGlou, 5 stars ,4 years ago,"Cozy atmosphere, amazing wine and service, delicious appetizers, and definitely one of my favourite places in Amsterdam."
146,GlouGlou, 5 stars ,4 years ago,Favorite place with the most unique wines I’ve ever tasted!
147,GlouGlou, 5 stars ,3 years ago,"Delicious wine selection, nice location,  cozy inside"
148,GlouGlou, 4 stars ,3 years ago,"Great selection of wine, decent french food."
149,GlouGlou, 2 stars ,5 months ago,Overpriced and under decorated
