,Name,Review Rate,Review Time,Review Text
120,Corner Bakery Amsterdam, 5 stars ,3 years ago,"A perfect place for a slow brunsh in the sun with good friends. I had wonderful eggs benedict, orange juice and a good cup of strong, hot coffee. Also- great service. Thank you so much"
121,Corner Bakery Amsterdam, 1 star ,2 years ago,"Horrible service! We waited for 1 hour so they can take our order and then to make our tea and get our cakes we waited for like 25 min
UGH NEVER GOING BACK! And ITS NOT TASTY AND OVERPRICED🤦🏻‍♀️"
122,Corner Bakery Amsterdam, 3 stars ,4 years ago,"A nice corner coffee with good atmosphere. The food was okay, but the service a bit slow. There were gluten free options, which was nice."
123,Corner Bakery Amsterdam, 5 stars ,3 years ago,"Amazing, unique cafe in Amsterdam. We went here everyday for breakfast. Highly recommend the red velvet pancakes!"
124,Corner Bakery Amsterdam, 5 stars ,4 years ago,Tiny cafe serves amazing breakfasts and light lunches
125,Corner Bakery Amsterdam, 5 stars ,7 months ago,"wonderful CROQUE MADAME...
very friendly service in a great district of a'dam ❤️👍🌈"
126,Corner Bakery Amsterdam, 5 stars ,4 years ago,"Amazing breakfast place. Engaged and happy staff, food presentation and quality were very high. Properly prepared coffee drinks."
127,Corner Bakery Amsterdam, 5 stars ,2 years ago,It was amazing had a wonderful experience love the staff and the food was surprisingly amazing very fast serving really enjoyed
128,Corner Bakery Amsterdam, 2 stars ,4 years ago,"It's not worth the price. The sandwiches are nothing special ( not too tasty) however they are too expensive. In general everything too expensive. And the place is too small, so it's not even comfortable."
129,Corner Bakery Amsterdam, 5 stars ,4 months ago,Awesome breakfast place 😊
130,Corner Bakery Amsterdam, 5 stars ,4 years ago,"It exceeded Rhonda's expectations--very hard to do.  Wonderful coffee, oatmeal, gluten free pancakes.interesting menu.  We all had two coffees.  Beautiful people eat here, but casual."
131,Corner Bakery Amsterdam, 5 stars ,8 months ago,Top top top !
132,Corner Bakery Amsterdam, 5 stars ,2 years ago,"Cozy atmosphere, great service, great food."
133,Corner Bakery Amsterdam, 5 stars ,3 years ago,Freak shakes are amazing
134,Corner Bakery Amsterdam, 5 stars ,3 years ago,"Amazing, unique cafe in Amsterdam. We went here everyday for breakfast. Highly recommend the red velvet pancakes!"
135,Corner Bakery Amsterdam, 5 stars ,3 years ago,"It was so busy, but the experience was great! Would really like to go again to try out more."
136,Corner Bakery Amsterdam, 5 stars ,a year ago,Special mention for the delicious American Pancakes ❤
137,Corner Bakery Amsterdam, 4 stars ,2 years ago,Fine breakfast
138,Corner Bakery Amsterdam, 5 stars ,4 years ago,"Delicious treats. We got a brownie and lemon square, and a cup of hot cocoa with whipped cream. So good!"
139,Corner Bakery Amsterdam, 4 stars ,2 years ago,good french toast with fruit ice coffee had to much of something that was probably cream but i got an green tea for free instead.
140,Corner Bakery Amsterdam, 3 stars ,3 years ago,"Good service. Nice place. Decent food, but do not order eggs!"
141,Corner Bakery Amsterdam, 5 stars ,a year ago,Tasty breakfast and lovely barista! I really enjoyed My stay
142,Corner Bakery Amsterdam, 4 stars ,2 years ago,"generous & tasty portions, welcoming and friendly service, quiet loud and little pricey for what it is"
143,Corner Bakery Amsterdam, 4 stars ,3 years ago,"Nice place to have a breakfast in the area, a bit expensive but ok.
The best, the breakfast with eggs, is not easy to find a place in Europe to have a breakfast with eggs; this breakfast was like a brunch."
144,Corner Bakery Amsterdam, 5 stars ,a year ago,"Great place
Delicious"
145,Corner Bakery Amsterdam, 5 stars ,4 years ago,Cute and charming eatery.  Lots of choices.  Outside tables and downstairs space too.  Homemade brownies and delicious french toast!
146,Corner Bakery Amsterdam, 5 stars ,4 years ago,Had the nicest birthday breakfast
147,Corner Bakery Amsterdam, 5 stars ,5 years ago,"Great cosy place, nice food specially for brunch, trendy amongst locals (very crowded). Service was excellent!"
148,Corner Bakery Amsterdam, 4 stars ,4 months ago,Tasty vegan sandwich!
149,Corner Bakery Amsterdam, 5 stars ,5 years ago,"Great atmosphere, delicious food and kind staff. Reasonably priced brunch menu as well."
150,Corner Bakery Amsterdam, 5 stars ,4 years ago,"Delicious, fast and friendly."
151,Corner Bakery Amsterdam, 4 stars ,2 years ago,good french toast with fruit ice coffee had to much of something that was probably cream but i got an green tea for free instead.
152,Corner Bakery Amsterdam, 5 stars ,5 months ago,Amazing sandwiches and pancakes
153,Corner Bakery Amsterdam, 2 stars ,a year ago,Very pricey and not delicious... the tables and floor were very dirty as well
154,Corner Bakery Amsterdam, 4 stars ,4 years ago,Delicious volcano drink! Cakes are also nice but better to share because slices are big!!
155,Corner Bakery Amsterdam, 4 stars ,2 years ago,"Just had coffee out there, it's a nice bistro slightly crowded but very sweet proprietor and friendly staff"
156,Corner Bakery Amsterdam, 5 stars ,5 years ago,Great home made breakfast food! Great flat white. Lovely and courteous staff and owner.
157,Corner Bakery Amsterdam, 5 stars ,5 years ago,"The service is perfect, the food is heavenly and arrived within five minutes. Very cute location."
158,Corner Bakery Amsterdam, 4 stars ,2 years ago,Nice place for brunch. Make reservations ahead as they’re very busy.
159,Corner Bakery Amsterdam, 4 stars ,2 years ago,"Great food, shame the staff started clearing out table more than 30minutes before closing"
160,Corner Bakery Amsterdam, 5 stars ,6 years ago,Amazing eggs Benedict! Really relaxed! Staff are super friendly. Great place for a relaxed brunch.
161,Corner Bakery Amsterdam, 5 stars ,3 years ago,"Very good food, nice staff and ambiance. I would recommend it absolutely"
162,Corner Bakery Amsterdam, 1 star ,4 years ago,Impolite and irresponsible staff. We had a reservation but they asked us to wait for additional 15 min outside in the cold before they manage our table. And in a very rude way.
163,Corner Bakery Amsterdam, 1 star ,5 months ago,Puts the sign in the middle of the pedestrian road!!
164,Corner Bakery Amsterdam, 5 stars ,3 years ago,"It was so busy, but the experience was great! Would really like to go again to try out more."
165,Corner Bakery Amsterdam, 5 stars ,a year ago,"Great food, reasonable price and nice location."
166,Corner Bakery Amsterdam, 2 stars ,4 years ago,"The place is to tiny, so uncomfortable to sit, and the dishes aren’t worth the price...  I wouldn’t recommend"
167,Corner Bakery Amsterdam, 5 stars ,4 years ago,"""I am just amazed by the design and small touches of this place that made it seem cozy. I will visit this place again when I visit Amsterdam in the near future."" - Ansel Ponce Diama"
168,Corner Bakery Amsterdam, 5 stars ,3 years ago,Lovely place and good food! Looks like we're home having breakfast.
169,Corner Bakery Amsterdam, 5 stars ,a year ago,Had a very nice and delicious breakfast here.
170,Corner Bakery Amsterdam, 5 stars ,3 years ago,"Very nice place!
Red velvet cake and red velvet pancakes are so good"
171,Corner Bakery Amsterdam, 3 stars ,3 years ago,Super expensive and everything has too much sugar. But for a special brunch is ok
172,Corner Bakery Amsterdam, 1 star ,3 years ago,3.9 EUR for an espresso macchiato?? Really?? Such a rip off and definitely won't come back.
173,Corner Bakery Amsterdam, 5 stars ,4 years ago,Little cute cafe near musuemplein.  Decorative and eye catching food and drink - taste good too!
174,Corner Bakery Amsterdam, 4 stars ,4 years ago,"Very American which works great ! Nice looking blog post ladies place ;)! Good menue , different and fancy !"
175,Corner Bakery Amsterdam, 4 stars ,3 years ago,Delicious food! Very busy though - felt a bit rushed.
176,Corner Bakery Amsterdam, 5 stars ,a year ago,Best Breakfast ever😍 Thank you dear Corner Bakery🥰
177,Corner Bakery Amsterdam, 5 stars ,6 years ago,Excellent little cafe with tasty food. Especially the pancakes are very good.
178,Corner Bakery Amsterdam, 5 stars ,4 years ago,Delightful. Cheerful staff. French toast with fruit was great. Good coffee.
179,Corner Bakery Amsterdam, 5 stars ,2 years ago,"Scrummy breakfasts, lovely place"
180,Corner Bakery Amsterdam, 5 stars ,2 years ago,"Great and healthy breakfast, very friendly!"
181,Corner Bakery Amsterdam, 5 stars ,4 years ago,"Really nice food, cute ambiance and friendly waiters."
182,Corner Bakery Amsterdam, 5 stars ,7 months ago,Best pancakes ever. 💕
183,Corner Bakery Amsterdam, 5 stars ,3 years ago,One of the best eggs bennidict I've had. Service was quick and friendly.
184,Corner Bakery Amsterdam, 5 stars ,2 years ago,Great! Going there anytime I'm in Amsterdam and it still amazing!!
185,Corner Bakery Amsterdam, 5 stars ,3 years ago,"Food was good, staff very friendly and service was quick."
186,Corner Bakery Amsterdam, 5 stars ,3 years ago,Amazing
187,Corner Bakery Amsterdam, 5 stars ,2 years ago,We had a great breakfast!!! Service was excellent!!
188,Corner Bakery Amsterdam, 4 stars ,3 years ago,Iced coffe was be noot good but apple Pie was be deliciouse ❤️
189,Corner Bakery Amsterdam, 5 stars ,2 years ago,"Service is great, i liked the decoration and the atmosphere"
190,Corner Bakery Amsterdam, 5 stars ,4 years ago,Avocada solomon health breakfast hannover breakfast tostu ve tokat with humus... the best one is hangover breakfast...
191,Corner Bakery Amsterdam, 4 stars ,3 years ago,Interesting spot but constantly busy. Very nice cakes and rolls.
192,Corner Bakery Amsterdam, 5 stars ,2 years ago,"Cozy atmosphere, great service, great food."
193,Corner Bakery Amsterdam, 5 stars ,5 years ago,"Very cute café, nice food and good service!"
194,Corner Bakery Amsterdam, 4 stars ,4 years ago,"One of the best cheesecakes I’ve had, but long waiting time"
195,Corner Bakery Amsterdam, 5 stars ,6 months ago,Good quality nice location
196,Corner Bakery Amsterdam, 5 stars ,4 years ago,"Food was fantastic, service was a little slow but that is because it was packed beyond full and spilling onto the sidewalk."
197,Corner Bakery Amsterdam, 5 stars ,3 years ago,Great oasis of rest with rock solid menu and friendly staff.
198,Corner Bakery Amsterdam, 4 stars ,3 years ago,"Great food, get there early for a table."
199,Corner Bakery Amsterdam, 5 stars ,4 years ago,"Been there three times during my stay, they have a special granola."
200,Corner Bakery Amsterdam, 5 stars ,2 years ago,Food is great and the location lovely!
201,Corner Bakery Amsterdam, 5 stars ,3 years ago,Amazing breakfast and very nice staff.
202,Corner Bakery Amsterdam, 5 stars ,3 years ago,Must visit place in Amsterdam
203,Corner Bakery Amsterdam, 3 stars ,2 years ago,"The food is fine, nice cafe"
204,Corner Bakery Amsterdam, 1 star ,5 years ago,2 Apple juice from small bottles more the 10 euros ... !! But it was organic!
205,Corner Bakery Amsterdam, 5 stars ,3 years ago,Freak shakes are amazing
206,Corner Bakery Amsterdam, 5 stars ,3 years ago,pink chocolate milks and sprinkles - fun drink options ! ^ ^
207,Corner Bakery Amsterdam, 5 stars ,a year ago,Special mention for the delicious American Pancakes ❤
208,Corner Bakery Amsterdam, 5 stars ,4 years ago,Amazing selection and great small town atmosphere!
209,Corner Bakery Amsterdam, 5 stars ,3 years ago,Take the yogurt!! It’s the best brunch yogurt I ever had
210,Corner Bakery Amsterdam, 5 stars ,4 years ago,It was a great visit! Also the food was great!
211,Corner Bakery Amsterdam, 5 stars ,3 years ago,"This is the Dam version of comfort food, very very nice !"
212,Corner Bakery Amsterdam, 5 stars ,2 years ago,Salmon with zatziki is super tastefull!
213,Corner Bakery Amsterdam, 5 stars ,3 years ago,"Great colours, fresh ingredients good taste."
214,Corner Bakery Amsterdam, 5 stars ,3 years ago,"Was really fun to do, will do again once I go there"
215,Corner Bakery Amsterdam, 4 stars ,3 years ago,Super cosy place with good food and shakes.
216,Corner Bakery Amsterdam, 5 stars ,2 years ago,"This corner bakery is really nice, must visit."
217,Corner Bakery Amsterdam, 5 stars ,2 years ago,I totally recommend the classic chai latte massala
218,Corner Bakery Amsterdam, 4 stars ,3 years ago,Friendly place with generous sized bowls ;)
219,Corner Bakery Amsterdam, 4 stars ,a year ago,"Tasty food, pleasant ambience."
220,Corner Bakery Amsterdam, 4 stars ,3 years ago,"Conveniently located. I think they forgot about me at first, but then all was OK."
221,Corner Bakery Amsterdam, 4 stars ,3 years ago,Perfect for kids.  The milkshakes are out of this world
222,Corner Bakery Amsterdam, 5 stars ,5 years ago,Good and healthy options in a comfortable and cozy place.
223,Corner Bakery Amsterdam, 5 stars ,4 years ago,"Great taste, fast and well priced"
224,Corner Bakery Amsterdam, 5 stars ,4 years ago,Incredible sweet treats and delicious drinks!
225,Corner Bakery Amsterdam, 5 stars ,3 years ago,Most amazing place for breakfast in Dam
226,Corner Bakery Amsterdam, 5 stars ,3 years ago,Amazing pancakes and shakes! A must!
227,Corner Bakery Amsterdam, 5 stars ,3 years ago,Super cute and great food
228,Corner Bakery Amsterdam, 5 stars ,2 years ago,"Great place, staff and food!"
229,Corner Bakery Amsterdam, 5 stars ,2 years ago,"Great looking food, omg!"
230,Corner Bakery Amsterdam, 4 stars ,5 years ago,The coffee and breakfast is great here.
231,Corner Bakery Amsterdam, 5 stars ,3 years ago,Amazing shake with donut on top :)
232,Corner Bakery Amsterdam, 5 stars ,3 years ago,Amazing breakfast
233,Corner Bakery Amsterdam, 1 star ,2 years ago,"Very bad costumer service , i will never visit again"
234,Corner Bakery Amsterdam, 5 stars ,5 years ago,Delicious coffee and home made cakes!
235,Corner Bakery Amsterdam, 3 stars ,a year ago,Over rated and under serviced
236,Corner Bakery Amsterdam, 5 stars ,3 years ago,Delicious
237,Corner Bakery Amsterdam, 5 stars ,2 years ago,"Amazing place, staff and food"
238,Corner Bakery Amsterdam, 5 stars ,4 years ago,Best breakfast around the area
239,Corner Bakery Amsterdam, 4 stars ,2 years ago,Fine breakfast
240,Corner Bakery Amsterdam, 5 stars ,3 years ago,Had the best carrot cake
241,Corner Bakery Amsterdam, 3 stars ,2 years ago,Nothing special at all. Very standard.
242,Corner Bakery Amsterdam, 4 stars ,3 years ago,nice people with tasty dessert.
243,Corner Bakery Amsterdam, 1 star ,2 years ago,Total ripoff dont waste your time
244,Corner Bakery Amsterdam, 5 stars ,3 years ago,Amazing food and costumer service
245,Corner Bakery Amsterdam, 5 stars ,2 years ago,Nice Food
246,Corner Bakery Amsterdam, 5 stars ,3 years ago,Nice place to take a breakfast.
247,Corner Bakery Amsterdam, 5 stars ,2 years ago,Definitely delivers the promise :)
248,Corner Bakery Amsterdam, 5 stars ,3 years ago,"Went for a freakshake for breakfast omg it was beaut. Made with fresh fruit not a cheap powder you mix with milk. Topped with a fresh donut, lots of whipped cream, jelly sweets, fruit loops and sprinkles. Couldn't actually finish it all coz …"
249,Corner Bakery Amsterdam, 5 stars ,3 years ago,Love it!!!
250,Corner Bakery Amsterdam, 5 stars ,2 years ago,Fantastic breakfast!
251,Corner Bakery Amsterdam, 5 stars ,3 years ago,Excellent!!!
252,Corner Bakery Amsterdam, 5 stars ,4 years ago,Soon good
253,Corner Bakery Amsterdam, 5 stars ,2 years ago,I loved the milkshakes!
254,Corner Bakery Amsterdam, 5 stars ,6 years ago,Awesome American pancakes!
255,Corner Bakery Amsterdam, 3 stars ,2 years ago,Nice place but expensive
256,Corner Bakery Amsterdam, 4 stars ,2 years ago,Nice place with nice workers.
257,Corner Bakery Amsterdam, 5 stars ,3 years ago,It was very delicious
258,Corner Bakery Amsterdam, 3 stars ,4 years ago,Weed drink and food together.
259,Corner Bakery Amsterdam, 5 stars ,4 years ago,GR8 carrot cake.
260,Corner Bakery Amsterdam, 5 stars ,3 years ago,Great food!
261,Corner Bakery Amsterdam, 5 stars ,3 years ago,Nice!
262,Corner Bakery Amsterdam, 5 stars ,3 years ago,Amaizing
263,Corner Bakery Amsterdam, 5 stars ,8 months ago,Top top top !
264,Corner Bakery Amsterdam, 4 stars ,5 years ago,Enjoy!
265,Corner Bakery Amsterdam, 5 stars ,3 years ago,Lovely waitress
266,Corner Bakery Amsterdam, 5 stars ,3 years ago,Very nice place !
267,Corner Bakery Amsterdam, 5 stars ,2 years ago,Great Service
268,Corner Bakery Amsterdam, 5 stars ,4 years ago,Great coffee.
269,Corner Bakery Amsterdam, 5 stars ,4 years ago,Must see in Amsterdam!
270,Corner Bakery Amsterdam, 5 stars ,4 years ago,Excellent
271,Corner Bakery Amsterdam, 5 stars ,3 years ago,A+
272,Corner Bakery Amsterdam, 2 stars ,a year ago,Nothing special
273,Corner Bakery Amsterdam, 5 stars ,6 years ago,excellent little place
274,Corner Bakery Amsterdam, 1 star ,4 years ago,Unfriendly staff!
275,Corner Bakery Amsterdam, 2 stars ,a year ago,Too expensiv
276,Corner Bakery Amsterdam, 5 stars ,2 years ago,Great place!!
277,Corner Bakery Amsterdam, 5 stars ,3 years ago,Fantastic milkshakes
278,Corner Bakery Amsterdam, 5 stars ,2 years ago,Delicious.
279,Corner Bakery Amsterdam, 5 stars ,2 years ago,Try the shake!!!!
280,Corner Bakery Amsterdam, 5 stars ,3 years ago,Perfect spot
281,Corner Bakery Amsterdam, 5 stars ,5 years ago,Hidden gem
282,Corner Bakery Amsterdam, 5 stars ,3 years ago,Mmmmmmmmmmmmmmmmm
283,Corner Bakery Amsterdam, 5 stars ,3 days ago,"Great bakery where you can have an amazing breakfast. Me and my gf tried some amazing American pancakes , yoghurt bowl with fresh fruits and. Nice and kind staff. Surely a place where to come back"
284,Corner Bakery Amsterdam, 5 stars ,2 weeks ago,"(Translated by Google) Very nice place with very nice employees. The ordering system is great, you simply order via the app, special requests were accepted personally. We had our table in the conservatory, it was really comfortable and …"
285,Corner Bakery Amsterdam, 4 stars ,6 months ago,(Translated by Google) Great breakfast 😍 I ordered the pancakes with fruit for myself and it was delicious. Ample portion and very sweet. …
286,Corner Bakery Amsterdam, 5 stars ,6 months ago,"(Translated by Google) Awesome! It's really not expensive for how much you get and how tasty it is. The French toast, souffle pancakes and the American pancakes are highly recommended! You are very nice inside. …"
287,Corner Bakery Amsterdam, 4 stars ,a week ago,"(Translated by Google) Very generous hangover brunch, but a little expensive for products and an order that is not made with the waiters but via a qr code on the phone… Very nice place and very well located near Museumplein …"
288,Corner Bakery Amsterdam, 5 stars ,6 months ago,"(Translated by Google) Great bakery with a very good selection of delicious food. The staff was extremely nice to the children and even our dog was given a large treat and water. Although you are very central, you sit quietly, a bit away …"
289,Corner Bakery Amsterdam, 5 stars ,6 months ago,"(Translated by Google) You will adore. After the Rijksmuseum, we went to eat at the Corner.
My god that was good. A salmon salad with a homemade sauce which I would have …"
290,Corner Bakery Amsterdam, 1 star ,6 months ago,"(Translated by Google) Too expensive and not tasty !!
My boyfriend and I went here and it wasn't tasty for the price!
My friend had to pay € 17 for 1 roll, omelette and some fruit, we waited 30 …"
291,Corner Bakery Amsterdam, 5 stars ,3 months ago,"(Translated by Google) Very cozy little café - especially recommended on rainy days. You are served warmly and even provided with a blanket should you get cold. I can only talk about the drinks, but I found them to be very tasty and …"
292,Corner Bakery Amsterdam, 5 stars ,6 months ago,(Translated by Google) Am thrilled! Order and pay easily via QR code and online meal card. The food was delicious and the staff was very friendly. I will gladly come again. …
293,Corner Bakery Amsterdam, 5 stars ,a month ago,"(Translated by Google) A very satisfying place. I love the taste and the staff!

(Original) …"
294,Corner Bakery Amsterdam, 5 stars ,5 months ago,"(Translated by Google) Lovely sitting outside. The girls finally had their freakskake.
We enjoyed. Friendly service too. …"
295,Corner Bakery Amsterdam, 4 stars ,6 months ago,"(Translated by Google) They have it well assembled, fully personalized, you order and pay with an app ... the attention is friendly, the food is quite good and the best is the coffee ""Coffee well made, with milk cream - NO foam, it's nice) …"
296,Corner Bakery Amsterdam, 5 stars ,3 months ago,"(Translated by Google) Very good service, delicious food, more portions. Delicious coffee! …"
297,Corner Bakery Amsterdam, 5 stars ,7 months ago,(Translated by Google) I've been here several times for the freak shake and the red velvet pancakes. Delicious!! …
298,Corner Bakery Amsterdam, 1 star ,4 months ago,"(Translated by Google) Let me start with the fact that me and my girlfriend got sick and threw up! We had nothing that day when the first meal was theirs! And secondly, very bad service 45 minutes to wait for a croissant and some fruit….is …"
299,Corner Bakery Amsterdam, 5 stars ,5 months ago,"(Translated by Google) Nice staff. Good food, generous portions.

(Original) …"
300,Corner Bakery Amsterdam, 5 stars ,5 months ago,"(Translated by Google) Super tasty dishes, with super friendly service.
Have ordered across the board and everything was very, very tasty. …"
301,Corner Bakery Amsterdam, 4 stars ,2 years ago,"(Translated by Google) Very nice place, just a few steps from the museum district. ideal place to have breakfast enjoying fresh fruit, smoothies, smoothies, pancakes and delicious homemade cakes. All very good, very good. …"
302,Corner Bakery Amsterdam, 5 stars ,6 months ago,"(Translated by Google) LOVELY! Customer-friendly, nice setting, value for money! I'm a fan! …"
303,Corner Bakery Amsterdam, 5 stars ,2 months ago,"(Translated by Google) Excellent little shop for breakfast. Offers very hearty fluffy pancakes I recommend the American breakfast with fruit, whipped cream and maple syrup, delicious. …"
304,Corner Bakery Amsterdam, 5 stars ,a year ago,"(Translated by Google) It is worth making a reservation here. It fills up quickly, especially on weekends. If you want to sit outside, you can do so even in colder temperatures, as heaters are installed above the benches to keep you warm. …"
305,Corner Bakery Amsterdam, 5 stars ,4 months ago,"(Translated by Google) Mega delicious you don't need to say more about it, it is worth a visit …"
306,Corner Bakery Amsterdam, 5 stars ,7 months ago,"(Translated by Google) Very tasty, friendly service, everything was great!

(Original) …"
307,Corner Bakery Amsterdam, 2 stars ,3 years ago,"(Translated by Google) We got there at 4pm knowing they close the doors at 5pm. The operation was quite stiff and slow and not so good mood. In the meantime, we have long been a fan of ""Anne & Max"" where you are always served with a good …"
308,Corner Bakery Amsterdam, 5 stars ,7 months ago,"(Translated by Google) Got a nice spot on the terrace, despite booking in advance was not successful. The online ordering on the terrace went wrong, but this was neatly resolved. The chicken and pulled beef sandwiches, red velvet pancakes …"
309,Corner Bakery Amsterdam, 5 stars ,a year ago,(Translated by Google) Insanely delicious breakfast. The little shop is always very full. Were there two days on the weekend because we liked it so much. The staff is sometimes a bit stressed because there is a lot to do but always remains …
310,Corner Bakery Amsterdam, 5 stars ,5 months ago,"(Translated by Google) Very nice place for breakfast or lunch. American dishes

(Original) …"
311,Corner Bakery Amsterdam, 5 stars ,a year ago,"(Translated by Google) Very nice breakfast / lunch restaurant just outside the center near the Rijksmuseum. Good and unique food / drink that is definitely worth it. They have different standard dishes like a sandwich, bouncer or croque …"
312,Corner Bakery Amsterdam, 5 stars ,3 years ago,"(Translated by Google) Delicious food in a sweet ambience.
If you want a healthy breakfast for a reasonable price, you're in the right place at this laid-back restaurant. The portions are filling and energetic. The …"
313,Corner Bakery Amsterdam, 4 stars ,4 years ago,"(Translated by Google) We have been January 7, was very cold then and have to wait outside for 45 minutes due to crowds. The dishes are good and served nicely, the freak shake is really freaky asome. 😀 You do sit on the windowsill in front …"
314,Corner Bakery Amsterdam, 5 stars ,2 years ago,"(Translated by Google) Found almost by chance, it has become a favorite destination of our breakfasts. Book on the site to secure the place. It's worth it! Every creation is surprising, rich and absolutely delicious !! A blend of flavors …"
315,Corner Bakery Amsterdam, 5 stars ,3 years ago,(Translated by Google) We ate there a total of two times. Both times it was almost full as there are unfortunately only a little more than 10 seats inside. But just as many outside when the weather is nice. We paid around 30 € each time for …
316,Corner Bakery Amsterdam, 5 stars ,2 years ago,"(Translated by Google) A really very delicious breakfast, with fresh mint tea and freshly squeezed orange juice and that served really nicely.
The staff is incredibly nice and friendly and that too on an early Sunday …"
317,Corner Bakery Amsterdam, 5 stars ,4 years ago,"(Translated by Google) Super tasty food and decorated very cute, the food is also nice! Very unstable haha, it is a bit on the expensive side but thought it was worth it. …"
