,Name,Review Rate,Review Time,Review Text
0,Café Luxembourg, 5 stars ,2 months ago,We had reservations and they accommodated us well beyond what we expected. We had the most fun and the best time ever in this restaurant....WOW.... This restaurant....... The food was amazing and the portions were huge. I will definitely be back.. Thank you so much you guys
1,Café Luxembourg, 5 stars ,6 months ago,"Great place, more targeted towards locals (no English menu) but super nice and helpful people, especially Jim.
They have both indoors and outdoors. I had to sit indoors due to colder weather and I forgot to take pics of the meal…"
2,Café Luxembourg, 5 stars ,6 days ago,Absolutely amazing. Nice vibe. Love it.
3,Café Luxembourg, 5 stars ,5 months ago,Was really delicious and the price was fair. I recommend the croques. All in all a perfect spot to have your breakfast
4,Café Luxembourg, 5 stars ,4 months ago,"Nice vibe. Can sit outside on the pavement, in a semi covered area or inside the restaurant itself.  We went for lunch. A good selection on the lunch menu. Delicious croquettes. A classic European brasserie"
5,Café Luxembourg, 4 stars ,9 months ago,Good location but touristy and a bit crowded which makes it hard for the staff to be attentive or caring.
6,Café Luxembourg, 2 stars ,2 weeks ago,Awful service. Very average food. Tired and lacking vibe. There are plenty of other fab places in Amsterdam that beat here. Wouldn’t recommend.
7,Café Luxembourg, 5 stars ,3 years ago,This place serves amazing breakfast. Food was fresh and delicious. Portions are big as well to have a hearty breakfast to start the day.
8,Café Luxembourg, 4 stars ,2 years ago,"I ordered Dutch Burger which was great and tasty (well cooked). It was a little bit expensive, 18.5 euros. The area was nice. I didn’t like the way the waitress behaved, wasn’t nice and friendly at all (compared to paris). Anyway the burger was delicious 😋"
9,Café Luxembourg, 2 stars ,6 months ago,"Restaurant with good view in interesting place with very poor customer service. You have to wait a lot of time for staff, than it can appear that something is not available after another 15 minutes. When you change your order you would wait …"
10,Café Luxembourg, 5 stars ,3 years ago,"Well, trying to decide if we had lunch, dinner or second lunch at the Cafe Luxembourg.  That is just how it is when you fly all night and arrive without sleep.  Our server was very patient and finally found drinks pleasing to each of us. Of …"
11,Café Luxembourg, 5 stars ,5 months ago,It was a nice Lavazzo coffee and grandmothers apple cake.
12,Café Luxembourg, 5 stars ,3 years ago,"Love love the big breakfast or brunch in here. I have been there 3 times to get some breakfast.
The taste was delicious and I couldn't stop eating. The orange juice was fresh. …"
13,Café Luxembourg, 5 stars ,4 years ago,"I can, once again, highly recommend this place! I have been here 4 or 5 times over the past couple of weeks and I am impressed. The staff is very professional; willing to help, observant and pleasant. The food is good and it is very well …"
14,Café Luxembourg, 5 stars ,2 years ago,Amazing breakfast! Place is so comfy I didn't want to leave. Christmas decorations are very fancy. Highly recommended for everyone to  visit!!!!!!
15,Café Luxembourg, 3 stars ,7 months ago,"Very unfriendly staff, had to wait ages for service and we're not given napkins or cutlery with the food. BUT best bitterballen you'll find in the city! (Only veil is good, shrimp tastes very poor)"
16,Café Luxembourg, 4 stars ,8 months ago,Great cocktails! Try “Lolea premium sangria rood”!
17,Café Luxembourg, 5 stars ,4 months ago,Easy going café in central Amsterdam. The make a great burger which I would recommend and surely we have again.
18,Café Luxembourg, 5 stars ,2 years ago,"Lovely meal & drink with amazing staff who went above and beyond by explaining the history of Genever, the different varieties and suggestions on where to go next."
19,Café Luxembourg, 4 stars ,2 years ago,"Cozy, nice place to have a drink or something to eat. They have a nice glass covered area where you can lookout on the street and surroundings."
20,Café Luxembourg, 5 stars ,5 years ago,What a great first meal in Amsterdam. My companion and I strolled around and found this place to be hopping and made thr decision to eat a late lunch here. It was fantastic and the waitress was attentive and friendly.
21,Café Luxembourg, 4 stars ,3 years ago,Lovely place to sit and watch the world go by from their conservatory. Nice nibbles selection. Friendly staff and great beer.
22,Café Luxembourg, 5 stars ,a month ago,"Always a nice hangout for a coffee, a beer, a bite and a business catch-up."
23,Café Luxembourg, 5 stars ,3 years ago,"Best brasserie in town. Suggestions:onion soup,crocque monsieur and eggs with smoked salmon"
24,Café Luxembourg, 5 stars ,3 years ago,"Located in het spui, gorgeous building, reasonable prices, nice food and a very nice service! They offer a very good variety of beers and they also have a separate menu for cider."
25,Café Luxembourg, 4 stars ,3 years ago,I am visiting Amsterdam for more than 20 years and this cafe is like an old friend ... You visit everything is same and great..
26,Café Luxembourg, 4 stars ,4 years ago,Wonder food/drinks - service a bit slow but overall a good dining experience
27,Café Luxembourg, 3 stars ,3 years ago,Good latte. It passed the spoon test. Food was decent but overpriced. I had cheese filled kroket.
28,Café Luxembourg, 5 stars ,a month ago,Beautiful and elegant shop with its staff
29,Café Luxembourg, 2 stars ,a year ago,"The food is good but the service is horrible. We've been waiting a lot for the menu, the drinks and the food. One of the waitresses forgot to bring us a menu so we asked another waitress to bring us a menu which also took around 15 minutes. …"
30,Café Luxembourg, 4 stars ,4 years ago,"Very friendly and attentive staff, especially the gentlemen who greets customers at the door. Shrimp croquette balls was amazing!"
31,Café Luxembourg, 4 stars ,3 years ago,A nice choice for coffee or a beer. Decent place an prices.
32,Café Luxembourg, 4 stars ,3 years ago,"Service was good, food was hot and beer was cold. Can't ask for more than that!"
33,Café Luxembourg, 4 stars ,3 years ago,"Very good food, better to reserve a table"
34,Café Luxembourg, 5 stars ,2 years ago,"Came here for brunch and got two burgers and the croquettes to share.

Both very nice and juicy - I was surprised when they asked how I wanted my …"
35,Café Luxembourg, 5 stars ,2 months ago,Amazing food and friendly staffs :))
36,Café Luxembourg, 4 stars ,3 years ago,A quaint cafe - I didn't see anything special about this place - the service is okay and the offerings are okay as well.
37,Café Luxembourg, 3 stars ,3 years ago,"Nice location in Amsterdam. Food was OK, but nothing of come back for. On the pricey side but you are paying for the views"
38,Café Luxembourg, 4 stars ,2 years ago,"Beautiful place, great food and drinks too. Try the croquette and a piece of apple pie!"
39,Café Luxembourg, 4 stars ,3 years ago,"Nice place for lunch, good beef croquettes"
40,Café Luxembourg, 5 stars ,2 years ago,A nice traditional cafe with an outdoor patio and an excellent croque madame.
41,Café Luxembourg, 5 stars ,3 months ago,Sit on the balcony and watch the world pass by while munching on your salmon sandwich and  tripple beer
42,Café Luxembourg, 4 stars ,5 years ago,"Good portions, tasty food friendly staff, nice ambience 😉"
43,Café Luxembourg, 5 stars ,6 months ago,"Nice food at a reasonable price, good service"
44,Café Luxembourg, 5 stars ,2 years ago,"Most people come here for the nostalgia & classic good service. Simple menu, but well prepared. Like a proper hamburger, mussels and roadkill chicken. I had them all, and they are all great!"
45,Café Luxembourg, 5 stars ,3 years ago,"This is a great place to kill an hour or two over a few drinks and some food. The staff is very helpful, and the menu is great. The location being right in Spui, is a real bonus too. It’s also a great spot for football matches that isn’t too noisy. Great vibes all around."
46,Café Luxembourg, 5 stars ,2 years ago,We were here for a quick bite and a hot drink to escape the rainy weather outside. The place was packed so we could only find a place to sit at the massive centre table that seats about 8-10 people. We loved the decor and the ambience of …
47,Café Luxembourg, 5 stars ,5 months ago,"A really good cafe, service great and good location"
48,Café Luxembourg, 3 stars ,2 years ago,"This review is only about the service. Having empty glasses on your table, a waiter seeing them and just moving on, not once but after every round for which I walked to the bar to the bar. And this while it was quite empty at 10 pm. That I …"
49,Café Luxembourg, 4 stars ,2 years ago,"Our first food stop after arriving in Amsterdam.  Had a very delicious and crispy Belgian waffle served with whipped cream, powdered sugar, ice cream and syrup.  The coffee was good also, but as was the case in most of Amsterdam very small …"
50,Café Luxembourg, 5 stars ,3 years ago,Arguably one of my favorite places in Amsterdam for breakfast and lunch. It's a very old cafe style place that feels very authentic. Most waiters have been working there for as long as I can remember and are extremely service minded.
51,Café Luxembourg, 2 stars ,2 years ago,"Nice setting but the food is awful here. The worst/toughest steak I’ve ever had. Undercooked fries. Well done, salty burger with a hard as a rock stale bun. Interior setting is nice, but go somewhere else."
52,Café Luxembourg, 4 stars ,6 months ago,"Nice place, kind staff.. the minus point, the bathroom was really dirty."
53,Café Luxembourg, 5 stars ,a month ago,Really good cheese table
54,Café Luxembourg, 4 stars ,2 years ago,"I like to come here to kill some time before work. They serve a decent coffee. When seated in the orangery the service is swift. Don't go to the back of the place, for the service will decrease in quality for some reason."
55,Café Luxembourg, 5 stars ,3 years ago,Such good food - we had a burger and pasta and both were delicious. Great service and drinks - especially the elderflower gin. Lovely place with a conservatory overlooking Spui square. Definitely recommend it.
56,Café Luxembourg, 4 stars ,2 years ago,"Great people watching spot, or people walking in front of bike watching spot. - Staff were nice, food was fast and good. A little bit overpriced, but you pay for the location and the view. - I'd come back and eat here with friends in the future for a quick lunch for sure."
57,Café Luxembourg, 5 stars ,a year ago,Loved the food here the Madame was perfect and the beer was cold suggest sitting in the front space great for cold rainy days
58,Café Luxembourg, 1 star ,2 years ago,"My mates where drunk when we went here for a drink, I was the sober one looking after them. When they ordered a round of drinks (3 cokes and 1 beer) they handed over 40 euros in notes I had to argue with the bar man to give us the change, …"
59,Café Luxembourg, 4 stars ,2 years ago,"Good atmosphere, friendly staff, solid food. Get your butt over there if you're in the center. The entrance is on the side during the winter, near the giant menu they have outside."
60,Café Luxembourg, 1 star ,2 years ago,"Has gone downhill rapidly. Personell acts almost inconvenienced by your mere presence, very unfriendly and seem unwilling to even take an order. Coffee was cold when we got it, went somewhere else for lunch."
61,Café Luxembourg, 5 stars ,4 years ago,I love this place.  I always visit on the 2 to 3 visits I make to Amsterdam a year.  They have a conservatory type structure on the front and it's great eating and drinking and watching all that is going on outside.  They do a really nice …
62,Café Luxembourg, 4 stars ,4 years ago,"Proper, classic, brown cafe. Went here for some drinks and wasn't dissapointed. Coffee, tea, piece of cake, all as expected.
I'd call his place roomy, atmospheric, plus the common table has an impressive number of newspapers!!"
63,Café Luxembourg, 5 stars ,a year ago,A perfect place to touch base in Amsterdam. Very friendly staff and the veal croquettes are not the only MUST try here ... could not stop at bitterballen eather ;-)
64,Café Luxembourg, 5 stars ,2 years ago,As a heavy eating America I can say the portions are enormous without any quality loss. Very tasty food and good service. Fulfilled what I wanted in a last Dutch meal before I left the country.
65,Café Luxembourg, 5 stars ,8 months ago,"My favourite place in Amsterdam, only point is the service might be Very slow when the place is busy"
66,Café Luxembourg, 1 star ,4 years ago,"The place was very clean, people were friendly, but when we tried to order a luxemburger...no we are out okay thats normal...I will have the chicken breast...no we are out...they only had half the menu!! I ended up getting a steak (medium …"
67,Café Luxembourg, 3 stars ,5 years ago,"They supposed to have the best bitterballen in Amsterdam. After spending 6.50 euro on 6 bitterballen, I can conclude that it is totally overrated and would never come here for that again. Their sandwiches are pretty decent though."
68,Café Luxembourg, 5 stars ,a year ago,"Nice tables by the river, especially on a sunny day! Friendly staff, nice coffee and nice people! Recommended!"
69,Café Luxembourg, 3 stars ,2 years ago,Tradicional cafe in Amsterdam. The plates were not very appealing to me and it's a bit expensive but I always go there to relax and drink some coffee outside which is nice
70,Café Luxembourg, 5 stars ,4 years ago,"I really enjoyed the place. We were 5 people to visit the restaurant after a walk from Amsterdam Centraal. We appreciate the kindness of all of the personnel, Emily in particular. We would like to visit again..."
71,Café Luxembourg, 3 stars ,5 years ago,"It's a nice place in a busy area of Amsterdam with reasonable prices. However, if you ask for no croutons, expect croutons. But staff was friendly, quick with service, etc. You get what you pay for!"
72,Café Luxembourg, 5 stars ,4 years ago,"I had nice cheese croquettes!
I found this restaurant after I watched a documentary on national geographic for Street foods around the world. …"
73,Café Luxembourg, 5 stars ,2 years ago,"Luxembourg breakfast is lovely so is the English. Good table service, staff are very friendly. Good prices, nice place 😁"
74,Café Luxembourg, 4 stars ,4 years ago,"Nice place to enjoy an evening at. Food tasty. Agree with others who found service a bit slow. Prices are fine, typical for Amsterdam."
75,Café Luxembourg, 4 stars ,3 years ago,"Centrally located, beautiful steaks, good service by helpful cheery staff. Good value and can recommend for medium range meals in a friendly, relaxed atmosphere."
76,Café Luxembourg, 4 stars ,4 months ago,Excellent food and beer
77,Café Luxembourg, 3 stars ,4 years ago,"They have good ""bitterballen"". If you wanna try good ones, try them here. But have to say: service isn't that good. Had to ask three times for a drink. It wasn't busy."
78,Café Luxembourg, 5 stars ,4 years ago,Really liked the croquettes and the fries. Not super fast service but tasty food and very 'authentic' feel. Recommended
79,Café Luxembourg, 5 stars ,2 years ago,Very solid quality food. The shrimp cocktail was very fresh and tasty. Staff were friendly
80,Café Luxembourg, 5 stars ,a year ago,I have visited this place many times and love the atmosphere. Great service and a wonderful scene.
81,Café Luxembourg, 5 stars ,2 years ago,"Great food, great staff. Our group of 28 people were served perfectly!"
82,Café Luxembourg, 5 stars ,8 years ago,"Nice restaurant, with friendly and polite waiters. The food is really good, and so is the price considering what you get! Really liked it"
83,Café Luxembourg, 1 star ,2 years ago,"I asked for a snack but they told that the kitchen was closed. After 5minutes, a group of Dutch people arrived and sat next to my table. They asked for food and they got it. I ask for food again and the waitress was extremely rude and ignored me, probably because I did not speak in Dutch."
84,Café Luxembourg, 5 stars ,2 years ago,"Lovely atmosphere, coffee and food. First class place to spend some time."
85,Café Luxembourg, 5 stars ,2 years ago,Stopped for lunch and it was delicious. Had the flamkuchen and the cheese croquette. Both were good.
86,Café Luxembourg, 4 stars ,4 years ago,Classic place. Good for a drink and to relax. Haven’t eaten here yet. Service is a bit slow .
87,Café Luxembourg, 5 stars ,4 years ago,"We breakfasted here twice.  Terrific food, nice portions and can't beat the views of the square.  Will be back!"
88,Café Luxembourg, 4 stars ,2 years ago,Great food and nice service. Awesome location. Love the atmosphere.
89,Café Luxembourg, 1 star ,3 years ago,Overrated. Staff brought wrong things and didn't get the water we asked for until we were ready to leave. Underwhelming food for the prices
90,Café Luxembourg, 4 stars ,2 years ago,"Love to go there for a drink and a snack when in Amsterdam. You must try their ""osseworst"", delicious"
91,Café Luxembourg, 5 stars ,9 years ago,"A very nice restaurant! Food is good, staff is nice, the square outside is beautiful, internet is strong enough here for your online calls."
92,Café Luxembourg, 5 stars ,2 years ago,Good food and friendly staff I visited twice and both times were as good as each other
93,Café Luxembourg, 4 stars ,7 years ago,Service was great. And the location by the square was ok. Never tried any food. Just the beer and those were ok.
94,Café Luxembourg, 5 stars ,5 months ago,Leffe beers on tap!
95,Café Luxembourg, 5 stars ,2 years ago,Lobster croques are out of this world!
96,Café Luxembourg, 3 stars ,3 years ago,Here between street partys for a rest. Me with a delicious koffie verkeerd . Good place to watch people. Now onwards to the rembrandt plein. 😀
97,Café Luxembourg, 5 stars ,4 years ago,Friendly staff and good food. Great spot for a couple cups of coffee.
98,Café Luxembourg, 5 stars ,4 years ago,"Fabulous food, good beer, lovely staff. Well worth a visit."
99,Café Luxembourg, 2 stars ,2 years ago,Food was ok but overpriced and service was really unpleasant.
100,Café Luxembourg, 4 stars ,5 years ago,Nice brown-cafe at the heart of downtown Amsterdam. Nice service with a smile. Good latte!
101,Café Luxembourg, 5 stars ,3 years ago,"Great service, and delicious food, will definitely come back here"
102,Café Luxembourg, 1 star ,4 years ago,"To send away a new mum of a 2month old crying baby is completely out of line ""Childbirth is isolating enough we don't need  cafes/restaurants like this to make it even harder"" quote from an other mother."
103,Café Luxembourg, 3 stars ,5 years ago,"Nice fries, nice view, but stay clear of the tuna melt: open- faced swamp thing."
104,Café Luxembourg, 1 star ,4 years ago,Today you literally kicked out a young couple with a baby because baby cried a little. What a shame! Never suggest anyone with kids to step into this place.
105,Café Luxembourg, 4 stars ,5 years ago,"We had croquettes (seafood, veal and cheese) all three of them are decent"
106,Café Luxembourg, 4 stars ,4 years ago,"I was there for a breakfast and the service and food were tasty, good portion, etc."
107,Café Luxembourg, 5 stars ,6 years ago,"Good food, friendly staff and prompt service. Try the Luxembourg burger, you won't be disappointed."
108,Café Luxembourg, 4 stars ,5 years ago,Local coffee with some basic food and drinks.. we had breakfast there... was nothing bad about it (no-wifi)
109,Café Luxembourg, 5 stars ,a year ago,"Great steak, good service and beer."
110,Café Luxembourg, 4 stars ,5 years ago,Very friendly staff. It would've been 5 stars if our section didn't smell.
111,Café Luxembourg, 3 stars ,5 years ago,"Good service and nice sitting inside, it's the uninspired food that lets this place down. Ok for lunch."
112,Café Luxembourg, 4 stars ,3 years ago,There's English menu but it was a little hard to understand. Fish was very good taste.
113,Café Luxembourg, 3 stars ,11 months ago,"Too noisy but nice cafe, very mixed public, too touristic."
114,Café Luxembourg, 4 stars ,5 years ago,"nice place for a coffe/beer/drink  We have been here in the afternoon, sitting outside."
115,Café Luxembourg, 4 stars ,4 years ago,Good food. I had the seabream which was perfectly prepared. Portions are generous
116,Café Luxembourg, 5 stars ,2 years ago,Great food And service fantastic for breakfast!
117,Café Luxembourg, 4 stars ,6 years ago,"Nice, cozy place, with a pretty complete menu in terms of eating and drinking options"
118,Café Luxembourg, 4 stars ,2 years ago,Great food & service. Love the atmosphere.
119,Café Luxembourg, 5 stars ,6 years ago,Very nice cafe. Great food. But no food from luxembourg itself.
120,Café Luxembourg, 4 stars ,5 years ago,Nice beer and good food. Very popular place
121,Café Luxembourg, 4 stars ,3 years ago,"Nice drinks, atmosphere. A bit noisy. A classic..."
122,Café Luxembourg, 5 stars ,a year ago,Great food & scenery!
123,Café Luxembourg, 4 stars ,5 years ago,Traditional old style brasserie. One of my favorite place for breakfast.
124,Café Luxembourg, 5 stars ,5 years ago,"Beautiful bar, great place for coffee or drinks with friends"
125,Café Luxembourg, 4 stars ,5 years ago,OK place to drink and have breakfast. Good breakfast with an assortment of choices.
126,Café Luxembourg, 3 stars ,2 years ago,"Touristic place, nice staff, but sometimes slow"
127,Café Luxembourg, 5 stars ,2 years ago,Great for a drink with bitterballen. Friendly service
128,Café Luxembourg, 4 stars ,3 years ago,Loved sitting at the front tasting local food and watching the world go by
129,Café Luxembourg, 4 stars ,8 years ago,"Nice restaurant.  Food is good, and waiters are friendly."
130,Café Luxembourg, 4 stars ,2 years ago,"Food is good, a bit pricey though."
131,Café Luxembourg, 4 stars ,4 years ago,Very good food. Reasonable price and good service
132,Café Luxembourg, 3 stars ,4 years ago,Food was okay nice selection central location
133,Café Luxembourg, 5 stars ,3 years ago,Very good steak and mussels! Reasonable price
134,Café Luxembourg, 4 stars ,4 years ago,"Top bar at the end of the spui, good service, good food , recommend"
135,Café Luxembourg, 4 stars ,4 years ago,Lovely spot for breakfast. Good eggs and fruit salad
136,Café Luxembourg, 5 stars ,3 years ago,Nice place to get good beer and apple pie
137,Café Luxembourg, 5 stars ,3 years ago,A traditional Eetcafe! A little pricy but definitely worth a visit
138,Café Luxembourg, 4 stars ,3 years ago,"Nice food, great view of Spui to watch the world go by"
139,Café Luxembourg, 4 stars ,3 years ago,Lovely food but toilets totaly gross.
140,Café Luxembourg, 5 stars ,6 years ago,Had good food and some beer from home (Washington).. Enjoyed it!
141,Café Luxembourg, 2 stars ,3 years ago,Staff completely bamboozled by desire to have a drink only and struggled with the concept of paying for drink as it was served
142,Café Luxembourg, 5 stars ,3 years ago,"Good food, not too crowded)"
143,Café Luxembourg, 5 stars ,2 years ago,Good beer and nice service.
144,Café Luxembourg, 5 stars ,5 years ago,"Great friendly service, great food ..
Highly recommended"
145,Café Luxembourg, 5 stars ,5 years ago,"Classic brown bar, perfect for a quiet drink with a friend and watching the world go by"
146,Café Luxembourg, 4 stars ,5 years ago,"Friendly staff, and good food and beverages. Perfect for a break."
147,Café Luxembourg, 5 stars ,5 years ago,Nice neighborhoor café. I had croque madame. It was delicious.
148,Café Luxembourg, 5 stars ,4 years ago,A good place for a quick cup of (very good) coffee.
149,Café Luxembourg, 4 stars ,2 years ago,"Great little cafe , good atmosphere,  do recomend"
150,Café Luxembourg, 4 stars ,4 years ago,"Very tasty chicken supreme , sage sauce and fries."
151,Café Luxembourg, 5 stars ,2 years ago,"Nice service, good prices, relaxed environment!"
152,Café Luxembourg, 3 stars ,4 years ago,"Mediocre French food. Excellent steak, gritty chocolate mousse."
153,Café Luxembourg, 4 stars ,4 years ago,Maybe the best bitterballen in Amsterdam. Steak also good
154,Café Luxembourg, 3 stars ,4 years ago,Not so good tasting coffee. Better places in Amsterdam!
155,Café Luxembourg, 5 stars ,6 years ago,Lively atmosphere and great food. Try Leffe with Croquet!
156,Café Luxembourg, 4 stars ,6 years ago,"The food was nice, but check the change."
157,Café Luxembourg, 5 stars ,5 years ago,Nice place to make a quick stop for coffee or lunch!
158,Café Luxembourg, 3 stars ,4 years ago,Just ok.  Very basic breakfast menu.
159,Café Luxembourg, 4 stars ,3 years ago,Good.
160,Café Luxembourg, 5 stars ,3 years ago,Amazing food
161,Café Luxembourg, 5 stars ,2 years ago,Try shrimp croquettes! Delicious 😋
162,Café Luxembourg, 4 stars ,4 years ago,Nice large space. Good atmosphere...
163,Café Luxembourg, 5 stars ,5 years ago,"Great old school café, smiling personel"
164,Café Luxembourg, 5 stars ,5 years ago,Really quaint little place lovely food and excellent service
165,Café Luxembourg, 5 stars ,6 years ago,Beautiful place. Great beer.
166,Café Luxembourg, 5 stars ,2 years ago,Best old pub in centre of Amsterdam
167,Café Luxembourg, 5 stars ,2 years ago,Great drinks and food.
168,Café Luxembourg, 5 stars ,4 years ago,"Picturesque setting, great coffee and croissants!"
169,Café Luxembourg, 5 stars ,2 years ago,Great stay for decades already.
170,Café Luxembourg, 5 stars ,5 years ago,Great service and lovely apple pie!
171,Café Luxembourg, 3 stars ,5 years ago,Good place to have big party with colleagues.
