,Name,Review Rate,Review Time,Review Text
232,Dolphins Coffeeshop, 5 stars ,6 years ago,"Underrated, good service, nice decor, good smoking room downstairs, and recommend isolator it's good quality n value for money. Will be back again."
233,Dolphins Coffeeshop, 4 stars ,5 years ago,"One of the best Shops in Town.  Tobacco and non Tobacco Zones. Good homegrown weed, mellow Music."
234,Dolphins Coffeeshop, 5 stars ,3 years ago,The most amazing interior of a coffeshop. Its like aquarium and you have bong on each table.
235,Dolphins Coffeeshop, 5 stars ,5 years ago,"The staff there is super friendly and so helpful we had a great time
we can not wait to visit again :)"
236,Dolphins Coffeeshop, 4 stars ,4 years ago,"Not a bad coffeeshop, less packed then those close to central station. Friendly girls checking nobody has passed out every now and then..."
237,Dolphins Coffeeshop, 4 stars ,3 years ago,"Nice coffee shop, a bit too crowded for its small size but nice interior with goldfish in glass bowls."
238,Dolphins Coffeeshop, 1 star ,5 years ago,Do not go here at all costs. The woman behind the counter is a grade A parcel. Needs chucking in one of the fine canals.
239,Dolphins Coffeeshop, 3 stars ,2 years ago,"Ok coffee shop, very low Diversity of strains, The ones i tried were ok but over priced comparing to other coffee shops and the service wasn't good."
240,Dolphins Coffeeshop, 1 star ,2 years ago,Need to buy 3 grams if you are in 5. Amsterdam provides much better and friendly coffees
241,Dolphins Coffeeshop, 5 stars ,6 years ago,Great value and always a nice chilled atmosphere. Booths downstairs for really enjoying the place ;)
242,Dolphins Coffeeshop, 1 star ,3 years ago,"Bad attitude from seller, she told us that we can sit only if we buy 2 grams each. And the place was empty!!"
243,Dolphins Coffeeshop, 1 star ,5 years ago,"Terrible service, coming in with a group of 6 we bought more then 100 euros of product and were not allowed to stay over an hour in the lounge area...Much better coffee shops elsewhere in Amsterdam!"
244,Dolphins Coffeeshop, 1 star ,3 years ago,The girl who worked there worked on us and made us buy more than needed. Do not recommend getting to the place where you work on customers !!
245,Dolphins Coffeeshop, 1 star ,5 years ago,Rude staff even when paying money. Don't let you check for seats. By far the worst coffeshop I've been in
246,Dolphins Coffeeshop, 5 stars ,2 years ago,Cool place. Staff were friendly and very helpful.
247,Dolphins Coffeeshop, 4 stars ,4 years ago,Friendly staff to accommodate your every need 😀 such comfort downstairs and great to meet like minded people
248,Dolphins Coffeeshop, 5 stars ,6 years ago,Awesome coffee shop with colour decor. The option to use their vaporizers is a nice touch.
249,Dolphins Coffeeshop, 5 stars ,4 years ago,"Cool Athmosphere, staff, nice interieteur & the dope was also oke. The Selection is limited. …"
250,Dolphins Coffeeshop, 1 star ,4 years ago,The stuff were okay with me but I could see how some customers were treated... most of those who came during my 20minutes stay left without staying or even buying
251,Dolphins Coffeeshop, 4 stars ,3 years ago,The guy who served us was great at explaining everything on offer. The space cake was great
252,Dolphins Coffeeshop, 5 stars ,3 years ago,"The thing that I like the most about this place is the downstairs, where you can relax and chill on the couches. Big ups."
253,Dolphins Coffeeshop, 1 star ,7 years ago,Was all good when my friend had a spacecake and when we got back to our hostel she started throwing up blood. Don't have spacecakes from here.
254,Dolphins Coffeeshop, 5 stars ,3 years ago,"Amazing staff, strong stuff, great wibes. Try the space muffin you wont regret it"
255,Dolphins Coffeeshop, 5 stars ,2 years ago,"First impression is amazing! I think this is a keeper!
Great place!"
256,Dolphins Coffeeshop, 1 star ,4 years ago,Ignorant staff made who only wanted more money. Worst coffee shop experience in Amsterdam
257,Dolphins Coffeeshop, 5 stars ,2 years ago,"Wicked little shop, downstairs is cosy and the service is top notch."
258,Dolphins Coffeeshop, 4 stars ,4 years ago,We nice staff
259,Dolphins Coffeeshop, 1 star ,2 years ago,"One of the bad coffee shop in amsterdam
Bad service.
mistake to come in the first place"
260,Dolphins Coffeeshop, 3 stars ,3 years ago,"Great place, but you have to buy weed and drinks"
261,Dolphins Coffeeshop, 4 stars ,5 years ago,White Dolphin sativa wad very nice; The place is cosy and comfortable with sofas and warm decor.
262,Dolphins Coffeeshop, 5 stars ,5 years ago,Great experience for a guest timer! Very relaxed environment and helpful staff.
263,Dolphins Coffeeshop, 5 stars ,2 years ago,This is one of the best places for edibles and top notch smoke
264,Dolphins Coffeeshop, 5 stars ,4 years ago,Great coffee shop with awesome service. Just ask away and they will guide you.
265,Dolphins Coffeeshop, 5 stars ,3 years ago,"Nice design, quite expensive prices, but good space cakes"
266,Dolphins Coffeeshop, 5 stars ,2 years ago,"The vape requires a deposit to be left,  well worth the trip."
267,Dolphins Coffeeshop, 1 star ,2 years ago,B-A-D service! Rude manager who thinks she can educate customers!! Don’t go there
268,Dolphins Coffeeshop, 5 stars ,2 years ago,My favorite coffeeshop in amsterdam. They got crazy vaporizers.
269,Dolphins Coffeeshop, 3 stars ,3 years ago,Good place but limited choice.  Lovely staff and peng bud🍁
270,Dolphins Coffeeshop, 5 stars ,2 years ago,Amazing vaping cafe - I recommend Dolphon Diesel - a sweet sativa
271,Dolphins Coffeeshop, 2 stars ,5 years ago,Staff very polite but not so kind. Pot only already packed. You have to drink even if you buy pot.
272,Dolphins Coffeeshop, 5 stars ,2 years ago,"Pretty chill, nice place to hang out for awhile hiding from the rain."
273,Dolphins Coffeeshop, 1 star ,5 years ago,Awful service. Never go there. There's plenty of much nicer coffee shops in Amsterdam.
274,Dolphins Coffeeshop, 3 stars ,7 years ago,"Not particularly good nor bad. The staff is efficient, they offer a vapeur menu that is OK."
275,Dolphins Coffeeshop, 5 stars ,3 years ago,I recommend this place to everyone I know. It's my favourite coffee shop
276,Dolphins Coffeeshop, 1 star ,3 years ago,Horrible experience. Forced us to either buy more than we asked for or leave. We chose to leave. Only four strains and unhelpful staff.
277,Dolphins Coffeeshop, 1 star ,4 years ago,"Super rude staff, tried to pressure us into buying more than what we wanted, bad quality product overpriced menu."
278,Dolphins Coffeeshop, 3 stars ,3 years ago,Good place but rude team. Good Cannabis and that is what's important for this place.
279,Dolphins Coffeeshop, 4 stars ,3 years ago,"Cool atmosphere. Decent prices, good weed!!"
280,Dolphins Coffeeshop, 4 stars ,4 years ago,Friendly staff and clean coffee shop but very small selection of items especially for those that help to relieve pain
281,Dolphins Coffeeshop, 5 stars ,4 years ago,Great place for people who like to smoke and push themselves to the limit
282,Dolphins Coffeeshop, 5 stars ,3 years ago,"Best coffee shop in Amsterdam! Friendly, knowledgeable staff & the most interesting decor."
283,Dolphins Coffeeshop, 5 stars ,a year ago,Great service great price great coffee great joints
284,Dolphins Coffeeshop, 5 stars ,2 years ago,"Great staff, good weed and muffins"
285,Dolphins Coffeeshop, 4 stars ,5 years ago,"Good place can get a little crowded and smokey especially if you smoke hash, which many people here do."
286,Dolphins Coffeeshop, 4 stars ,6 years ago,"Nice place, good music, helpful staff. And the best dessert ;-)"
287,Dolphins Coffeeshop, 5 stars ,2 years ago,Friendlist Coffee Shop! Always friendly and helpful to new people!
288,Dolphins Coffeeshop, 5 stars ,4 years ago,"Great hot choclate, alot of places to sit with airflow. Amazing weed"
289,Dolphins Coffeeshop, 5 stars ,4 years ago,Really good place and good green . Staff really helpful and friendly. I go there every time I visit Amsterdam
290,Dolphins Coffeeshop, 3 stars ,5 years ago,The place you sit and chill is a bit crowded but its still good shop
291,Dolphins Coffeeshop, 4 stars ,3 years ago,Good Quality and delicious muffins. Quite expensive but definitely worth a try
292,Dolphins Coffeeshop, 1 star ,4 years ago,"Even being a cool place, we decide to not stay as the staff is rude"
293,Dolphins Coffeeshop, 2 stars ,6 years ago,Decent weed but not such good service...owners are very bossy and try to sell you everything instead of letting chill
294,Dolphins Coffeeshop, 5 stars ,4 years ago,The staff want you to enjoy your time here and i certainly did.i would reccomend The Dolphins.
295,Dolphins Coffeeshop, 5 stars ,4 years ago,"Had an amazing time here, the staff are really nice and helpful."
296,Dolphins Coffeeshop, 5 stars ,2 years ago,Beautiful and well-equipped store. My favourite in Amsterdam!
297,Dolphins Coffeeshop, 4 stars ,5 years ago,Very cool place and atmosphere. the staff members are not very nice...
298,Dolphins Coffeeshop, 5 stars ,3 years ago,"Very friendly staff, came on our last night. Beautiful style."
299,Dolphins Coffeeshop, 5 stars ,3 years ago,Love this place id really welcoming and prices are really good I love the memes on the tv
300,Dolphins Coffeeshop, 5 stars ,2 years ago,Great place. And they have Jarritos. I liked it :)
301,Dolphins Coffeeshop, 5 stars ,2 years ago,The decor is amazing and the staff are awsome always helpful.
302,Dolphins Coffeeshop, 5 stars ,3 years ago,"Nice place, good stuff, very sympathic staff girls"
303,Dolphins Coffeeshop, 5 stars ,2 years ago,Probably one of the best coffee shops in town!
304,Dolphins Coffeeshop, 5 stars ,5 years ago,They sell very tasty hash cookies. Good stuff :D.
305,Dolphins Coffeeshop, 5 stars ,4 years ago,Ask for flower power and thank me later. Oh and the place is pretty cool inside the coral reef
306,Dolphins Coffeeshop, 3 stars ,5 years ago,"Very crowded, in order to stay inside, if in a large group, they will ""invite"" you to buy a lot of weed and drinks..."
307,Dolphins Coffeeshop, 1 star ,4 years ago,"The staff was so rude and not welcoming, they chased us out yelling at us for taking up space before we had even ordered."
308,Dolphins Coffeeshop, 5 stars ,2 years ago,This place looks so cool and not too crowded.
309,Dolphins Coffeeshop, 5 stars ,4 years ago,Nice coffeeshop with a good selection of herbs. Looza juices are delicious!
310,Dolphins Coffeeshop, 1 star ,5 years ago,"Small, not much seating. Each person must buy something to stay there."
311,Dolphins Coffeeshop, 5 stars ,5 years ago,You have to buy some staff :D to be able to stay there.
312,Dolphins Coffeeshop, 5 stars ,6 years ago,Very friendly and thoughtful staff. Excellent place to relax.
313,Dolphins Coffeeshop, 5 stars ,2 years ago,Really nice and cozy place with nice weed
314,Dolphins Coffeeshop, 5 stars ,3 years ago,One of my favourite coffee shops in the city 😊👍
315,Dolphins Coffeeshop, 1 star ,2 years ago,"Bad atmosphere, cringe waitress, small and bad marijuana variety"
316,Dolphins Coffeeshop, 5 stars ,4 years ago,OMG place where I'm gonna always come back :) best high ever :)
317,Dolphins Coffeeshop, 5 stars ,4 years ago,Excellent staff recommendation for my visit to Amsterdam. Very patient and helpful. Thanks
318,Dolphins Coffeeshop, 5 stars ,2 years ago,My favorite place !
319,Dolphins Coffeeshop, 5 stars ,2 years ago,Full of entertainment + great place for family hangout 😃😉
320,Dolphins Coffeeshop, 5 stars ,5 years ago,"Big thx to the staff for being super helpful, saved our day :) great shop, great product, great skills!"
321,Dolphins Coffeeshop, 5 stars ,2 years ago,"Cool environment, very nice prices"
322,Dolphins Coffeeshop, 1 star ,3 years ago,Worst Coffeeshop ever! Bad service! Don’t go there
323,Dolphins Coffeeshop, 5 stars ,2 years ago,Good weeds and very good attention. Have fun :)
324,Dolphins Coffeeshop, 5 stars ,6 years ago,"Awesome decor, friendly staff, cute dolphin theme. Excellent place"
325,Dolphins Coffeeshop, 5 stars ,4 years ago,Super nice staff and totally awesome atmosphere.
326,Dolphins Coffeeshop, 5 stars ,3 years ago,"I LOVED IT, GREAT ATMOSPHERE AND ALSO GREAT SUBMARINE-STYLE FOR THE TOBACCO AREA"
327,Dolphins Coffeeshop, 4 stars ,6 years ago,"Nice shop, good atmosphere but unfortunately bad music"
328,Dolphins Coffeeshop, 5 stars ,3 years ago,Very good coffeeshop but watch your step!
329,Dolphins Coffeeshop, 1 star ,4 years ago,Rude staff.we'll never come back. The only place we dind't like in Amsterdam.
330,Dolphins Coffeeshop, 1 star ,4 years ago,Cheap and tacky place. Rude young staff with MASSIVE attitude problems
331,Dolphins Coffeeshop, 5 stars ,2 years ago,One of my favourite coffee shops 😊
332,Dolphins Coffeeshop, 5 stars ,5 years ago,Very nice staff and cosy atmosphere. Would reccomend.
333,Dolphins Coffeeshop, 1 star ,5 years ago,We had a bad experience with the Staff because one of the waiter was too aggressive then they kicked us out!
334,Dolphins Coffeeshop, 4 stars ,3 years ago,Decent bud for price but go to the grey area or anywhere else if you really care
335,Dolphins Coffeeshop, 5 stars ,4 years ago,"Wow their space cakes are incredible, its the best in Amsterdam..."
336,Dolphins Coffeeshop, 5 stars ,5 years ago,"Relaxed atmosphere, good selection, and fantastic staff, highly recommend"
337,Dolphins Coffeeshop, 4 stars ,4 years ago,Very cosy coffeeshop! :) But the weed is a bit pricey
338,Dolphins Coffeeshop, 5 stars ,4 years ago,Really nice coffee shop. Feels like being under the sea.
339,Dolphins Coffeeshop, 5 stars ,3 years ago,"First coffee shop i went too that wasn't Bulldog, much chiller vibe."
340,Dolphins Coffeeshop, 4 stars ,3 years ago,Great coffee shop and cosy on a cold night.
341,Dolphins Coffeeshop, 1 star ,3 years ago,Bad place don't go... They seem grumpy like my grandmother 😡
342,Dolphins Coffeeshop, 5 stars ,2 years ago,Super friendly staff and good stuff :)
343,Dolphins Coffeeshop, 1 star ,3 years ago,"tourist trap - horrible place, rude staff. my advice: avoid if possible"
344,Dolphins Coffeeshop, 4 stars ,4 years ago,Pretty ridiculous cashier but good strong sativa
345,Dolphins Coffeeshop, 5 stars ,4 years ago,Nicest staff in any coffeeshop I've visited in Amsterdam!
346,Dolphins Coffeeshop, 2 stars ,4 years ago,Not as friendly as this used to be. Service was rushed but the smoke is still as good!
347,Dolphins Coffeeshop, 1 star ,a year ago,Staff extremelly  rude. It wasn't a good experience at all
348,Dolphins Coffeeshop, 1 star ,3 years ago,Rude lady said we have to go outside to smoke even though there were people sitting inside and smoking
349,Dolphins Coffeeshop, 5 stars ,4 years ago,Cody and quiet.  Small menu but solid selection.
350,Dolphins Coffeeshop, 1 star ,3 years ago,"Very rude female seller, place has good decoration, that's all."
351,Dolphins Coffeeshop, 4 stars ,3 years ago,Great place a little bit fancy and expansive
352,Dolphins Coffeeshop, 2 stars ,4 years ago,Limited choice on menu. Staff are really uptight and drinks so expensive!!
353,Dolphins Coffeeshop, 5 stars ,5 years ago,Love this place friendly staff also great prices!
354,Dolphins Coffeeshop, 1 star ,5 years ago,The waitress was rude. I dont recommend a place with people like this.
355,Dolphins Coffeeshop, 5 stars ,3 years ago,Nice place to  relax and staff were amazing
356,Dolphins Coffeeshop, 4 stars ,4 years ago,"Sells good stuff, staff is nice and welcoming."
357,Dolphins Coffeeshop, 5 stars ,4 years ago,Favorite coffee shop in Amsterdam. Make sure to say hi to Mia the cat!
358,Dolphins Coffeeshop, 4 stars ,3 years ago,Good atmosphere friendly staff x
359,Dolphins Coffeeshop, 5 stars ,3 years ago,The Place is very lovely and his staff is very friendly
360,Dolphins Coffeeshop, 5 stars ,3 years ago,The people working there is really nice! Thank you
361,Dolphins Coffeeshop, 5 stars ,4 years ago,Great coffeshop very clean and very nice staff
362,Dolphins Coffeeshop, 5 stars ,3 years ago,Best coffeeshop I've been to in the city
363,Dolphins Coffeeshop, 4 stars ,2 years ago,Amsterdam coffeeshop. Staff were good with good advice given.
364,Dolphins Coffeeshop, 4 stars ,3 years ago,Way too strict on everything. Prefer rookie's 🤷🏻‍♂️
365,Dolphins Coffeeshop, 5 stars ,4 years ago,Great wee coffe shop with superb mercandise
366,Dolphins Coffeeshop, 1 star ,6 years ago,"The place downstairs felt dirty and just bad, the staff was very unfriendly"
367,Dolphins Coffeeshop, 5 stars ,3 years ago,Great place to chill out with lovely staff
368,Dolphins Coffeeshop, 5 stars ,4 years ago,"Very organised, comfy seating, small tables"
369,Dolphins Coffeeshop, 4 stars ,3 years ago,Very commercial but still not a bad spot
370,Dolphins Coffeeshop, 5 stars ,2 years ago,Lovely coffee shop lovely staff 😀
371,Dolphins Coffeeshop, 5 stars ,2 years ago,Really particular location and nice products 😉
372,Dolphins Coffeeshop, 5 stars ,4 years ago,some of the best Weed in Amsterdam you get here.
373,Dolphins Coffeeshop, 5 stars ,3 years ago,Very helpful staff and the goodest little kitten!!!
374,Dolphins Coffeeshop, 5 stars ,2 years ago,The best quality available in the city center ;)
375,Dolphins Coffeeshop, 5 stars ,2 years ago,Really helpful staff and great ambience
376,Dolphins Coffeeshop, 4 stars ,4 years ago,Staff very nice. Good place.
377,Dolphins Coffeeshop, 4 stars ,2 years ago,"Good chilled vibe, weed on point"
378,Dolphins Coffeeshop, 5 stars ,5 years ago,"Love it, best seating area in Amsterdam, very chill"
379,Dolphins Coffeeshop, 5 stars ,5 years ago,Friendly waitress！I love this place！and my dizzy idiot friend LooooooooL
380,Dolphins Coffeeshop, 3 stars ,2 years ago,Decent selection. Aggressive staff members
381,Dolphins Coffeeshop, 5 stars ,2 years ago,Great seating area downstairs
382,Dolphins Coffeeshop, 5 stars ,3 years ago,Really great girls working there!
383,Dolphins Coffeeshop, 5 stars ,8 years ago,Awesome looking place inside and nice buds
384,Dolphins Coffeeshop, 5 stars ,5 years ago,The decor is really deep 😁  nice place
385,Dolphins Coffeeshop, 4 stars ,4 years ago,"Friendly staff and cheap accessories like grinders, papers, filters etc..."
386,Dolphins Coffeeshop, 5 stars ,3 years ago,Try space muffins 😉
387,Dolphins Coffeeshop, 5 stars ,2 years ago,Ahhh ive got a bike for them
388,Dolphins Coffeeshop, 4 stars ,3 years ago,Grenat coffee shop and the personnal are realy pro !
389,Dolphins Coffeeshop, 5 stars ,3 years ago,Great place to relax and chill out
390,Dolphins Coffeeshop, 1 star ,3 years ago,Bad place don't go... They seem grumpy like my grandmother 😡
391,Dolphins Coffeeshop, 5 stars ,5 years ago,You must try the tesla power
392,Dolphins Coffeeshop, 5 stars ,8 years ago,Awesome looking place inside and nice buds
393,Dolphins Coffeeshop, 5 stars ,5 years ago,Taste the muffins!!! Best thing ever
394,Dolphins Coffeeshop, 1 star ,7 years ago,Was all good when my friend had a spacecake and when we got back to our hostel she started throwing up blood. Don't have spacecakes from here.
395,Dolphins Coffeeshop, 1 star ,3 years ago,AVOID!!!!! This place used to be great but now even if you only want to nip in for a quick coffee they try and force you to buy low grade rubbish weed you only have a choice of 4 types all rubbish and if you don’t buy they ask you to leave …
396,Dolphins Coffeeshop, 4 stars ,3 years ago,"Awesome staff, fantastic bud! 👍"
397,Dolphins Coffeeshop, 4 stars ,4 years ago,"The weed is good, the place is mehh."
398,Dolphins Coffeeshop, 5 stars ,5 years ago,"Relaxed atmosphere, good selection, and fantastic staff, highly recommend"
399,Dolphins Coffeeshop, 2 stars ,5 years ago,Staff very polite but not so kind. Pot only already packed. You have to drink even if you buy pot.
400,Dolphins Coffeeshop, 5 stars ,3 years ago,"They have a cat, 5 stars"
401,Dolphins Coffeeshop, 5 stars ,2 years ago,Wicked place friendly and helpful
402,Dolphins Coffeeshop, 4 stars ,4 years ago,"The weed is good, the place is mehh."
403,Dolphins Coffeeshop, 4 stars ,4 years ago,Great place to relax and smoke
404,Dolphins Coffeeshop, 5 stars ,2 years ago,Very nice. Extremely chill.
405,Dolphins Coffeeshop, 4 stars ,5 years ago,Small and friendly. Comfortable and sociable.
406,Dolphins Coffeeshop, 5 stars ,4 years ago,Excellent service.Tesla power highly recommended
407,Dolphins Coffeeshop, 5 stars ,4 years ago,One of the best coffee shops in Amsterdam!
408,Dolphins Coffeeshop, 4 stars ,3 years ago,"Awesome staff, fantastic bud! 👍"
409,Dolphins Coffeeshop, 3 stars ,5 years ago,Good but not allowed tobacco
410,Dolphins Coffeeshop, 4 stars ,2 years ago,Good but dated decor
411,Dolphins Coffeeshop, 5 stars ,4 years ago,Always the Best! Five Star Service !
412,Dolphins Coffeeshop, 5 stars ,4 years ago,Great stuff realy great dolphin cakes
413,Dolphins Coffeeshop, 5 stars ,4 years ago,First Shop in Amsterdam still the best 😉
414,Dolphins Coffeeshop, 2 stars ,6 years ago,Nice decor but rude staff
415,Dolphins Coffeeshop, 5 stars ,2 years ago,Great Interior and friendly People!
416,Dolphins Coffeeshop, 5 stars ,7 months ago,No words needed.
417,Dolphins Coffeeshop, 5 stars ,8 years ago,Excellent on my top 10 list :-D
418,Dolphins Coffeeshop, 3 stars ,3 years ago,Was alright but downstairs was to warm
419,Dolphins Coffeeshop, 1 star ,2 years ago,Very bad shop dirty weed
420,Dolphins Coffeeshop, 1 star ,4 years ago,"Can't put feet up, what a joke"
421,Dolphins Coffeeshop, 5 stars ,4 years ago,Expensive but really good at what they sell
422,Dolphins Coffeeshop, 1 star ,6 years ago,Absolutely awful. Service was so bad we left... shame!
423,Dolphins Coffeeshop, 4 stars ,7 years ago,A good coffee shop. The personal it's very available......
424,Dolphins Coffeeshop, 5 stars ,4 years ago,Beautiful place. Wonderful people.
425,Dolphins Coffeeshop, 5 stars ,2 years ago,"Always is peace, one of the best."
426,Dolphins Coffeeshop, 1 star ,3 years ago,Customer service is simply terrible
427,Dolphins Coffeeshop, 5 stars ,3 years ago,Werry nice Coffey shop
428,Dolphins Coffeeshop, 2 stars ,4 years ago,"Over rated! Expensive, and not worth it."
429,Dolphins Coffeeshop, 5 stars ,5 years ago,Taste the muffins!!! Best thing ever
430,Dolphins Coffeeshop, 1 star ,4 years ago,Last coffeeshop I will ever go back to
431,Dolphins Coffeeshop, 5 stars ,4 years ago,"Cool cool cool
The vaporizers are awesome :D"
432,Dolphins Coffeeshop, 5 stars ,2 years ago,I liked it very much!
433,Dolphins Coffeeshop, 5 stars ,6 years ago,one of the most beautiful of amsterdam .. unsurpassed staff !!!!!!
434,Dolphins Coffeeshop, 1 star ,2 years ago,"Bad service, not kind at all"
435,Dolphins Coffeeshop, 5 stars ,4 years ago,The best Coffee Shop for me
436,Dolphins Coffeeshop, 1 star ,2 years ago,By far the worst shop I know.
437,Dolphins Coffeeshop, 1 star ,2 years ago,"Let me start saying this, the mould.. The mould... THE MOULD!!"
438,Dolphins Coffeeshop, 1 star ,3 years ago,It's a let down. Don't bother.
439,Dolphins Coffeeshop, 5 stars ,2 years ago,Super nice blaze hak
440,Dolphins Coffeeshop, 5 stars ,4 years ago,Good and cheap cannabis products
441,Dolphins Coffeeshop, 5 stars ,2 years ago,I love hanging this place.
442,Dolphins Coffeeshop, 4 stars ,2 years ago,Good atmosphere with good peoples
443,Dolphins Coffeeshop, 5 stars ,4 years ago,"place to be, very nice lounge"
444,Dolphins Coffeeshop, 5 stars ,2 years ago,You can fly over the rainbow...
445,Dolphins Coffeeshop, 5 stars ,3 years ago,As they do in Amsterdam and the reason y’all visit🤣
446,Dolphins Coffeeshop, 5 stars ,5 years ago,You must try the tesla power
447,Dolphins Coffeeshop, 5 stars ,5 years ago,Super Service. Very friendly  seller.
448,Dolphins Coffeeshop, 5 stars ,2 years ago,Best shop in town
449,Dolphins Coffeeshop, 4 stars ,5 years ago,Best space cake in town.
450,Dolphins Coffeeshop, 1 star ,3 years ago,Didn't really feel welcome
451,Dolphins Coffeeshop, 1 star ,5 years ago,I would never comeback. Bad staff.
452,Dolphins Coffeeshop, 3 stars ,4 years ago,They've got a stoner cat!
453,Dolphins Coffeeshop, 5 stars ,3 years ago,Amazing service !! Very nice !
454,Dolphins Coffeeshop, 1 star ,5 years ago,Weak cannabis menu. Unrated staff.
455,Dolphins Coffeeshop, 4 stars ,3 years ago,Time for chilling!
456,Dolphins Coffeeshop, 5 stars ,4 years ago,Very good shop 😘😂
457,Dolphins Coffeeshop, 5 stars ,3 years ago,Best spacemuffin in amsterdam
458,Dolphins Coffeeshop, 1 star ,4 years ago,"Terrible place, don't go!"
459,Dolphins Coffeeshop, 3 stars ,5 years ago,nice
460,Dolphins Coffeeshop, 5 stars ,4 years ago,Very....very.... strong cupcakes
461,Dolphins Coffeeshop, 1 star ,5 years ago,You must buy weed and drinks.
462,Dolphins Coffeeshop, 5 stars ,4 years ago,Staff incredibly polite.
463,Dolphins Coffeeshop, 5 stars ,4 years ago,"Best weed, best service"
464,Dolphins Coffeeshop, 5 stars ,3 years ago,very nice
465,Dolphins Coffeeshop, 5 stars ,3 years ago,Good spot to relax
466,Dolphins Coffeeshop, 5 stars ,3 years ago,best coffee shop i found
467,Dolphins Coffeeshop, 5 stars ,3 years ago,Amsterdams best of
468,Dolphins Coffeeshop, 5 stars ,3 years ago,Friendly best shop
469,Dolphins Coffeeshop, 1 star ,2 years ago,disgusting customer service.
470,Dolphins Coffeeshop, 1 star ,2 years ago,bad vibes
471,Dolphins Coffeeshop, 1 star ,4 years ago,Rude ppl
472,Dolphins Coffeeshop, 5 stars ,6 years ago,"Kind staff, good stuff"
473,Dolphins Coffeeshop, 3 stars ,3 years ago,Good weed nice
474,Dolphins Coffeeshop, 4 stars ,4 years ago,Cool shop
475,Dolphins Coffeeshop, 5 stars ,5 years ago,Good weed
476,Dolphins Coffeeshop, 5 stars ,5 years ago,Nice shop
477,Dolphins Coffeeshop, 5 stars ,2 years ago,Delicious muffins!
478,Dolphins Coffeeshop, 4 stars ,4 years ago,Best shop in Amsterdam.
