,Name,Review Rate,Review Time,Review Text
144,De Brabantse Aap, 5 stars ,4 years ago,Great place with a wide choice of special beers. Strongly recommended!
145,De Brabantse Aap, 5 stars ,4 years ago,"Good selection of beers. My Belgian friend who is quite picky on beers highly recommends this place, now that's a warranty."
146,De Brabantse Aap, 4 stars ,4 years ago,"Cosy place with friendly staff, good beer and hearthy food. A fun place to hang out."
147,De Brabantse Aap, 5 stars ,4 years ago,"One of the few places in Dam that gets you a place at busy hours. Nice beers, lovely atmosphere."
148,De Brabantse Aap, 5 stars ,4 years ago,Sijme was the greatest local guide we could hope for. This place is great! Try the bitterballen and the Jenever.
149,De Brabantse Aap, 4 stars ,3 years ago,Fun atmosphere. Great spot to eat dinner or grab a drink while watching over the canals
150,De Brabantse Aap, 5 stars ,4 years ago,Good place to sit and watch the crowds of tourist. Saw a fight almost break out between cyclists!
151,De Brabantse Aap, 5 stars ,3 years ago,"Beautiful setting to watch the world go by with a few drinks, staff are really friendly"
152,De Brabantse Aap, 4 stars ,3 years ago,"Reasonable selection of beers and a nice terrace, perfect central location."
153,De Brabantse Aap, 4 stars ,a month ago,Very nice!
154,De Brabantse Aap, 1 star ,2 years ago,I was 15 minutes sit outside and no one arrives to bring me a menu. I have to quit.
155,De Brabantse Aap, 4 stars ,3 years ago,Great food and service.
156,De Brabantse Aap, 5 stars ,5 years ago,"Love it! nice food, affortable price and an increbible polite and fast service."
157,De Brabantse Aap, 5 stars ,2 years ago,Hey the burger or a plate of bitterballen with a beer of your choice. They have a wide variety of beers.
158,De Brabantse Aap, 3 stars ,4 years ago,"Good selection of good beers, but the food is just OK."
159,De Brabantse Aap, 5 stars ,3 years ago,Excellent food and great beer. The “Blonde” was my fave!
160,De Brabantse Aap, 5 stars ,2 years ago,Excellent pub with a good vibe and friendly service.
161,De Brabantse Aap, 5 stars ,3 years ago,Amazing craft beer and great service. Beautiful location
162,De Brabantse Aap, 5 stars ,3 years ago,"As with most cafés in Amsterdam, this place has great Fries and Bitterballen."
163,De Brabantse Aap, 4 stars ,4 years ago,Good place for a drink and people  watching. Attentive & friendly staff.
164,De Brabantse Aap, 4 stars ,3 years ago,"Great place to do your inauguration, nice staff and good beer (Grolsch)"
165,De Brabantse Aap, 4 stars ,5 years ago,Good place for a drink. It has a great selection of beers.
166,De Brabantse Aap, 5 stars ,5 years ago,"Nice canal front bar. Good drinks, friendly staff and nice atmosphere."
167,De Brabantse Aap, 4 stars ,3 years ago,Excellent food and service. Will definitely visit again
168,De Brabantse Aap, 4 stars ,3 years ago,"Good choice for beer, great location. Expensive, even for Adam standards."
169,De Brabantse Aap, 5 stars ,4 years ago,"Good location, really nice staff, good prices and the best nachos ever!:)"
170,De Brabantse Aap, 4 stars ,2 years ago,"Very cosy, good looking bar. Service is slow."
171,De Brabantse Aap, 4 stars ,3 years ago,"Staff where very friendly, service is excellent, good food."
172,De Brabantse Aap, 5 stars ,a year ago,"Great beer for a great price with great service, what else does a man need?"
173,De Brabantse Aap, 4 stars ,5 years ago,"Good beer (local), good food and smart service. From café, lunch to dinner."
174,De Brabantse Aap, 5 stars ,3 years ago,Very friendly experience and fabulous service. We are all English and we felt very welcome!
175,De Brabantse Aap, 1 star ,2 years ago,"Service staff rude, took forever between starter and main course. No sense of urgency."
176,De Brabantse Aap, 3 stars ,3 years ago,Nothing special. The staff could be friendlier. Nice hot chocolate.
177,De Brabantse Aap, 5 stars ,2 years ago,"Lovely views, great space to chill for a beer or three"
178,De Brabantse Aap, 5 stars ,4 years ago,Excellent choice of beer and a great location to watch the world go by.
179,De Brabantse Aap, 2 stars ,5 years ago,"Very bustling and noisy, the food wasn't tasty.
Beer was good"
180,De Brabantse Aap, 5 stars ,2 years ago,Great place for street side drink and people watching.
181,De Brabantse Aap, 4 stars ,4 years ago,"Great atmosphere, good service, fair prices. Worthwhile to check out!"
182,De Brabantse Aap, 1 star ,3 years ago,They didn’t deliver what I ordered and the quality of food is bad (don’t try the sandwiches!). Also bad service
183,De Brabantse Aap, 4 stars ,2 years ago,Good service and reasonable assortment of beers
184,De Brabantse Aap, 4 stars ,a year ago,"Lovely raspberry place, pretty waiter"
185,De Brabantse Aap, 4 stars ,4 years ago,Nice for a quick meal! I liked the selection of beers.
186,De Brabantse Aap, 4 stars ,3 years ago,"Good selection of beer, a bit frantic and weird service."
187,De Brabantse Aap, 5 stars ,4 years ago,"Friendly staff, reasonable prices, food was excellent"
188,De Brabantse Aap, 5 stars ,4 years ago,Great beer selection and nice armosphere here
189,De Brabantse Aap, 4 stars ,2 years ago,Nice selection of beers. Fast service.
190,De Brabantse Aap, 5 stars ,4 years ago,Great beer. Nice and cold on a hot day.
191,De Brabantse Aap, 4 stars ,4 years ago,Good Place to have a coffee/beer and dinner at night
192,De Brabantse Aap, 4 stars ,4 years ago,Nice place for a drink with a beer variety and something to eat
193,De Brabantse Aap, 4 stars ,3 years ago,"Good beers, but very busy. Service is working"
194,De Brabantse Aap, 5 stars ,5 years ago,Great beer selection and lovely staff
195,De Brabantse Aap, 4 stars ,3 years ago,The food is good and authentic. No baby chairs
196,De Brabantse Aap, 5 stars ,3 years ago,"Incredible food, views and service was exceptional!"
197,De Brabantse Aap, 4 stars ,4 years ago,Good beer selection and surprisingly good fries!
198,De Brabantse Aap, 5 stars ,3 years ago,Quick tea stop. Lovely little spot enjoying the sunshine.
199,De Brabantse Aap, 3 stars ,2 years ago,Hopping bar with pretty good food and service.
200,De Brabantse Aap, 5 stars ,3 years ago,Great food. Very friendly staff
201,De Brabantse Aap, 3 stars ,5 years ago,"Very busy with typical Dutch service. Pretty straight forward. Not bad, not amazing."
202,De Brabantse Aap, 4 stars ,5 years ago,"Great Belgian beer selection, very cosy"
203,De Brabantse Aap, 3 stars ,4 years ago,"Good spot, lots of different beer but a grumpy waiter"
204,De Brabantse Aap, 4 stars ,2 years ago,Classy place with good drinks and good food
205,De Brabantse Aap, 5 stars ,2 years ago,Nice bar great food and drinks
206,De Brabantse Aap, 5 stars ,3 years ago,"Relaxing, people watching on a warm May afternoon with beer, burger and coffee."
207,De Brabantse Aap, 1 star ,3 years ago,"So you stop due to being an old fart, Google Maps believes I visited - get a life, sort out your AU, after all you can afford it."
208,De Brabantse Aap, 4 stars ,4 years ago,There are better options in town for getting a burger and a beer
209,De Brabantse Aap, 3 stars ,6 months ago,Ok
210,De Brabantse Aap, 4 stars ,6 years ago,Nice ambiance and a great selection of beers
211,De Brabantse Aap, 4 stars ,2 years ago,"Great beer, good food"
212,De Brabantse Aap, 4 stars ,5 years ago,One of my long time favorites. Good for a burger and beer.
213,De Brabantse Aap, 5 stars ,2 years ago,"Great food, house beer."
214,De Brabantse Aap, 5 stars ,5 years ago,Had a delicious sandwich here and a good tripel.
215,De Brabantse Aap, 5 stars ,6 years ago,Great place for a beer or lunch/diner
216,De Brabantse Aap, 5 stars ,3 years ago,Salmon was great!
217,De Brabantse Aap, 3 stars ,5 years ago,Nice place to grab a beer near a channel in Amsterdam.
218,De Brabantse Aap, 5 stars ,5 years ago,"Good location, friendly staff and good food"
219,De Brabantse Aap, 5 stars ,2 years ago,Nice spot in the city. Nice view outside
220,De Brabantse Aap, 5 stars ,3 years ago,"Great service, amazing beer!"
221,De Brabantse Aap, 3 stars ,3 years ago,Slow service when not even bust however staff were relaxed
222,De Brabantse Aap, 5 stars ,3 years ago,Good beers! Nice staff!
223,De Brabantse Aap, 5 stars ,4 years ago,Great beer selection and chips
224,De Brabantse Aap, 2 stars ,3 years ago,"Not particularly child friendly place, maybe not friendly at all..."
225,De Brabantse Aap, 5 stars ,2 years ago,My Favoriten Bar in the whole town
226,De Brabantse Aap, 2 stars ,2 years ago,Service is not very polite towards poles apparently
227,De Brabantse Aap, 5 stars ,4 years ago,"Great service, lively staff. Fun fun fun"
228,De Brabantse Aap, 1 star ,2 years ago,The worst food and service ever. Seriously.
229,De Brabantse Aap, 5 stars ,5 years ago,Cozy dinner/launch with friendly staff
230,De Brabantse Aap, 5 stars ,4 years ago,"The best hamburger of the world! With a Duvel, of course!"
231,De Brabantse Aap, 5 stars ,6 years ago,The best burgers i have tried in Amsterdam
232,De Brabantse Aap, 4 stars ,2 years ago,Great service and nice ambience.
233,De Brabantse Aap, 4 stars ,5 years ago,Nice traditional bar at Spui square.
234,De Brabantse Aap, 4 stars ,2 years ago,Love their loaded nachos 😋
235,De Brabantse Aap, 5 stars ,2 years ago,Great food and good people
236,De Brabantse Aap, 5 stars ,4 years ago,La Trappe!!😍 Food great too!
237,De Brabantse Aap, 5 stars ,5 years ago,Pretty quick service and a great location
238,De Brabantse Aap, 5 stars ,3 years ago,Not bad x
239,De Brabantse Aap, 4 stars ,2 years ago,Beer beer beer and more beer!
240,De Brabantse Aap, 4 stars ,4 years ago,Great drinks and people watching
241,De Brabantse Aap, 4 stars ,2 years ago,Nice environment with nice menu
242,De Brabantse Aap, 4 stars ,3 years ago,Great cheesecake and chocolate brownies
243,De Brabantse Aap, 5 stars ,3 years ago,I love the atmosphere and lovely staff.
244,De Brabantse Aap, 5 stars ,2 years ago,"Good bar , good atmosphere"
245,De Brabantse Aap, 5 stars ,7 months ago,Top!!
246,De Brabantse Aap, 4 stars ,2 years ago,Good special beers!
247,De Brabantse Aap, 4 stars ,5 years ago,"Looks turistic, but really nice."
248,De Brabantse Aap, 5 stars ,7 months ago,Super nice service
249,De Brabantse Aap, 4 stars ,3 years ago,Good beer.
250,De Brabantse Aap, 4 stars ,4 years ago,Great beer and Burgers.
251,De Brabantse Aap, 5 stars ,5 years ago,Love the local beers here
252,De Brabantse Aap, 4 stars ,5 years ago,Not bad choice of beer.
253,De Brabantse Aap, 5 stars ,5 years ago,Great selection of beer
254,De Brabantse Aap, 5 stars ,2 years ago,Best Nacho's👌
255,De Brabantse Aap, 5 stars ,2 years ago,Good cherry beer.
256,De Brabantse Aap, 5 stars ,3 years ago,A good place for being social.
257,De Brabantse Aap, 5 stars ,3 years ago,"Great place, good food"
258,De Brabantse Aap, 4 stars ,9 months ago,Friendly service.
259,De Brabantse Aap, 4 stars ,3 years ago,Ok place.
260,De Brabantse Aap, 4 stars ,3 years ago,Nice place to have a beer
261,De Brabantse Aap, 5 stars ,4 years ago,My favourite bar.
262,De Brabantse Aap, 4 stars ,5 years ago,Cozy bar for a good evening.
263,De Brabantse Aap, 5 stars ,4 years ago,Good food
264,De Brabantse Aap, 4 stars ,2 years ago,Like it here. Nice atmosphete
265,De Brabantse Aap, 2 stars ,3 years ago,Flat beer. Late cake
266,De Brabantse Aap, 5 stars ,4 years ago,Good food
267,De Brabantse Aap, 5 stars ,4 years ago,Tip top
268,De Brabantse Aap, 5 stars ,5 years ago,5 stars
269,De Brabantse Aap, 1 star ,3 years ago,The worst bar in Amsterdam
270,De Brabantse Aap, 5 stars ,8 months ago,Nice place!
271,De Brabantse Aap, 5 stars ,3 years ago,The beer was amazing
272,De Brabantse Aap, 5 stars ,3 years ago,Awesome food!
273,De Brabantse Aap, 3 stars ,4 years ago,Food was a bit dry.
274,De Brabantse Aap, 4 stars ,3 years ago,Nice terrace in the sun
275,De Brabantse Aap, 4 stars ,3 years ago,Really busy place.
276,De Brabantse Aap, 5 stars ,4 years ago,Exactly a beer house
277,De Brabantse Aap, 3 stars ,4 years ago,Literally the worst nachos
278,De Brabantse Aap, 4 stars ,4 years ago,Nice location and service
279,De Brabantse Aap, 5 stars ,2 years ago,Cool
280,De Brabantse Aap, 3 stars ,2 years ago,"Rude staff, crowded."
281,De Brabantse Aap, 5 stars ,4 years ago,Great terrace!
282,De Brabantse Aap, 5 stars ,2 years ago,Nice
283,De Brabantse Aap, 5 stars ,3 years ago,Nice
284,De Brabantse Aap, 5 stars ,2 years ago,Is very good!!!!
285,De Brabantse Aap, 5 stars ,a year ago,Love this place
286,De Brabantse Aap, 4 stars ,3 years ago,Nice food.
287,De Brabantse Aap, 5 stars ,5 years ago,Great beers
288,De Brabantse Aap, 5 stars ,3 years ago,Great cappuccino
289,De Brabantse Aap, 5 stars ,4 years ago,Awesome food
290,De Brabantse Aap, 1 star ,2 years ago,impolite staff
291,De Brabantse Aap, 3 stars ,2 years ago,Loud though
292,De Brabantse Aap, 3 stars ,2 years ago,The usual.
293,De Brabantse Aap, 4 stars ,4 years ago,Nice staff
294,De Brabantse Aap, 4 stars ,3 years ago,Great vibe
295,De Brabantse Aap, 4 stars ,4 years ago,Cool place
296,De Brabantse Aap, 4 stars ,5 years ago,Cosy place to be
297,De Brabantse Aap, 3 stars ,5 years ago,Nice place
298,De Brabantse Aap, 3 stars ,6 hours ago,"Very nice place for a beer or a lunch, but why 6.30 for a beer?"
299,De Brabantse Aap, 4 stars ,a month ago,(Translated by Google) Nice cozy restaurant . Great atmosphere. Dishes were tasty and for a fair price. …
300,De Brabantse Aap, 5 stars ,5 months ago,"(Translated by Google) Typically Amsterdam looking for a table, gathering chairs, sitting down, ordering drinks …"
301,De Brabantse Aap, 4 stars ,5 months ago,"(Translated by Google) Cozy tent on the Spui. Smooth friendly service. Here is a latte macchiato as it should be, nice layers and good taste and structure. …"
302,De Brabantse Aap, 5 stars ,3 weeks ago,"(Translated by Google) We had a great afternoon. We started with a white and a red wine. But since it was so cozy, we continued outside on the terrace with prosecco. We got a nice warm dress and had a great time. When it was time to really …"
303,De Brabantse Aap, 4 stars ,7 months ago,"(Translated by Google) Nice and cozy restaurant on the canal, with a beautiful view. Enjoying the weather, beer and snacks …"
304,De Brabantse Aap, 5 stars ,6 months ago,(Translated by Google) An excellent place run by competent guys where we could eat comfortably in a difficult moment (Sunday in August with rain and high density of tourists) …
305,De Brabantse Aap, 5 stars ,9 months ago,"(Translated by Google) You can sit comfortably here, also with the corona measures. The in-house beer (available as a sample board) is definitely recommended. …"
306,De Brabantse Aap, 4 stars ,3 days ago,"(Translated by Google) Nice restaurant in a good location. Somehow you keep coming back here. No wonder, tram line 2 passes it. One of the 1000 party corners of old Amsterdam starts around the corner. The service is quick and friendly. …"
307,De Brabantse Aap, 5 stars ,3 weeks ago,"(Translated by Google) Top location and nice pub, many beers and cozy atmosphere! …"
308,De Brabantse Aap, 5 stars ,6 months ago,"(Translated by Google) Super nice by the canal, very nice waiter too and good hearty sandwich …"
309,De Brabantse Aap, 5 stars ,a year ago,(Translated by Google) €€. Friendly. Clean. Pub-style. Fast. Good card. Good place to lunch in Amsterdam. We ate immediately and forgot to take pictures of the beef burger and fish and chips in a beer bar. Eat 15 € each. Great. Serving …
310,De Brabantse Aap, 5 stars ,9 months ago,"(Translated by Google) Very nice staff, tasty fries, nice place to sit outside

(Original) …"
311,De Brabantse Aap, 4 stars ,9 months ago,"(Translated by Google) The weather was lovely on the terrace. Nice location and quick service. And then that home-brewed 'Manke Monnik', what a pleasure! …"
312,De Brabantse Aap, 4 stars ,5 months ago,(Translated by Google) You can sit here nice and drink good beers. They also have a delicious and thick vegan hummus sandwich. …
313,De Brabantse Aap, 5 stars ,5 months ago,"(Translated by Google) Very nice service, delicious sandwiches🤩

(Original) …"
314,De Brabantse Aap, 5 stars ,5 months ago,"(Translated by Google) Had a spicy chicken sandwich last Sunday and some coffee and soda
Very good service and great food …"
315,De Brabantse Aap, 4 stars ,2 years ago,"(Translated by Google) In the past when it was often called the Beijaard, now years later it is just as fun with very friendly staff, many kinds of beers and ... Guiness on tap !! …"
316,De Brabantse Aap, 5 stars ,5 months ago,(Translated by Google) Nice place to have a drink. Bok beer from own brewery was very tasty. Friendly staff …
317,De Brabantse Aap, 2 stars ,5 years ago,"(Translated by Google) Because of the lack of honesty

Frame: ●●● …"
318,De Brabantse Aap, 4 stars ,7 months ago,"(Translated by Google) Definitely characteristic and very good! They always have an excellent IPA on tap and the fries in my opinion are among the best in Amsterdam !!! Average prices, young and kind staff! Super!!! …"
319,De Brabantse Aap, 4 stars ,4 months ago,"(Translated by Google) Despite many tourists, it still has an Amsterdam atmosphere. Good food and nice beers. Definitely go if you are in the area. …"
320,De Brabantse Aap, 5 stars ,7 months ago,"(Translated by Google) Cozy tent. Nicely decorated inside, beautiful card with beer …"
321,De Brabantse Aap, 5 stars ,2 years ago,"(Translated by Google) The place is located on a busy street overlooking the canal and the square. Very good to sit with a glass of beer after a long walk. Large selection of beer. We took only beer, so I can not say anything about the …"
322,De Brabantse Aap, 5 stars ,7 months ago,"(Translated by Google) Just ate a delicious lentil-tomato soup, really excellent, a nice pepper in it, on the terrace along the Singel and on the Spui in the center of Amsterdam. So a nice view and cozy. We were served by Sil, what a …"
323,De Brabantse Aap, 4 stars ,6 months ago,(Translated by Google) Surprising and tasty lunch menu. Enjoy the outdoors by the canal. Had pita bread with spicy chicken myself and partner had a sandwich with hummus. …
324,De Brabantse Aap, 3 stars ,2 years ago,"(Translated by Google) Sitting quietly, regularly tipped (paid each time) .. but little attention. Search for eye contact..for an extra order. What took a long time ... Staff is very ""busy"". Nice location in the evening …"
325,De Brabantse Aap, 5 stars ,2 weeks ago,"(Translated by Google) Old-fashioned fun, good food and good beer!

(Original) …"
326,De Brabantse Aap, 4 stars ,5 months ago,"(Translated by Google) We had a nice lunch at De Brabantse Aap, as we are used to there. …"
327,De Brabantse Aap, 5 stars ,8 months ago,(Translated by Google) Sat briefly but very cozy place. Service is very good and pleasant! Felt at ease and had a nice beer. There is no shortage of choice and there is a good atmosphere. Definitely recommended and will visit again soon. …
328,De Brabantse Aap, 4 stars ,6 months ago,"(Translated by Google) It's fine to have beers, but the food is very average for the price/quality, so not recommended. …"
329,De Brabantse Aap, 5 stars ,4 months ago,"(Translated by Google) Cozy cafe to eat and drink something. Friendly staff.

(Original) …"
330,De Brabantse Aap, 2 stars ,4 months ago,"(Translated by Google) mediocre, sandwich gets an unsatisfactory rating from me.
toasties looked good …"
331,De Brabantse Aap, 4 stars ,4 months ago,"(Translated by Google) Fresh ginger tea, Monkey sandwich was super tasty, service very competent and friendly. Great..... we will definitely come back. …"
332,De Brabantse Aap, 4 stars ,6 months ago,"(Translated by Google) Friendly bar along the canals in Amsterdam.
The atmosphere is friendly.
The price of beer, however, is excessive. …"
333,De Brabantse Aap, 5 stars ,3 months ago,"(Translated by Google) Fast service, good food and friendly cheerful staff!

(Original) …"
334,De Brabantse Aap, 5 stars ,3 months ago,"(Translated by Google) Really, sooo cozy and the service just knows how it should be!! …"
335,De Brabantse Aap, 3 stars ,8 months ago,"(Translated by Google) Great place in the center of. Amsterdam, they have their own beer. The snacks are made in frying fat that has seen its best days... …"
336,De Brabantse Aap, 5 stars ,7 months ago,"(Translated by Google) Delicious eaten with a wide range of special beer, the service was also super ome near highly recommended!! …"
337,De Brabantse Aap, 4 stars ,3 years ago,"(Translated by Google) Super cozy, delicious beer. Beer bread with beer butter is highly recommended. …"
338,De Brabantse Aap, 5 stars ,9 months ago,"(Translated by Google) Beautiful terrace and quiet with a nice view. I recommend the BitterBallen which were really excellent! The same goes for the fish ans chips, very good and in quantity! I highly recommend ! …"
339,De Brabantse Aap, 4 stars ,2 weeks ago,"(Translated by Google) Nice place. Tasty beers.

(Original)
Fijne plek. Lekkere biertjes."
340,De Brabantse Aap, 5 stars ,5 months ago,(Translated by Google) Lovely terrace. Lots of people to watch. Lots of choice in drinks and food …
341,De Brabantse Aap, 5 stars ,5 months ago,(Translated by Google) Cool location right on the water with different types of beer on tap. I can only recommend …
342,De Brabantse Aap, 4 stars ,7 months ago,"(Translated by Google) Nice place where you can have a drink and eat something small, the fries are recommended, really good here …"
343,De Brabantse Aap, 5 stars ,4 years ago,"(Translated by Google) Very busy, bad service and not a lot of special beer. Bitterbal is tasty, that was the only thing! …"
344,De Brabantse Aap, 4 stars ,7 months ago,(Translated by Google) Cozy cafe in a busy street. Service is very friendly. Bitter garnish tasted good …
345,De Brabantse Aap, 5 stars ,6 months ago,"(Translated by Google) Great place, beautiful view. Good food and beer

(Original) …"
346,De Brabantse Aap, 5 stars ,4 months ago,"(Translated by Google) A highly recommended place, for its food and its friendliness …"
347,De Brabantse Aap, 5 stars ,7 months ago,"(Translated by Google) Nice cozy tent. Nice food and friendly staff . top👍

(Original) …"
348,De Brabantse Aap, 4 stars ,5 months ago,"(Translated by Google) Good atmosphere, relaxed staff, tasty food

(Original) …"
349,De Brabantse Aap, 5 stars ,5 months ago,(Translated by Google) Hi there. Great food. Sitting by the canal. Best way to say goodbye to Amsterdam impossible …
350,De Brabantse Aap, 5 stars ,3 years ago,"(Translated by Google) Cozy bistro in the heart of Amsterdam. Very large selection of beer, delicious food, ideal for a snack in between. …"
351,De Brabantse Aap, 5 stars ,2 months ago,"(Translated by Google) Nice place the trams pass by the door good music

(Original) …"
352,De Brabantse Aap, 2 stars ,3 months ago,"(Translated by Google) ""Difficult huh, pins""

The food was great. …"
353,De Brabantse Aap, 4 stars ,2 years ago,"(Translated by Google) Super sandwich for lunch!
Whole wheat bread and salmon, bread with melted aged cheese. Weisse beer is a beautiful location. …"
354,De Brabantse Aap, 3 stars ,2 years ago,"(Translated by Google) Nice view of life, on the street, good mood, service and drinks with food …"
355,De Brabantse Aap, 1 star ,2 years ago,"(Translated by Google) The two went in to drink a glass of beer. There are a maximum of 7 people in the bar. Time 23.30, for 15 minutes not one of the three waiters came up. Gone. I read good reviews about this place. Not so good …"
356,De Brabantse Aap, 5 stars ,a year ago,(Translated by Google) The restaurant is beautifully situated right on the water. We were served quickly and politely. The toast with ham and cheese was great and just right for a short stopover. Price very fair too. To recommend! …
357,De Brabantse Aap, 5 stars ,5 months ago,"(Translated by Google) Good food for a normal price
Friendly service …"
358,De Brabantse Aap, 5 stars ,7 months ago,(Translated by Google) 3rd time been! Enjoyed a snack and a drink with my daughter of 5! Nice service …
359,De Brabantse Aap, 5 stars ,a month ago,"(Translated by Google) Nice food, friendly staff

(Original) …"
360,De Brabantse Aap, 4 stars ,a year ago,"(Translated by Google) The boy on the patio really was a host. Keep an eye on everything. Very friendly and fast. Aap sandwich very tasty, but beware, it is hot. :-) …"
361,De Brabantse Aap, 5 stars ,10 months ago,(Translated by Google) Lovely sitting on the terrace and if the weather is bad there is a nice open conservatory where you can enjoy a drink. …
362,De Brabantse Aap, 5 stars ,2 years ago,"(Translated by Google) Cozy place, a large selection of tasty beer and inexpensive …"
363,De Brabantse Aap, 2 stars ,7 months ago,(Translated by Google) Nice tent. Food not very good or special. Control variable. …
364,De Brabantse Aap, 5 stars ,3 years ago,"(Translated by Google) Nicely located, reasonably priced. Had sandwiches for lunch these were really tasty. Operation is quick and friendly even with the visible stress. We sat on the terrace, the restaurant is also nicely decorated inside. …"
365,De Brabantse Aap, 5 stars ,6 months ago,(Translated by Google) Tasty food and wide choice! Highly recommended for real people from Brabant! …
366,De Brabantse Aap, 5 stars ,4 years ago,"(Translated by Google) Were here in early March. The people are crowded. The waiters are very smart. Menu in English. There is beer from my brewery, which was difficult for me personally to find in Amsterdam. Beer is not bad, there are many …"
