,Name,Review Rate,Review Time,Review Text
0,Trattoria Totó, 5 stars ,6 months ago,I had the Linguine ai Frutti di mare y the Raviolo Ripieno al Tartufo with house red wine and everything was immaculate. The bathrooms were so good and service was great and I loved the cozy atmosphere.
1,Trattoria Totó, 5 stars ,5 days ago,"Cozy italian restaurant with friendly service and delicious food. Totally recommended, tried both the pasta and the pizza and both are really tasty. Good value for money."
2,Trattoria Totó, 5 stars ,4 months ago,"We had a wonderful meal at this restaurant. Spaghetti frutti di mare was perfectly prepared and well appointed with seafood. The pasta bolognese was also very good, a thick meat sauce and the pasta was al dente. House wines were good. …"
3,Trattoria Totó, 5 stars ,4 months ago,"Cosy typical Italian trattoria, the food was AWESOME. We had a dinner for two, after a long day exploring the city. It's a definitely a reason to visit Amsterdam again!"
4,Trattoria Totó, 4 stars ,3 years ago,Fine Italian restaurant with friendly staff. Food is tasteful (and hot!). Good pricing too. Like this post please if useful. Thank you.
5,Trattoria Totó, 5 stars ,4 months ago,More or less came across this Italian restaurant by pure chance while on vacation in Amsterdam. Amazing food and cozy atmosphere. Definitely worth a visit
6,Trattoria Totó, 5 stars ,2 years ago,"Tried the pasta with salmon. Was great. A lot of food as I couldn’t take dinner later.
Didn’t have much option of tea but loved the coffee. Waiter speak great English …"
7,Trattoria Totó, 5 stars ,4 months ago,Really tasty pasta and lovely staff. Sadly we weren’t able to eat in the restaurant because of the lockdown but it seemed very cosy so would like to go back and sit in
8,Trattoria Totó, 3 stars ,3 years ago,"Pretty okay food. Servers nice, funny, that they keep talking Italian to us. My salad was big portion, fish enough, but the side was a joke, I need much more veggies to fill me."
9,Trattoria Totó, 1 star ,5 months ago,"Really bad service, it was not the waitress's fault, it was the chef's fault, a group of friends of him came to the restaurant and they were having gyn and tonic after dinner while did not get even the starter. …"
10,Trattoria Totó, 5 stars ,4 years ago,"What a nice and delicious experience was coming to trattoria Totó!  A little cozy place where you can find its owners working in the kitchen and counter, where they go to your table and talk to you to check how was the food- outstanding …"
11,Trattoria Totó, 5 stars ,2 years ago,"Everything is perfect.. lasagna is a beautiful story.. we finished it while the plate was still hot
Nice service, clean and nicely decorated place"
12,Trattoria Totó, 4 stars ,4 years ago,Had the Four Cheese's Pasta. Not necessarily filling but a good meal nevertheless. The food is definitely authentic given my friend who's gone to Rome enjoyed the Italian very much with me. Drinks are kinda small so consider that. Waiter …
13,Trattoria Totó, 5 stars ,5 days ago,Feels like you travelled to Italy! Food and service were both amazing!!
14,Trattoria Totó, 5 stars ,2 years ago,Nice place to enjoy Italian food. The waiter is amazing and interesting.
15,Trattoria Totó, 4 stars ,3 years ago,"Cozy & hidden Italian trattoria. Nothing fancy, and that’s the best part of it: proper Italian food in the heart of the city. …"
16,Trattoria Totó, 5 stars ,3 weeks ago,"food was absolutelly delightful, will come back for sure!"
17,Trattoria Totó, 4 stars ,3 years ago,Cozy little basement restaurant with candle lit tables. Supreme authentic Italian food. A little pricey.
18,Trattoria Totó, 5 stars ,3 years ago,Great authentic Italian cuisine. Very friendly Italian staff. Cozy place but very small so you better reserve a table.
19,Trattoria Totó, 5 stars ,a year ago,"Spaghetti with Seafood was super delicious. Nice Team, beautiful small restaurant!"
20,Trattoria Totó, 5 stars ,3 years ago,Beautiful little Italian restaurant! Lovely staff! Great food! Would definitely recommend 😊
21,Trattoria Totó, 5 stars ,7 months ago,"Fantastic food, not too expensive. I got the salmon paparadelle and it was exactly what I needed at the time. Beware, a bottle of still water was 5,50 euros"
22,Trattoria Totó, 1 star ,5 months ago,I can latterly see pink lipsticks on unwashed glasses served for drinks + Dirty dishes. Not clean at all
23,Trattoria Totó, 5 stars ,4 years ago,"There is so nice waiters, the food is very tasty and Italian, large portions, delicious wine, pleasant and cozy interior, everything is perfect for a family dinner or a romantic date"
24,Trattoria Totó, 5 stars ,3 years ago,"Cozy atmosphere, delicious food, amazing staff!

We showed up without a reservation and fortunately it wasn’t so busy. From the …"
25,Trattoria Totó, 5 stars ,2 years ago,"Recently ate at Trattoria Toto with some friends, we had pizza to share and spaghetti bolognese and also the lasagna. The service was great and the food was amazing and one of the best pastas we have had in a restaurant. Highly recommended if you’re looking for some beautiful Italian food."
26,Trattoria Totó, 5 stars ,a year ago,We visit Amsterdam for the first time. Trattoria Toto was an amazing restaurant. Easy to get to and service was amazing. The food was fresh and tasted authentic. It’s a must visit if you find yourself in Amsterdam.
27,Trattoria Totó, 4 stars ,3 years ago,Steak special was delicious with a truffle sauce.  House wine was not very good. The pasta dishes were pretty good. Carpaccio was fresh and beautifully presented. Staff was helpful and the restaurant was charming.
28,Trattoria Totó, 5 stars ,3 years ago,"Stumbled upon this place by accident and it was so good! The service was friendly, the pizzas were great and the pastas were solid. everything felt freshly made and well dressed (nothing was drowning in sauce). Not super cheap but well worth it."
29,Trattoria Totó, 4 stars ,a year ago,Delicious pasta and wine. Sympatic staff :) (maybe a little bit too salty to our taste). Would be nice to have grated parmegiano on the tables but maybe there wasn't because of the covid.
30,Trattoria Totó, 5 stars ,3 years ago,Best lasagna I've had! Can't wait to have it again!
31,Trattoria Totó, 4 stars ,4 years ago,"Walked in for a delightful meal and were eagerly seated. Carpaccio, pasta, lobster, and wine were are very delightful, and the dishes were well prepared. Our server took great care of us, and made us feel welcome, even with a baby. Rustic italian atmosphere inside. Great meal."
32,Trattoria Totó, 4 stars ,2 years ago,"Excellent Italian fare, and they really seem to take pride in their food. The taglioline pasta with lobster was fantastic, if not a little messy.
However, the waiting stuff are laconic and a little unwelcoming."
33,Trattoria Totó, 5 stars ,2 years ago,"Delicious food and very friendly staff. I had the pasta bolognese and it was absolutely spot on!
The restaurant itself is very cozy and looks inviting.
It's great!"
34,Trattoria Totó, 5 stars ,3 years ago,"Liked the ambiance - small, cozy, intimate.
Myself and my husband had 3 courses, all excellent. Mixed green salad was very good with fresh vegetables. Bread was warm and seemed freshly made with fresh …"
35,Trattoria Totó, 1 star ,4 years ago,This is the first time I have felt compelled to write a negative review about any restaurant. They only had one server/waiter at the time. We waited over 30 minutes and did not even receive any water or drinks. I sat near the kitchen window …
36,Trattoria Totó, 5 stars ,3 years ago,"Great food.
This place is about genuine tastes rather than pretty food so expect character and flavor. …"
37,Trattoria Totó, 4 stars ,3 years ago,Very nice atmosphere. We were lucky to get a table on Friday night with no reservation. Prices are OK. Pasta and Pizza were great. All in all a very nice experience.
38,Trattoria Totó, 5 stars ,4 years ago,"After sitting in this restaurant for 10 minutes, you are teleported to a small Italian town in the countryside. The ambience is as authentic as I have ever had anywhere outside of Italy. …"
39,Trattoria Totó, 5 stars ,2 years ago,The pasta was delicious and the red wine house is fabulous!
40,Trattoria Totó, 5 stars ,4 years ago,"Service and stuff were excellent. Good basic Italian food. We had carpaccio, caprezee, pasta and pizza - all very good. Came with 3 kids- no sweat.
We will come back!"
41,Trattoria Totó, 4 stars ,4 years ago,"We were able to walk right in on a Saturday night, no wait at all. The service was good, very friendly.  Wine list was reasonable. Their focus is Pugliese food, including a few choices with burrata and some polpette.  This is a very casual place near the museums, away from the craziness of an Amsterdam weekend."
42,Trattoria Totó, 5 stars ,7 months ago,Was there today! Pasta gwith seafood is my favorite dish and there it was delicious ! Definitely will come again! I saw god) and he is Italian and works in this restaurant!
43,Trattoria Totó, 5 stars ,2 years ago,Ate lasagna and pasta by myself only cause i loved it. Best lasagna. Pasta is as good as usual. I recommend everyone this place. Food is incredible. Staff i vey polite. Loge the place.
44,Trattoria Totó, 1 star ,4 years ago,First time we had dinner at this restaurant we were quite disappointed about the pasta and the dessert so we left a review on IENS explaining what we did not like but also saying that we really appreciated the vitello tonnato. Today we went …
45,Trattoria Totó, 1 star ,3 years ago,Service was very rushed. Meat in spaghetti Bolognese was very poor quality. Lasagne served with no garnish or garlic bread. Poor quality all round and not good value for money
46,Trattoria Totó, 5 stars ,2 years ago,"Made my daughters supper happy with pasta boloñesa.  Very accommodating family operation, in reality a 4,5 but most appreciative to all."
47,Trattoria Totó, 1 star ,4 years ago,"A place with average food and execrable  service. We arrived at 6:30 and said we had an 8:00 curtain. Despite prodding, our main course never arrived until 7:40, allowing only time for a couple bites and paying the check, which also required prodding. Stay away."
48,Trattoria Totó, 5 stars ,a year ago,"The staff is very welcoming and kind, the food is amazing and in great quantity ! Love this restaurant , i 10000% recomand it !!!"
49,Trattoria Totó, 5 stars ,6 months ago,Do not miss it. Perfect place with good foods.
50,Trattoria Totó, 5 stars ,2 years ago,"Excellent customer service! Went in right before they were about to close and they still attended us with great service and great Italian food!
Thank you"
51,Trattoria Totó, 5 stars ,2 years ago,"Very tasty, authentic italian food, cosy place and awesome service that can greet you and maintain small talk in at least 5 languages:)"
52,Trattoria Totó, 5 stars ,5 years ago,Great food and service. They even cook up your gluten free pasta if you bring it in (which you can buy from Eco plaza). Yummy!
53,Trattoria Totó, 4 stars ,a year ago,"I didnt like the waiter serving the food and they have very high prices, however the food tastes good and since the prices are like that all over amsterdam Id still come back."
54,Trattoria Totó, 3 stars ,3 years ago,"Though this came up on my gluten free search it was not gluten free, they offered fish and steak for options but nothing else. I am sure it is wonderful but beware if you are looking for gluten free"
55,Trattoria Totó, 5 stars ,7 months ago,Nice salmon
56,Trattoria Totó, 4 stars ,4 years ago,best pasta i've ever had quite a wait but worth while it was fresh and hot although i didn't think the portion justified the price and slightly over priced hence only 4 stars but over all experience was very good and warm friendly waiter
57,Trattoria Totó, 5 stars ,2 years ago,"Great good, typical Italian menu, I loved it. The pastas are simply perfecto !"
58,Trattoria Totó, 5 stars ,3 years ago,"The most authentic Italian food and best service and ambience in Amsterdam ! You don’t have to fly to Italy, just go to Toto!"
59,Trattoria Totó, 5 stars ,3 years ago,"Excellent food, extremely fair prices for generous portions, very welcoming atmosphere. No better place to eat in the neighborhood!!"
60,Trattoria Totó, 4 stars ,8 years ago,Excellent service. Great food. Not cheap but really worth the money. Italian like only the Italians can cook.
61,Trattoria Totó, 5 stars ,5 years ago,"Very nice restaurant, great hospitality and a very delicious food, got the sea food pasta its was more than fantastic, tasty, i would highly recommend this restaurant for any one."
62,Trattoria Totó, 5 stars ,a year ago,Best place to have authentic Italian pasta. Amazing service as well.
63,Trattoria Totó, 4 stars ,2 years ago,My calzone was really good only the tiramisu was not wow and the waiter is very kind and friendly.
64,Trattoria Totó, 4 stars ,6 years ago,Very good Italian food and authentic decor. Only downside was that the service was a bit slow. Recommended.
65,Trattoria Totó, 5 stars ,2 years ago,"Food was absolutely delicious! Fair prices, friendly waiter! Recommended!!"
66,Trattoria Totó, 5 stars ,4 years ago,"Had to wait about 20 minutes for a seat. No biggie, we walked around the block. The food was good and the waiter was 10/10 funny and super."
67,Trattoria Totó, 5 stars ,3 years ago,Classic authentic Italian food.  Great cozy atmosphere.  Friendly service.
68,Trattoria Totó, 5 stars ,2 years ago,"Amazing pasta, delicious red wine. Great staff, and a really welcoming experience!"
69,Trattoria Totó, 3 stars ,3 years ago,Average italian food.  Quite expensive for the quality served on tables.  Decoration is good
70,Trattoria Totó, 5 stars ,4 years ago,"A quaint restaurant serving literally the best pizza I have ever had, which is saying a lot considering I am a well-traveled, pizza-loving, dining-oriented American."
71,Trattoria Totó, 4 stars ,3 years ago,"Nice primi piatti, nice pasta I broccoli. Italian waiters, good service. Authentic Tiramisu."
72,Trattoria Totó, 5 stars ,4 years ago,"Great place; pasta perfecto al dente!!! Lovely flavors: lasagna die for it. Nice place cozy, lovely attention 👌🏻"
73,Trattoria Totó, 5 stars ,4 years ago,I'm italian; I don't live in Amsterdam but in London and as Italian who lives abroad I can say that this place is what you need to feel the taste of home.
74,Trattoria Totó, 3 stars ,4 years ago,"The entree tasted good, however the truffle pasta tasted creamy but not truffle-alike at all"
75,Trattoria Totó, 5 stars ,2 years ago,"Amazing food, great service, still quite affordable. What more do you want?"
76,Trattoria Totó, 5 stars ,3 years ago,A true Italian trattoria.
77,Trattoria Totó, 5 stars ,2 years ago,"Got pasta with tomato sauce , it was beyond amazing , this place is a must for pasta lovers"
78,Trattoria Totó, 5 stars ,4 years ago,Excellent Italian food. Very authentic. Delicious.
79,Trattoria Totó, 5 stars ,3 years ago,Toto has an intimate and casual atmosphere and delicious food. Highly recommend Toto!
80,Trattoria Totó, 5 stars ,4 years ago,"Nice restaurant, where, so it seemed, the local Italians like to eat as well."
81,Trattoria Totó, 5 stars ,6 months ago,Amazing pasta loved it.
82,Trattoria Totó, 2 stars ,4 years ago,Cosy and authentic atmosphere. Highly overpriced for small portions left a bitter taste in the mouth.
83,Trattoria Totó, 5 stars ,3 years ago,Very good food and friendly service. Cozy atmosphere.
84,Trattoria Totó, 4 stars ,2 years ago,"Homemade pasta, tasty pizza, and friendly staff"
85,Trattoria Totó, 5 stars ,3 years ago,"Friendly atmosphere, delicious food straight out of Italy"
86,Trattoria Totó, 5 stars ,3 years ago,"A real hidden gem, awesome tasty classical Italian dishes"
87,Trattoria Totó, 5 stars ,2 years ago,Good food. Service is a bit slow but friendly.
88,Trattoria Totó, 5 stars ,3 years ago,"Stopped for lunch on a recommendation from the Marriott concierge. Delicious meal, with excellent service!"
89,Trattoria Totó, 5 stars ,a year ago,Nice place to be. Very good Pasta:)
90,Trattoria Totó, 5 stars ,6 months ago,Great food and service
91,Trattoria Totó, 5 stars ,5 years ago,Real Italian in Amsterdam. Wonderful wine and. Nice people.
92,Trattoria Totó, 5 stars ,3 years ago,Excellent  lasagna and ravioli . Very reasonable price .
93,Trattoria Totó, 4 stars ,2 years ago,"Small Italian restaurant, good food."
94,Trattoria Totó, 5 stars ,3 years ago,One of the best pizza I have ever had
95,Trattoria Totó, 4 stars ,5 months ago,Top
96,Trattoria Totó, 4 stars ,2 years ago,Pretty good food and service!
97,Trattoria Totó, 5 stars ,4 years ago,Great tasting pasta - perfectly sized proportions.
98,Trattoria Totó, 1 star ,2 years ago,Not family friendly restaurant also racist
99,Trattoria Totó, 5 stars ,4 years ago,Very good food
100,Trattoria Totó, 5 stars ,5 years ago,Real Italian restaurant good ingredients
101,Trattoria Totó, 5 stars ,4 years ago,Good food to my place nice service
102,Trattoria Totó, 4 stars ,3 years ago,really nice service and the food is good
103,Trattoria Totó, 4 stars ,3 years ago,"Great service, great food!"
104,Trattoria Totó, 5 stars ,3 years ago,Really good proper Italian food
105,Trattoria Totó, 5 stars ,6 months ago,"Perfect, 5/5"
106,Trattoria Totó, 3 stars ,5 years ago,"Ok, but the tastes are less characteristic."
107,Trattoria Totó, 5 stars ,3 years ago,Excellent food and service :)
108,Trattoria Totó, 5 stars ,2 years ago,Great food and atmosphere
109,Trattoria Totó, 5 stars ,2 years ago,Very good pizza
110,Trattoria Totó, 4 stars ,4 years ago,Proper Italian cuisine from Campania
111,Trattoria Totó, 5 stars ,3 years ago,Nice place good food
112,Trattoria Totó, 3 stars ,4 years ago,Brilliantly Italian but quite expensive
113,Trattoria Totó, 5 stars ,3 years ago,Great food and service
114,Trattoria Totó, 5 stars ,4 years ago,traditional italian food
115,Trattoria Totó, 4 stars ,a year ago,Great food.
116,Trattoria Totó, 5 stars ,2 years ago,Everything was great!
117,Trattoria Totó, 5 stars ,3 years ago,Good pizza 👍
118,Trattoria Totó, 5 stars ,3 years ago,A little piece of Italy in Amsterdam
119,Trattoria Totó, 5 stars ,2 years ago,Fantastic
120,Trattoria Totó, 5 stars ,2 years ago,Excellent
121,Trattoria Totó, 5 stars ,2 years ago,Top
122,Trattoria Totó, 4 stars ,3 years ago,Excellent food
123,Trattoria Totó, 5 stars ,4 years ago,Awesome pizza
124,Trattoria Totó, 2 stars ,2 years ago,Bad service
125,Trattoria Totó, 5 stars ,2 years ago,Nice pasta
126,Trattoria Totó, 5 stars ,2 weeks ago,"(Translated by Google) Very friendly and courteous staff, it's small and cozy with lots of style.
And the lasagne bolognese was just to die for, fresh out of the oven and …"
127,Trattoria Totó, 5 stars ,6 months ago,"(Translated by Google) Excellent food! As a Sicilian I say it is one of the best Italian restaurants you can eat in Amsterdam. The staff were very kind and helpful, plus a very nice place with Italian music! …"
128,Trattoria Totó, 5 stars ,3 months ago,"(Translated by Google) I loved it because of the food that is all great and also because of the kindness of its staff, especially the Peruvian waitress (she did not tell us her name) who always served us with a big smile. During our stay in …"
129,Trattoria Totó, 5 stars ,a month ago,"(Translated by Google) Great service, top quality food, the best server there is and very reasonable prices, I highly recommend! ❤️ …"
130,Trattoria Totó, 5 stars ,3 weeks ago,(Translated by Google) Very tasty authentic Italian pasta with a nice atmosphere and excellent staff! …
131,Trattoria Totó, 3 stars ,3 years ago,"(Translated by Google) Good ham, bread and olives. The mozzarella nothing special. Good pasta with pesto, but overcooked. The bill is high but still average for the restaurants around. Italian staff. …"
132,Trattoria Totó, 4 stars ,4 years ago,"(Translated by Google) If you are in the area ... if you want to really eat Italian .... I recommend this small but welcoming restaurant, run by kind and friendly Italians .... 4 dinners have really refreshed me and energized me after so …"
133,Trattoria Totó, 5 stars ,5 months ago,"(Translated by Google) Delicious eaten!
Starter, main and dessert were good, as was the wine...
Friendly service. …"
134,Trattoria Totó, 5 stars ,5 months ago,(Translated by Google) Beautiful place to eat Italian food. Very nice staff. Highly recommended. …
135,Trattoria Totó, 3 stars ,6 months ago,"(Translated by Google) Quite nice Italian restaurant, with an atypical decor.
For the food it is more than enough without being so exceptional. …"
136,Trattoria Totó, 5 stars ,3 years ago,"(Translated by Google) Small warm and very Italian restaurant (decoration, menu and team). The dishes are a delight especially the plate of San Sebastian ham and mozzarella. …"
137,Trattoria Totó, 5 stars ,4 years ago,"(Translated by Google) Traditional Italian decor, fresh pasta, accompanied by great wine, good choice for a cold day. …"
138,Trattoria Totó, 5 stars ,3 years ago,"(Translated by Google) A very high quality place with a homely atmosphere.
A homely and Italian atmosphere that gives you a great feeling from the local service people, a great selection of pizzas and pastas. …"
139,Trattoria Totó, 5 stars ,4 months ago,"(Translated by Google) We are treated to a plate of Totò (👍🏻👍🏻👍🏻) mixed antipasti and bruschetta as a starter.
Tuna and Totò pizza well crispy and well topped …"
140,Trattoria Totó, 5 stars ,a year ago,"(Translated by Google) Very good and authentic Italian cuisine. Gladly again.

(Original) …"
141,Trattoria Totó, 5 stars ,2 years ago,(Translated by Google) Cozy place. Nice food. Fair price. Very friendly and attentive attendants. …
142,Trattoria Totó, 5 stars ,a month ago,(Translated by Google) Restaurant at the top I highly recommend and the server at the top bravo! 👍 …
143,Trattoria Totó, 5 stars ,7 months ago,"(Translated by Google) Arriving at 9.30 pm was no problem. Super friendly staff, ready quickly, very cozy and very good value for money! Definitely recommend! …"
144,Trattoria Totó, 5 stars ,7 months ago,(Translated by Google) Omg I had that spaghetti frutti di mare and it was so unbelievably delicious I've never eaten so delicious Italian ❤🥰🍾 …
145,Trattoria Totó, 5 stars ,4 months ago,"(Translated by Google) The food is excellent the place very tasteful.

(Original) …"
146,Trattoria Totó, 4 stars ,2 years ago,"(Translated by Google) Very nice atmosphere, pasta was delicious, pizza went

(Original) …"
147,Trattoria Totó, 5 stars ,a year ago,"(Translated by Google) Very good food, nice atmosphere. Waiter's advice was very good. Best tiramisu ever! Cozy staff, clean and the perfect portions, not too big and certainly not too small. Did you have a nice evening! …"
148,Trattoria Totó, 5 stars ,5 months ago,"(Translated by Google) Excellent service and delicious food, good presentation and location …"
149,Trattoria Totó, 2 stars ,2 years ago,"(Translated by Google) Food very expensive. Margherita 10 euros. Tagliatelle with mini salmon pieces, which you can hardly get enough of, 15 €. The male service staff also became unfriendly and even bumped into one of the guests. In …"
150,Trattoria Totó, 5 stars ,2 years ago,"(Translated by Google) 100% Italian restaurant, I ate a fantastic amatriciana. I can't say anything else about the dishes because I didn't try them. Pizza in the media, but after all, you are still abroad. …"
151,Trattoria Totó, 5 stars ,2 years ago,"(Translated by Google) Even if on vacation, Italian cuisine has its reason. Homemade cannelloni, even dessert. Very nice staff. Adequate price. To visit. …"
152,Trattoria Totó, 5 stars ,2 years ago,(Translated by Google) Certainly one of the best pizzas I ever had !!! One of the best pizza of my life !!! …
153,Trattoria Totó, 2 stars ,2 years ago,"(Translated by Google) Service not at the top, the seated customers passed after all the customers in take-out so that it took more than 20 minutes just to get the drink. Moderately friendly staff, service too slow, we left without having …"
154,Trattoria Totó, 5 stars ,3 years ago,"(Translated by Google) Delicious Intalyan tratoria. Amazing pasta and pizza, good homemade wine and divine tiramisu. Sensitive service, the child does not eat practically anything and was fed anyway. The prices are quite humane in relation …"
155,Trattoria Totó, 5 stars ,7 months ago,"(Translated by Google) Very good, the food is delicious and the atmosphere is very pleasant …"
156,Trattoria Totó, 5 stars ,3 years ago,"(Translated by Google) Here they are the Italians who go abroad and look for an Italian restaurant, someone will have said this, it is true sometimes we do it when the offer is not exciting. I must say that you are never too disappointed, …"
157,Trattoria Totó, 2 stars ,9 years ago,"(Translated by Google) The ambiance and atmosphere are nice and good, so I walked in with fairly good expectations; …"
158,Trattoria Totó, 4 stars ,4 years ago,"(Translated by Google) The Pizza was very tasty, only the black border on one corner was disappointing. The Italian beer tasted great and the waiter told everything in English, Italian and half Dutch. That makes a nice atmosphere. …"
159,Trattoria Totó, 4 stars ,3 years ago,"(Translated by Google) Italian family restaurant decorated with photos and memorabilia of the Italian film star Totó, the alias of Antonio Griffo Focas Flavio Angelo Ducas Comneno Porfirogenito Gagliardi De Curtis di Bisanzio (Naples, …"
160,Trattoria Totó, 5 stars ,6 months ago,"(Translated by Google) Very well looked after and delicious 4 cheese pizza.

(Original) …"
