,Name,Review Rate,Review Time,Review Text
0,Café Lennep, 5 stars ,4 months ago,"Nice Place where you can sit outside directly at the canal. We didn't have any food (don't even know if they have vegan options; vegan cake at least wasn't available), but the beer-selection was very good. If you wan't to enjoy a chilled atmosphere this is the place to be... Especially at a sunset..."
1,Café Lennep, 4 stars ,3 years ago,"Wow, my best friend in Amsterdam lives across from this lovely neighbourhood cafe. A spacious place to have a nice gin & tonic or relax next to the canal. As you enter you see a large rotisserie slowly cooking chicken accompanied by this …"
2,Café Lennep, 1 star ,6 months ago,"So this happened last week.

We came to this place around 5pm, asked the waitress where we could sit and she …"
3,Café Lennep, 4 stars ,9 months ago,Delicious food and very nice location by the canal!
4,Café Lennep, 5 stars ,a year ago,Great place nice service and good food. Cozy area with gorgeous terrace. The waiter finished his shift and jumped into the canal for a swim. Unforgettable! I ll visit again.
5,Café Lennep, 4 stars ,2 years ago,"This is my third time here. My experience has been the same each time. Love the decor and layout, good vide. Put off a little by the delay in getting served. Pleased with the staff when i do get served and then delighted by the food. This …"
6,Café Lennep, 5 stars ,2 years ago,Very cool place to chill with friends. They have a garden like seating area and benches by the canal. Interior is also well decorated. Looks like a cozy bar but the food is amazing as well. Try their specialty chicken rotisserie dish. It …
7,Café Lennep, 5 stars ,2 years ago,"Great place for having lunch or dinner, next to a canal, in or outside. Really nice staff and good food. 5 stars!"
8,Café Lennep, 5 stars ,8 months ago,"Great café/bar in Amsterdam. The kimchi sandwich and the burger are super good. If you’re lucky, you can even enjoy the tables right next to the water. I love this place!"
9,Café Lennep, 5 stars ,4 years ago,"Good food, good beef, super fun waiter on a Sunday night. Decent prices. A bit too salty, but I guess it's a good strategy to make you drink more ;)"
10,Café Lennep, 5 stars ,a year ago,Amazing burguers (vegetarian options included) and salads. Near the channel so great views. …
11,Café Lennep, 3 stars ,a year ago,Had the veggie burger which was very tasty. Great atmosphere next to a canal. Docking 2 stars because it took an hour just to order our food after asking the waiter multiple times. I'll definitely go back again and see if that was just a fluke.
12,Café Lennep, 5 stars ,5 months ago,Amazing food and staff! Would highly recommend coming to this lovely cafe!
13,Café Lennep, 5 stars ,5 months ago,Very nice brown bar. They a very nice map. Service was very nice
14,Café Lennep, 5 stars ,3 years ago,I liked the place. It is just in front of a canal which gives you nice views when you are seating outside or next to the window inside. The food is delicious and pricing is okay for Amsterdam standards. Staff is super nice and smiling all the time. Beer and wine selection is enough to make you happy. I recommend French farm chicken.
15,Café Lennep, 5 stars ,8 months ago,"Had  a small party for my birthday this weekend at Cafe Lennep. Great food, drinks and awesome hospitality. There was a lot.of laughter and cheer."
16,Café Lennep, 5 stars ,9 months ago,"Great food, location, space & really friendly staff that makes you feel like home. After 1 year of covid they welcome back like you are coming back home. 😃"
17,Café Lennep, 3 stars ,2 years ago,"The first time we came here was brilliant, both the food and service. Tonight they didn't want to know us. The food was very average and the steak not cooked as we asked. A big disappointment for our last night in Amsterdam. We bought wine on the way home and enjoyed ourselves here instead."
18,Café Lennep, 5 stars ,a year ago,Beautiful location. Nice indoor and outdoor space. Good service.
19,Café Lennep, 5 stars ,4 years ago,"I recently celebrated my 34th birthday with 18 friends at Café Lennep and the experience could not have been more amazing. The staff is so warm, friendly and attentive you could have been mistaken to think you were in the US. The food was …"
20,Café Lennep, 5 stars ,2 years ago,Fantastic terrace with great beer selection. Food is simple yet expertly prepared with all the right flavours. Very homey style cooking and also a lot of choice snack wise. 10/10 would recommend.
21,Café Lennep, 1 star ,2 years ago,"The waiter was the worst I have encountered in a long time. He spilled a drink on one of us, barely said he is sorry. Then he forgot one of our food orders so a person from the group had to wait another 15-20 min while the rest of us were …"
22,Café Lennep, 4 stars ,2 years ago,"As I rocked to Cafe Lennep invited by a friend, I immediately liked the place. Even in the dull of a rainy Saturday afternoon the charm of the little courtyard is obvious. Inside the place is large and not that crowded but I guess a Sunday …"
23,Café Lennep, 4 stars ,6 years ago,Really delicious meat join. They have a good selection of local craft beers and a fantastic menu. This might be one of the best places in Amsterdam to have a proper beef roast. The interior is styling and the atmosphere cosy. Not appropriate for large groups (10+) though as the staff lose their patience quickly.
24,Café Lennep, 4 stars ,4 years ago,"I've seen this place with a lot of people, but when I decided to go, it was quite empty. A pity, but anyways it was a good experience. They were able to provide  snacks after 11pm, a very important detail for keeping an active evening. The music was also very good, a touch that I completely appreciate in bars, especially when it's good."
25,Café Lennep, 2 stars ,3 years ago,Our experience here on Saturday at lunchtime was pretty terrible all up. Our lunch order was completely forgotten by the waitress or the kitchen which meant we waited over an hour to eat in a place that was only 50% full. I had a chicken …
26,Café Lennep, 5 stars ,2 years ago,"Had a couple of sunny ciders and a salad. The food was beautifully presented, cozy outdoor terrace feels. However what made the experience so great was the staff: everyone was incredibly friendly and attentive. Thank you for the 🌻"
27,Café Lennep, 3 stars ,3 years ago,"Great service and atmosphere outdoors. Indoors, it's stuffy and all grilled chicken fumes. Dinner menu is one of the more expensive I've seen in Amsterdam (1.5 to 2x your average)"
28,Café Lennep, 5 stars ,5 years ago,"This is a great spot to sit in the sun and relax over drinks or a meal - outside of the busy tourist area, but with a large patio on the side of the canal. …"
29,Café Lennep, 5 stars ,4 years ago,"Cafe Lennep is great place to chill with a coffee by yourself in the afternoon, or spend an evening catching up with friends. It's atmosphere is calm and warm. There is a hipster feel with the large grill wall that they use to grill …"
30,Café Lennep, 5 stars ,2 years ago,It's funny that not being a hamburger restaurant they have the best hamburger in Amsterdam. The service is always fast and kind. Love this place! Don't forget to taste the chicken too ... delicious!
31,Café Lennep, 4 stars ,6 years ago,"Ignoring the fact that I sat down late and they were out of almost everything, it's s great visit. Waiting staff that's quick, which says a lot in Amsterdam and very friendly. …"
32,Café Lennep, 5 stars ,5 years ago,"One of my favorite places to go when the sun is out. The food is consistently good for both lunch and dinner.
The appetizer platter has a great selection of meats and cheeses and perfect for sharing."
33,Café Lennep, 3 stars ,4 years ago,Good is good. Atmosphere is lively! They have a great outside space and service is friendly! …
34,Café Lennep, 5 stars ,10 months ago,"Super nice terrace, very friendly staff, good food and quick service. Recommended!"
35,Café Lennep, 5 stars ,2 years ago,"Super lekker kip! And they're very friendly and accommodating, I asked if I could take something for take away and they don't usually do that, but they were so sweet to find a way to wrap it so I could take it home. I would definitely recommend supporting this local gem!"
36,Café Lennep, 5 stars ,6 years ago,"If you are in the neighborhood this place is worth your visit. The food was amazing from the rib eye right down to the espresso ice cream dessert  and a good assortment of beers. The staff was very friendly, with seating either inside or along the canal, you will look forward to your next visit."
37,Café Lennep, 5 stars ,4 years ago,"Great outdoor terrace by the water! The lunchmenu was full of classics, including  peanut butter & jelly and other variations.  Tried the Club Sandwich which was amazing and very reasonably priced! Great attentive and fast service! Will definitely come back to try their famous Tosti Lennep with farmers cheese and kimchi!"
38,Café Lennep, 4 stars ,7 months ago,Nice terrace by the water. They also have nice snacks!
39,Café Lennep, 5 stars ,9 months ago,Top spot in west. Perfect for drinks and borrel. Top-notch service as well. Highly recommended
40,Café Lennep, 1 star ,3 years ago,"Edit: came by just now, on Saturday at 10:57. We haven’t been let in because they are closed. They open at 11. No worries. Not coming back. …"
41,Café Lennep, 5 stars ,2 years ago,We nearly got hit by a sun shade but the staff was really apologetic about it and were generally really nice. The home made ice tea and the cheese burger were awesome. 5/5 would visit again
42,Café Lennep, 5 stars ,3 years ago,"This is a real hidden gem!!! Love the atmosphere! Play games, eat the amazing grilled chicken and enjoy the good staff and service. Special thanks to Rosaly, Renee, Ruben and Guido! Love it! ♡"
43,Café Lennep, 3 stars ,4 years ago,It has a good spot by the canal for a sunny afternoon and being inside is also nice as it is a cosy place. The food is average but the staff is the worst thing about this place. They are either bringing someone else's order or misunderstand …
44,Café Lennep, 1 star ,4 years ago,I had an 8:30pm booking and was sat at a nice table on the terrace next to the canal. We were asked what we would like to drink and told that drinks may take some time. 20 mins later the drinks arrived. Just after 9pm we decided we should …
45,Café Lennep, 5 stars ,2 years ago,"Very nice and cosy place. The coffee is very good, and so is the food. On a sunny day it's perfect to sit outside with a lovely view of the canal."
46,Café Lennep, 5 stars ,4 years ago,"Great place to have a burger and a beer! We had a nice place outside next to the canal. Staff really attentive and kind, will be back for sure!"
47,Café Lennep, 4 stars ,6 years ago,Very nice terrace by the water to have a drink and some snacks. The lennep platter is very nice if you just want to have some snacks. Menu also looked very appealing. Service is very friendly and pretty quick.
48,Café Lennep, 4 stars ,6 months ago,"Good place for lunch, terrace on the canal."
49,Café Lennep, 5 stars ,2 years ago,"The place has a great atmosphere, and the view onto the canal is special. The staff were really friendly while I was there as well."
50,Café Lennep, 3 stars ,2 years ago,Nice place but the host seemed to be quick to want to get me out of the place even though it was practically empty and I had ordered 2 drinks and food!
51,Café Lennep, 5 stars ,3 years ago,"One of the best Cafes in Amsterdam. Friendly staff,  cozy environment, good food (don't forget to try their specialty). Will visit again."
52,Café Lennep, 3 stars ,3 years ago,"Food is really good, but service is really slow! 4 people waiting tables tonight, 7 tables occupied and still you have to walk up to the bar to place an order.. at least the staff is friendly"
53,Café Lennep, 5 stars ,2 years ago,"I come here to drink beer, eat delicious food, chill on their awesome terrace, and get away from the tourists and you should too. Local and cozy, one of my GO TO favorites"
54,Café Lennep, 5 stars ,3 years ago,Amazing place for chicken !!!! just loved it ! staff is nice. Price alright. not so big inside so make sur to call them before for a spot
55,Café Lennep, 4 stars ,3 years ago,Really nice place. Good choice for food and drinks. Polite and friendly staff. Amazing terrace on the canal!!!
56,Café Lennep, 4 stars ,5 years ago,Very nice and laid back place with good food and friendly staff. Awesome terrace next to the canal to enjoy during spring and summer.
57,Café Lennep, 4 stars ,3 months ago,Very cute café !
58,Café Lennep, 3 stars ,3 years ago,"I had few drinks here staff very friendly,food looks delightful but didn't try it (because drinking) next time 😉"
59,Café Lennep, 5 stars ,2 years ago,Delicious sandwiches and cider! I also love the selection of tea they have!
60,Café Lennep, 4 stars ,4 years ago,"Outside terrasse is great, nice to find a proper bar that also prepare good food! Also good for groups"
61,Café Lennep, 4 stars ,4 years ago,"Nice place with great terrace seats at the water, basic food but done well and good atmosphere"
62,Café Lennep, 5 stars ,2 years ago,"Great service, even better food and atmosphere. I'll come back for sure :)"
63,Café Lennep, 4 stars ,4 years ago,"Cool place with good food as well, the terrace on the canal in the summer is just a must!!"
64,Café Lennep, 5 stars ,2 years ago,Really nice place for a drink. Nice space outside close to the water
65,Café Lennep, 5 stars ,a year ago,Super cosy place!
66,Café Lennep, 5 stars ,3 years ago,Very good food with generous portions unlike other Amsterdam restaurants.
67,Café Lennep, 4 stars ,3 years ago,Nice room. Cheese burger is simply but filling. Nice mayo!
68,Café Lennep, 5 stars ,4 years ago,Good chicken. Good burgers. The dishes are mostly 'simple' and delicious
69,Café Lennep, 5 stars ,2 years ago,A true jewel in Amsterdam! Great bar. Great staff. Great place!
70,Café Lennep, 4 stars ,2 years ago,Even my dog Noah loved this place...see the wee smirk on his sweet lil facey???!!!???
71,Café Lennep, 5 stars ,2 years ago,Great place to have beers with good staff and environment
72,Café Lennep, 3 stars ,2 years ago,"If you're not here with a company you are not ok. In other words, if you are here alone. Don't be. If you are in a company. Great!"
73,Café Lennep, 1 star ,4 years ago,Super slow kitchen. Attentive wait staff but chronically slow kitchen. Not worth the wait.
74,Café Lennep, 5 stars ,3 years ago,"Lovely athmosphere, attentive service and great food!"
75,Café Lennep, 5 stars ,a year ago,Always a lovely time here. Staff are amazing!
76,Café Lennep, 5 stars ,3 years ago,"Cozy environment, good and tasty food, I will definetely come back."
77,Café Lennep, 4 stars ,2 years ago,Great burger but slow service
78,Café Lennep, 3 stars ,5 years ago,A relaxed place and crowd. Drinks wise just the ordinary stuff.
79,Café Lennep, 5 stars ,2 years ago,Super nice food and pretty good service
80,Café Lennep, 5 stars ,3 years ago,"Excellent food, nice atmosphere."
81,Café Lennep, 4 stars ,3 years ago,If u want a full chicken well-baked of hamburger...this is a right place.
82,Café Lennep, 5 stars ,2 years ago,Lovely location in my quiet neighbourhood. Fast service
83,Café Lennep, 5 stars ,3 years ago,Wide range of beers and great chicken!
84,Café Lennep, 5 stars ,2 years ago,"Nice place right on the canal, great atmosphere"
85,Café Lennep, 5 stars ,8 months ago,Love It!
86,Café Lennep, 4 stars ,5 years ago,Friendly staff and tasty gin&tonics 🍹
87,Café Lennep, 5 stars ,4 years ago,Beautiful terrace and great food!
88,Café Lennep, 4 stars ,4 years ago,Simple but nicely varied dishes
89,Café Lennep, 4 stars ,3 years ago,great marinated grilled chicken!
90,Café Lennep, 5 stars ,2 years ago,Very cosy restaurant by the canal
91,Café Lennep, 2 stars ,4 years ago,"Super slow service, and the bread was moldy.."
92,Café Lennep, 5 stars ,2 years ago,Superb food & staff!
93,Café Lennep, 2 stars ,4 years ago,Too expensive while it's far from the center
94,Café Lennep, 5 stars ,3 years ago,Very good poussin !
95,Café Lennep, 4 stars ,4 years ago,Terrace on the water. Smoke on the water
96,Café Lennep, 3 stars ,4 years ago,Good local cafe
97,Café Lennep, 5 stars ,a year ago,Lovely place
98,Café Lennep, 4 stars ,2 years ago,Good coffee
99,Café Lennep, 1 star ,5 years ago,Arrogant service
100,Café Lennep, 5 stars ,4 years ago,cool place to be
101,Café Lennep, 4 stars ,3 days ago,Great staff
102,Café Lennep, 4 stars ,a month ago,"(Translated by Google) The appetizer menus, grilled chicken varieties and salads are very delicious. The employees are also very friendly. It is a pleasant place with its interior decoration and location. …"
103,Café Lennep, 5 stars ,4 months ago,(Translated by Google) I went here for dinner with two girlfriends and I recommend it to everyone. The atmosphere was very cozy and the food was fantastic. It was not too crowded like in the center. The wait staff was so attentive and …
104,Café Lennep, 5 stars ,5 months ago,"(Translated by Google) One of the nicest terraces in Amsterdam, where the sun always shines. Food is great, drink to feast. …"
105,Café Lennep, 3 stars ,4 months ago,"(Translated by Google) Nice place, cozy atmosphere, nice terrace, wheat beer also OK …"
106,Café Lennep, 1 star ,10 months ago,"(Translated by Google) If you come to deliver a boat full of guests, good for the turnover, you will be sent away for 5 minutes of loading / unloading. Was going to throw my lines loose …"
107,Café Lennep, 4 stars ,2 years ago,"(Translated by Google) Top chicken. Nice service on Oct. 8 Acoustics is the only reason not to come back. You have to shout to understand each other and it wasn't even busy. Curtain, ceiling silencers, etc. So beep. Adjust that and we'll be …"
108,Café Lennep, 1 star ,a year ago,"(Translated by Google) Monday sat here on the terrace, very nice on the water. Had some drinks and food.
Unfortunately the poussin was very dry and there was no taste to it. Tried with …"
109,Café Lennep, 1 star ,a year ago,"(Translated by Google) I thought I would eat here because it is summer and they have a big terrace. However, the food is very low here. Probably a great place for a beer, but you don't have to come here for food. …"
110,Café Lennep, 4 stars ,7 months ago,(Translated by Google) Delicious meal on a nice terrace on the water. Friendly service. …
111,Café Lennep, 5 stars ,3 years ago,"(Translated by Google) Super cozy tent! Very nice staff, extensive beer selection, good food on the menu. You can sit inside mega nice, and the terrace outside is really lovely. I come here very often, highly recommended! …"
112,Café Lennep, 3 stars ,4 years ago,"(Translated by Google) The chefs don't know the difference between regular aged cheese and goat cheese. Furthermore, the tasty food is well cared for. So if you are in for a surprise meal with a nice cafe atmosphere, go here. …"
113,Café Lennep, 4 stars ,6 years ago,"(Translated by Google) Cafe Lennep has a beautiful terrace on the Jacop van Lennepkade. So if you are lucky you can go ahead with the boat. The menu is simple but good and the wines are excellent, both in terms of quality and price. We were …"
114,Café Lennep, 1 star ,4 years ago,(Translated by Google) Staff don't even look at you when you enter. Asked ourselves if we could see the menu. After 15 minutes we also asked if we could order something. After 30 minutes I didn't even get a first drink and gave up hope. …
115,Café Lennep, 5 stars ,a year ago,"(Translated by Google) Nice restaurant, good atmosphere. Really friendly staff & great food! Top evenings experienced! …"
116,Café Lennep, 2 stars ,a year ago,"(Translated by Google) Unfortunately the food and drinks were served lukewarm and there was a thick hair in my food, which they apologized for but could not help it, they said ... …"
117,Café Lennep, 5 stars ,2 years ago,(Translated by Google) Cafe restaurant with landing place for boats. Terrace on the water. Great place for a nice glass of wine in the sun. …
118,Café Lennep, 5 stars ,4 years ago,"(Translated by Google) Late lunch with husband and 2 children. Super friendly, good looking and fast staff. Burgers were wonderfully tender and flavorful. Atmospheric place! …"
119,Café Lennep, 5 stars ,3 years ago,(Translated by Google) One of my favorite places to have a drink with friends on the terrace. Their new burger (burguoasa?) Is also recommended! …
120,Café Lennep, 4 stars ,4 years ago,(Translated by Google) Decorated very nicely inside. Not very busy. Friendly. The hamburger sandwich fell apart but the meat was nice and tender …
121,Café Lennep, 4 stars ,3 years ago,(Translated by Google) Specialty are French chicken from the spit! Highly recommended! Good atmosphere and extraordinarily good food for a pub / restaurant. …
122,Café Lennep, 5 stars ,4 years ago,"(Translated by Google) perfect place for a cozy dinner, lunch or drink. Lovely people and a beautiful place. The terrace is beautiful, especially on a mild summer evening …"
123,Café Lennep, 5 stars ,3 years ago,"(Translated by Google) Very hearty nachos, excellent spinach salad, very good cheese and meat platter.
Without forgetting the very cute and cozy setting, I highly recommend! …"
124,Café Lennep, 4 stars ,9 months ago,"(Translated by Google) Missed a patio heater otherwise top food !!

(Original) …"
125,Café Lennep, 5 stars ,2 years ago,(Translated by Google) Chicken is definitely recommended! Helpful staff and a wonderful terrace on the water are extra bonus points. …
126,Café Lennep, 5 stars ,2 years ago,"(Translated by Google) Nice cafe and good snacks.

(Original)
Leuk café en goede snacks."
127,Café Lennep, 5 stars ,4 years ago,(Translated by Google) Nice location and very friendly staff! Food is tasty and the atmosphere very friendly. …
128,Café Lennep, 5 stars ,3 years ago,"(Translated by Google) Lovely outside terrace, tasty chicken. Super staff. Nice place …"
129,Café Lennep, 3 stars ,9 months ago,"(Translated by Google) summary map. eat well

(Original) …"
130,Café Lennep, 4 stars ,3 years ago,"(Translated by Google) Nice terrace on the water, quiet street. Great eaten!

(Original) …"
131,Café Lennep, 5 stars ,2 years ago,"(Translated by Google) had a nice party from L&L. Great white beer drunk!

(Original) …"
132,Café Lennep, 4 stars ,2 years ago,"(Translated by Google) Nice, cozy eatery. Delicious chicken

(Original) …"
133,Café Lennep, 5 stars ,2 years ago,"(Translated by Google) Great food in a prime location and always nice service

(Original) …"
134,Café Lennep, 5 stars ,3 years ago,"(Translated by Google) Nice tent. Nice terrace. Great nachos.

(Original) …"
135,Café Lennep, 4 stars ,a year ago,"(Translated by Google) Nice and quiet to have a chat.

(Original) …"
136,Café Lennep, 5 stars ,3 years ago,(Translated by Google) Super fun with tasty drinks and delicious grill chickens! …
137,Café Lennep, 4 stars ,3 years ago,"(Translated by Google) Not too complicated, but delicious food.

(Original) …"
138,Café Lennep, 5 stars ,2 years ago,"(Translated by Google) A nice cafe with a nice terrace

(Original) …"
139,Café Lennep, 4 stars ,3 years ago,"(Translated by Google) excellent terrace on the canal
very cool …"
140,Café Lennep, 5 stars ,2 years ago,"(Translated by Google) Here it is actually always nice :)

(Original) …"
141,Café Lennep, 4 stars ,5 years ago,"(Translated by Google) Cozy atmosphere

Nice for a night out …"
142,Café Lennep, 4 stars ,2 years ago,"(Translated by Google) Cozy, with tasty snacks and good wine

(Original) …"
143,Café Lennep, 4 stars ,4 years ago,"(Translated by Google) For the terrace on the water and the nice service!

(Original) …"
144,Café Lennep, 5 stars ,a year ago,"(Translated by Google) Nice cafe on the water! 😄

(Original)
Leuk café aan het water! 😄"
145,Café Lennep, 4 stars ,3 years ago,(Translated by Google) Surprisingly nice corner with trees somewhere in Amsterdam …
146,Café Lennep, 5 stars ,4 years ago,"(Translated by Google) Cozy cafe with terrace on the water

(Original) …"
147,Café Lennep, 5 stars ,4 years ago,"(Translated by Google) Very cozy and friendly eatery.

(Original) …"
148,Café Lennep, 5 stars ,2 years ago,"(Translated by Google) Super cozy place!

(Original)
Super gezellige plek!"
149,Café Lennep, 4 stars ,4 years ago,"(Translated by Google) Burger tastes good

(Original)
Burger smaakt goed"
150,Café Lennep, 4 stars ,4 years ago,"(Translated by Google) Good Belgian beer

(Original)
Goed Belgisch bier"
151,Café Lennep, 5 stars ,3 years ago,"(Translated by Google) AWESOME!

(Original)
GEWELDIG!"
152,Café Lennep, 4 stars ,3 years ago,"(Translated by Google) Beer and tasty chickens

(Original)
Bier en lekkere kippetjes"
153,Café Lennep, 5 stars ,2 years ago,"(Translated by Google) Very nice place

(Original)
Hele fijne plek"
154,Café Lennep, 5 stars ,a year ago,
155,Café Lennep, 4 stars ,a year ago,"(Translated by Google) fast operation

(Original)
snelle bediening"
156,Café Lennep, 4 stars ,2 years ago,"(Translated by Google) Really enjoyed it.

(Original)
Erg genoten."
157,Café Lennep, 4 stars ,3 years ago,"(Translated by Google) Great food!

(Original)
Lekker kos!"
158,Café Lennep, 3 stars ,5 years ago,"(Translated by Google) Nice pub

(Original)
Leuke kroeg"
159,Café Lennep, 4 stars ,5 years ago,"(Translated by Google) Good food

(Original)
Lekker gegeten"
160,Café Lennep, 5 stars ,3 months ago,
161,Café Lennep, 5 stars ,2 years ago,
162,Café Lennep, 5 stars ,3 years ago,
163,Café Lennep, 5 stars ,a year ago,
