,Name,Review Rate,Review Time,Review Text
240,Meatless district, 5 stars ,2 months ago,Wholesome tasty food.
241,Meatless district, 5 stars ,3 years ago,This is the best vegan spot I have ever eaten at.  I'm not even a vegan.  If I had this spot in my home town I might be though...
242,Meatless district, 5 stars ,4 years ago,"Really Nice place to eat vegan food. Good vibes, Friendly staff and tasty Food."
243,Meatless district, 5 stars ,a year ago,"Good, friendly service. Didn’t appreciate the dog in the establishment, but had a good experience overall."
244,Meatless district, 5 stars ,4 years ago,"Came in from NYC hungry. Left satisfied!!! Friendly staff, super delicious food, tasty cocktails. All rounder."
245,Meatless district, 5 stars ,4 years ago,"Creative, delicious and cool. A regular destination when in Ansterdam. One of those places you want to take friends to. Nice outside in Summer."
246,Meatless district, 4 stars ,2 years ago,"Great envinronment,  good bite"
247,Meatless district, 4 stars ,4 years ago,Good food and friendly staff - although as a meat eater myself didn't enjoy as much as my vegan friends.
248,Meatless district, 5 stars ,2 years ago,"Best vegan meal I've had, ever. Period. And I've eaten as a vegan all over the world."
249,Meatless district, 4 stars ,3 years ago,Great food and vibe!  Only downside is sometimes the staff seem overwhelmed with the amount of tables.
250,Meatless district, 5 stars ,3 years ago,"Super friendly staff, stylish restaurant, and delicious food! I will be coming back here next time I visit."
251,Meatless district, 5 stars ,3 years ago,"Original tasty vegan food, nice staff and good atmosphere: highly recommended!"
252,Meatless district, 5 stars ,3 years ago,"Great place. Friendly staff, good location, nice decoration and good vibes. Very good food."
253,Meatless district, 5 stars ,2 years ago,"High level vegan food which takes a bit to create.
A bit pricy tho, but worth a visit and to chill."
254,Meatless district, 5 stars ,a year ago,Wonderful take on vegan cuisine! Highly recommend!
255,Meatless district, 5 stars ,4 years ago,"What a great place, nice atmosphere and a stunning vegan menu. Loved it!"
256,Meatless district, 5 stars ,2 years ago,"Exactly what you look for in a vegan restaurant. High quality and original recipes, and a great location"
257,Meatless district, 4 stars ,2 years ago,Nice vegan portions really. Good understanding about allergies. Nice Service!
258,Meatless district, 5 stars ,2 years ago,"Delicious food, friendly staff and a really cool interior. Loved it!"
259,Meatless district, 5 stars ,2 years ago,Lovely vegan restaurant - interesting menu and atmosphere with little pretension.
260,Meatless district, 5 stars ,3 years ago,Great vegan place! Recommend the “gravad lax” bagel and vegan croquettes.
261,Meatless district, 4 stars ,5 years ago,"The vegan food is very good, the staff is nice and the food was brought to our table very quickly"
262,Meatless district, 5 stars ,3 years ago,"Nice staff and good, healthy food. I especially liked the green pea soup."
263,Meatless district, 5 stars ,2 years ago,Fantastic food! The burger with Sweet potato fries is the thing to get!
264,Meatless district, 5 stars ,2 years ago,"It was delicious, the kimchi burger was so tasty and juicy! Loved it"
265,Meatless district, 5 stars ,2 years ago,Small place but the food was really impressive.  Would definitely return.
266,Meatless district, 5 stars ,a year ago,Great service and excellent brunch (Vegan)
267,Meatless district, 4 stars ,4 years ago,"Great food nice atmosphere, popular place, only downside was the fairly slow service."
268,Meatless district, 4 stars ,2 years ago,"Only went here to make use of the bathrooms, ordered coffee out of gratitude. Wasn't dissapointed, friendly staff."
269,Meatless district, 4 stars ,3 years ago,The food was delicious but everything was a bit slow. Eat here if you have enough time to sit and relax!
270,Meatless district, 5 stars ,3 years ago,"Really great place to eat, it's delicious and the people there are very nice"
271,Meatless district, 4 stars ,3 years ago,Staff were super friendly and the food was great. We will definitely come back again
272,Meatless district, 5 stars ,a year ago,Best vegan food in Amsterdam! Try the cheese platter and the sangria
273,Meatless district, 4 stars ,5 years ago,"Great restaurant, with vegetarian food. And the locations it self is absolutely stunning."
274,Meatless district, 5 stars ,3 years ago,The vegan burger is awesome. Great service and nice atmosphere.
275,Meatless district, 5 stars ,3 years ago,Lovely vegan dining place. Beautiful interiors and tasty food.
276,Meatless district, 4 stars ,3 years ago,"Good place to try some vegan non flafel 😀 food, staff were friendly and service were fast."
277,Meatless district, 4 stars ,3 years ago,Good vegan options. Friendly service. Large portions
278,Meatless district, 5 stars ,3 years ago,Great vegan food.. make sure you have a reservation though
279,Meatless district, 4 stars ,a year ago,Food is delicious but pricy for what you get.
280,Meatless district, 5 stars ,2 years ago,"Great food, amazing atmosphere, even better service."
281,Meatless district, 5 stars ,5 years ago,"Ate the cheese burger with fries, everything was delicious. Great atmosphere."
282,Meatless district, 1 star ,2 years ago,We don't go there any more.... food was teastles we were disappointed an service was bad....
283,Meatless district, 5 stars ,2 years ago,fantastic . get dessert.
284,Meatless district, 5 stars ,4 years ago,some of best vegan food I've had and definitley the best I've found in Amsterdam
285,Meatless district, 5 stars ,2 years ago,Delicious vegan food and a warm and cosy atmosphere
286,Meatless district, 5 stars ,3 years ago,"Need to go back... only had enough time for 2 plate, wine n takeaway coffee... I just need to spend a day=weekend working my way through the menu"
287,Meatless district, 4 stars ,2 years ago,Delicious red curry but I wouldn't recommend the carrot cake.
288,Meatless district, 3 stars ,4 months ago,"Mediocre food, mediocre staff"
289,Meatless district, 3 stars ,3 years ago,"One of vegan and vegetarian restaurants in Amsterdam. The food was okay, not bad."
290,Meatless district, 4 stars ,4 years ago,"Great food nice atmosphere, popular place, only downside was the fairly slow service."
291,Meatless district, 5 stars ,3 years ago,"Super friendly staff, stylish restaurant, and delicious food! I will be coming back here next time I visit."
292,Meatless district, 5 stars ,3 years ago,"Good ambient, good food, nice service."
293,Meatless district, 1 star ,3 years ago,We walked into eat on Monday. Despite the restaurant being mostly empty the staff said they could not accommodate us and we needed to make a reservation ahead of time. We were not able to make a reservation even the next day at the bar. We …
294,Meatless district, 5 stars ,4 years ago,Really nice ambiance and good food for a reasonable price.
295,Meatless district, 5 stars ,2 years ago,"Delicious vegan burger, amazing sweet potato fries"
296,Meatless district, 5 stars ,3 years ago,The Sunshine Bowl is one of the best dishes in Oud-West
297,Meatless district, 5 stars ,3 years ago,Great food good atmosphere good selection of beer and cocktails.
298,Meatless district, 5 stars ,4 years ago,some of best vegan food I've had and definitley the best I've found in Amsterdam
299,Meatless district, 4 stars ,2 years ago,Delicious red curry but I wouldn't recommend the carrot cake.
300,Meatless district, 5 stars ,3 years ago,Love the carrot humus and hamburguers! Make sure you book in advance!!!
301,Meatless district, 5 stars ,3 years ago,"The best BLT I ever had, including the ones with actual bacon."
302,Meatless district, 5 stars ,2 years ago,Amazing restaurant. Excellent food and service.
303,Meatless district, 5 stars ,3 years ago,Really delicious food. The coffee was good as well.
304,Meatless district, 4 stars ,3 years ago,Was disappointed that they don’t have gluten free options for sweets/cakes during lunch.
305,Meatless district, 5 stars ,4 years ago,If you are vegan and are visiting Amsterdam is a must. Really good vegan food !
306,Meatless district, 4 stars ,4 years ago,"Great meatless meal! Pasta was delicious, desert was okish"
307,Meatless district, 3 stars ,4 years ago,"food was okay, the menu did not have much possibilities. service and prices were okay as well."
308,Meatless district, 5 stars ,3 years ago,Very fine vegan food👌🏻 great service 💎
309,Meatless district, 4 stars ,4 years ago,Great selection of vegan food and tastes great too.
310,Meatless district, 5 stars ,2 years ago,"Wow really nice food, service was perfect!"
311,Meatless district, 5 stars ,5 years ago,I had really nice springrolls (raw) and the nachos. About time we had a place like this!
312,Meatless district, 5 stars ,2 years ago,"Delicious vegan burger, amazing sweet potato fries"
313,Meatless district, 5 stars ,4 years ago,Really nice ambiance and good food for a reasonable price.
314,Meatless district, 4 stars ,7 months ago,nice food would recommend
315,Meatless district, 5 stars ,3 years ago,The Sunshine Bowl is one of the best dishes in Oud-West
316,Meatless district, 5 stars ,3 years ago,Awesome looking place. Very good food and drinks
317,Meatless district, 3 stars ,4 years ago,"The food is flavorless, but they have friendly staff and quick service."
318,Meatless district, 5 stars ,4 years ago,One of the best vegan burger I ever had!
319,Meatless district, 5 stars ,4 years ago,"An awesome experience, delicious food and the nicest staff ever."
320,Meatless district, 5 stars ,2 years ago,Lovely tasty and innovative vegan food
321,Meatless district, 5 stars ,4 years ago,"Very friendly staff, cosy environment, nice food !"
322,Meatless district, 4 stars ,5 years ago,"Nice setting, food is above average but there's room for improvement"
323,Meatless district, 5 stars ,2 years ago,Top notch food! Service was amazing too!
324,Meatless district, 5 stars ,3 years ago,Food was excellent! The burger was unbelievable.
325,Meatless district, 4 stars ,4 years ago,Good vegetarian food.
326,Meatless district, 5 stars ,3 years ago,Im not even vegan but i love the food!
327,Meatless district, 5 stars ,3 years ago,"Great food, specially sweet potato fries"
328,Meatless district, 5 stars ,2 years ago,Surprisingly delicious vegan meat-imitating dishes..
329,Meatless district, 5 stars ,4 years ago,"Very good vegan food, a must visit."
330,Meatless district, 3 stars ,2 years ago,"The starters were good, but the mains and desserts were forgettable"
331,Meatless district, 5 stars ,2 years ago,Everything was so good 👌 I hope to come back soon 😁
332,Meatless district, 4 stars ,4 years ago,"Nice vegetarian food, dutch classics veggie-way"
333,Meatless district, 5 stars ,3 years ago,Hip place with excellent cuisine (and that's coming from a meat eater)
334,Meatless district, 5 stars ,4 years ago,"Amazing food, super fast service 🖒"
335,Meatless district, 5 stars ,3 years ago,"Try the Sunshine bowl. Amazing place, good vibes."
336,Meatless district, 5 stars ,a year ago,Super yum with great flavors
337,Meatless district, 5 stars ,2 years ago,"Good food, friendly staff."
338,Meatless district, 5 stars ,3 years ago,Some of the best vegan burgers out there!
339,Meatless district, 4 stars ,3 years ago,Had to wait long for my beers.. otherwise 5 stars
340,Meatless district, 5 stars ,2 years ago,Delicious Garden Salad! Thank you very much.
341,Meatless district, 5 stars ,4 years ago,Amazing service. Unreal vegan food!
342,Meatless district, 5 stars ,3 years ago,Good choices for breakfast.  Helpful staff
343,Meatless district, 5 stars ,5 years ago,"Amazing burgers, good simple menu."
344,Meatless district, 5 stars ,8 months ago,Nice food nice staff
345,Meatless district, 5 stars ,3 years ago,"Delicious. Their ""chicken"" tasted like chicken!"
346,Meatless district, 5 stars ,4 years ago,"Delicious food, good service, very pleased"
347,Meatless district, 5 stars ,3 years ago,"Good ambient, good food, nice service."
348,Meatless district, 5 stars ,3 years ago,The 'salmon and cream cheese' bagel was divine
349,Meatless district, 5 stars ,2 years ago,Amazing food and service....will be back
350,Meatless district, 4 stars ,3 years ago,Ok pricey but for a date night this place is amazing
351,Meatless district, 5 stars ,3 years ago,Nice atmosphere for a quick lunch :)
352,Meatless district, 5 stars ,3 years ago,"Friendly staff, excellent food 👌"
353,Meatless district, 2 stars ,4 years ago,Nice food but the service is terrible  it is such a pitty...
354,Meatless district, 5 stars ,3 years ago,One of the best vegan places in Amsterdam.
355,Meatless district, 5 stars ,2 years ago,Very good! Better than I hoped for.
356,Meatless district, 5 stars ,3 years ago,Best cafe latte I've ever tried!  💟
357,Meatless district, 5 stars ,3 years ago,The ghoulash and cheesecake were delicious.
358,Meatless district, 4 stars ,3 years ago,Nice food concept. Sloooooow service.
359,Meatless district, 1 star ,3 years ago,Slowest service ever in the world! Seriously... if you are hungry never ever go
360,Meatless district, 5 stars ,5 years ago,amazing burger!
361,Meatless district, 5 stars ,2 years ago,budget price but offer good stuff
362,Meatless district, 3 stars ,2 years ago,"Meet replacement should never be the focus, eating healthy should be"
363,Meatless district, 5 stars ,4 years ago,Super food. One of my favourites in Amsterdam
364,Meatless district, 5 stars ,3 years ago,"The ""salmon"" is really nice.. And also the rest :)"
365,Meatless district, 4 stars ,4 years ago,"Pricy, really tasty though, try the peanut butter cake"
366,Meatless district, 5 stars ,5 years ago,amazing 100% vegan food and beverages
367,Meatless district, 5 stars ,4 years ago,Good vegan food!! Recommended
368,Meatless district, 5 stars ,3 years ago,Fantastic food and great service
369,Meatless district, 5 stars ,3 years ago,amazing food... I loved it
370,Meatless district, 4 stars ,4 years ago,Very nice place for Vegetarians
371,Meatless district, 3 stars ,4 years ago,Expensive but nice oreos... Fried
372,Meatless district, 5 stars ,5 years ago,Fantastic mainly vegan restaurant
373,Meatless district, 5 stars ,3 years ago,Really good food. Will come back again.
374,Meatless district, 5 stars ,2 years ago,"Delicious food, friendly service"
375,Meatless district, 4 stars ,4 years ago,Great cocooning vegan place !
376,Meatless district, 4 stars ,3 years ago,Their 'chicken' burger is fab.
377,Meatless district, 5 stars ,5 years ago,Love the concept and the ceasar salad
378,Meatless district, 5 stars ,3 years ago,Kick-Ass. Can I say that? Kick-@$$. Just to be safe
379,Meatless district, 4 stars ,a year ago,Lasagne was great!
380,Meatless district, 5 stars ,3 years ago,"Excellent vibe, service and food."
381,Meatless district, 4 stars ,4 years ago,Great food and personnel!
382,Meatless district, 5 stars ,3 years ago,Great vegan burger
383,Meatless district, 4 stars ,a year ago,Nice place for vegetarians
384,Meatless district, 5 stars ,8 months ago,Amazing place!
385,Meatless district, 5 stars ,3 years ago,Nice place with super delicious food
386,Meatless district, 5 stars ,3 years ago,Great vegan spot!
387,Meatless district, 5 stars ,4 years ago,"Great food, recommended."
388,Meatless district, 5 stars ,4 years ago,Nice staff. Nice coffee.
389,Meatless district, 5 stars ,4 years ago,A vegan's dream come true.
390,Meatless district, 4 stars ,2 years ago,Good service and good food
391,Meatless district, 5 stars ,4 years ago,Very good food!
392,Meatless district, 5 stars ,4 years ago,Burger is hecking amazing
393,Meatless district, 5 stars ,2 years ago,Very nice restaurant
394,Meatless district, 5 stars ,3 years ago,Top notch and great atmosphere
395,Meatless district, 1 star ,2 years ago,"Bad service, bad food :("
396,Meatless district, 5 stars ,3 years ago,"We really enjoyed the food here, staff were lovely too"
397,Meatless district, 5 stars ,2 years ago,Very good food
398,Meatless district, 4 stars ,2 years ago,Everything is georgeous 👍🏼
399,Meatless district, 5 stars ,4 years ago,Great vegeterian food
400,Meatless district, 4 stars ,4 years ago,Nice vegetarian dishes.
401,Meatless district, 5 stars ,4 years ago,Divine vegan food!
402,Meatless district, 5 stars ,5 years ago,Have a burger with a clear conscience
403,Meatless district, 5 stars ,4 years ago,Delicious vegan food
404,Meatless district, 5 stars ,3 years ago,Nice place & Nice people :)
405,Meatless district, 5 stars ,2 years ago,Amazing stuff.
406,Meatless district, 4 stars ,3 years ago,Nice relaxed plac
407,Meatless district, 5 stars ,3 years ago,They got iKaffe!
408,Meatless district, 4 stars ,3 years ago,Delicious lunch!!
409,Meatless district, 4 stars ,a year ago,delicious burgers
410,Meatless district, 4 stars ,2 years ago,Great atmosphere
411,Meatless district, 4 stars ,4 years ago,Nice. Not amazing
412,Meatless district, 4 stars ,4 years ago,Fine
413,Meatless district, 5 stars ,a year ago,Delicious!!!
414,Meatless district, 5 stars ,3 years ago,Lovely place!
415,Meatless district, 5 stars ,3 years ago,FAT LION =) !!
416,Meatless district, 5 stars ,4 years ago,Favourite vegan
417,Meatless district, 4 stars ,2 years ago,Delicious food
418,Meatless district, 5 stars ,2 years ago,awesome. awesome awesome.
419,Meatless district, 5 stars ,4 years ago,Deliciousness 😍
420,Meatless district, 5 stars ,3 years ago,A must visit
421,Meatless district, 5 stars ,3 years ago,Good place
422,Meatless district, 4 stars ,3 years ago,Nice place
423,Meatless district, 5 stars ,2 years ago,Vegetables
424,Meatless district, 5 stars ,a week ago,"Very original and tasty food. It is a little bit more expensive than your average place to have casual dinner, but it is worth it. Loved the desserts!"
425,Meatless district, 5 stars ,6 days ago,Superb food and great customer service every time. Love this place.
426,Meatless district, 4 stars ,3 days ago,Amazing as always!!
427,Meatless district, 5 stars ,7 months ago,"(Translated by Google) The atmosphere was perfect, friendly service, nice music, quiet but cozy.
The food was also excellent, simple dishes with their own character. Great for …"
428,Meatless district, 5 stars ,a month ago,"(Translated by Google) Out of a spontaneous romantic inspiration we were able to enjoy our Valentine's dinner in Meatless District. The welcome was friendly and our coats were hung up, we felt like real VIPs. Romantic tunes brought us into …"
429,Meatless district, 5 stars ,4 months ago,"(Translated by Google) Really lovely flavors and texture. Sometimes even better than meat (hamburger). Peach cheesecake was top notch, tastiest so far. …"
430,Meatless district, 5 stars ,a year ago,"(Translated by Google) By far one of the best vegan restaurants in Amsterdam! It's not exactly cheap (rather in the middle price range), but the food you get is nicely presented and tastes great too. Even my non-vegan friend was thrilled. …"
431,Meatless district, 2 stars ,a year ago,"(Translated by Google) All in all, not very enthusiastic. What was nice is that we as vegetarian could eat everything from the menu. The food itself was unfortunately not special, there are vegetarian and vegan restaurants that are better. …"
432,Meatless district, 5 stars ,3 years ago,"(Translated by Google) A great place with delicious food, friendly staff and a pleasant atmosphere. Starter and main course were delicious. The cake was not that convincing. Overall, it was still a successful restaurant visit. …"
433,Meatless district, 5 stars ,2 years ago,"(Translated by Google) Super Vegan restaurant, a good choice and very well worked products! The chicken burger was very good and the sweet potato fries was a killer! I have never eaten sweet potatoes as crisp! And the raspberry cheesecake …"
434,Meatless district, 4 stars ,2 years ago,"(Translated by Google) Although I am a fan of vegan food (I am not a vegan), the food did not stand out here. We took as a starter the snack dish with delicious balls but oh so dirty fake chicken nuggets. They tasted boring and like soy. …"
435,Meatless district, 5 stars ,a month ago,"(Translated by Google) Special dishes and very tasty.

(Original) …"
436,Meatless district, 5 stars ,2 years ago,"(Translated by Google) Amazing vegan restaurant! The food on a high level is served in a good taste. When I get back to Amsterdam, I'll be back there again …"
437,Meatless district, 5 stars ,2 years ago,"(Translated by Google) The food is excellent, with a good variety of vegan dishes, great service and a cozy atmosphere. It is very worth knowing. …"
438,Meatless district, 5 stars ,2 years ago,"(Translated by Google) One of the best burger restaurants (which is veggie) that I could test !! Looking forward to return!
The quantities are precisely dosed according to me, the fries very good, and the …"
439,Meatless district, 5 stars ,2 years ago,"(Translated by Google) Staff very friendly and allowed us to wait at the bar and enjoy the cocktail. Very hipster place. A little more expensive than the other restaurant in the area, but it's definitely worth it. I loved. …"
440,Meatless district, 5 stars ,4 years ago,"(Translated by Google) Very friendly service, nice ambiance and dishes slightly different. Much vegan and made with attention. …"
441,Meatless district, 5 stars ,3 years ago,(Translated by Google) Very ingenious BLT sandwich & delicious Bretzl peanut butter brownie …
442,Meatless district, 4 stars ,2 years ago,"(Translated by Google) Nice atmosphere, nice staff. Great food only it was served cooled. Everything else good. …"
443,Meatless district, 4 stars ,5 months ago,(Translated by Google) Reminiscent of the vegan 416 in Tel Aviv. Good and more corrupt food …
444,Meatless district, 5 stars ,2 years ago,"(Translated by Google) Restaurant at the top, super good, very nice welcome!

(Original) …"
445,Meatless district, 3 stars ,2 years ago,"(Translated by Google) Eaten here yesterday, this was the third time. First time I had a delicious meal, second time it was disappointing and unfortunately again tonight. The chickpea fries with vadouvan and ailioli were a bit of a bite. …"
446,Meatless district, 3 stars ,2 years ago,"(Translated by Google) Tip: book! We arrived on the receipt and were given <2 hours to eat the 3 courses we wanted. In itself, were it not for an order from 23 citizens, so our main courses were delayed. Waitress forgot our wine, but that …"
447,Meatless district, 4 stars ,2 years ago,"(Translated by Google) Top restaurant with a beautiful classic look, spacious with lots of light. …"
448,Meatless district, 2 stars ,2 years ago,(Translated by Google) unfortunately no giede experience on the service after price quality verification were far to search. macaroni chees was a handful of over-cooked macaroni but the worst thing was that halfway through the avind a …
449,Meatless district, 5 stars ,5 months ago,"(Translated by Google) Delicious food and very pleasant service! Recommended!

(Original) …"
450,Meatless district, 5 stars ,3 years ago,"(Translated by Google) I have been to this restaurant several times and every time I am impressed. I am not a die hard vegan, usually persuaded by a vegan colleague, but, every time delicious. The gravad laugh, (no not from salmon), really …"
451,Meatless district, 3 stars ,3 years ago,"(Translated by Google) The food is very tasty and compared other vegan restaurants very culinary. The operation was unfortunately not good. First of all, we had to wait a long time before she came to show us the table. Then she was absent …"
452,Meatless district, 4 stars ,4 years ago,"(Translated by Google) Super tasty eaten. Delicious and creative dishes. We shared 3 starters and 3 main courses for three. We all raved about the food. However, all three of us suffered from greasy farmers for a few hours after dinner. …"
453,Meatless district, 5 stars ,2 years ago,"(Translated by Google) I went as a meat eater with my wife who likes to eat less meat and milk. The MD burger ordered and exceeded in terms of all expectations. Delicious food. And as icing on the apple sauce, the La Chouffe was also vegan …"
454,Meatless district, 2 stars ,3 years ago,(Translated by Google) Had dinner with the four of us. Humus and Terrine in advance and as main 3 times cheeseburger and once the chicken burger. We all had stomach and intestinal problems afterwards! One very nauseous the others slept …
455,Meatless district, 5 stars ,2 years ago,(Translated by Google) What a wonderful restaurant. You almost don't believe it's vegan. We went for lunch with the company within the framework of Meatless Fridays. A few are really meat eaters and were really skeptical. But what an …
456,Meatless district, 5 stars ,2 years ago,"(Translated by Google) As a butcher's son let me surprise. Very good food in good company. Kimchi burger was tasty, but a little dry. Taste was very good! Service was in English, later in Dutch. 🤔 Tables well clean, cutlery well clean. …"
457,Meatless district, 5 stars ,2 years ago,"(Translated by Google) Super friendly and sweet service! The food tasted real, honest and especially very tasty. I was there with 2 meat eaters and they would even like to go back there again! 100% recommended. …"
458,Meatless district, 4 stars ,8 months ago,(Translated by Google) Nice food and nice service. Only the place (Bilderdijkstraat) I didn't like. …
459,Meatless district, 5 stars ,3 years ago,(Translated by Google) We had not reserved for dinner and it was all booked / reserved and yet we were directly offered a table for a certain time (1 1/2 hours) which was quite enough :) …
