,Name,Review Rate,Review Time,Review Text
102,Dolphins Coffeeshop, 5 stars ,4 years ago,Different atmospheres and cool people. The hostess is awesome and she treated us kindly. Try to get here earlier in the day as crowds tend to make a mess of the place later in the afternoon and evening...
103,Dolphins Coffeeshop, 1 star ,3 years ago,"Coffeeshop to avoid. There is plenty of good ones but this one is awful. The price are high and the service is the most terrible I ever experienced. The ladies behind the counter are agressive, unhelpful, money oriented, contemptuous and …"
104,Dolphins Coffeeshop, 1 star ,2 years ago,Unfortunately i have to give this place a star. I dont want to give them one. I really liked the look of this cafe but unfortunately i only wanted a drink but was refused because i dont smoke. The staff we're externally rude. I felt i was being discredited. Discussing
105,Dolphins Coffeeshop, 5 stars ,3 years ago,"Pretty decent place. Decent priced weed, nice friendly staff. Downstairs tobacco smokers lounge. Great place. Omg the cutest cat (gfs opinion) great music for all."
106,Dolphins Coffeeshop, 5 stars ,a month ago,Best coffee in town :)
107,Dolphins Coffeeshop, 2 stars ,4 years ago,Went to Amsterdam for the third time and I really looked forward to visit my favorite coffeeshop again. We walked really far to get there but I knew it would be worth it. Unfortunatily we forgot that we had a little bag with some snacks and …
108,Dolphins Coffeeshop, 5 stars ,2 years ago,It's worth a visit. The place is wonderfully decorated. You feel like you visit a coral reef. The staff is nice too. It's one of my favourites places in Amsterdam.
109,Dolphins Coffeeshop, 4 stars ,5 years ago,"The decor is pretty awesome. The dolphin them stays true inside and out! They also had a great idea using rentable vaporizers, however, they weren't as efficient as they were technical. Overall no regrets!"
110,Dolphins Coffeeshop, 4 stars ,5 years ago,"This place was open when I first visited in 2003, I stayed close by at the hans brinker.
The space cakes here are awesome, the weed is good and the snacks and drinks are …"
111,Dolphins Coffeeshop, 1 star ,4 years ago,"Rude service. We were a group of friends visiting Amsterdam for the weekend who walked in the door and were looking for some space to sit, and before we could decide on anything we were chased out by the lady behind the counter for nothing …"
112,Dolphins Coffeeshop, 5 stars ,4 years ago,A good relaxing place. The Italian girl running the place does a great job! Also they have good quality stuff. A bit on the pricy side but we'll worth it. Enjoy ;-)
113,Dolphins Coffeeshop, 1 star ,4 years ago,Worst place I've ever been to in Amsterdam. I've been am Amsterdam regular for over 20 years and never have I been treated so badly. Pushed me in to buying their weed. Told me it was illegal to smoke any other weed in their shop. Then tried …
114,Dolphins Coffeeshop, 1 star ,5 years ago,"Very Poor selection and even worse service, Incompetent staff.

Girl asked for id, I provided her with my health card and also my Canadian …"
115,Dolphins Coffeeshop, 5 stars ,5 years ago,"Great with the new rules, the bud is strong but feels more medical than most of the other shops. Drinks were great, limited food range and the best vapes in Dam."
116,Dolphins Coffeeshop, 1 star ,6 years ago,"Went in here on a very hot summers day as a group of 4.
We never intended to stay long, we were just hopping from coffee shop to coffee shop. …"
117,Dolphins Coffeeshop, 5 stars ,2 years ago,"I love the interior.  Great asthetic.  Dolphin disiel made me THROW up. Thats never happened to me
Yea. …"
118,Dolphins Coffeeshop, 2 stars ,3 years ago,"I came here with my friends who live in Amsterdam. We usually enjoy the place and the ambient, so when I come to visit, we usually go back to the Dolphins. Last time, a few days ago, we went there to to stay just half an hour before the …"
119,Dolphins Coffeeshop, 5 stars ,4 years ago,Cool decor and a great choice of products
120,Dolphins Coffeeshop, 5 stars ,2 years ago,"Located in the city centre, is one of the most crazy coffeshop I've been so far. I really love how.it is decorated, the funny and awesome Staff and also the weed and kief."
121,Dolphins Coffeeshop, 5 stars ,3 years ago,"Great little shop, decor is unique. The compassionate staff were helping a woman who was sick when our group came in. They provide advice for novices to experts, thanks!"
122,Dolphins Coffeeshop, 2 stars ,7 years ago,Came here with friends who suggested it was a great place to come smoke- which it was once downstairs in comfy booths. However the woman working did not want to help in the slightest. Very rude and acted asif she hated her job. We had to …
123,Dolphins Coffeeshop, 1 star ,4 years ago,"Really disappointed... staff were a bit annoying, me and my girlfriend went in to get a drink but they tried to bully us into buying their weed. This is not compulsory by law and we were still going to be buying drinks, a few places were …"
124,Dolphins Coffeeshop, 1 star ,4 years ago,AVOID Avoid Avoid. Rude staff. Impolite to customers. Just want your money and for you not to hang around. Other shops near by are much nicer and friendlier. The shop decor is just a gimmick to draw you in.
125,Dolphins Coffeeshop, 5 stars ,3 years ago,Brilliant place second time being there. Really friendly staff. Nice smoking areas for tobacco and non. Would recommend
126,Dolphins Coffeeshop, 4 stars ,a year ago,Weed is bad hot choc was good.. service was top. And lounge down stairs very comfortable
127,Dolphins Coffeeshop, 1 star ,6 years ago,"Went to this coffeeshop twice in my week in Amsterdam - by far the worst one. The weed wasn't special and the atmosphere was awful, and two of the members of staff in particular were very unhelpful; one of them even hid my bottle of water …"
128,Dolphins Coffeeshop, 5 stars ,4 years ago,We were in Amsterdam for nearly 2 weeks. On our first day we discovered this diamond. Since then we smoked there everyday in the morning and the rest of the day we looked for other coffeeshops wich were nearly as good as this one but we …
129,Dolphins Coffeeshop, 1 star ,4 years ago,"Used to be a good coffeeshop but now the staff are more like red light drug dealers, pushy and insist every member of a group purchase an item on every single visit. Prices are high. Selection is poor. Avoid."
130,Dolphins Coffeeshop, 3 stars ,3 years ago,"Great quality products (I recommend the spacecake) and very chill place, but the prices have gotten quite high, and you are required to buy a drink and at least 1 marijuana product per person if you want to stay to smoke."
131,Dolphins Coffeeshop, 4 stars ,5 years ago,"First coffeeshop we went into. Great staff, not try hard attitude like most retail staff. Interesting decor, a bit small but still would go again and again."
132,Dolphins Coffeeshop, 5 stars ,2 years ago,We went here had fabulous time there my mate had a cake from there fantastic he can't wait for us to go back out just for them cakes 😁😁😁😁😁😁😁
133,Dolphins Coffeeshop, 5 stars ,2 years ago,"We had a great time here, small menu but good quality !
The staff was really nice to us, and the decoration is atypical !"
134,Dolphins Coffeeshop, 4 stars ,5 years ago,Nice and friendly staff and the ground floor has a nice aquatic ambiance. Downstairs has lots of good seating and good music. Good weed and free WiFi.
135,Dolphins Coffeeshop, 1 star ,3 years ago,"Shop is nice, shame about the staff, very very rude, very pushy with sales. Tried to charge me and my friend almost double for what we ordered. When questioned about the price immediately halfed it. Disgusting tourist trap. Avoid"
136,Dolphins Coffeeshop, 5 stars ,4 years ago,"Best muffins in Amsterdam. Fun atmosphere, great service, lots of nearby food and shopping to explore when you're done. My favorite coffeeshop I visited during my vacation."
137,Dolphins Coffeeshop, 4 stars ,4 years ago,"For me this one was one of the best.
The atmosphere there was nice it was like you were under the sea plus this one had so many cats i n there sleeping . …"
138,Dolphins Coffeeshop, 3 stars ,4 years ago,"Quirky place with an ocean theme. Very nice staff, plenty of seating with a downstairs area. Lots a different vaporizers to use. Just ask!"
139,Dolphins Coffeeshop, 1 star ,7 years ago,"NEVER EVER GO THIS CAFE AGAIN! THE WOMAN BAR STAFF HERE IS SO RUDE!!!!!!!!
I will never ever visit this place again!! There is a really rude woman working there at the bar who is really rude and obnoxious! She purposefully ignored us …"
140,Dolphins Coffeeshop, 5 stars ,3 years ago,"One of favourite coffeeshop. Nice variety on the menu. Friendly staff..  can get overcrowded but get what you need,and chill in a park. After all it's Amsterdam."
141,Dolphins Coffeeshop, 4 stars ,3 years ago,Great staff and really fun place!
142,Dolphins Coffeeshop, 1 star ,4 years ago,Horrible experience the responsible there was super cocky  (indonesian lookin woman) was very unfriendly the hash was so horrible i left it there. Weed wasnt anythin special. If u're trying coffeeshops dont try this one!
143,Dolphins Coffeeshop, 5 stars ,3 years ago,"Best quality of cannabis found in Amsterdam!! Their indica diesel is the bomb!! 10/10 would recommend a million times! An added bonus for cat lovers is their sweetheart of a kitty, called Sensimila (Mila for short)"
144,Dolphins Coffeeshop, 2 stars ,4 years ago,"Stuff in the store pushing you all the way to buy their stuff their drinks etc.
If you want to sit and smoke you need to buy something.
Many many more friendlier and better around. Not recommended"
145,Dolphins Coffeeshop, 5 stars ,3 years ago,"Great place to enjoy canabis, vaporizer upstairs, smoking down stairs. Nice music, great coffee, beautiful girls work here and are very helpful and friendly."
146,Dolphins Coffeeshop, 1 star ,3 years ago,"In the morning I was in the shop, bought something to smoke and drank a coffee. At afternoon just wanna drink a coffee, the girl which works there said to me that I had to buy weed again and I can stay and drink a coffee. …"
147,Dolphins Coffeeshop, 5 stars ,2 years ago,"+Nice and clean ambient
+Good Air Conditioner in the Tobacco Area
+friendly personal …"
148,Dolphins Coffeeshop, 1 star ,a year ago,"Ghetto and rude! Many better options in the area with lowe prices, higher quality and friendly staff"
149,Dolphins Coffeeshop, 5 stars ,2 years ago,"I like this spot. Discovered it first in 2010. Good vibes, nice people, good weed. Dig the downstairs chill zone. Cool shirts!"
150,Dolphins Coffeeshop, 1 star ,5 years ago,"We arrived and, at the first look, the local is a nice, well decorated place, but when we went to order the waitress didnt let us to order what we wanted because it didnt reach a minimun spend, and she was so unfriendly that we decided to leave. I wouldnt recommend this place."
151,Dolphins Coffeeshop, 3 stars ,2 years ago,"A good place to relax and smoke a good joint with good marijuana.
Pro: giant cupcake 😍
Con: low marijuana choise 😪 …"
152,Dolphins Coffeeshop, 1 star ,4 years ago,"Bought some weed, was going to roll up and smoke. Went to light up and was informed that everyone we were with HAD to buy a drink each and a gram each in order to smoke. Unwelcoming and unfriendly. Avoid."
153,Dolphins Coffeeshop, 1 star ,2 years ago,"Very unfriendly worker.
We wanted to take a picture but then came a worker and screamed at us. They could say it friendlier!"
154,Dolphins Coffeeshop, 5 stars ,4 years ago,"Loved this place, great decor upstairs, really nice to sit and chill. The staff are nice and the girls are great at keeping things in order and being super friendly and helpful"
155,Dolphins Coffeeshop, 4 stars ,4 years ago,Went here last year going back at the end of june a thought the place was really good staff was perfect and helpfull asked what there strongest was pointed me to this cross between sour diesel and something else stuff was wild easly one of …
156,Dolphins Coffeeshop, 1 star ,2 years ago,"The staff is so nasty sassy to everybody. Don't like this place , it's a shame it's a beautiful concept with the coral and dolphine theme. The staff ruin the atmosphere ...😕"
157,Dolphins Coffeeshop, 5 stars ,2 years ago,"Nice, chilling place with very kind personal . There are TVs on the wall which play funny pictures. Separate nontabac and tabac area. Lovely"
158,Dolphins Coffeeshop, 1 star ,3 years ago,"Have been to Amsterdam on 5 occasions and to all coffeeshops, have never purchased anything inside Dolphins as on the 2 occasions I tried to the staff were extremely rude, they seem to have some kind of complex. The other reviews here tell you that also..."
159,Dolphins Coffeeshop, 1 star ,5 years ago,"Feed them, ride them, swim with them, dolphins. We all love em.

You can imagine my excitement then when I'm confronted with the Dolphin …"
160,Dolphins Coffeeshop, 4 stars ,3 weeks ago,Nice place and stuff
161,Dolphins Coffeeshop, 5 stars ,3 years ago,The shop is awesome. One of the best places to relax. The staff is very friendly and the weed....: puh..... one of the best in Adam. Try the Dolphin Sativa :) …
162,Dolphins Coffeeshop, 3 stars ,2 years ago,"Nice little coffeeshop, friendly staff, well priced bud. Decent selection and quality of weed too"
163,Dolphins Coffeeshop, 1 star ,6 years ago,"Dreadful atmosphere, the staff constantly bother you with rules like not drinking your own water, not eating your own snacks, only one device will be allowed the internet password which is entered in your phone at the bar and few more. No ventilation in the basement area,don't go here."
164,Dolphins Coffeeshop, 5 stars ,7 years ago,"been here a few times not had a bad experience found the weed good, place is clean friendly atmosphere, going again in two weeks will call in and see if it's changed"
165,Dolphins Coffeeshop, 5 stars ,3 years ago,"Great place, super friendly and helpful staff. Best coffee shop we’ve been to so far. Highly recommended"
166,Dolphins Coffeeshop, 4 stars ,9 years ago,Nice place with perfect service and kind staff. The design of the coffee shop is great. The magic muffins are worth the price.
167,Dolphins Coffeeshop, 5 stars ,2 years ago,"A lot of fun in a really typical and nice location where you can find you peace surrounded by very professional service!
(Also she is WONDERFUL!)"
168,Dolphins Coffeeshop, 4 stars ,5 years ago,"Really quiet place with a smoking area underground-ish. There are just six seating areas though so if it's even a little crowded, it can be difficult to find a seat or privacy"
169,Dolphins Coffeeshop, 2 stars ,3 years ago,"There are better coffeeshops in town. Maniacal Service, you cannot relax, the waitress every 30 seconds came at the table. Too ansoius and pushing."
170,Dolphins Coffeeshop, 5 stars ,3 years ago,"Very good quality weed, super pleasant staff and free vaporizor use. The best coffee shop I've discovered so far."
171,Dolphins Coffeeshop, 2 stars ,3 years ago,"High prices, and stupid rule where you can't sit if you don't buy bud (ie not pre rolled).
Nice setting though, but too touristy"
172,Dolphins Coffeeshop, 4 stars ,4 years ago,"Helpful and friendly, don't be misled as the prices are listed for 1.2g. Vapourisers available but didn't use. Cool interior"
173,Dolphins Coffeeshop, 5 stars ,2 years ago,Loved it. Great staff too.
174,Dolphins Coffeeshop, 4 stars ,3 years ago,"Very interesting decor, staff are friendly. Not the biggest selection of strains but the ones that are available are good quality"
175,Dolphins Coffeeshop, 5 stars ,3 years ago,"We stayed in the hotel next door, so it was ideal lovley staff very friendly, felt looked after ☺ good smoke and hash and an underwater themed decor"
176,Dolphins Coffeeshop, 2 stars ,6 months ago,"Rude lady! Told us not to ""fall asleep"""
177,Dolphins Coffeeshop, 5 stars ,3 years ago,"The best coffee shop we ever had been in. Great vaporisers, great people, guide you throughout a great high and the whole vibe is very good"
178,Dolphins Coffeeshop, 5 stars ,8 years ago,"Best coffeeshop in amsterdam, friendly staff and relaxing music. Good Menu but not to expensive. Comfy space downstairs (even for bigger groups)"
179,Dolphins Coffeeshop, 5 stars ,2 years ago,"Great bud, nice staff, and calm. I came here twice and was happy with the prices and the quality."
180,Dolphins Coffeeshop, 3 stars ,3 years ago,Gone down hill very rude staff!! Need more people friendly staff in this place it used to be one of my favourite coffee shops in dam now not so sure sad to see
181,Dolphins Coffeeshop, 1 star ,6 years ago,"There is a clear nexus between hotels, restaurants and coffee shops. I saw ""Apollo"" spring up in each place I was recommended in a chain of destinations. …"
182,Dolphins Coffeeshop, 5 stars ,4 years ago,Very friendly and well priced place to visit.. staff knew about the products they sold and was a great chillout.. very cute cat too!
183,Dolphins Coffeeshop, 4 stars ,3 years ago,Good place. You can buy space cakes and grass here. Smoking place in down stairs in smoking area. Little bit expensive.
184,Dolphins Coffeeshop, 5 stars ,2 years ago,Staff are extremely friendly and helpful. Super relaxed and a really nice place to sit.
185,Dolphins Coffeeshop, 5 stars ,3 years ago,Excellent coffee shop frist time using a vape and the staff there were super friendly and helpfull really nice weed can tell its not packed with chemicals one of the best in amsterdam
186,Dolphins Coffeeshop, 5 stars ,2 years ago,"Rather good experience, fair enough prices and nice morrocon style seating area downstairs."
187,Dolphins Coffeeshop, 1 star ,2 years ago,Extremely rude staff!! The place itself looks so nice but the whole experience is ruined by how the staff are so impolite to customers.
188,Dolphins Coffeeshop, 2 stars ,3 years ago,Go in. Buy Tesla. Go out. One of the best strains in Amsterdam. One of the rudest employees in Amsterdam. Terrible atmosphere.
189,Dolphins Coffeeshop, 5 stars ,5 years ago,My favourite decorated coffeeshop in Amsterdam! Small menu and a few seats upstairs with volcanos. Buy a drink and go downstairs into the Atlantas themed cosy seating. A must visit spot.
190,Dolphins Coffeeshop, 3 stars ,5 years ago,July 2016. They have a couple of cute perky Australian girls working there- they were very nice but too warm an smoky downstairs we were glad to get out of there.
191,Dolphins Coffeeshop, 5 stars ,3 years ago,Funky coffee shop - exceptionally clean and staff are really friendly. We love the ocean friendly bags!
192,Dolphins Coffeeshop, 5 stars ,2 years ago,"Great place. Comfortable seats, friendly helpful staff, good weed."
193,Dolphins Coffeeshop, 4 stars ,5 years ago,"Staff were friendly and helpful, was very happy with the squidgy black. Alright interior and menu. Has tobacco licensed area."
194,Dolphins Coffeeshop, 1 star ,3 years ago,Rude lady giving this place a bad name for years. If you hate what you do then leave. Plenty of other coffeeshops and you won't be missed
195,Dolphins Coffeeshop, 3 stars ,2 years ago,"Years ago was one of the best in town. Now is turistic, not the best quality and expensive. But the basement is still a nice place..."
196,Dolphins Coffeeshop, 5 stars ,5 years ago,"Good atmosphere, friendly staff and no overbearing music. Nice and chilled out, just what you want after a hectic day"
197,Dolphins Coffeeshop, 1 star ,7 years ago,"Some crazy woman up in this mother, I was calm an chilled an next thing I got a drill sergeant in my ear, she ordered me an my homies all around this weird dolphin, then we sat down and thought we could relax an next thing I know I've got a …"
198,Dolphins Coffeeshop, 1 star ,3 years ago,"Did not like the people who worked there,bitchy atitiude and no service.
Ended up not buying there so i dont know how their hasj or weed is.
Their loss and someone elses win"
199,Dolphins Coffeeshop, 5 stars ,3 years ago,"Great experience.
Waitress are really nice. Keep it going!
We will come again definitely."
200,Dolphins Coffeeshop, 5 stars ,3 years ago,Always a really cool place with nice people and nice staff. If ever your hesitating just take a step inside and enjoy organic stuff.
201,Dolphins Coffeeshop, 5 stars ,2 years ago,Loved this coffeeshop so much... I wish I would have bought one of their amazing shirts... Highly recommend 💚💚
202,Dolphins Coffeeshop, 5 stars ,3 years ago,Great staff ..good weed ... cute cat. Nothing more to say. Been coming for years and will continue!
203,Dolphins Coffeeshop, 4 stars ,4 years ago,"staff are a bit blunt. but its the best ""stuff"" i found around dam in my 3 trips going here. its call isla power."
204,Dolphins Coffeeshop, 1 star ,3 years ago,AVOID!!!!! This place used to be great but now even if you only want to nip in for a quick coffee they try and force you to buy low grade rubbish weed you only have a choice of 4 types all rubbish and if you don’t buy they ask you to leave …
205,Dolphins Coffeeshop, 5 stars ,4 years ago,Nice and chilled easy going place been here an hour or so now don't really know! Dolphin diesel and dolphin haze top quality sure I'll be here for maybe another hour or so too who knows
206,Dolphins Coffeeshop, 2 stars ,5 years ago,"Staff was rude, and told my friends to buy a drink to stay, even though they had bought weed.  Worker also was yelling at others, who were just asking for help."
207,Dolphins Coffeeshop, 5 stars ,2 years ago,Perfect place to get baked everyone has a really chill vibe and the cannabis is 10/10 get your bits to this shop if your a real stoner
208,Dolphins Coffeeshop, 5 stars ,3 years ago,The upstairs part where you can't smoke cigarettes is great. Excellent service and friendly atmosphere and staff
209,Dolphins Coffeeshop, 5 stars ,4 years ago,"Really cool waitresses, they will definitely help you choose what kind of weed to buy. Amazing vibe"
210,Dolphins Coffeeshop, 3 stars ,6 years ago,My third time in amsterdam. at all my visits here  i stopped at the dolphins. this holiday i was twice. today after the checknout from the hotel the man in the place didn't allow us to get in with the luggage. next time in amsterdam i won't gonthere anymore. they lose a real customer
211,Dolphins Coffeeshop, 5 stars ,4 years ago,"Kind & helpfull staff, awesome stuff, decent price, great location. Overall amazing coffeshop, even for turists."
212,Dolphins Coffeeshop, 1 star ,2 years ago,Rude staff and the worst weed Amsterdam has to offer. Inside is outdated and moldy smelling.
213,Dolphins Coffeeshop, 5 stars ,2 years ago,Very chilled out to have real nice smoke and i love cat hes so cool recommended
214,Dolphins Coffeeshop, 5 stars ,2 years ago,"One of the best coffeeshops that I have ever seen, very lovely stuff"
215,Dolphins Coffeeshop, 1 star ,4 years ago,"Worst weed in Ams! Service was ok. But the weed man, was by far one of the worst ones i've ever had smoked! And i have smoked allot trough the years"
216,Dolphins Coffeeshop, 1 star ,4 years ago,"Was asked to leave as we playing cards, employee said they would rather get a sale then the customer leave than have them sit downstaies and chill for a bit."
217,Dolphins Coffeeshop, 3 stars ,4 years ago,Great spot but restrictions on what must be bought etc everyone in our party had to buy something in order to smoke downstairs.
218,Dolphins Coffeeshop, 5 stars ,3 years ago,"Absolutely amazing venue with lovely staff, thank you very much Olivia I really enjoyed our chat at the bar."
219,Dolphins Coffeeshop, 1 star ,2 years ago,"Rude service, have to spend over €30 in order to even be allowed a seat. Staff are horrid people, don't go, get your jelly fix elsewhere (not that there's anything in the dolphin)"
220,Dolphins Coffeeshop, 5 stars ,2 years ago,Very good stuff nice and upscale store front. Great location (as with all things Amsterdam!)
221,Dolphins Coffeeshop, 5 stars ,3 years ago,Great and quit place. The staff was so nice and friendly. The weed was  a m a i z i n g ! !
222,Dolphins Coffeeshop, 2 stars ,3 years ago,"Cool place, but worker was rude and told us we had to buy at least 3 grams for 5 people, and gave off judgmental vibes."
223,Dolphins Coffeeshop, 2 stars ,4 years ago,"The idea of having to purchase goods even if you want to sit down in here seemed a bit far fetched to me.
The decor inside is quite remarkable"
224,Dolphins Coffeeshop, 5 stars ,4 years ago,"Great overall experience, the staff gave me vrey good (and needed) advice, wonderful atmosphere inside, totally recommend!"
225,Dolphins Coffeeshop, 5 stars ,4 years ago,"A wonderful place. The decor is amazing, the downstairs very cozy and comfortable and the waiters very nice and friendly."
226,Dolphins Coffeeshop, 5 stars ,2 years ago,"Good vibes from this place ,great atmosphere and more over, the staff was super helping and cool,thanks!"
227,Dolphins Coffeeshop, 5 stars ,3 years ago,"Great people working there.  And the cat. Mimi,  I will miss you. Very good stuff serving there as well."
228,Dolphins Coffeeshop, 1 star ,2 years ago,out of all coffeshops I was the worst!! all items are super overpriced and the stuff is so super unfriendly! Please don’t go here !
229,Dolphins Coffeeshop, 1 star ,4 years ago,"Very rude staff!
If you want visit a place with good vibe and nice people avoid this place! …"
230,Dolphins Coffeeshop, 1 star ,2 years ago,"Impossible to seat there for just drink, staff is not friendly, we can pay just with cash and the smoke room is too small"
231,Dolphins Coffeeshop, 3 stars ,3 years ago,"Nice place and really friendly staff my only gripe, very limited with weed selection."
