,Name,Review Rate,Review Time,Review Text
111,Meatless district, 5 stars ,2 years ago,"Excellent experience last night ! We had the risotto and the barbacoa bowl and shared the focaccia with a nice bottle of organic wine. They have an open kitchen where you can see the chefs in action. The waitresses were very busy but kept the smile on. Keep some room for the cakes, it's worth it !"
112,Meatless district, 3 stars ,5 years ago,"First I think it's excellent that there is a vegan only restaurant, good work!
I really liked the atmosphere but the big problem they have was service. We sat at the bar whilst our table was being sorted and we were not offered a drink. …"
113,Meatless district, 5 stars ,3 years ago,"Great restaurant, it's spacious and beautiful inside, and serving delicious food! Their burger was good, but the sandwich and sweet potatoe fries were amazing. The staff was really cool and nice. It wasn't a problem to ask for it for take away, which was great!"
114,Meatless district, 5 stars ,4 years ago,"Great quiet place for a date or to bring family.
The food here was class and the food was relatively expensive - €14.50 for vegan seitan burger with fries- but delicious nonetheless. …"
115,Meatless district, 4 stars ,7 months ago,"The curry was amazing, highly recommend it
The cheesecake was good but not exceptional."
116,Meatless district, 3 stars ,5 years ago,"Love having another all vegan option in Amsterdam!  Found the food a bit hit or miss.  The chicken Caesar was great as was the pate (although a bit odd that the pate does not come with anything to spread it on).  The burgers, seemingly MD's …"
117,Meatless district, 5 stars ,3 years ago,"Came here at 9:45 on a Saturday, and thought they closed at 11. They do, but their kitchen closes at 10! They were happy to serve us late in the night and I'm so happy they did! I had the best vegetarian burger I've ever had! The fries were …"
118,Meatless district, 2 stars ,2 years ago,Falafel salad could be an Albert Heijn special. 100%. More dressing please
119,Meatless district, 5 stars ,2 years ago,"One or my favorite places to eat in Amsterdam. It's a nice sit-down restraunt with quality meals (that happen to be all Vegan) and inexpensive (<4 euro) draft beer. I wouldn't pop in for a quick bite or looking shabby, but if you're looking …"
120,Meatless district, 5 stars ,4 years ago,Vegetarian/Vegan restaurant. We need more of these! Nice interior with woods. Tasty food. We had the cheeseburger. Love the sweet potatoes fries. Big big complements for the dessert! Dessert at vegetarian/vegan restaurants have been a disappointment for me many times. But not here!
121,Meatless district, 5 stars ,4 years ago,"I've been nicely impressed by this restaurant. I've eten here for lunch and the menu was very interesting, with a wide choice of plant based specialities. we had the 'kip' and a burger with fries: the first one was very tasty and even …"
122,Meatless district, 5 stars ,5 years ago,"Exceptionally warm service, straight forward menu, amazing space. Durring my visit I got to try almost everything on the menu and could highly recommend the main with the puff pastry - it's hard to deliver in general but it's vegan and …"
123,Meatless district, 5 stars ,3 years ago,"Had dinner here about a week ago and absolutely loved it. The vibe is very nice and staff very kind and welcoming. I had the MD cheeseburger with sweet potato fries and it was delicious. Also their mayonaise, seriously the best vegan mayo i have tasted so far! Will definitely come back when i'm in Amsterdam again."
124,Meatless district, 4 stars ,3 years ago,"Large menu and the food is amazing!! Nice interior and actually was a great place to come and work. Service is friendly and the Chicken Cesar salad was big portion and delicious. Prices are a bit expensive, but it is a nice restaurant. Will definitely come back!"
125,Meatless district, 4 stars ,3 years ago,"Meatless district serves good food with nice service and a warm atmosphere. Although I do not think the quality and location really warrent the high price. For the price of a burger I would expect something extra or different, alas this was …"
126,Meatless district, 4 stars ,3 years ago,"I went here with my partner as she is vegan. I think of the many vegan restraunts we have been to, this is my favourite. Friendly service and excellent food prepaired well. …"
127,Meatless district, 3 stars ,5 years ago,"First was super happy that another vegetarian/vegan place opened in the city. It is on the pricey side and not convinced yet it's worth it. The ""vietnamese"" type of spring rolls were fried, oily and had no flavor at all. They would be so …"
128,Meatless district, 2 stars ,2 years ago,"I was very excited about this restaurant being completely vegan. However, after trying the Food I was very dissapointed. I had the bagel with no salmon, which was way too salty. All the dishes are also very pricy and not worth the money. One of the biggest dissapointments in Amsterdam."
129,Meatless district, 5 stars ,4 years ago,"This is amazing restaurant that will please Vegan, Vegetarian and ALL others. The food tastes fantastic is beautifully crafted and the service is great. I like to eat healthy but generally eat meat. Three of us shared 2 appetizers, 2 main …"
130,Meatless district, 5 stars ,a year ago,Meatless District is a wonderful and very delicious vegan restauraunt. It totally surprised us as non vegans. The menu was very diverse. The dessert was a higliht on this awesome evening. Strongly recemending it.
131,Meatless district, 3 stars ,3 years ago,"Maybe I should start with telling I'm not vegan and not really used to eat meat substitutes, but I often chose vegetarian dishes. Anyways, decided to try the MD burger at Meatless District. The burger was made of seitan (or 'wheat gluten') …"
132,Meatless district, 5 stars ,4 years ago,"Sooo good! We had an amazing jackfruit dish, tasty burger and delicious Jerusalem artichoke soup. To top it off, we finished with an amazing lime avocado cake. So far the best vegan place we've ever went to! Warm recommendation to everyone, even the hardcore meat lovers will be pleasantly surprised!;)"
133,Meatless district, 3 stars ,3 years ago,"Tried the burger, sunshine bowl and artichoke hummus. Burger was delicious but sunshine bowl was not great, noodles had a very strange slimey texture. Artichoke hummus was ok. Decor is nice. Service was friendly but a bit slow. Not a bad experience, but wouldn't go out of my way to return."
134,Meatless district, 5 stars ,3 years ago,"Best veggie burger in the history of my life,  great fries too. The crunch and flavor of the patty, char on the bun - too good, seriously brightened my day. Service was tops and very friendly."
135,Meatless district, 5 stars ,6 months ago,Absolutely amazing food and friendly staff :)
136,Meatless district, 4 stars ,2 years ago,Great service. Food was pretty good. We had the barbacoa salad which was delicious and the golden goddess wrap which lacked flavor. Sweet potato fries were excellent. It’s pretty pricey.
137,Meatless district, 3 stars ,3 years ago,"Food was good, very nicely presented, but portions are very small.
Service was under par - took a lot of time for the food to be ready, and staff seemed to be seriously under-manned. …"
138,Meatless district, 2 stars ,2 years ago,"Last year we had a lovely Saint valentine experience in the other location (de pijp) we decided to change this year, big mistake.
We had to wait 80 minutes for our main curse, when we complained about it they …"
139,Meatless district, 1 star ,2 years ago,"We came here just for a drink while waiting for a reservation at another restaurant. No one came to our table, so we went ourselves to order our drinks. After 15 minutes of watching the two waitresses talk to each other and not serve any …"
140,Meatless district, 2 stars ,4 years ago,"This place is trying to simulate non-vegan food with vegan alternatives so hard that they fail to include nice vegan dishes in the menu. They have vegan burgers, and vegan cheese, and vegan bacon, but none of those genuine fruit and …"
141,Meatless district, 5 stars ,2 years ago,"Cozy, friendly stuff, and the taste of the food is mind blowing"
142,Meatless district, 3 stars ,3 years ago,"Me and my friend went to the MD location on Van Woustraat and were seated close to the kitchen, which was nice. We had gingertea and both the seitan burger with sweet potatoe fries. The burgerpatty was big, juicy and great in taste, the fries crunchy and well seasoned. Service is fine and the staff friendly."
143,Meatless district, 4 stars ,4 years ago,"Great place if you are vegan, vegetarian, and/or gluten free. Highly recommend the AMC (cauliflower tempura). The Sunshine bowl (sweet potato noodle salad) and Caesar salad were also awesome. The veggie burger was ok. Service could be better."
144,Meatless district, 1 star ,3 years ago,"This was my second time at Meatless and being a vegan I reallly wanted to convince myself to ‘like’ their food, incidentally, the food is entirely over salted - and or seems to be the only spice they use.... Furthermore, the service is …"
145,Meatless district, 4 stars ,3 years ago,"Good service, great atmosphere and an absolutely delicious and flavorful vegan burger. We were so full we couldn't fit any dessert in but the options looked good."
146,Meatless district, 5 stars ,a year ago,"Nice restaurant, good food and the atmosphere is chill!"
147,Meatless district, 5 stars ,2 years ago,Inventive and delicious. Vegan food done right!
148,Meatless district, 4 stars ,4 years ago,"Was very excited about this place earlier on. Went back a few months ago and the menu had changed. Mostly just veggie burgers. Less interesting. Everything tastes great, the quality is good. Hope they change the menu again soon."
149,Meatless district, 3 stars ,3 years ago,"All vegan restaurant with a nice ambience. Friendly wait staff. The menu could do with a little diversity, but overall enjoyable. For the price, portions could be slightly larger."
150,Meatless district, 1 star ,3 years ago,Very nice atmosphere but way too pricy for what you get. The quality is good but we ordered the Risotto and the Sunshine Bowl and it was more like a Starter. And we are not heavy eaters.
151,Meatless district, 5 stars ,3 years ago,"Amazing vegan restaurant - would highly recommend the seitan burger!! Food was delicious, staff were lovely! It was more expensive than anywhere else we ate but we just used it as a 'treat' meal whilst on holiday."
152,Meatless district, 3 stars ,4 years ago,"Super friendly and enthusiastic staff. My burger wasn't bad, but I expected more from an all veg place. The mayonnaise that came with my chips was a bit fatty and bland. Atmosphere is alright, it felt quite crowded."
153,Meatless district, 2 stars ,3 years ago,"We had the Neottia as a starter and the Tagliatelle as a main. Both plates were disappointing. The ""chicken"" jackfruit (which can be delicious) was tough and oily. The Tagliatelle were also very oily. Both plates consisted of competing …"
154,Meatless district, 5 stars ,5 years ago,"Excellent vegan restaurant with fresh, tasty dishes, and super friendly staff. Try the Italian Pasta dish - spicey with a great homemade pesto and vegetables. Also the desert (chocolate cake) was delicious."
155,Meatless district, 5 stars ,3 years ago,"Very good vegan breakfast and brunch, some of the main dishes are a bit heavy. Great service, sweets need some improvement. All in all, maybe the best vegan place in Amsterdam"
156,Meatless district, 3 stars ,3 years ago,"Good food. Could be bigger portions though. Poorly educated service though. The waitress had to be called several times, didn't know a lot of things. Very blablabla. They didn't seem to care much for the well being of the customer"
157,Meatless district, 5 stars ,4 years ago,"My photography doesn't do it justice. Lovely meal - super tasty, great G&T, amazing service. Definitely recommend for plant-based and meat eaters alike!"
158,Meatless district, 5 stars ,4 years ago,"Absolutely amazing! My wife is vegan (I am certainly not) but I absolutely loved the burger here, and she loved her BLT. The eggplant bacon is awesome!"
159,Meatless district, 5 stars ,2 years ago,"I am not a vegan but I have to admit the food you'll find here is very good and tasty . Was very surprise especially by the bacon avocado, the staff is really nice and helpful. I recommend that restaurant if you want to try the vegan way of eating."
160,Meatless district, 5 stars ,2 years ago,"This place is fantastic. The food is super good, creative, and filling. The cocktails are really good too. The atmosphere is chic and nice!"
161,Meatless district, 5 stars ,2 years ago,"Fabulous snacks, we had the 'chicken nuggets' and chips. Unfortunately we arrived  at the wrong time for a proper meal but food was amazing. Service was good with friendly smile."
162,Meatless district, 5 stars ,2 years ago,"Amazing place. Cozy and super nice staff, I ate some Avocado dish (barmaid's suggestion) and it was delicious. Definitely will come back !"
163,Meatless district, 4 stars ,5 years ago,The portion of the main dish is a bit small. Burger is good taste and reasonable size. But the sweet potato fries are kind of soft and oiled..
164,Meatless district, 4 stars ,3 years ago,"Lovely vegan food in a city where vegetarians and vegans have little choice. Good drink selection (tasty beer) and fantastic cocktails. Nice relaxed vibe, check it out!"
165,Meatless district, 5 stars ,3 years ago,"Beautiful restaurant, great staff and even better food! Lots of variety, amazing flavours and looks beautiful on your plate. Highly recommend!"
166,Meatless district, 4 stars ,3 years ago,Nice restaurant with other dishes on the menu as normal. Very nice therefore. Try the beet root risotto. Very nice! Don't forget to make a reservation. Some days can be very busy
167,Meatless district, 5 stars ,7 months ago,"Great vegan food, cheese burger was the best"
168,Meatless district, 5 stars ,4 years ago,"A delightful new vegan restaurant in the centre of Amsterdam at Bilderdijkstraat 65 -67.  Owners, Cathalijne and Cil have paired with chef Wim Derksen to create a mouthwatering menu. The atmosphere has a great vibe, the service is fast and …"
169,Meatless district, 5 stars ,2 years ago,"Cool cosy atmosphere, really nice place. Service is good! And the food is amazing, all vegan and so delicious. Recommend it!"
170,Meatless district, 5 stars ,2 years ago,Super yummy vegan foods!
171,Meatless district, 4 stars ,3 years ago,The food here is absolutely superb- the only place in Amsterdam I ate twice. Everything tasted fresh and 'real'. But the service was a bit hit-and-miss... Mostly when trying to get the bill.
172,Meatless district, 5 stars ,5 months ago,Superb food. Superb staff. Highly recommended
173,Meatless district, 5 stars ,3 years ago,Didn't expect to find such a vegan gem in Amsterdam! Very creative menu and the items ordered were delicious! Service was a bit slow but I'll let it pass given the food!
174,Meatless district, 4 stars ,3 years ago,Been wanting to go for such a long time. Food was good and the Negroamaro on the wine list is delicious. Very nice service but I expected more daring food combinations on the menu
175,Meatless district, 5 stars ,2 years ago,Great Vegan food that tastes fantastic and isnt the normal burgers and sausages. Gets very busy so advise to book.
176,Meatless district, 5 stars ,3 years ago,"The vegan goulash is really excellent and worth the money, the mushroom benedict was more common and at a slightly less bargain price. …"
177,Meatless district, 2 stars ,2 years ago,"The food was very bad, tasteless, vegan but unhealthy. Who fries a soy burger? Very expensive, not worth it.
The staff was super friendly."
178,Meatless district, 5 stars ,3 years ago,"Really good food in a nice environment. Staff is nice and the place is not too far from the main attractions.
I would recommend the BLT, it's better than the ""real"" BLT with meat 😍❤️"
179,Meatless district, 3 stars ,2 years ago,Food is decent I would recommend the kimchi burger! The service isn’t great though maybe everyone’s just high but it’s very slow and no real assertiveness by the staff. No passion on the service floor in my honest humble opinion.
180,Meatless district, 1 star ,3 years ago,We walked into eat on Monday. Despite the restaurant being mostly empty the staff said they could not accommodate us and we needed to make a reservation ahead of time. We were not able to make a reservation even the next day at the bar. We …
181,Meatless district, 5 stars ,a year ago,"Had take away from this restaurant- amazing food, good packing and unexpected free cheesecake made our day 🥰"
182,Meatless district, 5 stars ,a year ago,I was surprised about the sweet potato friess and a tastfull vegan burguer! Really kind staff! I will come back for shure
183,Meatless district, 5 stars ,3 years ago,Delicious vegan food. The restaurant is really cosy and service was friendly and welcoming. Definitely a recommendation whether you are vegan or not.
184,Meatless district, 5 stars ,2 years ago,Amazing! Great delicious meatless vegan food and the atmosphere was also enjoyable! Good service! Highly recommended!
185,Meatless district, 5 stars ,5 years ago,"Great service, delicious food, fair prices!"
186,Meatless district, 5 stars ,4 years ago,"Lovely staff, great food. The restaurant was fully booked, and yet, managed to arrange a table for me and my friend. Can't wait to return!"
187,Meatless district, 5 stars ,4 years ago,"I really liked it, good service kind and polite people, im not vegan but soort of vegetarian but i.like the idea of meat less dishes specially hamburgers and steaks quite delicious and good looking with killing animals, 👍👍👍👍👍"
188,Meatless district, 5 stars ,3 years ago,Delicious pure vegan food. Staff was attentive and helpful. The environment is modern and comfortable. We love it
189,Meatless district, 4 stars ,3 years ago,"Great wines! Tentative staff! Don’t get the burger, it’s quite boring compared with the rest of the menu."
190,Meatless district, 5 stars ,4 years ago,Finally I had the time to check it out - and it was worth the ride (desde españa)!
191,Meatless district, 5 stars ,2 years ago,I’m so stunned by how amazing this food was! A really special place with such friendly staff! 10/10 would recommend <3
192,Meatless district, 4 stars ,3 years ago,"Great food. Larger menu would've been nice. Also, keen to eat raw flavours not meat impersonations."
193,Meatless district, 4 stars ,3 years ago,"The burger is amazing, came back again for the nachos. So good! Only wish the service was better, felt like ordering was an inconvienence."
194,Meatless district, 3 stars ,2 years ago,I had the Caesar salad wich i enjoyed. It was quite simple though. The staff was nice as well as the ambiance.
195,Meatless district, 5 stars ,2 years ago,amazing vegan food!!! love it. (also the waitresses were very friendly)
196,Meatless district, 5 stars ,2 years ago,"Delicious vegan food, cosy environment, definetly recommended. It is better to make a reservation, even in week days it is full."
197,Meatless district, 5 stars ,4 years ago,Fine dining for vegetarians and vegans
198,Meatless district, 5 stars ,a month ago,Great vegan food
199,Meatless district, 5 stars ,3 years ago,A very good vegan restaurant with nice food and good prices. I got a hamburger and sweet potato fries. Very big portion for a good price
200,Meatless district, 5 stars ,3 years ago,"I had the most amazing fake cheddar ever. It's big, tasty and the server is hot af. Yeah you, you vegetarian hunk💖"
201,Meatless district, 5 stars ,2 years ago,Excellent food. Everything made fresh. The chef is very good and so sympathetic.
202,Meatless district, 1 star ,3 years ago,"Was there for food yesterday afternoon..
All the food we had were awful..
The flavours were too strong and impossible to eat..with the raw taste of …"
203,Meatless district, 3 stars ,2 years ago,"Easy to choose from menu that rotates regularly. Service is fast and friendly, good food but not super impressive."
204,Meatless district, 5 stars ,3 years ago,This is a really delicious place with great art incorporated into each meal. Can't recommend enough and I'm not even vegan
205,Meatless district, 5 stars ,2 years ago,Perfect food! Always coming back
206,Meatless district, 5 stars ,4 years ago,I'm a meat eater so was a little sceptical about trying this place. However it was by far the best meal I had in Amsterdam. Genuinely delicious.
207,Meatless district, 4 stars ,3 years ago,"Great atmosphere and nice vegan junk food. Dont know if better than Vegan Junk Food Bar, but the burger was great."
208,Meatless district, 5 stars ,4 years ago,"The food is gorgeous, different and full of flavor. The desserts were incredible and the place looks very cool"
209,Meatless district, 5 stars ,3 years ago,"Lovely restaurant, very friendly staff, the food is fantastic, only wish we had this restaurant near home in England, because we would be regular visitors."
210,Meatless district, 5 stars ,2 years ago,For someone who never ate anything vegan - food was tasty. Staff very friendly and respectful.
211,Meatless district, 4 stars ,4 years ago,"Food here was phenomenal (I eat meat) the tagliatelli was outstanding. Dropped a star as I found a member of staff to be rather rude, however the good more than made up for it"
212,Meatless district, 2 stars ,2 years ago,"Poor and naive menu . . . Low food quality . . . Really a disappointment regarding vegan / vegetarian cuisine . The only good option is the burger , which you can get in other places for a much better price ."
213,Meatless district, 3 stars ,4 years ago,"If you're vegan by choice this might be a great option.

For a non vegan, the slow service and relatively bland food does not justify the price."
214,Meatless district, 5 stars ,4 years ago,"I went with a couple of vegan friends, I however do currently eat meat occasionally. The food was fantastic, didn't miss the meat in the slightest."
215,Meatless district, 5 stars ,3 years ago,"Very nice service ! The food is amazing ! We had the burger and the risotto and it was just delicious
Plus the restorant is beautiful!
A must go in Amsterdam!"
216,Meatless district, 5 stars ,3 years ago,Amazing good food! A was in company of non vegans and they were pleasantly surprised
217,Meatless district, 5 stars ,3 years ago,"Great food, super nice ambiance and a very nice drink menu. In addition to that great service. I would recommend this place to anyone"
218,Meatless district, 5 stars ,3 years ago,The food was as charming as delicious. Very friendly staff. Cozy atmosphere. Best restaurant experience in Amsterdam.
219,Meatless district, 5 stars ,4 years ago,"Great space , beautiful food and cakes!"
220,Meatless district, 5 stars ,2 years ago,lots of vegan dishes... even some with cheese-taste... they have a warm corner with a socket for a phone charger.
221,Meatless district, 5 stars ,2 years ago,Good stop for the vegan foodies. You can order a variety of vegan delights from burgers to salads to delicious deserts.
222,Meatless district, 3 stars ,4 years ago,"nice atmosphere, friendly service, good presentation, but the food was just okay. it was tasty, but not extraordinary."
223,Meatless district, 4 stars ,3 years ago,Stopped in for lunch and had a Caesar salad which was surprisingly good. The service staff was also very friendly and accommodating.
224,Meatless district, 5 stars ,3 years ago,An excellent restaurant for eating vegan with those that might not get excited by the idea as well as those that love their food but want to eat animal free.
225,Meatless district, 5 stars ,2 years ago,"Nice meatless food. If you want to get some good Vegan or Vegetarian food, go here :)"
226,Meatless district, 1 star ,2 years ago,Everything that could go wrong with vegan food can be found there... The staff is friendly but the food is bad. Dommage!
227,Meatless district, 5 stars ,2 years ago,"Fantastic service, superb beer and L’Exceptionnel was possibly the best steak I’ve ever had. Will 100% return."
228,Meatless district, 5 stars ,4 years ago,Excellent vegan restaurant! A bit $$$ but worth it. Cosy interior. Friendly staff.
229,Meatless district, 5 stars ,3 years ago,Never had anything here I didn't like. Excellent vegan food and great selection of drinks
230,Meatless district, 4 stars ,3 years ago,"Vegan place, nice food and drinks. Burger is very nice, smokey saitan burger. Not cheap, but not very expensive either."
231,Meatless district, 5 stars ,7 months ago,It was good! Nice waiter!
232,Meatless district, 5 stars ,4 years ago,Great food. All vegetarian or vegan. Very nice people and a great atmosphere
233,Meatless district, 4 stars ,2 years ago,"Super friendly staff, very delicious food...a vegan food restaurant...  Highly recommended"
234,Meatless district, 1 star ,3 years ago,"All I smelled was arrogance. The food might be good, but make sure that you hire the right people too.."
235,Meatless district, 5 stars ,3 years ago,"Food and drinks were very tasty and the service was very welcoming.
Will definitely go back next time I'm in Amsterdam."
236,Meatless district, 5 stars ,2 years ago,Good food good price
237,Meatless district, 3 stars ,3 years ago,Nice and cozy place to eat. I was there few times. Inattentive service especially at busy hours.
238,Meatless district, 5 stars ,a year ago,Everything is so tasty!(I'm not a vegan btw)
239,Meatless district, 3 stars ,3 years ago,"Unattentive and uninterested staff, long waits and mediocre and expensive food... was pretty disappointed all round. Didn’t live up to the reputation!"
