,Name,Review Rate,Review Time,Review Text
336,De blauwe Hollander, 5 stars ,5 months ago,"(Translated by Google) We really enjoyed our last evening here.
A nice selection of typical Dutch drinks and food. The staff is very friendly and helpful, but not intrusive (waiter likes to learn something new from every …"
337,De blauwe Hollander, 5 stars ,7 months ago,"(Translated by Google) We are a Spanish couple who were looking for typical Dutch food. 100% recommendable.
For the first course, a puree base with a meatball on top. Appetizer some strips …"
338,De blauwe Hollander, 5 stars ,4 months ago,"(Translated by Google) An incredible experience! Top value for money, typical and very good and plentiful dishes, and attentive staff. This is exactly the kind of place you want to discover when visiting a new city! I highly recommend, go …"
339,De blauwe Hollander, 4 stars ,4 months ago,"(Translated by Google) A bit of a wait on arrival despite the reservation, as well as for the dishes, but the servers made up for this by offering us a very good local digestif! The dishes were very good and plentiful (slaviken, beef …"
340,De blauwe Hollander, 5 stars ,3 months ago,"(Translated by Google) If you want to try Dutch food, you have few options since the gastronomy in Amsterdam is made up of that of other countries. This is one of the few places where you can try typical dishes. Good value for money and …"
341,De blauwe Hollander, 5 stars ,5 months ago,(Translated by Google) To taste authentic Dutch food. Herring with onions and then stamppot. Like mashed potatoes with sausage or meat in sauce on top. The price is very good and the attention of the very friendly staff. In a typical street …
342,De blauwe Hollander, 5 stars ,3 months ago,"(Translated by Google) Welcoming location, surprisingly warm, pleasant, family atmosphere, the traditional menu is generous and acceptable in price, Overall satisfied and I even came back after two days for the food well prepared and …"
343,De blauwe Hollander, 5 stars ,8 months ago,(Translated by Google) A typical Dutch food place with generous portions and great value for money. The service was very friendly and attentive. It is a place that I will recommend to anyone who asks me about Dutch food in Amsterdam. …
344,De blauwe Hollander, 5 stars ,6 months ago,"(Translated by Google) Very good location near the Rijksmuseum, in a lively street with many other restaurants. Nice selection of typical dishes and a very friendly and attentive service …"
345,De blauwe Hollander, 5 stars ,6 months ago,"(Translated by Google) Typical and good food. The place is nice and the waiters were attentive and friendly. We ordered stampot, a typical dish of mashed potatoes with different ingredients and meat (meatballs, veal or sausages) with a very …"
346,De blauwe Hollander, 5 stars ,5 months ago,(Translated by Google) Typical Dutch food in hearty plates with unbeatable attention. …
347,De blauwe Hollander, 5 stars ,4 months ago,"(Translated by Google) Good quantity, good quality and good price.
It is not another pizzeria 🤣🤣 traditional food in a nice area. Very good option to eat. …"
348,De blauwe Hollander, 5 stars ,6 months ago,"(Translated by Google) What a great restaurant, very friendly service and the food is a real party! Top spot in Amsterdam! …"
349,De blauwe Hollander, 5 stars ,3 months ago,"(Translated by Google) Yummy lunch, really nice waiters!
Recommended if you want to eat something typical Dutch …"
350,De blauwe Hollander, 5 stars ,6 months ago,(Translated by Google) Nice restaurant with the traditional Dutch pot. The staff is very nice and personable. The apple pie and meatball were top notch. …
351,De blauwe Hollander, 5 stars ,7 months ago,(Translated by Google) Very tasty the spare ribs were fantastic delicious really well done the garnish platter too and I don't even start with the peanut sauce for the chicken sate …
352,De blauwe Hollander, 5 stars ,a month ago,"(Translated by Google) We went for dinner and it was a great experience. The food was great (we tried the stampot and a mix of hot starters) and typical of there. They were also very nice, both the girl at the entrance, as well as the …"
353,De blauwe Hollander, 4 stars ,4 months ago,(Translated by Google) Small restaurant and the tables match each other. Good food …
354,De blauwe Hollander, 5 stars ,8 months ago,"(Translated by Google) The food was very good. The soup and the typical Dutch dish, whose name I can't remember, were tasty and, with the menu, you will surely not leave hungry and you will stay at ease. …"
355,De blauwe Hollander, 4 stars ,a month ago,"(Translated by Google) [French bellow]
Good restaurant offering some menu with Dutch specialties. Prices are ok (28€ for a starter/main/dessert menu), and waiters are communicative. …"
356,De blauwe Hollander, 4 stars ,4 months ago,"(Translated by Google) We were lucky with our spontaneous visit. It was already very full and with luck we got two tables.
The staff was very friendly and attentive. …"
357,De blauwe Hollander, 5 stars ,5 months ago,"(Translated by Google) Excellent Dutch cuisine restaurant, it can be reached with a nice walk along the canals (30 minutes walk from the station) located in a beautiful area full of places to dine and outdoor life. Very kind staff, clean …"
358,De blauwe Hollander, 5 stars ,3 weeks ago,(Translated by Google) Typical Dutch dishes. Very good. We had a great time and the service was great! I recommend …
359,De blauwe Hollander, 5 stars ,8 months ago,"(Translated by Google) First class service, no question was too much and you feel absolutely welcome, thank you very much!
The food is also absolutely recommendable, we had a bitterballen mix and the …"
360,De blauwe Hollander, 5 stars ,2 weeks ago,"(Translated by Google) Typical atmosphere and food, excellent quality and courtesy. Absolutely to try if you want to fully savor the local cooking …"
361,De blauwe Hollander, 3 stars ,3 weeks ago,"(Translated by Google) It is typical Dutch food, the people are very friendly and have a good sense of humor. As for the food, it's fine; You have to keep in mind that the Netherlands are not known for their gastronomy... but it is worth …"
362,De blauwe Hollander, 5 stars ,4 months ago,"(Translated by Google) Delicious food, very friendly welcome and service

(Original) …"
363,De blauwe Hollander, 5 stars ,3 years ago,"(Translated by Google) Finally a Dutch restaurant As it should be. I found it by chance by reading a few reviews here and there and I must say that I was lucky. Typical Dutch dishes very abundant and cooked with care, I ate a huge and …"
364,De blauwe Hollander, 5 stars ,4 months ago,"(Translated by Google) When we go on a trip we always like to eat a typical dish, if that is your case in De Blauwe Hollander you can taste a delicious Stampott. The place is very small but cozy and the attention of the exceptional staff. …"
365,De blauwe Hollander, 4 stars ,6 months ago,"(Translated by Google) Good place to have typical Dutch food.
Very clean bathroom.
Good prices and good location. …"
366,De blauwe Hollander, 5 stars ,4 years ago,(Translated by Google) Typical Dutch restaurant. Generous portions and quality of ingredients sets this place apart. Average city prices. We tasted soup and a complete dish with sauerkraut potatoes and meat all covered with a very tasty …
367,De blauwe Hollander, 5 stars ,a month ago,"(Translated by Google) Delicious food
Great service, nice, friendly and sociable
Homely atmosphere …"
368,De blauwe Hollander, 5 stars ,6 months ago,"(Translated by Google) We had lunch, Sergio, a Dutch guy who speaks Italian well, served us, he was wonderful, he pampered us all the time. We ate typical dishes of excellent quality. Good value, quality / price. Highly recommended! …"
369,De blauwe Hollander, 5 stars ,6 months ago,"(Translated by Google) Friendly staff. The place was packed, but the staff makes sure that everyone is already served and also checks every now and then if we still had drinks. We also don't know what we deserved, but we got a liqueur on …"
370,De blauwe Hollander, 5 stars ,2 years ago,"(Translated by Google) Really delicious food .. typical Dutch dishes with very generous portions
.Located clean and pretty. We stayed three consecutive nights I tried almost all …"
371,De blauwe Hollander, 5 stars ,2 weeks ago,"(Translated by Google) 100% recommended, typical Dutch food, very attentive and friendly, reasonable prices, the one we liked the most in Amsterdam, they also speak some Spanish, a success. …"
372,De blauwe Hollander, 5 stars ,4 months ago,"(Translated by Google) Excellent food, courtesy of the staff and excellent quality price …"
373,De blauwe Hollander, 4 stars ,3 years ago,"(Translated by Google) In the middle of one of the most active areas of the city, we find this restaurant to try some of the local gastronomy. The food was very good and the service pleasant. The site is small and if you are a group, better …"
374,De blauwe Hollander, 2 stars ,2 years ago,"(Translated by Google) Appetizers were alright. Main course was not very intoxicating. An employee with access to the kitchen (no waiter) has washed himself at the toilet after big business, not hands. Is visited gug. Without reservation, …"
375,De blauwe Hollander, 5 stars ,2 years ago,"(Translated by Google) Perfect restaurant to enjoy a typical Dutch menu. Good quality, good service and at a price commensurate with the product offered. The beef stampot was super rich! A mashed potato with a special flavor and the meat of …"
376,De blauwe Hollander, 5 stars ,3 years ago,"(Translated by Google) Typical Dutch restaurant. You can find meat, fish and vegetarian dishes. Staff very welcoming and sometimes even very funny. Prices are fair for the quantity and quality of food. Highly recommended. …"
377,De blauwe Hollander, 5 stars ,4 months ago,(Translated by Google) Everything tastes amazing! Just like my grandma used to make it! The atmosphere was cozy and very welcoming and the crew - simply the nicest and most competent people I've ever met in a restaurant in the Netherlands! …
378,De blauwe Hollander, 4 stars ,2 years ago,"(Translated by Google) I was in this place for two nights and I ate very well. Typical restaurant with traditional Dutch dishes. Friendly staff, excellent desserts. …"
379,De blauwe Hollander, 5 stars ,2 years ago,"(Translated by Google) Restaurant with 3 B’s: Good, Nice and Cheap. Super recommended this restaurant with typical Dutch food. The mustard dijon very rich, the meat sauce very rich and the meatballs. All very rich. If you are looking for a …"
380,De blauwe Hollander, 3 stars ,3 years ago,(Translated by Google) Right compromise between price and local cuisine. Book xke always full. Large portions. It is eaten with € 25 per person (2 portions + drink). Reservation possible with The Fork but be careful that the discount is …
381,De blauwe Hollander, 4 stars ,2 years ago,"(Translated by Google) Great food, informal atmosphere, the staff speaks several languages. Good collection of craft beers, ideal for tourists who want to try traditional Dutch cuisine in the heart of Amsterdam. Selecting tracks for …"
382,De blauwe Hollander, 5 stars ,3 weeks ago,"(Translated by Google) Very nice restaurant with really traditional Dutch food !!
It is worth visiting to make a delicious trip on the trails of the Netherlands …"
383,De blauwe Hollander, 5 stars ,a year ago,"(Translated by Google) Dutch pot! Meatball very tasty and the homemade cheese croquettes very tasty. Also their homemade cheesecake, different from normal, but super tasty. And above all very friendly staff. Definitely recommended to eat …"
384,De blauwe Hollander, 5 stars ,2 years ago,"(Translated by Google) A place with good food, friendly service and huge amounts. Although the prices may seem expensive notice that the quantities are large, in my case we ordered an entree, a main course and a dessert to share between two …"
385,De blauwe Hollander, 5 stars ,3 months ago,(Translated by Google) Tasty typical Dutch food. Very good attention and service in a warm and welcoming environment. .Highly recommended. …
386,De blauwe Hollander, 4 stars ,2 years ago,(Translated by Google) Small restaurant nice even if the facade does not look mine. Everything is good from the country's cheese soup to the bitterballen. Courteous and impeccable service. Maybe barely expensive but it's still ok. …
387,De blauwe Hollander, 3 stars ,6 months ago,"(Translated by Google) Food was delicious but not outstanding. Plus a lot of Dutch specialties (Stampot, Bitterballen) also in vegetarian form.
However, the portions are very small and therefore quite expensive. (15 € for a …"
388,De blauwe Hollander, 4 stars ,5 months ago,"(Translated by Google) The restaurant is in a neighborhood with dozens of restaurants. The decor is rather rustic.
The service was very nice and helpful. …"
389,De blauwe Hollander, 5 stars ,3 years ago,"(Translated by Google) From 10!!! The best we tried for amsterdam, the food service desserts, I definitely recommend 100% to all who visit that area, we also attended a Spanish girl Super friendly and everything she recommended was to suck …"
390,De blauwe Hollander, 2 stars ,2 years ago,"(Translated by Google) A very big disappointment, I came recommended by the tour guide and to my surprise, I ordered a meat dish which was hard, difficult to digest. The potatoes had frozen and raw taste inside. It is my first restaurant in …"
391,De blauwe Hollander, 5 stars ,6 months ago,(Translated by Google) Good restaurant with local cuisine. Large portions and a nice interior. …
392,De blauwe Hollander, 4 stars ,2 years ago,(Translated by Google) Typical Dutch cuisine at reasonable prices. All the flavor of Holland in abundant dishes. Friendly and fast staff. Perfect for those who love tradition and genuine food. …
393,De blauwe Hollander, 5 stars ,2 years ago,"(Translated by Google) A place to eat great food, genuine and tasty. We took
stamppot endive with bacon bits and a meatball ""and stamppot Hutspot carrot and onion with tender beef, both very good. We found the flesh of the second …"
394,De blauwe Hollander, 4 stars ,2 years ago,"(Translated by Google) Good restaurant to discover Dutch cuisine such as stamppot, fresh herring with onions or poffertjes for dessert. The restaurant was crowded but the service was efficient and friendly. Good value for money in this …"
395,De blauwe Hollander, 5 stars ,2 weeks ago,"(Translated by Google) We were looking for local cuisine and found it. Herring, pea soup and beef on a bed of mashed potatoes with vegetables. …"
396,De blauwe Hollander, 5 stars ,2 years ago,"(Translated by Google) Restaurant found ""by chance"" with the fork, but a pleasant and excellent surprise. Nice local, service but above all delicious cuisine! We will gladly return to the next trip to Amsterdam! …"
397,De blauwe Hollander, 4 stars ,3 weeks ago,"(Translated by Google) Good restaurant with typical food, very friendly staff

(Original) …"
398,De blauwe Hollander, 4 stars ,4 months ago,"(Translated by Google) A pleasant surprise, nice all those Dutch dishes and well prepared. I sat at the window there was plenty to see outside and inside too by the way. Recommended …"
399,De blauwe Hollander, 5 stars ,6 months ago,"(Translated by Google) If you are looking for homemade Dutch food at a good price and in a great location, De Blauwe Hollander is an excellent proposition. Highly recommended both the salmon with fresh asparagus and the Stamppot with veal. …"
400,De blauwe Hollander, 5 stars ,4 years ago,"(Translated by Google) Absolutely to try.
Restaurant where you can taste typical Dutch dishes. Informal, family atmosphere we had a great time. Try the stamppot (traditional Dutch dish based on mashed …"
401,De blauwe Hollander, 4 stars ,2 years ago,"(Translated by Google) Somewhat expensive, but good Dutch food.
The mussels coming out of the pot were quite effective with white wine. It seems that you have french fries & mayo here instead of buckets. …"
402,De blauwe Hollander, 5 stars ,3 years ago,"(Translated by Google) For our first experience in Amsterdam we were looking for something ""Dutch"". Well, you can't miss this restaurant then! Really short waiting times, considering the complexity of the dishes, very polite staff, truly …"
403,De blauwe Hollander, 5 stars ,2 years ago,"(Translated by Google) If you are looking for a typical Dutch local with friendly service and fair price, you should definitely try it. Large portions.
Generally very crowded, we were on time in the early afternoon and we could also …"
404,De blauwe Hollander, 5 stars ,5 months ago,"(Translated by Google) Delicious food, very friendly and pleasant staff.
Definitely a recommended place to eat.
Until next time ️ …"
405,De blauwe Hollander, 5 stars ,4 months ago,"(Translated by Google) Very well, a very nice waitress from Romania attended us, we ate a typical pea soup with very rich bacon and some battered balls I think they are called Bitteballen (I do not know if it is well written) all good, it …"
406,De blauwe Hollander, 5 stars ,3 years ago,"(Translated by Google) If you visit Amsterdam with time and want to enjoy its gastronomy in a good restaurant, do not hesitate, book, it always gets full. Everything was very good and the perfect treatment …"
407,De blauwe Hollander, 4 stars ,2 years ago,"(Translated by Google) Restaurant with Dutch food at a good price in the center. The area is full of Italian restaurants, Chinese, tourist etc so this is a good option. Two dishes and two beers came out at 40 euros. …"
408,De blauwe Hollander, 5 stars ,2 years ago,"(Translated by Google) I didn't know how to eat Dutch food for the first time but it was very good to my standards 😊
I ’ve never had eaten Dutch food so I do n’t know well but it was very great for …"
409,De blauwe Hollander, 4 stars ,2 years ago,"(Translated by Google) Near the Leidseplein square is this restaurant that we saw on the internet as a highlight in Amsterdam and it was recommended by our tour guide to eat the typical Stamppot. Delightful The restaurant is fine, quiet, …"
410,De blauwe Hollander, 3 stars ,3 years ago,"(Translated by Google) If you want to try Dutch food, this is the place for you. The service is not very linguistically international. Food is served quickly and is ok, but a bit low in salt at normal prices for Amsterdam. …"
411,De blauwe Hollander, 4 stars ,2 weeks ago,"(Translated by Google) Average prices and food, friendly people.
Recommended!! …"
412,De blauwe Hollander, 5 stars ,6 months ago,"(Translated by Google) An incredible attention the waiter was at all times attending us with great kindness.
The food is very good and exquisite homemade products xquisitanto first courses. …"
413,De blauwe Hollander, 4 stars ,2 years ago,"(Translated by Google) Note the Dutch cuisine and given the excellent value for money, De Blauwe Hollander is an above-average restaurant that makes its service and hospitality the main weapons that it produces with every customer. …"
414,De blauwe Hollander, 3 stars ,4 years ago,"(Translated by Google) Among the many restaurants frequented in the week of stay in Amsterdam, de blauwe hollander has left me quite indifferent. Decent courses, but with nothing that stands out in particular. Good soup. …"
415,De blauwe Hollander, 5 stars ,7 months ago,(Translated by Google) Perfect place to try typical Dutch food. The service is fast and efficient. The waitresses are charming and advise you on what to order. A must stop here for a delicious Dutch meal. …
416,De blauwe Hollander, 5 stars ,4 months ago,"(Translated by Google) We tried the menu and the truth is, we were very satisfied for € 24 excluding drinks, a place with a good variety and very friendly. Rep ++++ …"
417,De blauwe Hollander, 4 stars ,2 years ago,(Translated by Google) Dutch food It is an expensive tad but the food is good. It is quite advisable to ask any of the menus as it is cheaper. The pea soup and the veal puree were good. …
418,De blauwe Hollander, 4 stars ,2 years ago,"(Translated by Google) Typical Dutch food very good, but carillo, I also suppose that the whole of Holland is expensive. A meal for 4 with several drinks and 4 courses left € 90. …"
419,De blauwe Hollander, 4 stars ,4 months ago,"(Translated by Google) Very good typical dishes, super friendly staff, quality price more than reasonable …"
420,De blauwe Hollander, 4 stars ,2 years ago,(Translated by Google) Very nice place and staff. The food is good and the prices very affordable. There are Spanish staff …
421,De blauwe Hollander, 5 stars ,2 years ago,"(Translated by Google) We sat dinner on Saturday night, and the truth is that the food was very good, and the staff was also treated. It is a cozy and traditional restaurant where you can taste typical dishes. …"
422,De blauwe Hollander, 4 stars ,4 years ago,"(Translated by Google) Good food. They have a menu € 20.50 (first course- soups, second to choose meat and third dessert). If you ask for water they put you a cool bottle from the tap. Rich and elaborate soups. We liked. They also give you …"
423,De blauwe Hollander, 5 stars ,8 months ago,"(Translated by Google) Great discovery. The meal is very generous and rich. The service is excellent, I have been to a lot of restaurants in Amsterdam and each time I am incredibly surprised. They are so outgoing, respectful and kind. …"
424,De blauwe Hollander, 4 stars ,3 years ago,"(Translated by Google) Restaurant with typical Dutch cuisine.
The menu is rich, the dishes are tasty and abundant.
It is within walking distance of the Leidseplein. …"
425,De blauwe Hollander, 5 stars ,2 years ago,"(Translated by Google) I recommend the stamppot, quality Dutch food and lots of it, very good value for money. Honorable mention to the waitress who attended us, brought forward the service on time of practically the whole room alone. In …"
426,De blauwe Hollander, 5 stars ,8 months ago,"(Translated by Google) Very good little restaurant in a very touristy area, nice Dutch menu with the famous stamppot (a kind of mash with vegetables), very pleasant and smiling service. …"
427,De blauwe Hollander, 5 stars ,3 years ago,"(Translated by Google) A typical Dutch meal. An exquisite treatment. A must when visiting Amsterdam. More if you take advantage of the day you visit the Van Gogh museum, it is very close …"
428,De blauwe Hollander, 5 stars ,6 months ago,"(Translated by Google) Traditional Dutch restaurant in a nice neighborhood, the food was very good, the service friendly and warm, and the prices more than fair. I recommend with my eyes closed. …"
429,De blauwe Hollander, 4 stars ,3 years ago,"(Translated by Google) Friendly welcome and service.
Cozy and warm place.
Restaurant offering typical Dutch dishes. …"
430,De blauwe Hollander, 5 stars ,2 years ago,"(Translated by Google) If you are in Amsterdam and want to try the typical Dutch cuisine you have to go by de Blawe boiling ... and the staff were helpful, friendly, and courteous ,, l 'environment is small but cozy and really exquisite …"
431,De blauwe Hollander, 5 stars ,5 months ago,(Translated by Google) Food tastes delicious and fresh. Definitely recommended for Dutch cuisine. Prices are great. …
432,De blauwe Hollander, 5 stars ,2 years ago,(Translated by Google) Great Dutch restaurant perfect service well-kept and very good dishes …
433,De blauwe Hollander, 4 stars ,a month ago,"(Translated by Google) Warm and pleasant traditional restaurant. Quality food

(Original) …"
434,De blauwe Hollander, 4 stars ,2 years ago,"(Translated by Google) Nice place in which to try some typical Dutch dish, variety of dishes, nice waiters, they serve fast. …"
435,De blauwe Hollander, 5 stars ,3 years ago,"(Translated by Google) Very welcoming place, friendly and helpful staff and the dishes are tasty and abundant. I will definitely stay there again; To try …"
436,De blauwe Hollander, 5 stars ,7 months ago,"(Translated by Google) Careful menu with a choice of complete wines, dishes very well prepared and presented, a welcoming and careful team. Big plus for the discovery of Jenever (local alcohol) guided by Sergio! I recommend ! …"
437,De blauwe Hollander, 5 stars ,2 years ago,"(Translated by Google) Great restaurant! Real Dutch cuisine, clear map and very nice service staff! It's worth a visit. Reservation is recommended. …"
438,De blauwe Hollander, 5 stars ,8 months ago,(Translated by Google) Had dinner at this great restaurant for the first time tonight. If you want to eat well in Amsterdam you go here. the gentlemen in the service are wonderfully nice. very very friendly. the meat deliciously soft …
439,De blauwe Hollander, 5 stars ,2 years ago,"(Translated by Google) An ideal place to taste the famous Dutch stamppot. The staff is very friendly and helpful and the service is fast, although small, it is cozy. …"
440,De blauwe Hollander, 5 stars ,2 years ago,"(Translated by Google) It is a beautiful, romantic, unique restaurant with excellent original dishes and a vast choice in the menu, perfect service, maximum highly recommended kindness …"
441,De blauwe Hollander, 3 stars ,2 years ago,"(Translated by Google) Dutch home cooking store.

Mashed potatoes are a staple food. …"
442,De blauwe Hollander, 4 stars ,3 years ago,(Translated by Google) Good value for money to discover Dutch specialties ... very good apple pie for dessert …
443,De blauwe Hollander, 5 stars ,2 years ago,(Translated by Google) If you want to taste excellent Dutch dishes you are in the right place! …
