,Name,Review Rate,Review Time,Review Text
0,Black Gold Amsterdam, 5 stars ,4 months ago,"A perfect speciality cafe, where you can find a lot of vinyl recordings and also listen to some right there. …"
1,Black Gold Amsterdam, 4 stars ,6 months ago,"Tried flat white and black coffee, both taste amazing, It’s soft in your mouth, with a light and subtle blend of flavors. When I say soft, I don’t mean weak. A weak taste is thin and watery, often with sharp taste notes... A coffee for …"
2,Black Gold Amsterdam, 5 stars ,6 months ago,"I don’t drink coffee but I buy a lot of tunes here. Great staff, very friendly and very knowledgeable about coffee and music. I also happen to own The Lastage Inn bed & breakfast on the same street and serve my guests coffee bought from here every morning. Nothing but praise from my guests and so only five stars from me."
3,Black Gold Amsterdam, 5 stars ,5 months ago,"This is a proof that good staff is 99% of success! People are so friendly and helpful, if you have any questions wither about the coffee or records, they are there to help. And the music? If is a delight, sitting there, enjoying your drink and listening amazing soundtrack hand picked by the staff from their private LP stash."
4,Black Gold Amsterdam, 5 stars ,5 months ago,Perfect flat white and extensive record collection. Welcoming and cool atmosphere. Great place to spend having our last coffee in Amsterdam …
5,Black Gold Amsterdam, 5 stars ,2 years ago,"Came to this place by pure luck (well ... via google maps 'explore nearby' really). It's situated in the heart of Amsterdam Old East. Very interesting hipster atmosphere, nice coffee. The cafe is combined with music shop (vinyl and CDs primarily). Recommended -  would love to visit again."
6,Black Gold Amsterdam, 5 stars ,3 years ago,"Nice, cosy place to get good coffee and listen to fine tunes. Friendly owner who made one of the best Aeropress coffee I’ve ever had. Not touristy at all, which is good. Recommended!"
7,Black Gold Amsterdam, 5 stars ,4 months ago,"The best cafe in Amsterdam to my experience. Cozy and peaceful, with a nice and friendly staff and of course delicious coffee."
8,Black Gold Amsterdam, 5 stars ,4 years ago,You can feel that it is a unique atmosphere with a wide range of coffee selection. The vinyl concept is extensively inventive. A must-try for an experience.
9,Black Gold Amsterdam, 5 stars ,2 years ago,Great little shop. Very good coffee and amazing music. Found some really good books in there to read as I was enjoying my cappuccino.
10,Black Gold Amsterdam, 5 stars ,7 months ago,One of the best Specialty coffee in Amsterdam
11,Black Gold Amsterdam, 4 stars ,3 years ago,Great coffee; very good selection of beans.  The person working there is very knowledgeable about coffee.
12,Black Gold Amsterdam, 5 stars ,3 years ago,"Must visit coffee shop in Amsterdam. Coffee shop as in they serve real coffee. The place is filled with nice illustration arts. Ask for the coffee that looks like tea, I don’t know the exact name. Feel free to check the pictures to understand this concept."
13,Black Gold Amsterdam, 5 stars ,7 months ago,"Possibly the best coffee / record spot in Amsterdam. The staff are friendly too, so go ahead and chat them up. Try the cakes if you can, they're quite unique like the matcha lemon or something with yuzu and sake."
14,Black Gold Amsterdam, 4 stars ,4 years ago,"Cool Concept! Vinyl Store/Specialty Coffeeshop/Neighborhood Meeting Place.

Really friendly owner who serves some of the best beans in Amsterdam!"
15,Black Gold Amsterdam, 5 stars ,5 months ago,"A hidden gem, very close to the centre of Amsterdam. Very cool place, very friendly staff and fantastic coffee - the flat white, americano and V60 were all really excellent."
16,Black Gold Amsterdam, 3 stars ,2 years ago,"Nice place, friendly staff but v60 we ordered did not have much taste not enough coffee was used to make it...."
17,Black Gold Amsterdam, 5 stars ,2 years ago,". shop_great place with nice music⠀
. price_regular for the netherlands⠀
. espresso_bit bitter for my taste⠀ …"
18,Black Gold Amsterdam, 5 stars ,11 months ago,"The best coffee ever, and the records they offer are very nice. Lots of local producers from Amsterdam, a lot of new albums, they know their stuff! Great and cozy place, would definitely recommend"
19,Black Gold Amsterdam, 5 stars ,2 years ago,"Good coffee, cozy, didn’t expect it to be a vinyl store when I saw it on maps, but very pleasantly surprised :)"
20,Black Gold Amsterdam, 5 stars ,2 years ago,Good boys with amazing coffee. Must visit in Amsterdam.
21,Black Gold Amsterdam, 5 stars ,a year ago,"As italian, I can say and confirm that the coffee was so good! Well done! I definitely will come back! Then, I didn’t taste any dessert, but the looked so tasty..."
22,Black Gold Amsterdam, 5 stars ,a year ago,"My favorite cafe in Amsterdam. Great if you want great coffee (pour over, espresso, etc) and listen to cool records. They also sell high quality coffee equipment and vinyl."
23,Black Gold Amsterdam, 5 stars ,3 years ago,Nice coffee and staff! Love the records there too
24,Black Gold Amsterdam, 5 stars ,a year ago,My new go to spot for great coffee & 90’s boom bap! Bought that fetti instrumentals LP today ✌️
25,Black Gold Amsterdam, 5 stars ,7 months ago,"Loved the staff, this guy working on Sunday morning was really nice and friendly! Aeropress filter coffee was really tasty!"
26,Black Gold Amsterdam, 5 stars ,2 years ago,Very nice and unique place for coffee and music albums
27,Black Gold Amsterdam, 5 stars ,2 years ago,Fantastic americano. I could taste the love for coffee.
28,Black Gold Amsterdam, 5 stars ,2 years ago,"Small, out of the way place near Nieuwmarkt. Sells coffee, cakes and a selection of vinyl records. I think they might do the best cup of coffee in Amsterdam! Every time I go, I'm blown away by the coffee. Superb!"
29,Black Gold Amsterdam, 5 stars ,3 years ago,I really like this place... Very few real coffee designated places in Amsterdam and this is one of them. They do a great job at having one of the biggest selections of single origins with the usage of numerous roasters as they see fit. Vibe is very hipstery and it is cool that the music is played on genuine vinyls
30,Black Gold Amsterdam, 5 stars ,6 months ago,"Simply put, the best coffee place in town."
31,Black Gold Amsterdam, 5 stars ,4 years ago,"In my quest to find the perfect place to sip my coffee  in Amsterdam I think after 8 months I've found myself the prime spot. To be able to go somewhere so quiet, with an owner who engages and takes a genuine interest in his clients taste …"
32,Black Gold Amsterdam, 5 stars ,3 months ago,Super cozy + top notch cold brew
33,Black Gold Amsterdam, 5 stars ,a year ago,"Great coffee, brilliantly odd snacks (rice - sake cakes), very friendly staff and fantastic eclectic vinyl. What a great little (coffee) shop."
34,Black Gold Amsterdam, 5 stars ,6 months ago,Simply the best coffee in Amsterdam! In a class of its own!
35,Black Gold Amsterdam, 5 stars ,5 years ago,"Greeted with a Friendly and warm smile.
Coffee made with love and care. Siebrand (the owner) makes sure to ask you after you've had your coffee if you liked it and what you thought of the beans. You …"
36,Black Gold Amsterdam, 5 stars ,6 years ago,"Visiting this cafe was a major highlight of my time in Amsterdam...I cannot rave about it enough! Between the DELICIOUS coffee, the heavenly baked goods, the OUTSTANDING vinyl collection and the relaxed, tasteful ambience, I was truly blown …"
37,Black Gold Amsterdam, 5 stars ,6 years ago,"Awesome coffee, though their standard espresso roast was a little bitter I plan to try other options. The barista was super nice and talked about vinyl with me despite my ignorance. Nice hidden gem."
38,Black Gold Amsterdam, 5 stars ,2 years ago,One of the nicest coffee shops I’ve ever been to. I really enjoyed the music choices and that the Café is also a vinyl shop. Beautiful interior and great coffee advise.
39,Black Gold Amsterdam, 5 stars ,2 years ago,"I loved this coffee shop and its really nice atmosphere. Good place to go to when you just arrived in Amsterdam. It's not too busy, and the coffee is really good. Everything is single origin! …"
40,Black Gold Amsterdam, 5 stars ,10 months ago,"Great coffee, great records, friendly service. All in all nice chill place to go."
41,Black Gold Amsterdam, 5 stars ,3 years ago,"Great atmosphere in a local coffee place - not far away from the Amsterdam city centre, but without the crowds & madness. Siebrand spins mostly a mix of funk, soul & hiphop and together with the very nice selection of coffee creates a great vibe. One of my favourite spots in AMS."
42,Black Gold Amsterdam, 5 stars ,a year ago,"Best coffee in town! Added bonus: cool vibe, super friendly owner, and music records for sale."
43,Black Gold Amsterdam, 5 stars ,2 years ago,"As a caffeine addicted Australian, I've been pulling my hair out trying to find a half decent flat white in the Netherlands. But expats and visitors need look no further - one of the best coffees I've had anywhere."
44,Black Gold Amsterdam, 5 stars ,3 years ago,"Very nice atmosphere, top notch coffee. As others have said, a great place to spend a little time with the analog pleasures of coffee and vinyl."
45,Black Gold Amsterdam, 5 stars ,4 years ago,"Fantastic coffee and atmosphere, great service. Highly recommended."
46,Black Gold Amsterdam, 5 stars ,4 years ago,"Groovy tunes amidst some of the best coffee in town. The coolest cats come here to hangout and enjoy the moment. Owners are beautiful, as are the vibes of the place. Not to be missed."
47,Black Gold Amsterdam, 5 stars ,6 months ago,Peaceful and quiet (might be cause I was there on a weekday afternoon but nonetheless 💕)
48,Black Gold Amsterdam, 5 stars ,3 years ago,"Chill dj picks and coffee, travelers order the mint and ginger tea... after an espresso ... awesome"
49,Black Gold Amsterdam, 5 stars ,4 years ago,"My local coffee place and how lucky I am! Siebrand knows all regulars by name, makes a great coffee and has an inspiring hip hop selection which is partly for sale."
50,Black Gold Amsterdam, 5 stars ,3 years ago,"Fantastic coffee shop with the best selection of hip hop/rap records i've ever seen available for sale. Found a EP by MC Eiht that he released before which way iz west i didnt even know existed! The guy running it was friendly and talkative as well, a real go to spot for any rap heads."
51,Black Gold Amsterdam, 5 stars ,4 years ago,"Amazing coffee and an small but awesome collection of Hip Hop and Jazz records.
Wanted to look for one record, ended up staying for hours because it's just so cozy!"
52,Black Gold Amsterdam, 5 stars ,4 years ago,Super cozy and friendly place. Tasty coffee and breakfasts
53,Black Gold Amsterdam, 5 stars ,2 years ago,Coolest coffee in town!
54,Black Gold Amsterdam, 5 stars ,5 years ago,"Might be the best flat white of Amsterdam. Superb coffee, friendly straff, homemade cake (try the coconut-almond-abricot flapjack!), nice ambiance. Also you can buy vinyl and coffee goods.
Must visit."
55,Black Gold Amsterdam, 4 stars ,a year ago,Cool place and concept! Service was not exceptional though and coffee was just average. A 20 second shot is too fast ...
56,Black Gold Amsterdam, 4 stars ,2 years ago,"Really nice staff and cute location. Excellent coffee. Only downside is there are not a lot of seating space, and hardly any tables."
57,Black Gold Amsterdam, 5 stars ,3 years ago,Really good coffee with a cool vibe and good music.
58,Black Gold Amsterdam, 5 stars ,a year ago,"The best and chillest neighbourhood cafe, enjoy some good tunes with a delicious cup of coffee"
59,Black Gold Amsterdam, 5 stars ,2 years ago,Proper coffee made with respect. Good crew too.
60,Black Gold Amsterdam, 5 stars ,2 years ago,"Great coffee and all the options a coffee enthusiast would like. Chill atmosphere, you can buy a vinyl or coffee accessories as well."
61,Black Gold Amsterdam, 5 stars ,2 years ago,"My favourite coffee place in all of Amsterdam. Delicious coffee and cakes, great staff, golden light and groovy music. 🌻"
62,Black Gold Amsterdam, 5 stars ,3 years ago,"Great coffee, expertly made. Super friendly barista and great music. Awesome coffee selection. 10/10."
63,Black Gold Amsterdam, 5 stars ,2 years ago,Amazing coffee to-go. Quite a hipster place with vinyl records on sale. Music loud if you’re sitting in.
64,Black Gold Amsterdam, 5 stars ,7 months ago,Cool and open minded personal with honest advice. Try the Espresso!
65,Black Gold Amsterdam, 5 stars ,3 years ago,Really good coffee and friendly people around
66,Black Gold Amsterdam, 5 stars ,2 years ago,"Chill to the vibes of good tunes, great coffee"
67,Black Gold Amsterdam, 5 stars ,4 years ago,Great coffee on a quiet street just off the red light district.  An oasis in the area.  Great staff.  Cool vibe.  Love relaxing here.
68,Black Gold Amsterdam, 5 stars ,4 years ago,Lovely hipster coffee shop. Great cup. Homegrown blend. Very recommended if you're in Newmarket .
69,Black Gold Amsterdam, 5 stars ,a year ago,"Favorite!!!
Both for Chai Latte and Records.
Owner is lovely!"
70,Black Gold Amsterdam, 5 stars ,6 months ago,Good coffee and friendly owner
71,Black Gold Amsterdam, 4 stars ,2 years ago,"Nice place, choice of different coffees, very interesting reading material. Could be more cozy for my taste"
72,Black Gold Amsterdam, 5 stars ,4 years ago,"Very cool and nice place with great music and also coffee. If you're looking for some place to calm down, this is it:) enjoy:)"
73,Black Gold Amsterdam, 5 stars ,3 years ago,"Amazing coffee and vibe - owner and staff are super attentive and know about their coffee.
Really love coming here!"
74,Black Gold Amsterdam, 5 stars ,3 years ago,what a lovely place in Amsterdam :) it feels like sitting  in your own living room - but just way better coffe and music
75,Black Gold Amsterdam, 5 stars ,4 years ago,"Great coffee. Such a nice play. You can stay all the day, listening to music, diggin, workin', eatin great cakes."
76,Black Gold Amsterdam, 5 stars ,4 years ago,"Great third wave coffee shop. The owner is a super cool guy, and the fresh roasted coffee is very good."
77,Black Gold Amsterdam, 5 stars ,4 years ago,Great coffee. Great music. Found some fresh vinyl for presents last year.
78,Black Gold Amsterdam, 5 stars ,a year ago,"Amazing coffee, music and lovely people."
79,Black Gold Amsterdam, 5 stars ,4 years ago,A super friendly and tasty coffee shop
80,Black Gold Amsterdam, 5 stars ,5 years ago,"Chai latte, coffee, music: everything is excellent. You can even work there or grab a book and enjoy the place"
81,Black Gold Amsterdam, 5 stars ,2 years ago,Really good coffee ! Best flat white I've had in Dam
82,Black Gold Amsterdam, 5 stars ,2 years ago,Secret spot that actually known by many hipster baristas - got a morning cortado to wake my walk in A’dam til midnight !
83,Black Gold Amsterdam, 5 stars ,2 years ago,My 3rd attempt to find a great specialty coffee place in Amsterdam and hand down the best  so far 👌
84,Black Gold Amsterdam, 5 stars ,2 years ago,"Great place to grab a quick tasty espresso, friendly staff"
85,Black Gold Amsterdam, 5 stars ,4 years ago,"Great coffee, home-feeling like setting 🎼🎧☕️☕️☕️ and very friendly staff."
86,Black Gold Amsterdam, 4 stars ,2 years ago,"The coffee and the vibe is great, the jazz music is not my world..."
87,Black Gold Amsterdam, 5 stars ,a year ago,"Cozy place, good coffee and tea, cool guy playing good music"
88,Black Gold Amsterdam, 5 stars ,4 years ago,Epic coffee & great vibe. Enjoy pure happiness in the cup.
89,Black Gold Amsterdam, 4 stars ,2 years ago,"Hipster coffee place. Good coffee, good music but kind of generic."
90,Black Gold Amsterdam, 4 stars ,a year ago,"Good coffee,  friendly atmosphere"
91,Black Gold Amsterdam, 5 stars ,3 years ago,Very cozy coffee bar with nice local/ international roasters.
92,Black Gold Amsterdam, 5 stars ,5 years ago,Cozy friendly coffee &  Vinyl store with quite knowledgeable staff.
93,Black Gold Amsterdam, 5 stars ,4 years ago,"a lovely place to spend time with good music, nice people and great coffee"
94,Black Gold Amsterdam, 5 stars ,a year ago,One of the best cafes in Amsterdam! For sure!
95,Black Gold Amsterdam, 5 stars ,3 years ago,This was a welcome reprieve from the terrible coffee that plagues most of Europe. Black Gold functions at an extremely high level. Thank you BG!
96,Black Gold Amsterdam, 5 stars ,2 years ago,Really good brewed coffes with nice atmosphere and music.
97,Black Gold Amsterdam, 5 stars ,2 years ago,"If you love coffee and vinyl, This is the place to be!"
98,Black Gold Amsterdam, 5 stars ,a year ago,Really cool place for coffee and records.
99,Black Gold Amsterdam, 5 stars ,3 years ago,Ethiopian Gesha and Ethiopian Natural and Washed brand available here!! €5 for a Gesha only
100,Black Gold Amsterdam, 5 stars ,3 years ago,"Just a normal coffee, but good atmosphere and music"
101,Black Gold Amsterdam, 5 stars ,2 years ago,Great atmosphere. Nice coffee
102,Black Gold Amsterdam, 5 stars ,4 years ago,Good quality coffee and a really cozy place.
103,Black Gold Amsterdam, 4 stars ,2 years ago,"Great products and music!
Wish the seats were softer!"
104,Black Gold Amsterdam, 5 stars ,3 years ago,Incredibly cool coffee and record shop. Check it out!
105,Black Gold Amsterdam, 5 stars ,3 years ago,Great place! Love the vibe and the Rwanda aeropress was great
106,Black Gold Amsterdam, 5 stars ,3 years ago,Great coffee and some great tunes to buy.
107,Black Gold Amsterdam, 5 stars ,3 years ago,Chill place to drink coffee and work. Good music on deck.
108,Black Gold Amsterdam, 5 stars ,a year ago,White Label Coffee + Vinyl = Heaven
109,Black Gold Amsterdam, 5 stars ,3 years ago,"Friendly staff, nice interiour and awesome coffee."
110,Black Gold Amsterdam, 4 stars ,5 years ago,Hidden gem in the city centre. pefect coffee and a vinyl store.
111,Black Gold Amsterdam, 5 stars ,4 years ago,Great place to stay all afternoon and listen to great tunes!
112,Black Gold Amsterdam, 5 stars ,11 months ago,Best coffee in Amsterdam!
113,Black Gold Amsterdam, 4 stars ,3 years ago,It's so cool that you'd better not go there!
114,Black Gold Amsterdam, 4 stars ,3 years ago,Cafe and vinyl store sometimes live dj a plus
115,Black Gold Amsterdam, 5 stars ,4 years ago,"Great coffee, music and service."
116,Black Gold Amsterdam, 5 stars ,2 years ago,Best coffee and hidden spot in Amsterdam!
117,Black Gold Amsterdam, 5 stars ,6 years ago,Super nice little café with cool music
118,Black Gold Amsterdam, 5 stars ,2 years ago,"Top coffee, good music"
119,Black Gold Amsterdam, 5 stars ,a year ago,Really good coffee.
120,Black Gold Amsterdam, 5 stars ,5 years ago,Great coffee and record selection
121,Black Gold Amsterdam, 5 stars ,5 years ago,Great for filter Coffee and vinyls
122,Black Gold Amsterdam, 5 stars ,3 years ago,Great coffee and vinyl.
123,Black Gold Amsterdam, 5 stars ,2 years ago,Best cappuccino and latte in the hood!
124,Black Gold Amsterdam, 5 stars ,3 years ago,Good coffee... Good tunes!
125,Black Gold Amsterdam, 4 stars ,3 years ago,Real coffee. A coffee shop that sells coffee and vinyl.
126,Black Gold Amsterdam, 5 stars ,3 years ago,Friendly! Great coffee!
127,Black Gold Amsterdam, 5 stars ,2 years ago,Favourite cafe in Amsterdam!
128,Black Gold Amsterdam, 5 stars ,8 months ago,Good coffee.
129,Black Gold Amsterdam, 5 stars ,2 years ago,Great coffee!
130,Black Gold Amsterdam, 5 stars ,6 years ago,love for coffee & vinyl
131,Black Gold Amsterdam, 5 stars ,a year ago,Best coffee
132,Black Gold Amsterdam, 5 stars ,4 years ago,Coffee and vinyl <3
133,Black Gold Amsterdam, 5 stars ,4 years ago,Good strong coffee
134,Black Gold Amsterdam, 5 stars ,3 years ago,Excellent coffee.
135,Black Gold Amsterdam, 5 stars ,4 years ago,Healthy + tasty👌
136,Black Gold Amsterdam, 5 stars ,2 years ago,great roasts!
137,Black Gold Amsterdam, 5 stars ,2 years ago,Good coffee.
138,Black Gold Amsterdam, 5 stars ,2 years ago,Loved it 🤘
139,Black Gold Amsterdam, 5 stars ,4 years ago,Best place
140,Black Gold Amsterdam, 5 stars ,2 weeks ago,Good coffee and good music. Love the concept !
141,Black Gold Amsterdam, 5 stars ,4 years ago,"(Translated by Google) A coffee shop with great music.
Chic coffee is brewed here (you can safely take both a filter and pour over), offer a traditional set of drinks based on espresso. They know about coffee and …"
142,Black Gold Amsterdam, 5 stars ,3 years ago,"(Translated by Google) fell in by accident despite the rather remote alley and it was good! Concept great, cool music, macchiato very round, foam well - was the only thing that wasn't perfect. Sitting area with sockets, toilet clean - …"
143,Black Gold Amsterdam, 5 stars ,6 months ago,"(Translated by Google) A coffee there took off all the stress of the city.

(Original) …"
144,Black Gold Amsterdam, 5 stars ,3 years ago,"(Translated by Google) Very nice cafe, with vinyl records

(Original)
很不错的咖啡馆，还有黑胶唱片"
145,Black Gold Amsterdam, 5 stars ,a year ago,"(Translated by Google) It's a very nice, not-too-big record store with an emphasis on hip hop, reaggea and jazz. As soon as you enter the shop you feel at home, chilling out in front of your plates and listening to the records is just …"
146,Black Gold Amsterdam, 5 stars ,3 years ago,"(Translated by Google) Here you can enjoy a very nice cup of coffee and talk to the owner about current developments in the Third Wave Coffee movement.
Quiet and relaxed establishment. …"
147,Black Gold Amsterdam, 5 stars ,3 years ago,"(Translated by Google) This restaurant has an informal, friendly atmosphere where you immediately feel welcome. It's like entering a house party that hasn't really started yet. Nice music, nice people and it seems like everyone is good …"
148,Black Gold Amsterdam, 5 stars ,2 years ago,"(Translated by Google) Nice place, and the coffee is really good! The owner is kind and willing to give valuable advice to drink lovers ... who, like everything else, will always be able to do well only Italians! …"
149,Black Gold Amsterdam, 5 stars ,3 years ago,"(Translated by Google) Specialty Café in Amsterdam
⠀
⠀ …"
150,Black Gold Amsterdam, 5 stars ,3 years ago,"(Translated by Google) I was there for the “Hundred Secret Senses” exhibition by Mara Liem (on view until October 31, 2018)
Pleasant atmosphere and delicious coffee (with oats or soy) and a nice barista …"
151,Black Gold Amsterdam, 5 stars ,a year ago,"(Translated by Google) Favorite coffee place in Amsterdam. I always discover good new music here, while enjoying a delicious coffee or tea. …"
152,Black Gold Amsterdam, 5 stars ,2 years ago,"(Translated by Google) We decided to set aside the maps and we lost ourselves in the search for good coffee. We got it! The decor and the family atmosphere attracted a lot of attention, it is not a conventional cafeteria. In addition, it …"
153,Black Gold Amsterdam, 1 star ,3 years ago,"(Translated by Google) Owner sends you away if you are calling inside for too long. ""It's not an office here."" This while no one was inside. I loved coming here to get a coffee, but with this guy's arrogance, I wouldn't advise anyone to …"
154,Black Gold Amsterdam, 5 stars ,3 years ago,"(Translated by Google) Hip hop at Vynil so favo coffee bar with addictive home made / baked side dishes coffee: Croissant, chocolate chip cookie, cinnamon bun. Coffee top …"
155,Black Gold Amsterdam, 5 stars ,2 years ago,"(Translated by Google) Nice place with very good coffee, sometimes full / busy.

(Original) …"
156,Black Gold Amsterdam, 5 stars ,11 months ago,"(Translated by Google) If you like good coffee and nice tunes.

(Original) …"
157,Black Gold Amsterdam, 5 stars ,3 years ago,"(Translated by Google) This place is really fantastic. Good coffee and vinyl, need I say more? …"
158,Black Gold Amsterdam, 5 stars ,2 years ago,"(Translated by Google) The slightly different coffee bar, super nice people, special musical accompaniment …"
159,Black Gold Amsterdam, 5 stars ,2 years ago,"(Translated by Google) Very successful, a place where we have always been with my family …"
160,Black Gold Amsterdam, 5 stars ,3 years ago,"(Translated by Google) Best coffee in town, also LPs and live music.

(Original) …"
161,Black Gold Amsterdam, 5 stars ,3 years ago,"(Translated by Google) Very good coffee and relaxed atmosphere.

(Original) …"
162,Black Gold Amsterdam, 5 stars ,3 years ago,"(Translated by Google) Fine place, just out of the crowds, with very good coffee! …"
163,Black Gold Amsterdam, 5 stars ,5 years ago,(Translated by Google) Great cookie and granola! Service and hospitality hympec! Atmosphere top! We will come back! …
164,Black Gold Amsterdam, 5 stars ,3 years ago,"(Translated by Google) Delicious coffee. Great music. Cool people 👌

(Original) …"
165,Black Gold Amsterdam, 3 stars ,2 years ago,"(Translated by Google) Coffee solala but they have great LP's

(Original) …"
166,Black Gold Amsterdam, 5 stars ,5 years ago,"(Translated by Google) Beautiful bar !! Alternative to all !! Coffee, disks, chocolate, cakes..figo !! …"
167,Black Gold Amsterdam, 5 stars ,3 years ago,(Translated by Google) One of the best specialty coffee in Amsterdam that I managed to try. …
168,Black Gold Amsterdam, 5 stars ,a year ago,"(Translated by Google) Great guy and nice coffee 😀

(Original) …"
169,Black Gold Amsterdam, 5 stars ,5 years ago,"(Translated by Google) nice people, great coffee, great music!

(Original) …"
170,Black Gold Amsterdam, 5 stars ,4 years ago,"(Translated by Google) Delicious coffee !!

(Original)
Heerlijke koffie!!"
171,Black Gold Amsterdam, 5 stars ,2 years ago,
