,Name,Review Rate,Review Time,Review Text
144,Prins Heerlijk, 5 stars ,2 years ago,Great Dutch style egg breakfast and super friendly staff.
145,Prins Heerlijk, 5 stars ,2 years ago,Amazing pancakes and great coffee! Great location and super sweet staff
146,Prins Heerlijk, 5 stars ,3 years ago,"Really great breakfast! Try the Dutch pancakes too, they’re delicious."
147,Prins Heerlijk, 5 stars ,2 years ago,Really nice place for a brunch on Amsterdam. However they don't have Toilets
148,Prins Heerlijk, 5 stars ,2 years ago,One the best breakfast ever...fresh and really good taste.😁
149,Prins Heerlijk, 5 stars ,3 years ago,"Great food, little cosy place and received the most friendly smiling service I’ve had in a while."
150,Prins Heerlijk, 5 stars ,8 months ago,Good food and great waiters
151,Prins Heerlijk, 5 stars ,3 years ago,"Execellent service from the staff, the food is the best over the amsterdam center.....if you want a fast service and delicious you should directly stop here."
152,Prins Heerlijk, 4 stars ,5 years ago,"A good place to have a coffee or sandwich. You can even have a Latte Macchiato there, which is actually not easy to find in the Netherlands."
153,Prins Heerlijk, 5 stars ,2 years ago,Pancakes were fantastic and had great service! Overall great experience
154,Prins Heerlijk, 4 stars ,4 years ago,"Small, cramped space with good food, reasonable coffee, and friendly service.  Good for a quick bite."
155,Prins Heerlijk, 5 stars ,4 years ago,We really loved everything we tried. My best meal in amsterdam. Lovely staff.
156,Prins Heerlijk, 5 stars ,3 years ago,Well it was I'lly before. Best breakfast we had. Open air.. good food. Tasty
157,Prins Heerlijk, 5 stars ,3 years ago,"Small cafe. Nice place, nice people, and  great food. Try the smoked salmon sandwich!"
158,Prins Heerlijk, 5 stars ,2 years ago,"Only had a drink here, so cannot comment on the food, but a nice place."
159,Prins Heerlijk, 4 stars ,3 years ago,Friendly place where you can get a decent breakfast. Close to Centraal. Expect to pay a bit more because of the location.
160,Prins Heerlijk, 4 stars ,4 years ago,Cosy little place but the food is very good! Worth a try if you can get a seat.
161,Prins Heerlijk, 5 stars ,3 years ago,Lovely food... lovely service 👍👍 I recommend the dutch egg for breakfast
162,Prins Heerlijk, 5 stars ,2 years ago,Very nice food good and tasty not very expensive... I like it ... recommended
163,Prins Heerlijk, 5 stars ,2 years ago,Great Food and Awesome Service! Comfortable and Clean
164,Prins Heerlijk, 4 stars ,5 years ago,Good choice of food. You can eat breakfast all day long which is really good !
165,Prins Heerlijk, 5 stars ,6 years ago,"They help us in our earlier breakfast !
Staff so friendly and food was great!"
166,Prins Heerlijk, 5 stars ,3 years ago,"Great service, great food:)

A litlle bit pricy but  I guess That's the erea"
167,Prins Heerlijk, 5 stars ,6 years ago,Great place. The burgers are superb. Will come back when I am in Amsterdam !
168,Prins Heerlijk, 4 stars ,2 years ago,Good for a quick bite!
169,Prins Heerlijk, 3 stars ,4 years ago,"Quite cramped and expensive, plus no one knows how to do a breakfast like us Brits, but it's still pretty good."
170,Prins Heerlijk, 2 stars ,a year ago,"Recap and review of my 2018 trip:

Small cafe with expensively priced average food"
171,Prins Heerlijk, 5 stars ,3 years ago,"Great place, really good music being played, friendly staff and very nice food!"
172,Prins Heerlijk, 4 stars ,5 years ago,"Nice service, good place. They should have a portable machine to pay with cards instead of asking people to go inside to pay"
173,Prins Heerlijk, 5 stars ,3 years ago,"Great breakfast, great accommodation ,didn't have fried eggs"
174,Prins Heerlijk, 4 stars ,5 years ago,"Lunch was lovely, plenty of heaters around the place to keep you warm too"
175,Prins Heerlijk, 5 stars ,2 years ago,"Great food, coffee and service and affordable!!"
176,Prins Heerlijk, 5 stars ,4 years ago,Great food fast and friendly service. I will miss them when I return to America.
177,Prins Heerlijk, 5 stars ,4 years ago,Lovely place for food and coffee. Small in space but food is nice.
178,Prins Heerlijk, 4 stars ,2 years ago,Very friendly staff. In the centre os Amsterdam. Nice food.
179,Prins Heerlijk, 3 stars ,3 years ago,"Good breakfast and coffee, but quite overpriced (latte: 4,80)."
180,Prins Heerlijk, 5 stars ,4 years ago,Quick and tasty breakfast right after you leave central train station. Friendly staff.
181,Prins Heerlijk, 4 stars ,6 months ago,"Its ok, nothing special"
182,Prins Heerlijk, 4 stars ,4 years ago,The food and everything is just awsome. I just miss a toilett :x but the rest is nearly perfect!
183,Prins Heerlijk, 5 stars ,2 years ago,Beautiful little cafe serving traditional Dutch food.
184,Prins Heerlijk, 5 stars ,4 years ago,Fillet American is amazing and service is great! Also do freshly squeezed orange juice
185,Prins Heerlijk, 5 stars ,3 years ago,"Late night food, excellent Prince Pancake (we ordered a second), friendly service"
186,Prins Heerlijk, 4 stars ,8 months ago,"Nice breakfast, nice place"
187,Prins Heerlijk, 5 stars ,5 years ago,"Been here few times during my journey as seaman. Good cappuccino, wifi and the location..."
188,Prins Heerlijk, 5 stars ,4 years ago,Had English Breakfast so delicious and everyone was great.
189,Prins Heerlijk, 5 stars ,2 years ago,The coffee is amazing
190,Prins Heerlijk, 5 stars ,2 years ago,Great English breakfast and coffee and friendly service
191,Prins Heerlijk, 4 stars ,3 years ago,Food and coffee was good but menu is limited.
192,Prins Heerlijk, 5 stars ,3 years ago,"Great Fondue, just ask them to go light on the salt, and it will be PERFECTION."
193,Prins Heerlijk, 4 stars ,3 years ago,A “homey” feel inside. Great service and good food to start the day
194,Prins Heerlijk, 4 stars ,8 years ago,Very clean and staff eager to please really nice fresh food and reasonably priced
195,Prins Heerlijk, 5 stars ,3 years ago,"Great breakfast as always, our favourite breakfast spot"
196,Prins Heerlijk, 4 stars ,5 years ago,"Best sandwich bar in town. A little bit pricey, though."
197,Prins Heerlijk, 5 stars ,6 years ago,"Very tasty. The staff very kind.
Good breakfast..."
198,Prins Heerlijk, 5 stars ,4 years ago,Lovely breakfast plenty of options for different dietary requirements
199,Prins Heerlijk, 5 stars ,4 years ago,Great place to visit. Highly recommended.
200,Prins Heerlijk, 4 stars ,2 years ago,"Good food and coffee, fast friendly service"
201,Prins Heerlijk, 4 stars ,4 years ago,"Good local food, not expensive. Good to visit."
202,Prins Heerlijk, 5 stars ,2 years ago,Good food and well presented.Steak was excellent
203,Prins Heerlijk, 5 stars ,4 years ago,Fastastic food for the small price. Very tasty food and incredibly charming place.
204,Prins Heerlijk, 5 stars ,3 years ago,Amazing veggie omelette. Next I'll try the one with salmon.
205,Prins Heerlijk, 4 stars ,2 years ago,Lovely breakfast and really friendly staff
206,Prins Heerlijk, 1 star ,6 months ago,Worst customer service.
207,Prins Heerlijk, 5 stars ,4 years ago,"Great food, great coffee. Lovely staff."
208,Prins Heerlijk, 5 stars ,3 years ago,A friendly  staff and feel like home cooking great breakfast
209,Prins Heerlijk, 3 stars ,2 years ago,Excellent food and beers service very nice
210,Prins Heerlijk, 4 stars ,3 years ago,Nice place. Good food. Went a couple of times.
211,Prins Heerlijk, 5 stars ,3 years ago,"The food is really good, great service and staff"
212,Prins Heerlijk, 5 stars ,7 years ago,Great service and delicious food for a reasonable price.
213,Prins Heerlijk, 4 stars ,3 years ago,Very friendly and welcoming! Decent pancakes.
214,Prins Heerlijk, 4 stars ,5 years ago,Very small but very cool. Nice sandwich and pancake
215,Prins Heerlijk, 5 stars ,4 years ago,Great portions great taste wonderful service
216,Prins Heerlijk, 5 stars ,3 years ago,"Delicious bread, accommodating and friendly service."
217,Prins Heerlijk, 5 stars ,2 years ago,Very good food and very nice staff!
218,Prins Heerlijk, 5 stars ,6 months ago,Nice
219,Prins Heerlijk, 5 stars ,3 years ago,"Great local selection, friendly service, overall great experience"
220,Prins Heerlijk, 5 stars ,8 years ago,"Good espresso (illy)
Nice place, friendly crew!"
221,Prins Heerlijk, 5 stars ,2 years ago,Great place for early breakfast
222,Prins Heerlijk, 5 stars ,3 years ago,Best breakfast !!!!
223,Prins Heerlijk, 5 stars ,3 years ago,"Warm, cosy and friendly with lovely food"
224,Prins Heerlijk, 4 stars ,2 years ago,Super spicy food. Nice !!!
225,Prins Heerlijk, 5 stars ,4 years ago,Wonderful club sandwich. Very busy location.
226,Prins Heerlijk, 4 stars ,4 years ago,Little bit expensive place . The pancake with nutella is great
227,Prins Heerlijk, 5 stars ,2 years ago,Great for breakfast
228,Prins Heerlijk, 5 stars ,8 years ago,Great sandwiches before and after the redlight destrict B-)
229,Prins Heerlijk, 5 stars ,2 years ago,Like a lot that concept and tasty food also
230,Prins Heerlijk, 5 stars ,6 months ago,Great food
231,Prins Heerlijk, 5 stars ,5 years ago,Great breakfast in nice restaurant.
232,Prins Heerlijk, 5 stars ,3 years ago,Sweet potato fries were really good
233,Prins Heerlijk, 5 stars ,3 years ago,Great pancakes and hot fish!
234,Prins Heerlijk, 5 stars ,2 years ago,Amazing food. Made my morning
235,Prins Heerlijk, 4 stars ,5 years ago,Very nice place for calm breakfast
236,Prins Heerlijk, 4 stars ,3 years ago,Good breakfast
237,Prins Heerlijk, 5 stars ,3 years ago,"Wow wow wow! How do they do it???
Amazing food!"
238,Prins Heerlijk, 4 stars ,2 years ago,Very good place for breakfast
239,Prins Heerlijk, 4 stars ,2 years ago,"Lovely soup, friendly staff"
240,Prins Heerlijk, 2 stars ,6 months ago,Bad customer service
241,Prins Heerlijk, 1 star ,6 months ago,Worst behaviour.
242,Prins Heerlijk, 4 stars ,2 years ago,Decent place with nice food!
243,Prins Heerlijk, 5 stars ,3 years ago,Tasty breakfast and nice service
244,Prins Heerlijk, 4 stars ,3 years ago,Good breakfast in a small shop.
245,Prins Heerlijk, 4 stars ,3 years ago,The best “uitsmijter” ever. Friendly staff.
246,Prins Heerlijk, 5 stars ,2 years ago,Get the prince burger and the fries it’s epic
247,Prins Heerlijk, 5 stars ,4 years ago,The pulled chicken with bacon is amazing
248,Prins Heerlijk, 4 stars ,4 years ago,For such a small place the food is worth it
249,Prins Heerlijk, 5 stars ,2 years ago,Loved the food and the atmosphere
250,Prins Heerlijk, 4 stars ,3 years ago,"Tasty pancake, but small"
251,Prins Heerlijk, 4 stars ,3 years ago,I loved their pancakes 😍😍😍
252,Prins Heerlijk, 3 stars ,3 years ago,Good food. Kinda pricy.
253,Prins Heerlijk, 5 stars ,3 years ago,Always ready for breakfast! 🥚🍳🥓🍟🥛
254,Prins Heerlijk, 5 stars ,3 years ago,Awesome place absolutely loved it.
255,Prins Heerlijk, 5 stars ,2 years ago,"Good food, good service."
256,Prins Heerlijk, 5 stars ,3 years ago,Great food and service!
257,Prins Heerlijk, 5 stars ,2 years ago,Friendly staff good food
258,Prins Heerlijk, 4 stars ,2 years ago,Great service and burgers
259,Prins Heerlijk, 5 stars ,5 years ago,"Food, Service, Ambient... simply excellent"
260,Prins Heerlijk, 4 stars ,2 years ago,Loved the veggie burger
261,Prins Heerlijk, 5 stars ,2 months ago,superchill!
262,Prins Heerlijk, 5 stars ,3 years ago,Great English breakfast
263,Prins Heerlijk, 5 stars ,2 years ago,Good breakfast and coffee!
264,Prins Heerlijk, 5 stars ,3 years ago,Fish burger with sweet fries
265,Prins Heerlijk, 5 stars ,4 years ago,Good hotel .great for Amsterdam
266,Prins Heerlijk, 5 stars ,a year ago,Unbelievable - absolutly King🔥
267,Prins Heerlijk, 3 stars ,3 years ago,Tasty food and nice place
268,Prins Heerlijk, 4 stars ,4 years ago,"Playing Dire straights, breakfast brothers in arms."
269,Prins Heerlijk, 5 stars ,6 years ago,"Always fresh, healthy, and friendly."
270,Prins Heerlijk, 5 stars ,3 years ago,Nice people and good food
271,Prins Heerlijk, 5 stars ,3 years ago,Lots of shops.friendly service
272,Prins Heerlijk, 5 stars ,2 years ago,Great pancakes.
273,Prins Heerlijk, 4 stars ,2 years ago,Great mint tea
274,Prins Heerlijk, 2 stars ,4 years ago,Cheap but poor coffee :(
275,Prins Heerlijk, 5 stars ,2 years ago,Great Burguer!
276,Prins Heerlijk, 5 stars ,4 years ago,Great hotel
277,Prins Heerlijk, 5 stars ,2 years ago,The croissant was perfect.
278,Prins Heerlijk, 5 stars ,2 years ago,Food is Amazing!
279,Prins Heerlijk, 1 star ,3 years ago,Terrible food and not good value
280,Prins Heerlijk, 5 stars ,5 years ago,Best sandwich around
281,Prins Heerlijk, 4 stars ,3 years ago,Warm and friendly
282,Prins Heerlijk, 5 stars ,2 years ago,Fabulous little Café
283,Prins Heerlijk, 5 stars ,4 years ago,Great!
284,Prins Heerlijk, 5 stars ,3 years ago,Great pancakes
285,Prins Heerlijk, 3 stars ,2 years ago,Good
286,Prins Heerlijk, 5 stars ,2 years ago,Nice for breakfast
287,Prins Heerlijk, 5 stars ,2 years ago,Great
288,Prins Heerlijk, 4 stars ,2 years ago,Yep liked it
289,Prins Heerlijk, 5 stars ,2 years ago,Love it always
290,Prins Heerlijk, 5 stars ,2 years ago,Good breakfast
291,Prins Heerlijk, 4 stars ,8 years ago,Great salads!
292,Prins Heerlijk, 4 stars ,2 years ago,Really nice
293,Prins Heerlijk, 5 stars ,3 years ago,Just loved it!!!!
294,Prins Heerlijk, 5 stars ,2 years ago,Good fun in here
295,Prins Heerlijk, 5 stars ,4 years ago,Good Burgers.
296,Prins Heerlijk, 5 stars ,5 years ago,Vega burger!
297,Prins Heerlijk, 5 stars ,2 years ago,delicious!
298,Prins Heerlijk, 5 stars ,3 years ago,Perfect coffe
299,Prins Heerlijk, 5 stars ,3 years ago,Awesome place
300,Prins Heerlijk, 4 stars ,3 years ago,Wonderful place
301,Prins Heerlijk, 1 star ,a day ago,"We stayed for 8 nights, and this place has the rudest waitress we’ve had in Amsterdam."
302,Prins Heerlijk, 5 stars ,5 months ago,(Translated by Google) My personal number 1 in Amsterdam when it comes to burgers. I've eaten here at least 10 times because I just can't get enough of the burgers🍔🔥 I'm looking forward to my next visit to Prins Heerlijk! …
303,Prins Heerlijk, 3 stars ,5 months ago,(Translated by Google) Small cozy terrace with a nice view of a shopping street and a square. Food was mediocre. …
304,Prins Heerlijk, 5 stars ,6 months ago,"(Translated by Google) Nice establishment. Loved the burgers - hot, fresh and juicy. After the visit, he left a tip - and the guy said that once a week they make food and feed children from poor families. They also buy toys and things for …"
305,Prins Heerlijk, 5 stars ,a year ago,"(Translated by Google) Warm and welcoming place, friendly helpful staff.
The place is perfect for couples or up to 3 people being small as a place, the food that is to say perfect plentiful prepared impeccably! …"
306,Prins Heerlijk, 4 stars ,2 years ago,"(Translated by Google) Small cozy place, warm staff with fast service. Had a very good meal on the go. Vegetarian burger not bad at all. …"
307,Prins Heerlijk, 5 stars ,2 years ago,"(Translated by Google) Small cozy place, the team is in a good mood in the morning. The service is impeccable. The pancakes are very good. Location in the center open from 8am. …"
308,Prins Heerlijk, 3 stars ,3 years ago,(Translated by Google) It is a small place like all the others in this place. They are friendly and the desserts are great. But it is excessively expensive. Two large Cappuccinos and 2 desserts 20 euros. …
309,Prins Heerlijk, 1 star ,4 months ago,"(Translated by Google) The menu has changed compared to the opinions (change of owner?), What is served is edible but not worth the detour. Much too expensive for the quality. Very cold welcome, not worth its grade …"
310,Prins Heerlijk, 4 stars ,2 years ago,"(Translated by Google) Full
A little sweet cafe in the center. There are snacks, dessert and coffee. Time can be spent shortly. Staff is relevant, prices are average …"
311,Prins Heerlijk, 5 stars ,2 years ago,"(Translated by Google) Wow, really....I was really happy after coming here. I ate this and felt really happy... I was hungry, so it was terrifyingly delicious. I ate it alone, and it was about 7 euros for mini pancakes and 10 euros for …"
312,Prins Heerlijk, 5 stars ,4 months ago,"(Translated by Google) Great breakfast, fairly quick service.
Approximately € 10 for pancakes and cappuccino …"
313,Prins Heerlijk, 1 star ,6 months ago,"(Translated by Google) Unfortunately very small and not tasty pancakes. For 7.50 I expect a lot more.
Staff partly unfriendly and overwhelmed. …"
314,Prins Heerlijk, 5 stars ,2 years ago,(Translated by Google) Very tasty and great for breakfast. It's hard to get a seat. …
315,Prins Heerlijk, 5 stars ,2 years ago,"(Translated by Google) Tea room very well located in the old district of Haarlem, it is the ideal place to have breakfast: tea, coffee, scones, setting, everything is perfect. Not to mention the staff very attentive! …"
316,Prins Heerlijk, 3 stars ,6 months ago,"(Translated by Google) Here we had a breakfast that took some getting used to.
Old Amsterdam Sandwich is a hamburger bun with three slices of cheese. …"
317,Prins Heerlijk, 5 stars ,3 years ago,"(Translated by Google) Excellent breakfast 🥞, for all savory and sweet tastes. Must try if you go to Amsterdam! …"
318,Prins Heerlijk, 5 stars ,3 years ago,"(Translated by Google) A small restaurant, but very tasty, home-cooked food.

Pictures tell words ... …"
319,Prins Heerlijk, 5 stars ,3 years ago,"(Translated by Google) very very good breakfast! super cute and warm place! fast service, I order this place in Amsterdam! …"
320,Prins Heerlijk, 5 stars ,3 years ago,(Translated by Google) Breakfast on site ... a killer !!! I recommend the chocolate banana pancakes with homemade chocolate ... the service is fast and the prices correct :) …
321,Prins Heerlijk, 5 stars ,2 years ago,"(Translated by Google) A nice place for breakfast: English, German and other breakfasts, as well as yogurt with granola, pancakes and more. …"
322,Prins Heerlijk, 5 stars ,4 years ago,"(Translated by Google) Excellent cuisine, the restaurant is run by two very nice girls! 😊 …"
323,Prins Heerlijk, 3 stars ,8 months ago,"(Translated by Google) Staff is overwhelmed and stressed even though the restaurant was almost empty. Unfortunately, the pancakes weren't really fresh.
Unfortunately not to be recommended. …"
324,Prins Heerlijk, 5 stars ,5 months ago,"(Translated by Google) Very nice staff and great breakfast.

(Original) …"
325,Prins Heerlijk, 5 stars ,2 years ago,"(Translated by Google) Small but cozy place near the central station. I had an excellent breakfast (espresso + chocolate croissant) spending about 6.50. Sunny and friendly staff, excellent food and acceptable coffee …"
326,Prins Heerlijk, 5 stars ,2 years ago,(Translated by Google) Yesterday ended up here by accident because we wanted to eat something quickly for a concert. We couldn't have had it better! …
327,Prins Heerlijk, 4 stars ,2 years ago,(Translated by Google) Small friendly and cozy place at the foot of the many hotels in the area. A bit expensive for what it is but as we just arrived from the station is not too bad for a break. The fries with burgers are against by not …
328,Prins Heerlijk, 5 stars ,4 years ago,"(Translated by Google) Tasty burgers, fast service and extremely friendly staff. And all in a nice location! Look out the window to see the colorful people walking by! …"
329,Prins Heerlijk, 3 stars ,3 years ago,"(Translated by Google) We were yesterday in this place for a quick dinner, the place very nice, the simple and very good sandwiches, I recommend the sweet potatoes as a side. Too bad for the blond room who had a lot of sympathy to sell 😅 …"
330,Prins Heerlijk, 5 stars ,a year ago,"(Translated by Google) Very tasty and above all very friendly staff. Great location and reasonable prices
We're here for the second time today and if there is a free table outside …"
331,Prins Heerlijk, 4 stars ,2 years ago,"(Translated by Google) Great place for a good English lunch! The staff is simpa, responsive.
It's a little expensive but they offered us a juice 🥝 …"
332,Prins Heerlijk, 5 stars ,2 years ago,"(Translated by Google) Best baguettes in town. Especially the chicken special. A little bit small, but if you tolerate something you get a seat. The portions could be a little bigger. But in terms of taste it is the best that the city has …"
333,Prins Heerlijk, 3 stars ,2 years ago,"(Translated by Google) Eat them ok especially the breakfast

(Original)
أكلهم طيب خصوصا الفطار"
334,Prins Heerlijk, 5 stars ,2 years ago,"(Translated by Google) Great restaurant where you can have breakfast with friendly staff. Seating is not always possible, but it's definitely worth waiting for. Will definitely come again sicherlich …"
335,Prins Heerlijk, 5 stars ,7 months ago,"(Translated by Google) Very friendly welcome, practical for a quick snack and delicious. …"
336,Prins Heerlijk, 5 stars ,4 years ago,"(Translated by Google) Great little restaurant. Super cheap for the city center location. Everything we had was delicious and freshly prepared. Nice girls behind the counter. There are very few seats inside, but you can also sit outside. …"
337,Prins Heerlijk, 5 stars ,2 years ago,"(Translated by Google) Short stay in Amsterdam, we discovered by chance this place. We had breakfast there (very well served and rather rich!). Then we went back for a snack. …"
338,Prins Heerlijk, 3 stars ,4 years ago,"(Translated by Google) I wanted a quick bite to eat before catching my train back to Belgium and I made a good choice. The waiters very active and friendly with each other, you could see the good relationship they had although maybe they …"
339,Prins Heerlijk, 5 stars ,5 months ago,"(Translated by Google) Good place for European breakfasts.

(Original) …"
340,Prins Heerlijk, 5 stars ,2 years ago,"(Translated by Google) I had a delicious breakfast croissant, bacon with egg. A delicious coffee The place is small, but cozy and sufficient. Average prices, but fair for the quality of the product. …"
341,Prins Heerlijk, 3 stars ,4 years ago,"(Translated by Google) Correct but nothing exceptional. The sweet potato fries are nice but super fatty. The hummus is not bad, served on a slice of sandwich-style bread (the only vegan dish on the menu). The waitress could be nicer, it …"
342,Prins Heerlijk, 5 stars ,4 years ago,"(Translated by Google) Really a great coffee in the early morning just as it should be small cozy and smells of coffee.
All in all a very, very great atmosphere and simply delicious what is offered. …"
343,Prins Heerlijk, 2 stars ,4 years ago,(Translated by Google) Reasonable sandwiches although it is not very special for the high price you pay. The Americain Pancakes of € 10 are not worth their price and come from the microwave. …
344,Prins Heerlijk, 4 stars ,3 years ago,"(Translated by Google) Good location and good service. Poor infrastructure. Very little room at indoor tables. Not to mention the bathrooms, nonexistent .... As for prices, it is within the mid-range. Point in favor is that they open very …"
345,Prins Heerlijk, 5 stars ,a year ago,"(Translated by Google) In the top ! Open early, very good, quite varied choice for lunch. Team in a good mood nothing to complain about testing absolutely! …"
346,Prins Heerlijk, 5 stars ,2 years ago,(Translated by Google) The original line was too long and I regret it. Homemade hamburger It was basic but it was well mixed and it was delicious! …
347,Prins Heerlijk, 4 stars ,2 years ago,"(Translated by Google) Good service and pretty good food. The price is reasonable and they serve pancake-style breakfast food, or eggs prepared in various ways, all day. …"
348,Prins Heerlijk, 2 stars ,3 years ago,"(Translated by Google) Narrow and noisy
But very friendly staff
Unfortunately, as is often the case in Holland, the food does not have much …"
349,Prins Heerlijk, 3 stars ,4 years ago,"(Translated by Google) Correct but really not extra: very fatty, steak which does not seem to be necessarily 100% pure beef. 3 stars because friendly team and food which is nevertheless edible …"
350,Prins Heerlijk, 2 stars ,4 years ago,"(Translated by Google) The food was tasty, not very much though. Just a pity that you have to wait 15 minutes for the bill and then wait 20 minutes until you can pay ... Because you walk to the kitchen yourself. …"
351,Prins Heerlijk, 4 stars ,4 years ago,"(Translated by Google) Super central! We were accommodated in the annex, unfortunately the stairs were very steep and the up and down with a larger suitcase becomes a sporting challenge here! Otherwise very nice staff and definitely …"
352,Prins Heerlijk, 1 star ,4 years ago,"(Translated by Google) no longer for amsterdammers, only tourist still welcome. various sandwiches off the menu, become tighter, cozier. now only breakfast factory …"
353,Prins Heerlijk, 3 stars ,3 years ago,"(Translated by Google) Small, rather uncomfortable to sit on. There are little things to eat that are okay. Long opening times and offers for all meals / times of the day, also to take away. …"
354,Prins Heerlijk, 5 stars ,4 years ago,"(Translated by Google) Super tasty burgers! Sweet little restaurant with nice conditions.
Food is served quickly. …"
355,Prins Heerlijk, 5 stars ,4 years ago,"(Translated by Google) Very nice place, kind service, you can eat or have just a coffee and a dessert. Low prices in relation to the place. …"
356,Prins Heerlijk, 1 star ,2 years ago,(Translated by Google) Weak and expensive food. Had lunch once. Badly dressed and unfriendly maid. Tiny restaurant. Tiny and unconditional toilet. Not to repeat. …
