,Name,Review Rate,Review Time,Review Text
159,Susie's Saloon, 5 stars ,2 years ago,"Good beers, great staff, nice people. Chilled pint"
160,Susie's Saloon, 5 stars ,4 years ago,Fab bar right in the centre of Amsterdam red light district. Great beer and great craic
161,Susie's Saloon, 5 stars ,a year ago,Lost my phone but Gael found it and put it behind the bar thank you.
162,Susie's Saloon, 5 stars ,a year ago,Breakfast is as lovely as the awesomeness of the bar and its staff
163,Susie's Saloon, 3 stars ,3 years ago,"Nice location, good beer, but a rude waitress spoilt our visit"
164,Susie's Saloon, 2 stars ,3 years ago,the lady at the bar is realy rude..👎 but the young runner guy is cool
165,Susie's Saloon, 5 stars ,2 years ago,Fun place to go for sure and great music!
166,Susie's Saloon, 5 stars ,4 years ago,"Good place in Amsterdam to have a drink near to red light
The staff is nice"
167,Susie's Saloon, 5 stars ,4 years ago,"Great service, good beer and excellent music!"
168,Susie's Saloon, 5 stars ,3 years ago,"Amazing atmosphere, super chill people all around"
169,Susie's Saloon, 5 stars ,4 years ago,Great place for a drink and right money nice people as well
170,Susie's Saloon, 4 stars ,5 years ago,"Good beer and nice atmosphere.

Very centric in the city"
171,Susie's Saloon, 3 stars ,5 years ago,Happy hours makes this place the cheapest place to have beers in central Amsterdam.
172,Susie's Saloon, 5 stars ,8 years ago,"Great staff, great sports coverage. very friendly, good food to"
173,Susie's Saloon, 5 stars ,4 years ago,"Nice food,great staff,great music, a must"
174,Susie's Saloon, 4 stars ,2 years ago,Good place to watch football. Except when there's rugby on.
175,Susie's Saloon, 5 stars ,4 years ago,Top bar with a massive smoke room. Friendly staff. Will be back
176,Susie's Saloon, 5 stars ,2 years ago,Amazing bar with a great atmosphere
177,Susie's Saloon, 5 stars ,2 years ago,Quality little bar staff great food ok
178,Susie's Saloon, 5 stars ,4 years ago,"Nice little bar, happy hour from 1530-1800"
179,Susie's Saloon, 5 stars ,4 years ago,Excellent place to go. Friendly and right in the centre close to everything you need.
180,Susie's Saloon, 5 stars ,4 years ago,"Love this place, very friendly staff, good for bar snacks, coffee and drinks"
181,Susie's Saloon, 5 stars ,2 years ago,"Great atmosphere, smoking room available."
182,Susie's Saloon, 3 stars ,3 years ago,"Boring, no ambiance, lacking authenticity. Feels out of place in Amsterdam"
183,Susie's Saloon, 5 stars ,2 years ago,Great Pub
184,Susie's Saloon, 5 stars ,2 years ago,First time I had visited it and it was a brilliant place
185,Susie's Saloon, 5 stars ,2 years ago,Had a great time drinking beer and watching people.
186,Susie's Saloon, 5 stars ,4 years ago,"Good bar, lovely indoor smoking areas"
187,Susie's Saloon, 4 stars ,2 years ago,Great for all aspects of your Amsterdam red light experience
188,Susie's Saloon, 5 stars ,2 years ago,"Rocking
Great service
Helpful crew
I would highly recommend."
189,Susie's Saloon, 5 stars ,4 years ago,Great bar on the edge of the Red Light district.
190,Susie's Saloon, 3 stars ,3 years ago,Good but a bit cramped blonde hair lady brilliant .
191,Susie's Saloon, 3 stars ,4 years ago,"Nice place friendly staff,  smoking room appreciated!"
192,Susie's Saloon, 5 stars ,5 years ago,Love this place! Everytime we're in the Dam deffo must see
193,Susie's Saloon, 4 stars ,4 years ago,"Large bar. In the centre, has smoking. Room outside seating right on the canals"
194,Susie's Saloon, 5 stars ,2 years ago,Cracking place to drink at. Looking foward to visiting Susie's again
195,Susie's Saloon, 5 stars ,3 years ago,This is a genuine bar with a lot of locals. Not the place for a romantic date.
196,Susie's Saloon, 5 stars ,a year ago,"Crazy english meeting place,just fun"
197,Susie's Saloon, 5 stars ,2 years ago,Interesting enviroment. Good music good beer.
198,Susie's Saloon, 5 stars ,5 years ago,"Friendly staff, good happy hour and friendly crowd. Will visit again."
199,Susie's Saloon, 5 stars ,5 years ago,Great spot for good but cheap drinks!
200,Susie's Saloon, 5 stars ,3 years ago,Made feel really welcome here had a couple of good night's here.
201,Susie's Saloon, 4 stars ,4 years ago,Nice bar in the centre/red light district.
202,Susie's Saloon, 5 stars ,2 years ago,"Great bar, great prices, great music!"
203,Susie's Saloon, 5 stars ,5 years ago,"Nice music
Low prices
Good Stuff
Close to the center"
204,Susie's Saloon, 5 stars ,3 years ago,Such a cool place everyone in the world should come here at least 1 time
205,Susie's Saloon, 5 stars ,3 years ago,Nice people great vibe tasty beers
206,Susie's Saloon, 3 stars ,5 years ago,"I like this bar, good prices for beers."
207,Susie's Saloon, 4 stars ,2 years ago,"Cheap drinks, nice staff."
208,Susie's Saloon, 5 stars ,4 years ago,"Nice staff, good tunes! Smoking room!"
209,Susie's Saloon, 4 stars ,7 months ago,Dive bar
210,Susie's Saloon, 5 stars ,2 years ago,My favourite place in Amsterdam. 10/10!
211,Susie's Saloon, 4 stars ,4 years ago,Customer service could be better but still clean and tidy.
212,Susie's Saloon, 4 stars ,4 years ago,Ordinary bar with a billiards table. Tourist crowd. Friendly staff.
213,Susie's Saloon, 5 stars ,2 years ago,Always a great place to drink
214,Susie's Saloon, 5 stars ,3 years ago,Good Happy Hour deals and pitcher prices
215,Susie's Saloon, 5 stars ,4 years ago,Fantastic time ones again can't wait to go back
216,Susie's Saloon, 5 stars ,3 years ago,Fantastic Biker Style Bar. Loved it!
217,Susie's Saloon, 5 stars ,4 years ago,Best place to visit in Dam - Staff and owners at out of this world. GDBS
218,Susie's Saloon, 4 stars ,4 years ago,Great little bar with a fantastic buzz about it.
219,Susie's Saloon, 4 stars ,3 years ago,"Great music, staff and beer"
220,Susie's Saloon, 5 stars ,5 years ago,"Really good atmosphere, plus all the sport"
221,Susie's Saloon, 5 stars ,2 years ago,Pitchers by the canal on a sunny day can’t be beat.
222,Susie's Saloon, 5 stars ,3 years ago,Great Saloon. Make a stop even if just quick
223,Susie's Saloon, 4 stars ,2 years ago,Come here for the happy hour!
224,Susie's Saloon, 5 stars ,2 years ago,Best bar in Dam central.
225,Susie's Saloon, 5 stars ,3 years ago,"Lovely bar, good beer"
226,Susie's Saloon, 5 stars ,3 years ago,"A great place to eat,drink and smoke"
227,Susie's Saloon, 5 stars ,3 years ago,Nice bar with smoking room.
228,Susie's Saloon, 5 stars ,3 years ago,Great bar great smoking area
229,Susie's Saloon, 4 stars ,3 years ago,"My type of place. Great service, staff and location. 😏"
230,Susie's Saloon, 5 stars ,3 years ago,Great music. Great atmosphere
231,Susie's Saloon, 5 stars ,2 years ago,"Great atmosphere, friendly staff"
232,Susie's Saloon, 4 stars ,2 years ago,If you like dope this is the place for you!
233,Susie's Saloon, 4 stars ,2 years ago,Nice place to have some beers
234,Susie's Saloon, 5 stars ,2 years ago,I went here every night i was in the dam what a place 👌👌
235,Susie's Saloon, 4 stars ,3 years ago,Nice ambience and very nice and friendly staff!
236,Susie's Saloon, 5 stars ,2 years ago,Love this place. Full  of characters
237,Susie's Saloon, 5 stars ,4 years ago,One of the best bars in town
238,Susie's Saloon, 5 stars ,3 years ago,Great happy hour prices!
239,Susie's Saloon, 5 stars ,3 years ago,Brilliant little spot! Food n beer spot on!
240,Susie's Saloon, 5 stars ,4 years ago,"A place where you can be yourself, nice and relaxed!!"
241,Susie's Saloon, 4 stars ,2 years ago,"Great staff, good laugh, nice place"
242,Susie's Saloon, 5 stars ,3 years ago,"Great bar, great location."
243,Susie's Saloon, 5 stars ,3 years ago,Chilled bar with a great smell
244,Susie's Saloon, 5 stars ,2 years ago,First visit to Amsterdam. Loved Susie's
245,Susie's Saloon, 4 stars ,3 years ago,One of the best bars in Amsterdam
246,Susie's Saloon, 5 stars ,2 years ago,All bars are great
247,Susie's Saloon, 5 stars ,3 years ago,A very cool place in deed.👍👍
248,Susie's Saloon, 5 stars ,4 years ago,Brilliant bar
249,Susie's Saloon, 5 stars ,2 years ago,Great staff and friendly locals 👍🏻
250,Susie's Saloon, 5 stars ,4 years ago,"Great staff, Great music."
251,Susie's Saloon, 5 stars ,5 years ago,Funky spot to have a drink and smoke
252,Susie's Saloon, 3 stars ,4 years ago,Wasn't as good as I remembered. Still worth a visit
253,Susie's Saloon, 3 stars ,4 years ago,Cheap beer and good service.
254,Susie's Saloon, 5 stars ,3 years ago,Never been to amsterdam without a trip here
255,Susie's Saloon, 5 stars ,4 years ago,Nice place to dring some beer.
256,Susie's Saloon, 5 stars ,2 years ago,Great atmosphere and music
257,Susie's Saloon, 5 stars ,3 years ago,I’ve killed a few hours in here over the years
258,Susie's Saloon, 3 stars ,2 years ago,Bar ok loud music
259,Susie's Saloon, 3 stars ,3 years ago,"Got kicked out of this place in the end, the staff are pretty rude. If you’re looking for somewhere to have a beer, game of pool and escape large crowds, this is ok. They serve Grolsch instead of Heineken on tap which is cheaper than your average pint around Amsterdam. Oh, and they are pet friendly 🐶"
260,Susie's Saloon, 5 stars ,4 years ago,Nice and cosy lovely staff
261,Susie's Saloon, 5 stars ,3 years ago,Happy hour works for me
262,Susie's Saloon, 3 stars ,3 years ago,"Nice location, good beer, but a rude waitress spoilt our visit"
263,Susie's Saloon, 1 star ,3 years ago,We've been send off within 45 minutes for the reason that we were not ordering enough drinks.. Really unfriendly waiter.
264,Susie's Saloon, 5 stars ,2 years ago,I went here every night i was in the dam what a place 👌👌
265,Susie's Saloon, 4 stars ,4 years ago,"Large bar. In the centre, has smoking. Room outside seating right on the canals"
266,Susie's Saloon, 4 stars ,2 years ago,Great bar!
267,Susie's Saloon, 4 stars ,3 years ago,Happy hour is goos
268,Susie's Saloon, 5 stars ,4 years ago,One of the best bars in town
269,Susie's Saloon, 5 stars ,4 years ago,Best full English in town
270,Susie's Saloon, 5 stars ,3 years ago,Happy hour works for me
271,Susie's Saloon, 4 stars ,2 years ago,Great bar
272,Susie's Saloon, 5 stars ,2 years ago,"Dope music, chill place"
273,Susie's Saloon, 5 stars ,2 years ago,Such fun
274,Susie's Saloon, 5 stars ,3 years ago,Best bar in Amsterdam!
275,Susie's Saloon, 4 stars ,3 years ago,Great hole in the wall place.
276,Susie's Saloon, 5 stars ,2 years ago,Really nice bar
277,Susie's Saloon, 4 stars ,3 years ago,Happy hour is goos
278,Susie's Saloon, 4 stars ,4 years ago,Good choice of jukebox music..
279,Susie's Saloon, 5 stars ,2 years ago,not bad
280,Susie's Saloon, 4 stars ,3 years ago,Beautiful place well worth a visit
281,Susie's Saloon, 4 stars ,2 years ago,Great bar
282,Susie's Saloon, 4 stars ,4 years ago,No bad. Howling of weed but
283,Susie's Saloon, 5 stars ,2 years ago,good beer
284,Susie's Saloon, 1 star ,6 months ago,Bad service
285,Susie's Saloon, 2 stars ,2 years ago,Too busy and too many tourists
286,Susie's Saloon, 5 stars ,3 years ago,Very fun
287,Susie's Saloon, 5 stars ,4 years ago,Best bar in amsterdam
288,Susie's Saloon, 5 stars ,3 years ago,Super pab
289,Susie's Saloon, 5 stars ,3 years ago,Fav coffee shop in Amsterdam
290,Susie's Saloon, 5 stars ,4 years ago,Nice and cosy lovely staff
291,Susie's Saloon, 5 stars ,3 years ago,cool bar
292,Susie's Saloon, 5 stars ,2 years ago,Best bar in Amsterdam
293,Susie's Saloon, 5 stars ,5 years ago,5 Stars !
294,Susie's Saloon, 4 stars ,4 years ago,Good place with nice  English service
295,Susie's Saloon, 5 stars ,2 years ago,Great pub!
296,Susie's Saloon, 5 stars ,5 years ago,Good bar
297,Susie's Saloon, 5 stars ,3 years ago,Nice cheap beer.
298,Susie's Saloon, 5 stars ,3 years ago,Really cool place.
299,Susie's Saloon, 4 stars ,2 years ago,Good place to Hangout
300,Susie's Saloon, 5 stars ,4 years ago,Amazing pub!
301,Susie's Saloon, 5 stars ,4 years ago,Best full English in town
302,Susie's Saloon, 3 stars ,4 years ago,OK. Normal pricing for Amsterdam
303,Susie's Saloon, 4 stars ,2 years ago,Great pub!!
304,Susie's Saloon, 5 stars ,3 years ago,This place will make you drunk 😅
305,Susie's Saloon, 5 stars ,3 years ago,Great for a pint.
306,Susie's Saloon, 5 stars ,3 years ago,I always stop in when in Amsterdam!
307,Susie's Saloon, 5 stars ,2 years ago,Great place to chill
308,Susie's Saloon, 5 stars ,4 years ago,Amazing and staff are lovely
309,Susie's Saloon, 5 stars ,a year ago,Amazing
310,Susie's Saloon, 5 stars ,3 years ago,Great location and people
311,Susie's Saloon, 3 stars ,5 years ago,Leanne loves the place
312,Susie's Saloon, 3 stars ,2 years ago,Hmmmmm
313,Susie's Saloon, 5 stars ,3 years ago,Best people ever
314,Susie's Saloon, 4 stars ,5 years ago,have a pool table
315,Susie's Saloon, 5 stars ,4 years ago,Loved it
316,Susie's Saloon, 5 stars ,4 years ago,Fantastic bar ✌
317,Susie's Saloon, 5 stars ,2 years ago,Amazing vibe in here
318,Susie's Saloon, 3 stars ,5 years ago,Crowded touristic place
319,Susie's Saloon, 4 stars ,3 years ago,Bissy but frendley
320,Susie's Saloon, 5 stars ,2 years ago,Top
321,Susie's Saloon, 5 stars ,4 years ago,Such a lovely place
322,Susie's Saloon, 3 stars ,4 years ago,Need improvement on service
323,Susie's Saloon, 5 stars ,2 years ago,Nice
324,Susie's Saloon, 4 stars ,2 years ago,The tipical pub
325,Susie's Saloon, 5 stars ,3 years ago,"Top place, luv it..."
326,Susie's Saloon, 5 stars ,3 years ago,Absolutely brilliant
327,Susie's Saloon, 5 stars ,3 years ago,Can be
328,Susie's Saloon, 5 stars ,3 years ago,Brilliant
329,Susie's Saloon, 5 stars ,4 years ago,Great atmosphere
330,Susie's Saloon, 5 stars ,3 years ago,Awesome
331,Susie's Saloon, 4 stars ,3 years ago,Good ambiance
332,Susie's Saloon, 4 stars ,4 years ago,Nice
333,Susie's Saloon, 5 stars ,2 years ago,Special
334,Susie's Saloon, 4 stars ,3 years ago,Fine place to be !
335,Susie's Saloon, 3 stars ,4 years ago,Ok for a beer
336,Susie's Saloon, 5 stars ,4 years ago,Great cafe
337,Susie's Saloon, 5 stars ,3 years ago,Epic
338,Susie's Saloon, 5 stars ,3 years ago,Like it like it ;)
339,Susie's Saloon, 5 stars ,3 years ago,Love it here
340,Susie's Saloon, 4 stars ,4 years ago,Good atmosphere
341,Susie's Saloon, 3 stars ,2 years ago,Never alters
342,Susie's Saloon, 5 stars ,6 years ago,Simply...best.
343,Susie's Saloon, 5 stars ,4 years ago,I love this place
344,Susie's Saloon, 5 stars ,3 years ago,Friendly place 😍
345,Susie's Saloon, 5 stars ,5 years ago,Great location
346,Susie's Saloon, 5 stars ,3 years ago,Perfect place
347,Susie's Saloon, 5 stars ,3 years ago,Outstanding 😜
348,Susie's Saloon, 5 stars ,2 years ago,Cultured location
349,Susie's Saloon, 5 stars ,2 years ago,Enlightenment
350,Susie's Saloon, 4 stars ,2 years ago,Correct 👍👍👍
351,Susie's Saloon, 5 stars ,4 days ago,Nice location. Had a wonderful night there. Good stuff.
352,Susie's Saloon, 5 stars ,3 months ago,"(Translated by Google) It was always fun, let's go further, Herman van Frontier says! …"
353,Susie's Saloon, 5 stars ,8 months ago,"(Translated by Google) Cozy place with nice drinks. It is true that you have to get your drink yourself when you sit outside, but it is great that you walk in and can chat with strangers for a while and you walk back to your seat with a …"
354,Susie's Saloon, 5 stars ,4 months ago,"(Translated by Google) A great bar where you immediately feel at home!

(Original) …"
355,Susie's Saloon, 5 stars ,3 months ago,"(Translated by Google) Nice location and cozy place

(Original) …"
356,Susie's Saloon, 5 stars ,3 years ago,"(Translated by Google) Nice place with outdoor seating.
Open until 00.00
Not too expensive beer when you go in and buy …"
357,Susie's Saloon, 5 stars ,7 months ago,(Translated by Google) The best bar in the country go there and you will understand the people are great and the atmosphere is there !!! …
358,Susie's Saloon, 4 stars ,a year ago,"(Translated by Google) Nice place to drink a jug of beer. They also have happy hour and then you drink a bit cheaper. Was very quiet during covid19, normally quite busy. …"
359,Susie's Saloon, 5 stars ,4 months ago,"(Translated by Google) Good pub, pub for good mood
Grade 5 …"
360,Susie's Saloon, 1 star ,2 years ago,"(Translated by Google) After our drinks were empty, the old one told us to go or order again. 15 minutes from the extension was still over, honestly, I have never had anything disrespectful in a pub / pub. …"
361,Susie's Saloon, 4 stars ,4 years ago,(Translated by Google) Atmospheric bar where a lot of local. I advise you to visit only at happy hours. …
362,Susie's Saloon, 5 stars ,2 years ago,"(Translated by Google) Our favorite bar in Amsterdam, good beer, has a smoking area inside the premises is great, the waiters are friendly, good music and a very good atmosphere. I recommend it 100%. Next time I come back I will definitely …"
363,Susie's Saloon, 5 stars ,a year ago,(Translated by Google) Good choice of beers. Billiards. Large counter. Nice boss. Small terrace near the canal for tourists. …
364,Susie's Saloon, 5 stars ,6 months ago,"(Translated by Google) Good atmosphere, good map. Simply recommended.

(Original) …"
365,Susie's Saloon, 1 star ,3 years ago,"(Translated by Google) The bartender was nice! , but you have to get your own drink. The music was way too loud and the rose was impossible to drink. The toilet was gross and the regulars were quite obnoxious. …"
366,Susie's Saloon, 5 stars ,2 years ago,(Translated by Google) We were there for several days. Great for chilling a beer and smoking. Sport is by the way and music is also interesting. Please continue like this! 👍 …
367,Susie's Saloon, 5 stars ,3 years ago,"(Translated by Google) Very nice saloon, pleasant staff and billiards available for only 1 euro.
Very good prices (12.50 euros for 10 jagger shots) and interesting happy hour! …"
368,Susie's Saloon, 5 stars ,3 years ago,"(Translated by Google) Excellent attention and very good beers.

(Original) …"
369,Susie's Saloon, 4 stars ,a year ago,"(Translated by Google) Pretty decent happy hour for what is Amsterdam, the atmosphere is not the best but it makes up for it with a very good location …"
370,Susie's Saloon, 4 stars ,5 years ago,(Translated by Google) Beautiful terrace on the water. The service is pretty messy but that does not make the atmosphere any less. Interior decoration is also very nice. Expect pricing center. …
371,Susie's Saloon, 4 stars ,2 years ago,"(Translated by Google) Nice music venue of all kinds, with a smoking area, the girl at the bar a bit scammed in the service but still advised …"
372,Susie's Saloon, 5 stars ,2 years ago,"(Translated by Google) The beer is very good and not at the price of gold, it is in a very central place, the atmosphere is great and the rock music is even better. For me it has everything …"
373,Susie's Saloon, 5 stars ,3 years ago,"(Translated by Google) If you visit Amsterdam, do not forget to stop by this place, it is super comfortable, the beer is very good and if you have happy hour it is very cheap, they have a special padding so you can smoke without having to …"
374,Susie's Saloon, 4 stars ,3 years ago,(Translated by Google) Top spot! Especially if you want to refuel with a group of friends. Happy Hour 3 for a pint. …
375,Susie's Saloon, 5 stars ,3 years ago,"(Translated by Google) Bar with good music, it has an area for founders the glass of beer at 5 euros normal for the area but I found it expensive, normal for a previous one …"
376,Susie's Saloon, 5 stars ,4 years ago,"(Translated by Google) For the first time I was there in 1992, at the time it was also coffeeshop, when I come to Amsterdam a stop is mandatory! …"
377,Susie's Saloon, 4 stars ,4 years ago,(Translated by Google) It has a smooking room and a store to choose which songs sound € 3x1 !!! Also happy hours with good cadi prices. …
378,Susie's Saloon, 3 stars ,4 years ago,(Translated by Google) The clients are from Amsterdam. They have two moments with happy hour. The terrace is in front of one of the rivers. Very nice. …
379,Susie's Saloon, 5 stars ,a year ago,(Translated by Google) great atmosphere relaxed voice and you can buff. definitely wants to go back …
380,Susie's Saloon, 3 stars ,3 years ago,(Translated by Google) Top tent! Asterisks less because 50 cents will be charged for debit card payments. …
381,Susie's Saloon, 4 stars ,a year ago,"(Translated by Google) The service was friendly, good, and fast. Glad this was my first pub …"
382,Susie's Saloon, 5 stars ,3 years ago,"(Translated by Google) Very good cafe, nice staff and the happy hour pints taste good! …"
383,Susie's Saloon, 5 stars ,2 years ago,"(Translated by Google) Mind bar! Good musicians! Bring your own weed 😉

(Original) …"
384,Susie's Saloon, 3 stars ,2 years ago,(Translated by Google) Staff cannot get to work. On the terrace you have to go get your drink yourself. …
385,Susie's Saloon, 5 stars ,3 years ago,"(Translated by Google) Top employees in a good mood. Delicious ""English Breakfast"". Was fun. …"
386,Susie's Saloon, 5 stars ,4 years ago,"(Translated by Google) Good pub to hang out, there is also a billiard table. Watch out, don't fall into the canal !!! …"
387,Susie's Saloon, 3 stars ,2 years ago,(Translated by Google) It's all right. I now know how Adis and Kalles worked for the first time. …
388,Susie's Saloon, 4 stars ,2 years ago,"(Translated by Google) Great place. So does Bar, so does Coffee Shop, Paul too. Also close to Primark .... …"
389,Susie's Saloon, 5 stars ,3 years ago,"(Translated by Google) Great location. Great music, nice people and good beer

(Original) …"
390,Susie's Saloon, 5 stars ,5 years ago,"(Translated by Google) cool bar

(Original)
coole Bar"
391,Susie's Saloon, 5 stars ,3 years ago,"(Translated by Google) Excellent bar! Good sandwiches too :)

(Original) …"
392,Susie's Saloon, 5 stars ,2 years ago,"(Translated by Google) Home simpatic, very good atmosphere. I recommend

(Original) …"
393,Susie's Saloon, 5 stars ,4 years ago,"(Translated by Google) Very nice pub with terribly tasty beer !!

(Original) …"
394,Susie's Saloon, 5 stars ,4 years ago,"(Translated by Google) Good care and smoking room, serious people HA Mc

(Original) …"
395,Susie's Saloon, 5 stars ,3 years ago,"(Translated by Google) Really nice bar to enjoy Amsterdam!

(Original) …"
396,Susie's Saloon, 1 star ,2 years ago,(Translated by Google) Very rude hello said and after 20min still nobody came to use / order …
397,Susie's Saloon, 4 stars ,2 years ago,"(Translated by Google) Pool table, separate smoking area, cozy

(Original) …"
398,Susie's Saloon, 4 stars ,4 years ago,"(Translated by Google) Good music, space for smokers, great atmosphere

(Original) …"
399,Susie's Saloon, 5 stars ,2 years ago,"(Translated by Google) Friendly people and a delicious English breakfast!

(Original) …"
400,Susie's Saloon, 4 stars ,a year ago,"(Translated by Google) Old western saloon, super nice place

(Original) …"
401,Susie's Saloon, 5 stars ,4 years ago,"(Translated by Google) Cozy atmosphere, not very touristy, it is very quiet.

(Original) …"
402,Susie's Saloon, 5 stars ,3 years ago,"(Translated by Google) Good place to have a few beers and relax!

(Original) …"
403,Susie's Saloon, 5 stars ,2 years ago,"(Translated by Google) They do not have beer without gluten

(Original)
No tienen cerveza sin gluten"
404,Susie's Saloon, 5 stars ,2 years ago,"(Translated by Google) Cool pub.

(Original)
Coole Kneipe."
405,Susie's Saloon, 5 stars ,4 years ago,"(Translated by Google) Great, great atmosphere, decent price, professional manager! …"
406,Susie's Saloon, 5 stars ,3 years ago,"(Translated by Google) Place that wilso likes, but it does not matter to me.

(Original) …"
407,Susie's Saloon, 4 stars ,3 years ago,"(Translated by Google) Where you expect. Just not a pub.

(Original) …"
408,Susie's Saloon, 3 stars ,4 years ago,"(Translated by Google) Cozy pub, good beer, good music.

(Original) …"
409,Susie's Saloon, 4 stars ,3 years ago,"(Translated by Google) I even recommend so often full.

(Original) …"
410,Susie's Saloon, 5 stars ,11 months ago,"(Translated by Google) Thumbs up. Glasses too!

(Original)
Daumen hoch. Gläser auch!"
411,Susie's Saloon, 4 stars ,4 years ago,"(Translated by Google) Nice place, good music and medium service

(Original) …"
412,Susie's Saloon, 4 stars ,3 years ago,"(Translated by Google) Excellent option for a good Grolsch

(Original) …"
413,Susie's Saloon, 4 stars ,4 years ago,"(Translated by Google) Old-fashioned cosiness. Nice atmosphere.

(Original) …"
414,Susie's Saloon, 5 stars ,2 years ago,"(Translated by Google) A pleasant atmosphere, friendly staff

(Original) …"
415,Susie's Saloon, 1 star ,2 years ago,"(Translated by Google) Very unfriendly and rude hostess

(Original) …"
416,Susie's Saloon, 4 stars ,3 years ago,"(Translated by Google) Nice place in the middle of the fried egg yolk

(Original) …"
417,Susie's Saloon, 5 stars ,3 years ago,"(Translated by Google) Sussies is the best bar in Amsterdam

(Original) …"
418,Susie's Saloon, 4 stars ,2 years ago,"(Translated by Google) Always my pleasure

(Original)
Immer wieder gerne"
419,Susie's Saloon, 5 stars ,5 years ago,"(Translated by Google) Very good music.

(Original)
Muy buena música."
420,Susie's Saloon, 5 stars ,3 years ago,"(Translated by Google) Chilled ... incl. smoker lounge ... 😃

(Original) …"
421,Susie's Saloon, 5 stars ,4 years ago,"(Translated by Google) Big seal big beer big biker

(Original) …"
422,Susie's Saloon, 5 stars ,3 years ago,"(Translated by Google) You just have to go there

(Original)
Mann muss eifach dort hin"
423,Susie's Saloon, 1 star ,a year ago,"(Translated by Google) Stank jester cat

(Original)
Stonk nar kat"
