,Name,Review Rate,Review Time,Review Text
121,De blauwe Hollander, 5 stars ,5 years ago,"Really tasty food. Ordered the carrot and curry soup, which was great in this winter weather. The beef stamppot was outstanding; the gravy goes great with the stamppot (which is something like mashed potatoes with veggies in it). Price goes for €20.60 for a set of soup, stamppot and a yoghurt dessert. Recommend highly for Dutch food!"
122,De blauwe Hollander, 5 stars ,2 years ago,"Tasty meal, great service!"
123,De blauwe Hollander, 2 stars ,2 years ago,"The meat wasn't bad but the clams were too cooked and they didn't tasted good, the restaurant was too hot and the tables were soo close between each other that you didn't had your privacy; but the most annoying thing was the rude staff"
124,De blauwe Hollander, 5 stars ,2 years ago,"Nice and friendly staff, good Dutch cuisine (thanks for letting me found it out) and last, but not least, honest price. Surely we'll see each other at next trip in Amsterdam."
125,De blauwe Hollander, 5 stars ,2 years ago,"Fantastic beer , great food and good service"
126,De blauwe Hollander, 5 stars ,6 years ago,"We had been hoping to find Dutch cuisine, but didn't see much around, so we decided to go to whatever looked good.  We walked around looking for a place to eat forever and found De Blauwe Hollander, a Dutch place after all!  We both had different versions of the vegetarian hotch potch, which was delicious and very filling."
127,De blauwe Hollander, 4 stars ,3 years ago,"Typical local restaurant with original dutch food. Everyone who was in Holland can confim, that the dutch cuisine is nothing special. But De blauwe Hollander can show you the dutch food from the other, better and delicious way. Even a …"
128,De blauwe Hollander, 4 stars ,2 years ago,Typical Dutch restaurant. I enjoyed the tender beach and the Cheese as starter.
129,De blauwe Hollander, 5 stars ,6 years ago,"We tried this restaurant with the advice of Tripadvisor, high rank of the list. What I had for dinner is Fishsoup with codfilet, mussels, dutch shrimps, paprika mayonnaise and bread! It can't be more tasty! The best fish soup I have had in …"
130,De blauwe Hollander, 5 stars ,a year ago,Nice food and excellent service!
131,De blauwe Hollander, 4 stars ,2 years ago,Good local food. Price/quality relation is acceptable. Do not expect too much space it is tight seated. Reservation is recommended.
132,De blauwe Hollander, 5 stars ,2 years ago,Amazing food and nice staff! Really decent prices for the quality of food they serve and comparing to other places in Amsterdam! Well worth earing here
133,De blauwe Hollander, 4 stars ,2 years ago,"Good local cuisine, enjoyed chicken satay and steaming mussels, both great mains and large portions. Pleasant service too."
134,De blauwe Hollander, 5 stars ,a year ago,"The food is really good and the plate generous, then the personal is cheerful.
I strongly recommend !"
135,De blauwe Hollander, 5 stars ,5 years ago,"Friendly service, delicious Dutch food.  We particularly liked the cheese croquetes, the stampots, the daily specials, the soup, and for dessert; the apple pie and the little pancakes."
136,De blauwe Hollander, 4 stars ,4 years ago,"Great pancakes, I had with bacon she had with Nutella. Sometimes in the dam the bacon pancake can be very thin with little bacon so you're hungry again in an hour, but this was thick and delicious"
137,De blauwe Hollander, 4 stars ,3 years ago,"Great traditional food in Amsterdam. Stampot here is so great. Make booking in advance!
Price: £££ for what it is but it's worth it!"
138,De blauwe Hollander, 5 stars ,4 years ago,Delicious authentic Dutch food. Highly recommended for their pea soup and stamppot. Local beers also a nice touch.
139,De blauwe Hollander, 5 stars ,2 years ago,Good food and hostability  I recommend
140,De blauwe Hollander, 5 stars ,5 years ago,Lovely place. Very good typical food. The owner is very kind and prices are fair. Must go if you are in Amsterdam.
141,De blauwe Hollander, 5 stars ,4 years ago,"I can say only: OMG!! The food is really delicious and amazing. The waitress was very kind...If you want to try some local  food in Amsterdam, I highly recommend this restaurant!!!"
142,De blauwe Hollander, 4 stars ,3 years ago,Dutch food. We liked the food. Service was ok.
143,De blauwe Hollander, 5 stars ,2 years ago,Staff was really kind and food was great.
144,De blauwe Hollander, 5 stars ,3 years ago,Staff were very friendly. Food was simple and delicious. And it was a really nice end to my partners birthday weekend.
145,De blauwe Hollander, 1 star ,3 years ago,Some of the worst service I've had for the most mediocre food. Do not waste your time. Waited over 2 hrs for our food and were only comped for a couple drinks. Not worth it.
146,De blauwe Hollander, 5 stars ,3 years ago,Very good place to taste the typical dutch plate stampot but also for other kind of food. Good prices and awesome quality. Do bot forget to try the poffertjes
147,De blauwe Hollander, 5 stars ,2 years ago,"Amazing little place. Quick service and delicious, hearty Dutch cuisine. Thoroughly recommend the Stamppot"
148,De blauwe Hollander, 4 stars ,a year ago,"If you are in Amsterdam, then you must try this cozy little restaurant: the typical food is delicious and the waitress is so nice!"
149,De blauwe Hollander, 5 stars ,6 years ago,"I'm very happy with the food, service, ambiance, and value. I got exactly what I was looking for, a hearty, fresh, authentic Dutch dinner. Noms!"
150,De blauwe Hollander, 5 stars ,2 years ago,Excellent service! I was profoundly shocked by the outstanding quality/price rate. Great place to eat in the perfect location.
151,De blauwe Hollander, 5 stars ,6 years ago,Excellent food reasonable price. Low key atmosphere. A welcome escape from the guys on the street selling 5 euro pizza.
152,De blauwe Hollander, 3 stars ,2 years ago,"Recommend the Salmon. The beef wasn’t as tender as it should be.
Good price and one of few real local restaurant around !"
153,De blauwe Hollander, 4 stars ,6 years ago,Very attentive staff. Food arrived quickly and was absolutely delicious. A great place to try Dutch cuisine
154,De blauwe Hollander, 3 stars ,2 years ago,Lovely staff. They were very busy which may explain why my Stompot was cool. Shame cos it was very tasty.
155,De blauwe Hollander, 5 stars ,2 years ago,Authentic Dutch cuisine. I'm really happy we got a chance to experience the food and friendly staff.
156,De blauwe Hollander, 5 stars ,5 years ago,"Food_Snert at de Blauwe Hollander is served with a thick slab of bacon and dense, Frisian-style rye bread. Several varieties of stamppot are also on offer at de Blauwe Hollander, all of which are plated up with seasonal meats and generous lashings of gravy."
157,De blauwe Hollander, 5 stars ,2 years ago,Excellent food and service!
158,De blauwe Hollander, 4 stars ,2 years ago,Probably on the top 5 in Dutch food in Amsterdam
159,De blauwe Hollander, 5 stars ,2 years ago,Food was okay for the price. Its nice that there are some restaurants left in Amsterdam which don‘t scam you.
160,De blauwe Hollander, 4 stars ,6 years ago,"Really good Dutch food (and DO try the spare ribs, you won't regret it) and super friendly staff. Definitely a jewel in this most expensive part of town."
161,De blauwe Hollander, 5 stars ,2 years ago,"Great place for dinner. Nice personnel, good taste of food. Definitely recomended."
162,De blauwe Hollander, 5 stars ,4 years ago,We always eat here when passing through Amsterdam. Great food...especially when it's cold outside. Reservations essential
163,De blauwe Hollander, 5 stars ,3 years ago,"Great place to have an authentic dutch dinner! The location is perfect, just around Leidsplein, so you can enjoy the city!"
164,De blauwe Hollander, 4 stars ,3 years ago,"Popped in for a meal. Went for the traditional Dutch which was fine , tasty and tender. Service was good too."
165,De blauwe Hollander, 5 stars ,7 months ago,"Good food, nice place."
166,De blauwe Hollander, 2 stars ,4 years ago,"Food was fine, but the wait time to get served and between dishes arriving was far too long. This is a once only restaurant for me."
167,De blauwe Hollander, 5 stars ,4 years ago,Great traditional food and excellent beers. Service was quick and friendly. A must visit!
168,De blauwe Hollander, 5 stars ,2 years ago,"Great atmosphere, hospitality and food! Sergio treated us very well and it was the cherry on top of our last night in Amsterdam!!"
169,De blauwe Hollander, 4 stars ,4 years ago,"Decent food. If you go across to the Pantry, their people are more cheerful and food is tastier. Both are same on cost"
170,De blauwe Hollander, 5 stars ,3 years ago,"Nice restaurant with typical dutch food, the only drawback is that it is not too big so it gets full easily, better make a reservation!"
171,De blauwe Hollander, 4 stars ,5 years ago,I make a point to go here each time I visit Amsterdam. Good traditional Dutch food and friendly service at a very reasonable price.
172,De blauwe Hollander, 4 stars ,4 years ago,Traditional Dutch Cuisine. Very Kind & Friendly Staff. A bit crowded. Reservation highly recommended.
173,De blauwe Hollander, 2 stars ,2 years ago,"The food was very bland, but that is typical Dutch. Additionally, they forgot to put in our food order, so we waiting over 1.5 hours for our food."
174,De blauwe Hollander, 4 stars ,3 years ago,"A bit slow service but staff is nice,  you will find typical old Dutch cuisine here!"
175,De blauwe Hollander, 5 stars ,4 years ago,The feel of a home cooked meal like the stamppot while you're traveling...priceless. …
176,De blauwe Hollander, 5 stars ,6 years ago,"We had two soups that were great, the cheese croquettes are really tasty, the environment is warm."
177,De blauwe Hollander, 1 star ,2 years ago,Worst dutch made food i ever ate! Dont waste your money there! The quality of food is really bad!
178,De blauwe Hollander, 5 stars ,8 years ago,It was very tasty + it is the only place in Amsterdam (at least which I know) where you indeed can get dutch national food.
179,De blauwe Hollander, 5 stars ,5 years ago,"Very friendly service by staff, reasonable prices for traditional Dutch casual cuisine. Don't pass up this jem!"
180,De blauwe Hollander, 4 stars ,2 years ago,"The ribs are really good, the service was excellent . Decoration in general is good. Bathrooms can be improven."
181,De blauwe Hollander, 5 stars ,3 years ago,Beautiful restaurant. We stayed here having dinner. Very tasty dishes. I recomend it.
182,De blauwe Hollander, 1 star ,2 years ago,"Denied us lunch because we were 6 persons and they have tables of 4, so they would lose 2 seats. Unacceptable rude place!"
183,De blauwe Hollander, 5 stars ,3 years ago,Excellent place. Great experience. Delicious food and drinks. Attention available both in English or Spanish
184,De blauwe Hollander, 5 stars ,2 years ago,"Lovely Dutch food, very popular, reasonably priced and friendly staff."
185,De blauwe Hollander, 5 stars ,2 years ago,Everyone in my party was very happy with this authentically Dutch restaurant. (Look up the discount on The Fork app!)
186,De blauwe Hollander, 5 stars ,2 years ago,"Everything was really nice, calm warming atmosphere, tasty traditional food."
187,De blauwe Hollander, 1 star ,4 years ago,The very rude staff and meal came 1 hour later after we ordered. I never recommend this restaurant! Try to find another one.
188,De blauwe Hollander, 5 stars ,2 years ago,Superlative food and service. Recommend the 16 piece appetizer platter and poffertges!
189,De blauwe Hollander, 4 stars ,4 years ago,Great food and view. Not a huge wine or beer selection but from what was there was good.
190,De blauwe Hollander, 5 stars ,2 years ago,"Very good food, awesome desserts... Must try apple pie... Very polite hosts..."
191,De blauwe Hollander, 5 stars ,2 years ago,"Very tasty, come hungry!"
192,De blauwe Hollander, 4 stars ,2 years ago,"Tasty meal and fast service, local craft beer and drinks! Good!👍"
193,De blauwe Hollander, 5 stars ,a year ago,Great selection of Dutch cuisine and very tasty 😋
194,De blauwe Hollander, 5 stars ,2 years ago,Very very nice staff. Super friendly. Food was decent. Would return for the friendly service
195,De blauwe Hollander, 5 stars ,2 years ago,"Excellent dutch food, big portions and great service!"
196,De blauwe Hollander, 5 stars ,2 years ago,Amazing food at a reasonable price. Had a great time there.
197,De blauwe Hollander, 5 stars ,3 years ago,"Great Local Cuisine, great atmosphere, good service & good value for money. Highly recommended"
198,De blauwe Hollander, 5 stars ,4 years ago,We had a delicious traditional lunch accommodated by a very friendly waiter. Many thanks!
199,De blauwe Hollander, 4 stars ,5 years ago,"It's quite good dutch cuisine for tourists

The waiter was very nice."
200,De blauwe Hollander, 5 stars ,3 months ago,Excelent food and service
201,De blauwe Hollander, 5 stars ,2 years ago,Great food.. Slow service but the staff were very polite anf funny
202,De blauwe Hollander, 5 stars ,3 years ago,"Great food, not too pricy, and th e service was great as well."
203,De blauwe Hollander, 5 stars ,2 years ago,"Excellent food, good service, but a bit overpriced."
204,De blauwe Hollander, 5 stars ,2 years ago,"Nice personal, the price for pizza is low and I liked pizza.  100% recommended"
205,De blauwe Hollander, 4 stars ,2 years ago,"Very nice food, good portions, nice people !"
206,De blauwe Hollander, 5 stars ,2 years ago,Great food - tried the stamppot which was delicious. Great service too :)
207,De blauwe Hollander, 5 stars ,2 years ago,Great authentic restaurant with local options and reasonable pricing.
208,De blauwe Hollander, 5 stars ,2 years ago,"A wonderful experience. Delicious food, amazing service! Just come."
209,De blauwe Hollander, 5 stars ,2 years ago,"Very tasty, very friendly and very accommodating for our toddler!"
210,De blauwe Hollander, 5 stars ,2 years ago,"Good experience in Amsterdam to discover the famous dishes made in Netherlands.
Go there !"
211,De blauwe Hollander, 5 stars ,3 years ago,Very Good food and service. Certainly it is a recommended place to eat stamppot.
212,De blauwe Hollander, 5 stars ,2 years ago,Fantastic Food - Fantastic service - Had to go Twice on the same trip!
213,De blauwe Hollander, 5 stars ,2 years ago,"Very nice! Quick service, nice portions and easy ambiance."
214,De blauwe Hollander, 5 stars ,2 years ago,"Very friendly staff, delicious food and great atmosphere."
215,De blauwe Hollander, 4 stars ,4 years ago,"Excellent food traditional food, friendly staff. Clean, affordabĺe prices."
216,De blauwe Hollander, 3 stars ,4 years ago,Good if not exceptional Dutch food. Staff was friendly and good.
217,De blauwe Hollander, 4 stars ,2 years ago,Good Dutch Food. I don't like whipped cream on the surface of Vla-Fli.
218,De blauwe Hollander, 5 stars ,2 years ago,"I like dutch food, so it was delicious. Thanks for having us again 👏🏼"
219,De blauwe Hollander, 4 stars ,5 years ago,"Delicious dutch food and at affordable prices, nice restaurant, relaxing atmosphere and nice staff"
220,De blauwe Hollander, 5 stars ,2 years ago,The taste is so authentic
221,De blauwe Hollander, 5 stars ,4 years ago,Great traditional Dutch cuisine! Snert and a stamppot are both must-try!
222,De blauwe Hollander, 5 stars ,5 months ago,Best stompot in Amsterdam
223,De blauwe Hollander, 5 stars ,2 years ago,Very good and real traditional Dutch food
224,De blauwe Hollander, 1 star ,3 years ago,"Tasteless food, amateur waiters/waitresses, slow service, overpriced, bad ambience."
225,De blauwe Hollander, 5 stars ,2 years ago,"Great local menu, friendly staff"
226,De blauwe Hollander, 5 stars ,4 years ago,Very delicious authentic meals and nice staff.
227,De blauwe Hollander, 5 stars ,4 years ago,Great traditional Dutch food and excellent service!
228,De blauwe Hollander, 3 stars ,4 years ago,We experienced very slow service.  The food was OK & reasonably priced.
229,De blauwe Hollander, 5 stars ,2 years ago,Really good and authentic local food.
230,De blauwe Hollander, 5 stars ,2 years ago,"Excellent service,  friendly waitresses and delicious food!!"
231,De blauwe Hollander, 5 stars ,2 years ago,Amazing Dutch Food! Good vibes too
232,De blauwe Hollander, 5 stars ,4 years ago,Food was delish!! Staff were very friendly and chatty too!!
233,De blauwe Hollander, 5 stars ,2 years ago,"Real ""homecoocked"" food, All FRESH kind polite sweet service"
234,De blauwe Hollander, 4 stars ,2 years ago,Cozy place. food is excellent but not service
235,De blauwe Hollander, 5 stars ,a year ago,Very good service and tasty food👌🏻
236,De blauwe Hollander, 1 star ,2 years ago,Didn't even make it to ordering because the place smelt like toilet.
237,De blauwe Hollander, 5 stars ,a year ago,Extremely delicious local food!
238,De blauwe Hollander, 5 stars ,2 years ago,Genuine Dutch cuisine. Must try if you're in Amsterdam
239,De blauwe Hollander, 5 stars ,a year ago,Very good Stamppot with meat ball!
240,De blauwe Hollander, 3 stars ,4 years ago,"Great food, unfortunately staff were a little brusque and waiting time was long."
241,De blauwe Hollander, 3 stars ,8 years ago,"Manager was extremely rude, very poor service and told paying customers that he was pissed off with them. Very very dissapointed, avoid at
all costs"
242,De blauwe Hollander, 3 stars ,3 years ago,"The apple pie was awesome, entrees were average."
243,De blauwe Hollander, 5 stars ,2 years ago,Very delicious. Thank you vero much for the service
244,De blauwe Hollander, 5 stars ,4 years ago,Great place with fantastic food and cery pleasant service.
245,De blauwe Hollander, 4 stars ,4 years ago,4.5 very friendly and lovely food was a great taste experience
246,De blauwe Hollander, 5 stars ,2 years ago,"The beefsteak was great, also very friendly staff."
247,De blauwe Hollander, 5 stars ,3 years ago,"very nice restaurant, good dutch food"
248,De blauwe Hollander, 5 stars ,5 years ago,The hutspot and poffertjes are wonderful!  Great place to eat!
249,De blauwe Hollander, 5 stars ,3 years ago,Good service and great food!! Love it ;)
250,De blauwe Hollander, 5 stars ,5 years ago,"Very friendly service by staff, reasonable prices for traditional Dutch casual cuisine. Don't pass up this jem!"
251,De blauwe Hollander, 4 stars ,4 years ago,4.5 very friendly and lovely food was a great taste experience
252,De blauwe Hollander, 4 stars ,6 years ago,"Really good Dutch food (and DO try the spare ribs, you won't regret it) and super friendly staff. Definitely a jewel in this most expensive part of town."
253,De blauwe Hollander, 1 star ,2 years ago,"Denied us lunch because we were 6 persons and they have tables of 4, so they would lose 2 seats. Unacceptable rude place!"
254,De blauwe Hollander, 3 stars ,3 years ago,"The apple pie was awesome, entrees were average."
255,De blauwe Hollander, 4 stars ,3 years ago,"Good service, and Food."
256,De blauwe Hollander, 4 stars ,5 years ago,I liked it too much to eat traditional holland foods and beers.
257,De blauwe Hollander, 5 stars ,5 years ago,"Really tasty food. Ordered the carrot and curry soup, which was great in this winter weather. The beef stamppot was outstanding; the gravy goes great with the stamppot (which is something like mashed potatoes with veggies in it). Price goes for €20.60 for a set of soup, stamppot and a yoghurt dessert. Recommend highly for Dutch food!"
258,De blauwe Hollander, 5 stars ,4 years ago,Great Dutch food and nice atmosphere
259,De blauwe Hollander, 5 stars ,8 years ago,It was very tasty + it is the only place in Amsterdam (at least which I know) where you indeed can get dutch national food.
260,De blauwe Hollander, 3 stars ,3 years ago,Ok for thypical dutsch food. Service a bit slow
261,De blauwe Hollander, 5 stars ,2 years ago,Great service and wonderful meal.
262,De blauwe Hollander, 4 stars ,2 years ago,Authentic Dutch food. Good service
263,De blauwe Hollander, 5 stars ,5 years ago,Fantastic. Hut spot brilliant. Homely relaxed restaurant.
264,De blauwe Hollander, 5 stars ,3 years ago,The stamppot is really good. I definately recommend that plate in here.
265,De blauwe Hollander, 5 stars ,8 years ago,Amazing dutch cuisine: a breakfast as well as lunch!
266,De blauwe Hollander, 5 stars ,6 months ago,Tasty Dutch food.
267,De blauwe Hollander, 4 stars ,7 years ago,"Surprisingly good food, heavenly apple pie )"
268,De blauwe Hollander, 5 stars ,a year ago,Best dutch kitchen in Amsterdam 👍🏻
269,De blauwe Hollander, 5 stars ,6 months ago,Highly recommended!!
270,De blauwe Hollander, 5 stars ,6 years ago,"Really straightforward, tasty Dutch food, and the friendliest folks"
271,De blauwe Hollander, 5 stars ,5 years ago,Proper Dutch food... Great atmosphere
272,De blauwe Hollander, 4 stars ,4 years ago,Good. Dutch. Food. Yum.
273,De blauwe Hollander, 5 stars ,3 years ago,Excellent cuisine. Recommended.
274,De blauwe Hollander, 5 stars ,3 years ago,Tipical Dutch Food great locatinon real plesent situation
275,De blauwe Hollander, 3 stars ,4 years ago,"Only one and slow waiter..we spent there 2,5h just for the lunch"
276,De blauwe Hollander, 4 stars ,3 years ago,"Good food, water and bread very expensive"
277,De blauwe Hollander, 5 stars ,2 years ago,Good food and excellent service
278,De blauwe Hollander, 5 stars ,4 years ago,Great restaurant with delicious foods ❤️
279,De blauwe Hollander, 4 stars ,6 years ago,Good for tasting real dutch food...
280,De blauwe Hollander, 5 stars ,6 months ago,Great
281,De blauwe Hollander, 4 stars ,3 years ago,Nice real food. Nice service.
282,De blauwe Hollander, 4 stars ,5 years ago,Good restaurant to try local cuisine.
283,De blauwe Hollander, 5 stars ,8 months ago,Top!
284,De blauwe Hollander, 5 stars ,5 years ago,Traditional Duch food in a Nice location
285,De blauwe Hollander, 5 stars ,4 years ago,A place to comeback. Real Dutch cuisine!
286,De blauwe Hollander, 5 stars ,2 years ago,Nice place with very good food
287,De blauwe Hollander, 3 stars ,2 years ago,"Very busy, be sure to get reservations."
288,De blauwe Hollander, 5 stars ,4 years ago,Great hearty food selection.
289,De blauwe Hollander, 1 star ,2 years ago,"unfriendly staff, overpriced, and no tapwater"
290,De blauwe Hollander, 5 stars ,5 years ago,Really great tasting food
291,De blauwe Hollander, 5 stars ,6 years ago,Great traditional dutch food
292,De blauwe Hollander, 5 stars ,3 months ago,Great place
293,De blauwe Hollander, 4 stars ,3 years ago,Nice people good food
294,De blauwe Hollander, 3 stars ,3 years ago,Nice experience and good food
295,De blauwe Hollander, 3 stars ,3 years ago,The nice place where to have a beer.
296,De blauwe Hollander, 5 stars ,2 years ago,Very good
297,De blauwe Hollander, 4 stars ,3 years ago,"Good service, and Food."
298,De blauwe Hollander, 2 stars ,3 years ago,Poor service. Food is overcooked.
299,De blauwe Hollander, 4 stars ,5 years ago,Nice traditional Dutch food
300,De blauwe Hollander, 5 stars ,6 years ago,Very nice dutch restaurant
301,De blauwe Hollander, 4 stars ,2 years ago,Good food
302,De blauwe Hollander, 5 stars ,2 years ago,Great Food and service
303,De blauwe Hollander, 5 stars ,4 years ago,"Great experience!!!!
Top food !!!!!
Top service!!!!!!
Top team!!!!!!"
304,De blauwe Hollander, 5 stars ,2 years ago,Very good
305,De blauwe Hollander, 4 stars ,2 years ago,Very nice pub !
306,De blauwe Hollander, 4 stars ,5 years ago,Traditional Dutch food in the center.
307,De blauwe Hollander, 4 stars ,2 years ago,Very good
308,De blauwe Hollander, 5 stars ,5 years ago,Nice Dutch food!
309,De blauwe Hollander, 1 star ,2 years ago,Bad staff no thank you!
310,De blauwe Hollander, 5 stars ,3 years ago,Super good bitter balls
311,De blauwe Hollander, 1 star ,3 years ago,slow food  for much money
312,De blauwe Hollander, 4 stars ,4 years ago,Nice food
313,De blauwe Hollander, 5 stars ,4 years ago,Top food
314,De blauwe Hollander, 4 stars ,4 years ago,Great food!
315,De blauwe Hollander, 4 stars ,6 years ago,Very nice restaurant
316,De blauwe Hollander, 5 stars ,2 years ago,Everything was perfect. 👌👍
317,De blauwe Hollander, 4 stars ,2 years ago,Tasty dutch food
318,De blauwe Hollander, 4 stars ,2 years ago,Cosy
319,De blauwe Hollander, 5 stars ,3 years ago,Loved it!
320,De blauwe Hollander, 5 stars ,3 years ago,Good Dutch food
321,De blauwe Hollander, 5 stars ,2 years ago,Great Dutch experience
322,De blauwe Hollander, 5 stars ,a year ago,Excellent! :)
323,De blauwe Hollander, 5 stars ,2 years ago,Good
324,De blauwe Hollander, 5 stars ,2 years ago,Awesome food
325,De blauwe Hollander, 4 stars ,4 years ago,"good, but expensive."
326,De blauwe Hollander, 5 stars ,5 years ago,Cool kitchen!
327,De blauwe Hollander, 3 stars ,3 years ago,Correct
328,De blauwe Hollander, 2 stars ,3 years ago,Ok
329,De blauwe Hollander, 3 stars ,2 years ago,Was just ok
330,De blauwe Hollander, 5 stars ,3 years ago,Great place
331,De blauwe Hollander, 4 stars ,5 years ago,Nice place
332,De blauwe Hollander, 5 stars ,a week ago,Fantastic service and great food. They did everything possible to give a poor vegan a great meal as part of a non-vegan group ;)
333,De blauwe Hollander, 5 stars ,3 days ago,Delicious stamppot (even a vegetarian version available)! Great place to try out Dutch specialities. Friendly staff.
334,De blauwe Hollander, 5 stars ,a week ago,"Delish!  Sole was perfect Euro style.  I had the traditional beef on potatoes, carrots and kraut.  Nice."
335,De blauwe Hollander, 5 stars ,7 months ago,"(Translated by Google) Restaurant where you can eat Dutch and non-Dutch specialties. The prices are in the average of Amsterdam, but by booking with the fork the discount makes it with an excellent quality / price ratio! Home cooking and …"
