,Name,Review Rate,Review Time,Review Text
302,Vandaag, 1 star ,3 years ago,"(Translated by Google) Well, a waste of money .. Or am I just tired of this kind of restaurant? The meat was tasty, but the rest, well, too much of the same in this type of restaurant. In any case, this was certainly not worth repeating for …"
303,Vandaag, 2 stars ,2 years ago,"(Translated by Google) Good food! Only the so-called ""management"" are young people. Got a very dirty table yesterday. A smart boy was going to make a 'table'. Another table was pushed 30 cm through. Everything was covered with liquor on the …"
304,Vandaag, 4 stars ,2 years ago,(Translated by Google) I think it is appalling that a child of 4 years pays just as much as a teenager. My youngest of 4 certainly does not eat as much as my oldest of just 12 who already paid adult rates. And who doesn't eat as much as an …
305,Vandaag, 3 stars ,3 years ago,"(Translated by Google) Eaten here for the first time some time ago. As long as it was quiet I liked it, once it was busy I notice that at 1.60 I don't like it between all those people who are pushing to get food. I have a tendency to think …"
306,Vandaag, 4 stars ,2 years ago,"(Translated by Google) Went there on a weekday. Delicious eaten.
Minus, nice pieces of duck meat, fried snacks and sauces cold. Unfortunately!
Friendly staff. Complete experience, nice atmosphere. Good value for money. So …"
307,Vandaag, 3 stars ,2 years ago,"(Translated by Google) Typical all-you-can-eat: quick snacks are waiting, but for most 'more expensive' products (such as scallops, shrimps, steak and fish) you have to wait a while. Fairly pricey for two and a half hours of dining. …"
308,Vandaag, 4 stars ,4 years ago,"(Translated by Google) Asian food, cheap and quite tasty, the truth that a good experience …"
309,Vandaag, 1 star ,2 years ago,"(Translated by Google) Upon arrival by a not so cheerful hostess welcomed, probably because there was a ""difficult"" customer in front of us. We found the range to be poor, little choice compared to other all-you-can-eat restaurants and some …"
310,Vandaag, 4 stars ,3 years ago,"(Translated by Google) Nice unique room with multiple types of food.
What do I think of the service in general?
Its acceptable. When it is busy there are not many people available, but that …"
311,Vandaag, 5 stars ,2 years ago,"(Translated by Google) Extensive menu choice and diversity of kitchens. Wok, pasta, pizza, fries, sushi. You name it and they have it. A huge dessert buffet with plenty of choice. The children can bake cookies and take them home. Nice …"
312,Vandaag, 3 stars ,7 months ago,"(Translated by Google) Since new setting, choice less. No more drinking for free …"
313,Vandaag, 5 stars ,a year ago,"(Translated by Google) Very good food, very nice concept! Hopefully friendly lady who has been working there for 10 years sees this message, I have kept my promise! It is a nice renewed concept and we have been sitting all night! …"
314,Vandaag, 1 star ,2 years ago,"(Translated by Google) After years of coming it was disappointing yesterday. Pasta sauce was warm but the pasta itself was stone cold as if it came out of the cooling, I also literally got pasta with sauce (without toppings) I thought, …"
315,Vandaag, 1 star ,2 years ago,"(Translated by Google) We knew Restaurant today as one of the best and tastiest world food tents. Today we have been back after a few years, the food was bad. The meat and fish had no taste at all. The wok section had only a small variation …"
316,Vandaag, 5 stars ,a year ago,(Translated by Google) The food was super delicious. Really friendly staff. And certainly a recommendation to eat there again. Greetings from South Limburg …
317,Vandaag, 5 stars ,a year ago,"(Translated by Google) Friendly welcome, corona-proof operation. Food is delicious
Learning point: Kitchen staff needlessly shout at each other via (because of) …"
318,Vandaag, 4 stars ,5 years ago,"(Translated by Google) Restaurant is good to eat and the staff upon entering are really very friendly.
Only on holidays the ball pit is much too small all children want to get in …"
319,Vandaag, 5 stars ,7 months ago,"(Translated by Google) A good restaurant for all tastes.

(Original) …"
320,Vandaag, 3 stars ,2 years ago,"(Translated by Google) The mayonnaise and the fries sauce and ketchup were unfortunately unfortunate. Furthermore, there was a hair on the fruit that I wanted to grab and the ice that you could grab was almost melted. The positive thing was …"
321,Vandaag, 5 stars ,8 months ago,"(Translated by Google) Delicious

(Original)
Heerlijk"
322,Vandaag, 5 stars ,3 years ago,"(Translated by Google) Lots of variety, both food and drinks. Operation good! Even helped me bring drinks to the table. Was fairly busy but the different chefs advise you to finish your round in advance. Nice play corner also for the little …"
323,Vandaag, 2 stars ,2 years ago,"(Translated by Google) Super nicely done, lots of choice in food, but the quality of food is really bad. It all looks nice until you taste it. It tastes as if the food has been outside of the fridge for a few days. It tastes very dirty and …"
324,Vandaag, 1 star ,3 years ago,"(Translated by Google) The food was very mediocre for the price, but that was to be expected for an all you can eat restaurant. …"
325,Vandaag, 4 stars ,3 years ago,"(Translated by Google) Plenty of choice in various cuisines so very suitable for a group. The buffet is not in the middle of the restaurant so it is a bit further from the left. If you have people in the company who are less agile, it is …"
326,Vandaag, 2 stars ,2 years ago,"(Translated by Google) Food quality moderate. Meat dry, chewy. Vegetable fine. Tomato soup has the same taste as pasta sauce. Restaurant messy. Staff friendly. Children's corner fun. Allergens cards are everywhere but are not filled in. A …"
327,Vandaag, 5 stars ,4 years ago,"(Translated by Google) Many choices of dishes on buffet or before you prepare a la moment. Children have their own section with their favorites (fries, nuggets, ...), a district with a ball pit, climbing equipment and an employee who …"
328,Vandaag, 4 stars ,2 years ago,"(Translated by Google) The well-known concept of food that you want for a fixed price, parking in the area is pricey, but keep in mind that this will come at a total price. Sitting area is spacious but where the food is and is prepared is …"
329,Vandaag, 3 stars ,4 years ago,(Translated by Google) The sushi and the wok taste good. Today it was not that busy and then some of the other dishes are a little too long and are drier than intended. The staff are generally friendly. My son really liked baking cookies. …
330,Vandaag, 2 stars ,4 years ago,"(Translated by Google) Eating in the keep warm is cold such as fries and squabbling, choice is also not very much, on the site and Facebook page they show very beautiful photos and then you get the impression that there is a lot of choice …"
331,Vandaag, 5 stars ,2 years ago,"(Translated by Google) Today another delicious dinner at today, one of the best all you can eat restaurant in Amsterdam. Today I was welcomed again as usual by my favorite cook Jesus ... Jesus who is a real asset to this restaurant, with …"
332,Vandaag, 2 stars ,4 years ago,"(Translated by Google) I tried everything, but the spare ribs could not be eaten and the buffet was probably too long, because everything was tough and dry. The wok was great, but it is also prepared fresh. Too bad the kids can only bake …"
333,Vandaag, 1 star ,6 years ago,"(Translated by Google) What a special experience it was.
Staff is not interested, too young and inexperienced. Tables were not cleared in time, accumulation of plates and dishes. Far too busy and noise from small …"
334,Vandaag, 1 star ,3 years ago,(Translated by Google) My wife and 2 young children enjoy going out as a family for an evening. Tonight we chose to eat at restaurant Today in Amsterdam. In Utrecht we have been to Today before and have always had a positive experience. …
335,Vandaag, 4 stars ,2 years ago,"(Translated by Google) The restaurant was really top in terms of food. Staff must be trained to know what to do in the event of an emergency.
The hair of one of the children caught fire and they did not respond adequately. …"
336,Vandaag, 4 stars ,3 years ago,"(Translated by Google) We arrived without a reservation, but this was no problem.
We opted for a la carte, although the buffet also looked good. …"
337,Vandaag, 2 stars ,2 years ago,(Translated by Google) The food was delicious but staff (manager) her language was very weird and rude to us. She interfered with what kind of food we had on the table and it seemed a bit racist. Restaurant today Amsterdam. …
338,Vandaag, 4 stars ,2 years ago,(Translated by Google) The only thing less was the round lights on the ceiling ... these gave poor light and the chance of a headache as it darkened outside. Maybe warmer light can be put in? These lamps only hang above 1 part of the …
339,Vandaag, 5 stars ,a year ago,(Translated by Google) Very good food staff friendly I can say nothing else that it is worth a 10 so restaurant today is just a pity that you have no restaurant in Limburg hope it will come again ?? …
340,Vandaag, 1 star ,4 years ago,"(Translated by Google) The food was very bad, meat was cold, and often very tough, only the sushi was tasty. there is no arguing about taste. but when we both come home with cramps in our stomach (and not from overeating) that tells me …"
341,Vandaag, 4 stars ,3 years ago,"(Translated by Google) Nice and affordable restaurant. Various sorts
Sushi, tasty soups, delicious chinese starters. A well-stocked salad bar. Tasty tapas, delicious carpaccio with soft dressing. A wok section, a grill section. …"
342,Vandaag, 1 star ,4 years ago,"(Translated by Google) Bad, customer unfriendly, noisy staff. From time to time it seemed like a bother. Food was on buffet for too long so was cold and dry. Deals were made and the price cheated when staff members knew customers. So never …"
343,Vandaag, 1 star ,3 years ago,"(Translated by Google) Nothing to get for a vegan! No hummus, nothing on bread and there is milk in everything. Went there with four friends and are not willing to do anything for you if you fall out of the boat. Served ridiculously. Can I …"
344,Vandaag, 3 stars ,2 years ago,"(Translated by Google) Wonderfully spacious restaurant, has something for everyone. It is not clear how it works everywhere. Such as the wok, where you pack meat / fish can be worked out in a step-by-step plan. For the rest, neat! …"
345,Vandaag, 1 star ,5 years ago,"(Translated by Google) Went to eat here on my birthday. The food is disastrous, dirty and tasteless. If you like children and noise, this is a great place to eat. The staff at the counter are friendly, once inside ""Laura"" said her word …"
346,Vandaag, 4 stars ,2 years ago,(Translated by Google) as 13 and 14 year old we were not officially allowed to eat without guidance so ff called and super nice we could just come on arrival just talked to the manager that she that we could always come to her if something …
347,Vandaag, 4 stars ,10 months ago,"(Translated by Google) Great so many dishes that you can eat here. Recommended!

(Original) …"
348,Vandaag, 1 star ,a year ago,"(Translated by Google) Everything was less than lukewarm or just plain cold.
Even after several reports it was not possible to serve it really hot.
Very unfortunate, will NOT recommend this tent to ANYONE. …"
349,Vandaag, 4 stars ,4 years ago,"(Translated by Google) Restaurant today is always good for when you want to enjoy an evening of delicious food from different cuisines. Meat is always very tender, so I have no doubt about its quality. Downside is that it is always very …"
350,Vandaag, 4 stars ,3 years ago,"(Translated by Google) Slightly more luxurious dishes (such as crab and oysters) than restaurants with a similar concept. Free for a birthday boy or girl with 3 paying guests. It is advisable to book 2 hours, because paying extra costs the …"
351,Vandaag, 3 stars ,2 years ago,"(Translated by Google) We were very disappointed. When cleaning up, cutlery always fell to the floor and my daughter has been suffering from her stomach since we ate there. A few years ago we thought it was much nicer, more extensive and …"
352,Vandaag, 4 stars ,3 years ago,"(Translated by Google) Lots of good food from different cultures of which you can grab a lot. It's not too expensive. The desserts are delicious too, plus the chocolate fountain makes it extra delicious. Sometimes it is a bit crowded, but …"
353,Vandaag, 4 stars ,a year ago,"(Translated by Google) Good service, friendly people. Lots of choice between meat, fish and vegetarian. …"
354,Vandaag, 5 stars ,a year ago,"(Translated by Google) Super nice takeout package. Recommended to have a nice dinner at home. Not expensive and very varied. You don't have to think, just get everything :-) …"
355,Vandaag, 5 stars ,2 years ago,(Translated by Google) Extensive buffet and tasty food. Large seating area and wide paths. Friendly staff. Plus is the children's kitchen where children can bake cookies and the free entrance for Kids. …
356,Vandaag, 2 stars ,2 years ago,"(Translated by Google) Although the majority tasted fine, the extremely dirty toilets (including dried-up old spit on the walls) and the fact that two of our table companions later had problems with their stomach after eating oysters was …"
357,Vandaag, 2 stars ,3 years ago,"(Translated by Google) Too bad despite the fact that there were enough other empty tables that evening so did not want to give us another table. Unfortunately, but if the evening has yet to begin. Yes then it will be difficult to enjoy all …"
358,Vandaag, 5 stars ,a year ago,"(Translated by Google) Very delicious food, and beautiful dishes. Beautiful decoration and above all super cool.
I like this new concept. …"
359,Vandaag, 4 stars ,5 years ago,"(Translated by Google) With a family of 6 people it is sometimes a bit difficult to meet everyone's preferences. At Today we don't have that problem. There is something for every taste, and compared to another well-known buffet / wok …"
360,Vandaag, 4 stars ,4 years ago,"(Translated by Google) The food is good, the prices are reasonable. I find the service and a bit lackluster this time. They are not very friendly and do not often come to take away the used plates. But on other times I was there that went …"
361,Vandaag, 1 star ,3 years ago,(Translated by Google) I have indicated that I cannot tolerate cow's milk. It would be taken into account. Once inside I was told there was only fruit for me. I would have liked dessert too. The other guests could choose. No follow-up for …
362,Vandaag, 2 stars ,6 years ago,"(Translated by Google) The concept is good for a 6 + ""today"" with 6 people dined on January 2 at ""today"".
Don't expect a culinary tour de force but the concept is fun, food overcooked or …"
363,Vandaag, 4 stars ,3 years ago,"(Translated by Google) A good restaurant for young and old. Tasty and good food, something for everyone. Toilets could be a bit cleaner. Nice and customer-friendly staff. However, the parking garage is very expensive. Something that said …"
364,Vandaag, 1 star ,2 years ago,(Translated by Google) It is a shame to say this but: I have never eaten so moderately. The food tasted like it was 5 days old. There is also little choice. I definitely expect more for the price I paid. …
365,Vandaag, 1 star ,5 years ago,"(Translated by Google) We arrived at the checkout, and the staff were very friendly. Once inside, the staff turned out to be less friendly than expected, especially the staff who prepare the dishes. Take, for example, the woman who was …"
366,Vandaag, 5 stars ,3 years ago,"(Translated by Google) Great food nice and fresh despite the crowds, everything neatly present …"
367,Vandaag, 5 stars ,a year ago,"(Translated by Google) Top restaurant with nice people and fast service! Even with the current corona situation, they have been able to turn it into a pleasant environment. …"
368,Vandaag, 1 star ,4 years ago,"(Translated by Google) This location is really bad, Utrecht against me is a true paradise and 100x better and friendlier. Bins with food constantly empty and if there is something in it it is lukewarm and limp .. the chefs at the grill are …"
369,Vandaag, 3 stars ,3 years ago,"(Translated by Google) A lot of choice. The kitchen staff are very nice, the ladies in the service, who take the plates off the table, are generally a bit grumpy ... and it was quite cold unfortunately. Furthermore, fine, especially for …"
370,Vandaag, 3 stars ,3 years ago,"(Translated by Google) All-You-Can-Eat restaurant with a very large selection. Sushi, pizza, steaks, spare ribs, etc. etc.
Steaks are freshly cut and grilled. …"
371,Vandaag, 1 star ,6 years ago,(Translated by Google) It is definitely not recommended this restaurant. with a smile inside and cranky weather outside after an hour we got up (while 2 pays 32.50 pp) and we decided to leave. The employee asked if everything was …
372,Vandaag, 1 star ,a year ago,"(Translated by Google) Not an atmospheric restaurant at all, the food is reasonable, but you don't go here for fun. …"
373,Vandaag, 2 stars ,2 years ago,(Translated by Google) Zagrijnig to rude staff. Especially in the kitchen. Angry Chinese people who have no patience for customers. Cooking you have to really love to do otherwise does not taste and that is sure to notice here. …
374,Vandaag, 1 star ,7 years ago,"(Translated by Google) If you look through the windows from outside this restaurant it all looks nice. But once inside the appearance is deceiving.
To start with: Reservations are not passed on, Frontdesk is very unkind you …"
375,Vandaag, 4 stars ,3 years ago,"(Translated by Google) Easy reservation.
Diversity and Quality of dishes
SPACIOUS + sufficient. …"
376,Vandaag, 3 stars ,4 years ago,"(Translated by Google) From 19.30 it was very busy. The choice is very wide and quite ok but for Euro 41 pp (for 3 hours) you can of course eat better elsewhere and you do not have to look at the clock, on the other hand, your drink is …"
377,Vandaag, 3 stars ,4 years ago,"(Translated by Google) Been here on Valentine's Day thought it was expensive for what you got nothing no exsta special food or drink, there was all a heart balloon at the table nothing else but pay 35.95 euros per person but the food was …"
378,Vandaag, 4 stars ,4 years ago,"(Translated by Google) I loved welcoming the staff, it is an international restaurant but I think it should be like more variety because there are too many Asian food. But in terms of dessert nothing to say well stocked! Very welcoming …"
379,Vandaag, 3 stars ,3 years ago,"(Translated by Google) Dishes that had already been prepared were lukewarm or warm. Dishes that were prepared in front of you were of very great quality and well and friendly prepared. Service bar was good, but takeout from the tables could …"
380,Vandaag, 3 stars ,5 years ago,(Translated by Google) If you want to eat a lot for little money you have to be here. The food is fine but the atmosphere not so. You always take turns to get something and therefore do not sit comfortably together at the table. Anyway …
381,Vandaag, 5 stars ,5 years ago,"(Translated by Google) Super tasty food. Been there more often and changed dishes. Staff is very nice, I was asked if I wanted the designated table when the servant saw that I doubted, she immediately arranged a new table. Furthermore, the …"
382,Vandaag, 1 star ,2 years ago,"(Translated by Google) ""We've got food poisoning there."" I still have emailed to them about it, but not once a response. It seems like a good shop, but if you look better, it is very unsanitary. 😡😡😡 …"
383,Vandaag, 1 star ,4 years ago,"(Translated by Google) Compared to a few years ago, the quality of the food has deteriorated very much.
The restaurant was very busy last Sunday, so you had to stand in too long lines …"
384,Vandaag, 3 stars ,a year ago,(Translated by Google) Complicated system since corona. Menu has changed and choices more limited. The old concept worked better so after corona I would like to return to normal ... …
385,Vandaag, 2 stars ,4 years ago,(Translated by Google) Upon entering at checkout a young man in a white shirt is not customer friendly at all. Service and respect was hard to find for the customer. He was just smart for free. And that on my birthday! I regret that I went …
386,Vandaag, 4 stars ,5 years ago,"(Translated by Google) It's pretty good. Except for the troublesome things, so the rating 4.
Reservation is required. Or wait. …"
387,Vandaag, 4 stars ,2 years ago,"(Translated by Google) Was always 5 stars but now dropped to 4. Food still fine but the furniture and decoration could use a makeover.
Service great. …"
388,Vandaag, 4 stars ,3 years ago,"(Translated by Google) Tasty and well eaten.
Just a pity that it is so busy.
You can eat as much as you want. …"
389,Vandaag, 3 stars ,2 years ago,(Translated by Google) concept is nice birthday girl who can eat for free but some dishes are really not to eat find this not really worth repeating …
390,Vandaag, 3 stars ,2 years ago,"(Translated by Google) Excellent price-quality ratio. Good diverse range, something for everyone. The birthday boy got a discount. There was a timely clearance for the next round. …"
391,Vandaag, 5 stars ,3 years ago,"(Translated by Google) good food, very big but cozy. I only visit you once a year so I can't write a better review about it. But that once a year is worth 5 stars. …"
392,Vandaag, 2 stars ,3 years ago,"(Translated by Google) Very nice eaten after a long working day @ 9mnd fair (beans, chicken and potato - so nothing crazy) but unfortunately the next day a terribly set up face of likely additions to the food. Nice people. …"
393,Vandaag, 4 stars ,7 months ago,"(Translated by Google) Reserved for August 26 as

(Original) …"
394,Vandaag, 4 stars ,3 years ago,"(Translated by Google) The sushi, oysters, shrimps and squid ... all tasty. Do not judge the price because I was invited.
It struck me that the audience was very diverse / Amsterdam. …"
395,Vandaag, 5 stars ,2 years ago,"(Translated by Google) Cool place for all kinds of occasional events

(Original) …"
396,Vandaag, 3 stars ,3 years ago,"(Translated by Google) It's all edible. But it's not super tasty, because it's mass-produced. Early friday price is fine for what you get but it really isn't worth more! …"
397,Vandaag, 4 stars ,5 years ago,(Translated by Google) Delicious eaten everything fresh. From meat to fish. Very friendly staff. Both service and the chefs themselves. Just good value for money. So we will definitely come back. …
398,Vandaag, 3 stars ,a year ago,"(Translated by Google) Had lunch yesterday but it took too long for the order to arrive, so we have to do the next order quickly …"
399,Vandaag, 5 stars ,5 months ago,"(Translated by Google) Very good

(Original)
Heel erg lekker"
400,Vandaag, 1 star ,3 years ago,"(Translated by Google) I found the girl behind the counter in the children's play corner to be very unprofessional. I conclude this from the way she spoke to children when the coins were not in the device, she snapped them off. …"
401,Vandaag, 5 stars ,3 years ago,(Translated by Google) Good friendly service. Great food especially the fish species but too much. Enough for everyone. And affordable and cozy. …
402,Vandaag, 5 stars ,2 years ago,"(Translated by Google) Nice cozy place especially if you are with kids.
Only a bit more fun if they would occasionally put up other dishes …"
403,Vandaag, 4 stars ,5 months ago,"(Translated by Google) Beautiful, I loved it, good food

(Original)
Lindo amei, comida boa"
404,Vandaag, 4 stars ,3 years ago,(Translated by Google) Nice cozy good food good ride correct product knowledge and can give you tips a lot of variation in food good price quality ratio some downsides are the crowds and customer-friendly of the service you are often put in …
405,Vandaag, 4 stars ,4 months ago,"(Translated by Google) So much variety of tastes

(Original)
Tanta varietà di gusti"
406,Vandaag, 1 star ,3 years ago,"(Translated by Google) The food that is prepared on the plate and wok was good, but the rest not too good. A tip, do not leave food under the lamp for too long dries out and that is food waste. …"
407,Vandaag, 2 stars ,5 years ago,"(Translated by Google) No atmosphere cold factory sushi small range of food not a cozy place to eat.
It is not the staff or anything but the wow or atmosphere factor is missing …"
408,Vandaag, 5 stars ,10 months ago,"(Translated by Google) I feel fine. The boss is a very good person, very nice to us and a good boss. …"
409,Vandaag, 3 stars ,3 years ago,"(Translated by Google) Good food, enough variety in the food. Less are the carts that come past your table to pick up the plates, make a lot of noise and remain standing for a relatively long time …"
410,Vandaag, 1 star ,3 years ago,(Translated by Google) do not take into account people who have had a gastric bypass and eat even less than a child . so not an option for us to go there. …
411,Vandaag, 5 stars ,2 years ago,"(Translated by Google) Great food shed, this is what you can expect from it. It is a pity that there is not really an atmosphere. The food is great for the price. Occasionally a little too salty. …"
412,Vandaag, 1 star ,3 years ago,"(Translated by Google) I didn't like it.. the today in utrecht was great, the atmosphere was good customer-friendly.. you were always helped with a smile.. at amsterdam they asked something and then turned their backs. …"
