,Name,Review Rate,Review Time,Review Text
148,Groot Melkhuis, 3 stars ,3 years ago,"Not much choice in food.
The hot chocolate was average.
Had to pay to use the toilet."
149,Groot Melkhuis, 4 stars ,8 years ago,Great place for families. You can have a snack or a sandwich while kids play.
150,Groot Melkhuis, 4 stars ,2 years ago,Kids love the play area. Wish it never closed so early
151,Groot Melkhuis, 4 stars ,a year ago,"Lovely park, friendly cafe!"
152,Groot Melkhuis, 4 stars ,a year ago,Been going here for donkeys years. Time to do up the kids swings etc.
153,Groot Melkhuis, 5 stars ,4 years ago,Great playground area for the children and a great place to sit in nice weather.
154,Groot Melkhuis, 4 stars ,5 years ago,"Nice cafe, self service not optimal though. Great location."
155,Groot Melkhuis, 5 stars ,2 years ago,Perfect place to visit for running or walking arround the lake.
156,Groot Melkhuis, 3 stars ,3 years ago,"Location is great, self service works, quality offood mediocre, great for kids in playground."
157,Groot Melkhuis, 4 stars ,3 years ago,"Beautiful place, warm drinks to cold day 😀"
158,Groot Melkhuis, 3 stars ,4 years ago,Jelly cat elephant lost here please message me if found! Playground for kids is great
159,Groot Melkhuis, 4 stars ,2 years ago,"Great park for kids, good beer for adults"
160,Groot Melkhuis, 3 stars ,3 years ago,"Super place but no well organized, heavily crowded, long queue (no table service)"
161,Groot Melkhuis, 5 stars ,a year ago,Great service. Nice Glüwein!
162,Groot Melkhuis, 3 stars ,5 years ago,"Great location in summer, but too much focused on kids in my opinion."
163,Groot Melkhuis, 4 stars ,a year ago,Good spot to have a snack in the park
164,Groot Melkhuis, 5 stars ,2 years ago,It has La Chouffe aaaand we can have it at the esplanada :D
165,Groot Melkhuis, 5 stars ,3 years ago,Great Café with a very nice playground for children.
166,Groot Melkhuis, 4 stars ,3 years ago,Great place for a bite and a drink while in the park.
167,Groot Melkhuis, 5 stars ,7 months ago,Nice spot in the heart of the park
168,Groot Melkhuis, 3 stars ,3 years ago,"It was ok, decent coffee and a pain au chocolate which was alright."
169,Groot Melkhuis, 5 stars ,3 years ago,Nice spot
170,Groot Melkhuis, 3 stars ,2 years ago,Nice place but long time to take a order
171,Groot Melkhuis, 5 stars ,3 years ago,Simple but all you need to get a drink or bite in the park
172,Groot Melkhuis, 4 stars ,5 years ago,"Self service, great location, good enough food and drinks (nothing spectacular though)."
173,Groot Melkhuis, 5 stars ,3 years ago,Nice with good coffee and a small kids area
174,Groot Melkhuis, 4 stars ,5 years ago,Coffee better than the Theehuis.  Good stop off on the way out of the Park
175,Groot Melkhuis, 4 stars ,5 years ago,"Little pricey, but pretty good lunch selection."
176,Groot Melkhuis, 5 stars ,5 years ago,Great little cafe in the park. Snacks and playgrounds for children and coffee for the grownups.
177,Groot Melkhuis, 3 stars ,3 years ago,Average. good stop for family with kids as it has a playground
178,Groot Melkhuis, 4 stars ,5 years ago,Nice place to have a drink and play Pokémon (3 Pokéstop around).
179,Groot Melkhuis, 4 stars ,3 years ago,Self service café in the middle of the park. Good for families with kids
180,Groot Melkhuis, 4 stars ,3 years ago,"A lovely spot for when the sun is out, great service and great wine"
181,Groot Melkhuis, 5 stars ,3 years ago,"Nice restaurant in Vondel park, great view"
182,Groot Melkhuis, 5 stars ,2 years ago,Beautiful view. Nice environment. Loved it
183,Groot Melkhuis, 4 stars ,2 years ago,Nice cozy place but slow with service....
184,Groot Melkhuis, 4 stars ,2 years ago,Nice place to sit and enjoy your coffee.
185,Groot Melkhuis, 2 stars ,a year ago,Location great value for money meh
186,Groot Melkhuis, 5 stars ,a year ago,A cozy hang out in the beautiful Vondel park...
187,Groot Melkhuis, 4 stars ,5 years ago,Cool place to have a drink while the kids play
188,Groot Melkhuis, 5 stars ,3 years ago,Fresh air perfect place to start a day with breakfast at this place.
189,Groot Melkhuis, 5 stars ,3 years ago,Nice little park with lakes and rose garden
190,Groot Melkhuis, 5 stars ,2 years ago,Good prices and especially good when the day is sunny
191,Groot Melkhuis, 4 stars ,3 years ago,Beautiful place to have lunch or a drink at.
192,Groot Melkhuis, 2 stars ,3 years ago,Not great food but great location
193,Groot Melkhuis, 1 star ,4 years ago,"15€ for a pancake and toast, still 50cents to use bathroom to clean your hands."
194,Groot Melkhuis, 2 stars ,8 years ago,went there due to the recommendation of a tourism guide and what a disappointment..really cheap food
195,Groot Melkhuis, 5 stars ,3 years ago,Nice play area for kids under 5
196,Groot Melkhuis, 2 stars ,4 years ago,Very random cafe with lack of variety of food. Beverages are oke.
197,Groot Melkhuis, 4 stars ,2 years ago,More like a quick bite eatary.
198,Groot Melkhuis, 5 stars ,3 years ago,Great place friendly staff good food
199,Groot Melkhuis, 1 star ,3 years ago,This place charges money for bathroom use EVEN to paying customers. I find this preposterous.
200,Groot Melkhuis, 4 stars ,5 years ago,Fine cafe with a nice terrace beautifully located in the Vondelpark
201,Groot Melkhuis, 4 stars ,2 years ago,"Here I got alot of Ice Cream,I liked it alot"
202,Groot Melkhuis, 5 stars ,7 months ago,Nice!
203,Groot Melkhuis, 4 stars ,3 years ago,nice lunch after a long waiting line 🍀
204,Groot Melkhuis, 5 stars ,2 years ago,Lovely place with incredible pancakes
205,Groot Melkhuis, 4 stars ,2 years ago,Great spot for a break in vondel park
206,Groot Melkhuis, 4 stars ,3 years ago,Loved it and the food is very good.
207,Groot Melkhuis, 3 stars ,2 years ago,"Nice for a snack, but a bit expensive"
208,Groot Melkhuis, 2 stars ,3 years ago,Very disappointed to have to pay to use the toilet at a cafe.
209,Groot Melkhuis, 5 stars ,3 years ago,Lovely food in a beautiful setting
210,Groot Melkhuis, 4 stars ,3 years ago,"Self service restaurants, easy quick bite"
211,Groot Melkhuis, 4 stars ,2 years ago,Their Fresh mint tea is great
212,Groot Melkhuis, 5 stars ,2 years ago,"Great coffee, amazing view 🌄"
213,Groot Melkhuis, 4 stars ,5 years ago,Good location. Self service. Good prices.
214,Groot Melkhuis, 3 stars ,3 years ago,Nice place. Not very good service
215,Groot Melkhuis, 3 stars ,4 years ago,Poor quality food. Industrial service. Very crowded
216,Groot Melkhuis, 5 stars ,2 years ago,Great location and great food
217,Groot Melkhuis, 4 stars ,2 years ago,"Great setting, great food"
218,Groot Melkhuis, 5 stars ,2 years ago,"Fantastic location, good coffee"
219,Groot Melkhuis, 5 stars ,3 years ago,Amazing place!
220,Groot Melkhuis, 5 stars ,3 years ago,The park is really beautiful!
221,Groot Melkhuis, 5 stars ,3 years ago,Very good Tina sandwich!
222,Groot Melkhuis, 5 stars ,2 years ago,Best nutella pancake ever
223,Groot Melkhuis, 4 stars ,3 years ago,Fantastic Coffee and bakon pancake.
224,Groot Melkhuis, 4 stars ,2 years ago,Nice breakfast in the park
225,Groot Melkhuis, 5 stars ,3 years ago,Definitely worth a visit when visiting Amsterdam ..
226,Groot Melkhuis, 5 stars ,2 years ago,Such a nice place!
227,Groot Melkhuis, 5 stars ,a year ago,Nice to go to with the kids
228,Groot Melkhuis, 5 stars ,a year ago,Great playground.
229,Groot Melkhuis, 5 stars ,9 months ago,Nice
230,Groot Melkhuis, 5 stars ,3 years ago,nice spot for breakfast.
231,Groot Melkhuis, 5 stars ,2 years ago,Good rest
232,Groot Melkhuis, 5 stars ,2 years ago,Perfect for children. We had a lively afternoon here. Enjoying the food and the park. Was lovely to be able to relax and our son was able to run around safely and play.
233,Groot Melkhuis, 5 stars ,2 years ago,Very nice
234,Groot Melkhuis, 1 star ,2 years ago,Overcrowded and full of children
235,Groot Melkhuis, 4 stars ,6 years ago,"Come here with kids, not without."
236,Groot Melkhuis, 3 stars ,2 years ago,It's okay
237,Groot Melkhuis, 4 stars ,8 months ago,White
238,Groot Melkhuis, 3 stars ,a year ago,Too much expensive
239,Groot Melkhuis, 5 stars ,2 years ago,10/10
240,Groot Melkhuis, 5 stars ,3 years ago,Food and beverage are good
241,Groot Melkhuis, 5 stars ,4 years ago,Lovely park cafe
242,Groot Melkhuis, 1 star ,4 years ago,bad food
243,Groot Melkhuis, 5 stars ,2 years ago,Great view
244,Groot Melkhuis, 5 stars ,2 years ago,Very beautiful place
245,Groot Melkhuis, 5 stars ,3 years ago,With kids... Perfect
246,Groot Melkhuis, 3 stars ,2 years ago,Good for kids
247,Groot Melkhuis, 5 stars ,3 years ago,Nice place to chill
248,Groot Melkhuis, 5 stars ,a year ago,What a park! 😳
249,Groot Melkhuis, 5 stars ,3 years ago,Very nice place
250,Groot Melkhuis, 5 stars ,2 years ago,great
251,Groot Melkhuis, 5 stars ,2 years ago,Lovely
252,Groot Melkhuis, 5 stars ,3 years ago,Groooot-tastic
253,Groot Melkhuis, 5 stars ,3 years ago,Ok
254,Groot Melkhuis, 5 stars ,3 years ago,Nice terrace
255,Groot Melkhuis, 5 stars ,2 years ago,Nice
256,Groot Melkhuis, 5 stars ,4 years ago,This place is amazing !
257,Groot Melkhuis, 5 stars ,3 years ago,Awesome
258,Groot Melkhuis, 5 stars ,3 years ago,Nice
259,Groot Melkhuis, 4 stars ,a year ago,Good place
260,Groot Melkhuis, 5 stars ,4 years ago,Top
261,Groot Melkhuis, 3 stars ,3 years ago,Nice place!
262,Groot Melkhuis, 4 stars ,4 years ago,great ambience
263,Groot Melkhuis, 5 stars ,2 years ago,Lovely place
264,Groot Melkhuis, 1 star ,3 years ago,No service
265,Groot Melkhuis, 5 stars ,3 years ago,Looking forward to it
266,Groot Melkhuis, 3 stars ,3 years ago,limited food
267,Groot Melkhuis, 5 stars ,3 years ago,Friendly place
268,Groot Melkhuis, 4 stars ,13 hours ago,Nice spot
269,Groot Melkhuis, 5 stars ,7 months ago,"(Translated by Google) Very beautiful place, just the planes passing above us but nothing really annoying. Pleasant staff. I recommend ! …"
270,Groot Melkhuis, 5 stars ,7 months ago,"(Translated by Google) The pancakes are great, service is ok, prices are normal. …"
271,Groot Melkhuis, 1 star ,4 months ago,"(Translated by Google) Dear owner, develop a system that the guests don't have to pay for the toilet. There were six of us, a bill of 45 euros, and each of us had to pay 70 cents separately for the toilet, that is really not possible. I …"
272,Groot Melkhuis, 3 stars ,6 months ago,"(Translated by Google) The children can have a great time, lots of play equipment and plenty of seats. A lot of pigeons and wasps, which is a nuisance while consuming the (mandatory) consumption. The prices of the castle in the air (3.50 …"
273,Groot Melkhuis, 5 stars ,6 months ago,"(Translated by Google) Well placed terrace, nice view and quiet place to enjoy the food or drink. The only drawback is that it is not always clean, here and there rats, wasps, etc. But you can't do much about that because of its location …"
274,Groot Melkhuis, 3 stars ,2 years ago,"(Translated by Google) If you want to eat and / or drink something in the Vondelpark and want to sit nicely, this is the place for you. Prices are ok 👌 Toilet available, but costs extra. The park is definitely worth a visit. 👍 …"
275,Groot Melkhuis, 5 stars ,5 months ago,"(Translated by Google) Nice terrace, good assortment of snacks and drinks plus a big playground for the kids which is also very nice if you don't even have children because they don't come to play on the terrace, you can enjoy your coffee …"
276,Groot Melkhuis, 5 stars ,a year ago,"(Translated by Google) In the middle of the park. Good place to relax and for a drink ... coffee & cake. Everything is self-service. Toilets are available, but cost extra. …"
277,Groot Melkhuis, 3 stars ,2 years ago,(Translated by Google) We've been to this wonderful place !!! The view is incredible !!! But the food has to ask inside the restaurant and we ordered some coffees and pies that were not very good !!!! …
278,Groot Melkhuis, 5 stars ,2 years ago,(Translated by Google) Great pitch for a cup of coffee and pastry or a tasty sandwich with a large playground for the little ones …
279,Groot Melkhuis, 5 stars ,2 years ago,"(Translated by Google) A pleasant cafe with a relaxed atmosphere, perfect for relaxing after a windy walk in the park. Pea soup highly recommend …"
280,Groot Melkhuis, 4 stars ,3 years ago,(Translated by Google) The view of the Vondelpark is the restaurant's biggest attraction. The prices charged at this establishment are slightly higher than those charged at other establishments. …
281,Groot Melkhuis, 3 stars ,7 months ago,"(Translated by Google) Nice place to have a drink, especially by the water. Reasonable range of drinks and snacks. It is a pity that when you order cheese sticks and ask for mustard (instead of sweet spring roll sauce) you have to pay for a …"
282,Groot Melkhuis, 5 stars ,3 years ago,"(Translated by Google) After wandering around the Vondelpark, it is convenient to take a short break and have a drink. When you walk to the end of Vondelpark, you will see this sweet place on the right. …"
283,Groot Melkhuis, 1 star ,2 years ago,"(Translated by Google) Long queue at the self service buffet, everything is expensive and the play equipment very outdated. The most annoying is that you can not go to the bathroom, even if you are a customer! You then have to join the back …"
284,Groot Melkhuis, 4 stars ,8 months ago,"(Translated by Google) Very nice ambience! WC chargeable.

(Original) …"
285,Groot Melkhuis, 4 stars ,a week ago,"(Translated by Google) Is nice for the family but a bit expensive

(Original) …"
286,Groot Melkhuis, 3 stars ,7 months ago,(Translated by Google) Location top. Only the service mediocre. Takeaway menu with small dishes. Which should normally be of better quality. You really pay for the location. …
287,Groot Melkhuis, 5 stars ,8 months ago,(Translated by Google) Nice to sit after a bike ride criss-cross through Amsterdam …
288,Groot Melkhuis, 5 stars ,5 months ago,(Translated by Google) Always a treat to go here with kids; for moms and dads as well as for the little ones! …
289,Groot Melkhuis, 5 stars ,6 months ago,"(Translated by Google) Idyllic location in the park with a playground for the children. You can sit right at the playground, the cappuccino and strawberry cake were great and at a fair price. …"
290,Groot Melkhuis, 1 star ,2 months ago,(Translated by Google) Horribly disinterested staff and prices not in line with the Quality delivered …
291,Groot Melkhuis, 5 stars ,7 months ago,"(Translated by Google) Great place, in the middle of the park 😃and really delicious pancakes, perfect wine when you're there with the kids. Prices are ok for the location. Staff very nice …"
292,Groot Melkhuis, 4 stars ,a year ago,(Translated by Google) Nice place but self-service and extra costs for the toilet …
293,Groot Melkhuis, 4 stars ,3 years ago,(Translated by Google) A nice and great park to miss an afternoon. You can't miss it if you go on vacation to Amsterdam …
294,Groot Melkhuis, 5 stars ,3 years ago,"(Translated by Google) Super nice view and incredibly delicious food. By the way, also affordable ;-) …"
295,Groot Melkhuis, 5 stars ,3 months ago,"(Translated by Google) Super variety of cheeses and flavors. Goat, sheep, and cow with Green and red pesto etc …"
296,Groot Melkhuis, 5 stars ,2 years ago,(Translated by Google) Nice cafe in the middle of the Vondelpark. Perfect for a small or big break from the hustle and bustle of the city center. …
297,Groot Melkhuis, 3 stars ,3 years ago,"(Translated by Google) Because of the price and the crowds on nice days three stars. For the rest, it is a nice place to drink a cup of coffee on the terrace. …"
298,Groot Melkhuis, 1 star ,4 months ago,"(Translated by Google) They got my order wrong twice. Terrible, also very slow service. …"
299,Groot Melkhuis, 5 stars ,2 years ago,(Translated by Google) Terrace in the middle of the vondel Park in Amsterdam. With great variety of food and drink. …
300,Groot Melkhuis, 4 stars ,8 months ago,(Translated by Google) It was in a beautiful spot in the Vondelpark Amsterdam on the water. With a playground for the children. Just a pity that when we were there there was little choice in food …
301,Groot Melkhuis, 3 stars ,2 years ago,(Translated by Google) Nice because it's in the middle of the park but the restaurant bar isn't much. …
302,Groot Melkhuis, 4 stars ,11 months ago,"(Translated by Google) Was nice ff out during this time, can not write a review because they were only allowed to sell drinks from a table in itself very happy with this time 😎😇🧐 …"
303,Groot Melkhuis, 4 stars ,7 months ago,"(Translated by Google) Good, fun with kids.
Price is too expensive for a pancake I thought. …"
304,Groot Melkhuis, 3 stars ,a year ago,"(Translated by Google) Fantastic location but self service .... really inhospitable and unnecessary during corona.
Furthermore, the walking directions are awkward, the mandatory hand gel stinks …"
305,Groot Melkhuis, 5 stars ,2 years ago,(Translated by Google) A very nicely located cafe in Vondelparkin. A nice resting point if you are tired of walking. …
306,Groot Melkhuis, 4 stars ,3 years ago,"(Translated by Google) Practically a high service, canned beer, you get it, pay at the cashier and choose a table in the sun and enjoy :) …"
307,Groot Melkhuis, 5 stars ,a year ago,(Translated by Google) Nice place ideal when the terraces are allowed to open again. Vondelpark currently closed due to covid measure. Enjoy the green heart of Amsterdam center in the sun. …
308,Groot Melkhuis, 4 stars ,7 months ago,"(Translated by Google) OK. Tomorrow we will come back again. Not everyone has Facebook, luckily 🙂 see you tomorrow …"
309,Groot Melkhuis, 4 stars ,7 months ago,"(Translated by Google) Nice playground, price as you can expect from location, lots of seating, lacks a 0% specialty beer …"
310,Groot Melkhuis, 1 star ,6 months ago,(Translated by Google) The toilets are chargeable while you eat in the cafe. The waitresses don't take the time to explain and are not very pleasant. …
311,Groot Melkhuis, 5 stars ,6 months ago,"(Translated by Google) Very cozy sitting and enjoying the water.

(Original) …"
312,Groot Melkhuis, 5 stars ,3 years ago,(Translated by Google) A moment of calm .. a light meal .. this park in the middle of the city is superb .. it feels good there …
313,Groot Melkhuis, 4 stars ,2 years ago,(Translated by Google) Very nice place outdoors basic food pizas sandwiches but rich and not very expensive …
314,Groot Melkhuis, 4 stars ,7 months ago,(Translated by Google) You can enjoy a drink in the sun while the children play. …
315,Groot Melkhuis, 2 stars ,3 years ago,"(Translated by Google) Prime location and fun playground for children. However, the 'self-service' system is a disaster and also far too expensive. I queued for 30 minutes to order and then had to wait another 20 minutes for a half melted …"
316,Groot Melkhuis, 1 star ,3 years ago,"(Translated by Google) The club that runs this does not deserve such a nice place in the park. Semi-cooked service buffet, poorly maintained playground, unclear. And they open and close when it suits them. Also in the middle of school …"
317,Groot Melkhuis, 1 star ,7 months ago,"(Translated by Google) Rude staff, 9 times out of 10. Shame about the great location. Never again for us. …"
318,Groot Melkhuis, 5 stars ,8 months ago,"(Translated by Google) Perfect for a day with the family!

(Original) …"
319,Groot Melkhuis, 1 star ,a year ago,(Translated by Google) Very inhospitable. Had dinner and drinks with the whole family but had to pay extra to use the toilet. As a guest you are not taken seriously here at all. …
320,Groot Melkhuis, 2 stars ,a year ago,(Translated by Google) Good place to have lunch but there are 2 women at the toilet entrance who ask you to pay 70 cents for the toilet while I just paid for my lunch! I really don't think this is hospitable otherwise I would have given it …
321,Groot Melkhuis, 1 star ,2 years ago,"(Translated by Google) Who thinks up a self-service restaurant in the middle of the park. (Where children play)
Queue at the counter is overly long. …"
322,Groot Melkhuis, 5 stars ,2 years ago,"(Translated by Google) A wonderful place for everyone, both children and adults. The children can play all kinds of games in the sandbox or at the attractions. Eat an ice cream, eat pancakes or chocolate milk with whipped cream and parents …"
323,Groot Melkhuis, 3 stars ,3 years ago,"(Translated by Google) Closed playground in the Vondelpark. In the summer it is nice and quiet between the screaming children with a beer. While your children go wild in the sandbox, on the swing, the cable car or a climbing frame. Despite …"
324,Groot Melkhuis, 5 stars ,a year ago,(Translated by Google) When the Groot Melkhuis is open (hopefully soon) it is a great place to have something to eat and / or drink. Not expensive and friendly staff! …
325,Groot Melkhuis, 3 stars ,8 months ago,"(Translated by Google) A lot of rubbish remains, children's attractions often broken. Staff fine …"
326,Groot Melkhuis, 4 stars ,2 years ago,(Translated by Google) Oh poor poor man. Have me on your very first day at work. Have ordered two coke and checkout. Do I also want a receipt ..... But nice and comfortable. Very unfortunate that you have to pay for the tpilet. Even if you …
327,Groot Melkhuis, 5 stars ,9 months ago,(Translated by Google) Great place to rest and let the kids play. The food and drinks are great and the price .... really not expensive. …
328,Groot Melkhuis, 4 stars ,8 months ago,"(Translated by Google) Nice place to have a drink after a walk in the Vondepark

(Original) …"
329,Groot Melkhuis, 3 stars ,3 years ago,"(Translated by Google) Nice place to have a beer or juice by the water's edge in the middle of the park. Prices are a bit high, but nothing different from the rest of the city. The way they announce that your order is ready is a bit …"
330,Groot Melkhuis, 3 stars ,3 years ago,"(Translated by Google) As is so often the case in Amsterdam, people are unnecessarily high on a fairly basic coffee tent. Location is nice, but the Vondelpark is currently quite worn out and so are these restaurants. The staff are also …"
331,Groot Melkhuis, 5 stars ,4 years ago,(Translated by Google) Delicious peppermint tea. Many beautiful birds near the tables. …
332,Groot Melkhuis, 2 stars ,a year ago,(Translated by Google) This has to be done differently. 20 min in line to pay for two soft drinks that I already have in my hand the whole line. …
333,Groot Melkhuis, 3 stars ,2 years ago,"(Translated by Google) Nice terrace, separate children's section. No table service. …"
334,Groot Melkhuis, 4 stars ,2 years ago,"(Translated by Google) It's really fun for kids. A pity that they no longer had pancakes at half past five. I promised my nephew. So make sure you are on time for 5 hours, otherwise you are out of luck. …"
335,Groot Melkhuis, 3 stars ,3 years ago,(Translated by Google) Very beautiful and quiet place. But that was a spoiled moment by the wasp invasion. We couldn't take advantage. Food and hospitality not great. This setting is recommended for the view. …
336,Groot Melkhuis, 5 stars ,8 months ago,(Translated by Google) Beautiful sits in the middle of Vondelpark. Lovely place to relax …
337,Groot Melkhuis, 3 stars ,2 years ago,"(Translated by Google) The terrace is large and there are many tables to sit on. The staff is friendly. Unfortunately, the food offered in the self service are very expensive and much is packed in plastic. …"
338,Groot Melkhuis, 4 stars ,6 years ago,"(Translated by Google) A bar serving hot and cold drinks and various desserts. The food is not memorable but compensates for all the splendid location, by the lake, in which to relax while sipping tea and eating the typical appeltaart. …"
339,Groot Melkhuis, 4 stars ,a year ago,(Translated by Google) Super fun playground for children! Great restaurant to take some (self-service). Place in Vondelpark is of course top. …
340,Groot Melkhuis, 4 stars ,3 years ago,"(Translated by Google) A nice cafe on the water and on the playground. Children can enjoy themselves while you drink a nice cup of tea.
Nice staff. Only downside is that it is self service, and very long lines at the …"
341,Groot Melkhuis, 1 star ,4 years ago,"(Translated by Google) Table was filthy, staff cleared away but there were still many leftovers and they were not cleaned up. It is self-service and not very cozy in terms of atmosphere. Nice for children because of the large playground. …"
342,Groot Melkhuis, 1 star ,6 months ago,"(Translated by Google) Rude waitresses, too bad because beautiful place ...

(Original) …"
343,Groot Melkhuis, 1 star ,6 years ago,"(Translated by Google) Watch out with the staff here!
Yesterday afternoon my son wanted to get a lollipop.
That could well it was very quiet …"
344,Groot Melkhuis, 4 stars ,3 years ago,"(Translated by Google) Beautiful memories.....
A household name for years ...
Hadn't been there for a long time and a lot has changed ... too bad ... …"
345,Groot Melkhuis, 5 stars ,2 months ago,"(Translated by Google) Lovely place on the water, in the middle of Vondelpark. Lots of homemade products.
Although it is sometimes very busy at the counter, you always see happy faces. …"
346,Groot Melkhuis, 2 stars ,3 years ago,(Translated by Google) At first it looked very nice to sit along the water. But the food was very disappointing. (Pre-made and cooled. Also self-service) price quality therefore less. …
