,Name,Review Rate,Review Time,Review Text
0,Starbucks, 5 stars ,3 months ago,There was 2 English speakers girls who were in a really good and nice mood. The service was also very quick and the coffee was delicious. Amazing job team!
1,Starbucks, 4 stars ,2 years ago,This is a nice A funny Starbucks branch since they didn’t even have a cappuccino on the menu (but you can order it 😉) the staff was nice on a late weekend night and even the coffee was okay. The option to have some of the cookies heated is a big plus and that made the experience so much better .
2,Starbucks, 2 stars ,a month ago,Actually weird  tht that place had no toilet  . If u ask them if u have toilet they send you to mc Donald’s next door. Pffff
3,Starbucks, 2 stars ,4 months ago,Not the nicest of Starbucks. Didn't seem to be ready for checking codes.  Person taking orders was also checking codes  so took longer to order. Would have bn easier to do as u came in
4,Starbucks, 1 star ,2 months ago,"Slowest service ever. There were 4 person to serve and I had to wait almost 30 minutes. Normally in Netherlands service are slow, so no big surprise, but here it's even slowest than usual."
5,Starbucks, 4 stars ,2 years ago,They are verry fast. Good starbucks. But with all other caffe shops in Amsterdam this is not must visit place.
6,Starbucks, 1 star ,4 months ago,"Woof. Guy sat in the corner and was playing Justin Bieber’s Stay LOUD on a LOOP, occasionally yelling. It was 09:00. He was not being told to stop, even when he clearly started bothering a girl sitting next to him. Aside from allowing the …"
7,Starbucks, 3 stars ,3 years ago,"Nice location and a good stop for a coffee fix.  Five cheese toasty was nice and toasty, but’s it’s cheese on bread for €4.50....really....€4.50? It could have been €2.50 and they’d make a good profit on it. The pumpkin spice latte (PSL) …"
8,Starbucks, 1 star ,3 years ago,Due to how busy this place is - it should have a person cleaning the dining area constantly.  Also they drip coffee (tasted burnt).  For high volume they should have better quality.
9,Starbucks, 1 star ,3 months ago,Worst Starbucks ever! Pandemic going on and no alcohol for the hands. Flies all over the place and the whole place not hygienic.
10,Starbucks, 1 star ,7 months ago,"No lavatory, coffee like watered down instant. I already had a very bad Espresso experience in the US, Starbucks second chance to provide me with a good coffee... total fail. A waste of money!"
11,Starbucks, 5 stars ,4 months ago,Fast and good service. Friendly staff Nothing special a regular Starbucks experience
12,Starbucks, 1 star ,2 months ago,"Offers coffee for 5€, does not provide toilet and shouts at you if you sit down"
13,Starbucks, 5 stars ,3 years ago,Excellent ✌️ very friendly and helpful service 👍 I made a mistake when ordering and received free replacement drink 😁
14,Starbucks, 1 star ,a month ago,Bad customer service!! I wish I hadn’t stopped in here !!
15,Starbucks, 2 stars ,8 months ago,"This is the filthiest Starbucks I've seen. All the tables are dirty, even the counter where they serve the drinks had dirty dishes all over it. When the line died down and no one was waiting to order or to be served, they still didn't go out to clean the tables."
16,Starbucks, 4 stars ,4 months ago,"Located in a great spot.
No bathroom on site."
17,Starbucks, 5 stars ,2 years ago,Great staff and enjoyable atmosphere. All I wish is for some tables outside but it's fine since leidseplein is right below to sit around.
18,Starbucks, 1 star ,6 months ago,"No wc inside, dirty table. We need to ask two times to come to clean."
19,Starbucks, 5 stars ,2 years ago,"Same quality Starbucks coffee, with as close as you can get to a New York style cheesecake"
20,Starbucks, 3 stars ,a year ago,"Sometimes you need a taste of home. Good Starbucks, friendly and fast. Never going to be spectacular but rarely bad. Would rather go to a local coffee shop here in Amsterdam but this is a good, reliable second choice."
21,Starbucks, 4 stars ,4 years ago,one of the best place for coffee and chill out.   1star reduced because limitations in seating arrangement.
22,Starbucks, 1 star ,a year ago,"The waiter was extremely rude. I order in Dutch so there was no possible excuse. He put whipped cream in my frapuccino which i didnt order. Once i mentioned, sorry i didnt order whipped cream.he took it, removed the whiped cream fast from …"
23,Starbucks, 5 stars ,2 years ago,"Great service with friendly English speaking staff. Nice and cool inside with the air con on a hot summer's day. The Java Chip frappucchino with soy milk was delicious. It was busy with customers and orders but they managed it well and consequently, the waiting time wasn't too long."
24,Starbucks, 4 stars ,7 months ago,"Very good coffee just a bad location but its not their fault, customer service was very nice."
25,Starbucks, 5 stars ,2 years ago,"People are great! They are the first coffee shop in Amsterdam that opens at 6:30am. Staff is super friendly. My only complain is they don't have Splenda or Stevia, but that is a problem in ALL Europe :( anyhow they have Non Lactose Milk and I am happy about it."
26,Starbucks, 5 stars ,2 years ago,"Fast & high quality service even during the rush hour, very nice baristas."
27,Starbucks, 3 stars ,a month ago,Small place without toilet's
28,Starbucks, 2 stars ,8 months ago,My expectations were not met. The staff are in need of training. This was certainly not the Starbucks experience I have been accustomed too.
29,Starbucks, 4 stars ,4 years ago,Just as any Starbucks but smaller and fewer tables. Good barista though
30,Starbucks, 1 star ,2 months ago,"Overrated, expensive and slow service"
31,Starbucks, 5 stars ,2 weeks ago,Very good as always
32,Starbucks, 1 star ,3 years ago,"I have been there several times now, they made a mistake twice now, some of the staff is very rude when you tell them they got the order wrong. Even though you can see the order written by themselves on the cup. Not the Starbucks service I …"
33,Starbucks, 5 stars ,4 years ago,"This Starbucks had a most welcoming and friendly staff! Made me feel very comfortable and welcomed (Thanks Huseyin!). Also, this Starbucks is open till late at night, 12am, which is nice. …"
34,Starbucks, 5 stars ,3 years ago,Very friendly staff. I ordered a iced cappuccino and didn't like it much. A very charming waiter noticed and offered to change it to something else with a smile. Clean and professional and accommodating.
35,Starbucks, 1 star ,2 years ago,"The location is good, BUT this place has NO TOILETS! And a staff member was a bit rude when asking if I wanted to order more coffee (or leave the table!). Not a good place to go with friends for a chat with coffee, or work a bit."
36,Starbucks, 5 stars ,2 years ago,Warm caffee during cold evenings:)
37,Starbucks, 5 stars ,2 years ago,"The coffee looked weird. It was brown and very hot (burned my mouth). So strange. Had 12 more. This happened 26 hours ago, I'm still awake. Is this normal?"
38,Starbucks, 4 stars ,4 years ago,"Regular Starbucks with everything you could expect on the menu. Staff is very friendly and nice but not very well organized, we went twice and each time they forgot part of our order and we had to ask again... Although they offered a free drink to apologize, which was a nice gesture."
39,Starbucks, 3 stars ,2 years ago,Crepes were fine.  Coffee Cup filled to the brim had to wait 5 mind for content to cool down before I could drink some to make space for milk...
40,Starbucks, 4 stars ,3 years ago,Starbucks is always a consistent experience in every country I have visited and this one was no exception! …
41,Starbucks, 4 stars ,2 years ago,StarBucks the great American chain of coffee and frappacino stores has one of their stores close to Amsterdam’s Leidseplein entertainment area. …
42,Starbucks, 2 stars ,2 years ago,I would expect at least a well made coffee at Starbucks with the high prices. I got a simple cappuccino and the milk was not foamed well and the coffee was tasting burned. Bad experience.
43,Starbucks, 5 stars ,2 years ago,Nice place personel and yes next to the bulldog and MC
44,Starbucks, 5 stars ,3 years ago,"Awesome place, specially because the service is so kind and helpful.
I actually left my backpack and they put it away in a safe place and returned it with a big smile!!
Great team!!"
45,Starbucks, 5 stars ,2 years ago,Nice Starbucks. Clean cafe and a nice patio to sit on. It is one of the busier shops but the coffee is really tasty. Very nice staff too.
46,Starbucks, 2 stars ,7 years ago,"Nice to enjoy Starbucks beverages but this place is small, there is no toilets and this is quite noisy. Therefore, there is absolutely no reason to spend EUR 4 - 5 for a drink in this place!"
47,Starbucks, 4 stars ,5 years ago,"As with any franchise, the people make the difference. I found this location to be clean and the staff where fast, friendly, and patient. The seating is a bit awkward, so I'd recommend grabbing something to go."
48,Starbucks, 5 stars ,3 years ago,"A branch of Starbucks coffee.  Good range of coffees, teas and cold drinks.  Good choice of sandwiches, cakes, biscuits etc.  In an old large house, well worth a visit."
49,Starbucks, 4 stars ,2 years ago,"Its a good big Starbucks. Great staff,nice drinks. Let down by the tourists using the toilets non stop."
50,Starbucks, 4 stars ,3 years ago,"They were very nice , as well as STARBUCKS that does NOT accept Starbucks gift card pmts. I blame corporate for that. Otherswise this was a nice place"
51,Starbucks, 3 stars ,2 years ago,"Friendly service, great coffee. However, the place is quite small and tables were not cleaned frequently."
52,Starbucks, 1 star ,2 years ago,"I always visit to this Starbucks But!!!

!!! Stuff (guy in black glasses) is FORCING !!! (NOT asking) to BUY something …"
53,Starbucks, 3 stars ,3 years ago,"Nice location, friendly staff and open late. In the winter time the seating area can be a bit cold and drafty due to an inconsistently closed door."
54,Starbucks, 1 star ,a year ago,Horrible service where staff feel like they’re doing you a favor by taking your order.
55,Starbucks, 3 stars ,8 months ago,See customers weren't masked and no employee said anything.
56,Starbucks, 1 star ,4 months ago,Very rude barrista
57,Starbucks, 4 stars ,6 months ago,Very central and nice staff.
58,Starbucks, 5 stars ,a year ago,"Had a triple chocolate latte, fast and good service even in covid19 time."
59,Starbucks, 5 stars ,4 years ago,"Clean place, good WiFi."
60,Starbucks, 4 stars ,3 years ago,"It’s always been really crowded in here, but the staff are quick and friendly. I’d avoid this Starbucks and go further into Centrum. There is a larger Starbucks near Dam Square."
61,Starbucks, 5 stars ,2 years ago,"This Starbucks’s as become a common place for me to grab s coffee, always great service and consistently made coffee. Recommend!"
62,Starbucks, 2 stars ,4 years ago,Coffee was terrible as Starbucks coffee usually is. The service was not good and slow in general. Only good thing is that it is the only coffee shop in the area that opened till midnight.
63,Starbucks, 4 stars ,3 years ago,"sit with a good friend and talk and talk and talk, no one bothers you, coffee is excellent, its awesome because Amsterdam is awesome! once done go out and walk a lot :)"
64,Starbucks, 5 stars ,8 months ago,Kind service and nice drinks.
65,Starbucks, 3 stars ,4 years ago,"Uncomfortable seating, the tables were weirdly low where we tried to do some work on our laptops. Also, please get more power outlets!"
66,Starbucks, 5 stars ,5 years ago,"The place is very good. The staff is very friendly .
The problem is that the place is not big and always crowded. I think this is a general thing in Amsterdam , most of cafe are not big."
67,Starbucks, 2 stars ,2 years ago,Not a fan of their coffee and the fact that they don't have a customer's toilet made it more undesirable to go buy food or a drink.
68,Starbucks, 4 stars ,5 years ago,Very nice place to have proper size coffee. Cakes look very tempting but taste not as great.
69,Starbucks, 4 stars ,2 years ago,"Its Starbucks, much like any other Starbucks around the world. If you like your coffee, like I do, it's a good place to stop by at."
70,Starbucks, 5 stars ,a year ago,"Attentive staff, clean."
71,Starbucks, 3 stars ,a year ago,"It's a Starbucks, what can I say? Everything is good and expensive except the coffee, the coffee is just expensive."
72,Starbucks, 5 stars ,3 years ago,Amazing frapuccino. Strong opened free wifi. Can find a place to sit if you wait a bit
73,Starbucks, 5 stars ,2 years ago,So convenient for early morning  coffee sit at the window watch the world go by nice staff
74,Starbucks, 4 stars ,2 years ago,Went there for a shelter for the terrible wind and rain but sat for hours. The staff are super nice!
75,Starbucks, 5 stars ,a year ago,"Sweet bevery, large choice of drinks, and kind staff"
76,Starbucks, 5 stars ,3 years ago,The review don't do this place justice. It's a great place to go eyeball to eyeball with punks from all over Europe.
77,Starbucks, 2 stars ,a year ago,Staff is rude and slow. No toilets and very small place.
78,Starbucks, 4 stars ,a year ago,Pretty much the same as any other Starbucks..
79,Starbucks, 4 stars ,2 years ago,"Generic, small sized Starbucks, fast service and a few tables to sit down at."
80,Starbucks, 1 star ,2 years ago,"Awful customer service and poor quality coffee, not as good as usual Starbucks"
81,Starbucks, 5 stars ,3 years ago,"Employees are nice, good quality coffee, quick service"
82,Starbucks, 5 stars ,2 years ago,Friendly staff. Dog friendly place. Great coffee.
83,Starbucks, 3 stars ,4 years ago,Good for getting coffee to go. Not good if you're planning on actually drinking it there
84,Starbucks, 1 star ,4 years ago,"Nasty quality coffee, go see the Dutch alternative Coffee company. Thank you for charging me extra for some coffee shot you didn't tell me about."
85,Starbucks, 5 stars ,2 years ago,Standard Starbucks experience. Nice staff and cozy place.
86,Starbucks, 3 stars ,4 years ago,"It's a starbucks, not much else to say. Good seating and decent service."
87,Starbucks, 4 stars ,4 years ago,A good place to wait McDonald's for your breakfast. Unfortunately there was no bathroom.
88,Starbucks, 3 stars ,4 years ago,"what do you expect its a Starbucks, but this one had no toilet so i had to go into McDonalds to ... well...... you know"
89,Starbucks, 5 stars ,2 years ago,Hot tall Caramel macchiato that's my choice always
90,Starbucks, 3 stars ,5 years ago,As far as Starbucks go this is about as plain as you can get.  The coffee though is good.
91,Starbucks, 3 stars ,5 years ago,"Crowded place, mainly tourists. Enough alternatives in the area for good coffee in a nicer environment."
92,Starbucks, 5 stars ,4 years ago,Lovely place to grab breakfast. The staff are lovely and the service is excellent.
93,Starbucks, 5 stars ,2 years ago,"Always good coffee, dont mind waiting for it"
94,Starbucks, 4 stars ,5 years ago,"Another great Starbucks, could've had more people working as there was a wait"
95,Starbucks, 5 stars ,2 years ago,In shopping area. Delicious coffee. Great service. Free wifi.
96,Starbucks, 4 stars ,2 years ago,"A normal Starbucks in a busy area, service in good standard."
97,Starbucks, 5 stars ,4 years ago,"Great service, a machine was broken and quickly fixed. 2 free drinks for the trouble"
98,Starbucks, 3 stars ,2 years ago,"It is a place for coffee and refreshments.
Very popular with American tourists...."
99,Starbucks, 3 stars ,3 years ago,"The staff is polite, but food and drinks are a nightmare."
100,Starbucks, 5 stars ,4 years ago,"Food was made fast, staff were very friendly."
101,Starbucks, 4 stars ,4 years ago,Too bland interior. But as expected of Starbucks - great service!
102,Starbucks, 1 star ,2 years ago,I've travelled to 30+ countries and 100s of Starbucks that have starbucks and this is the worst one Ive been to.
103,Starbucks, 5 stars ,2 years ago,Excellent service delicious and fast food
104,Starbucks, 5 stars ,3 weeks ago,its a starbucks ;)
105,Starbucks, 4 stars ,4 years ago,"polite staff, fast service considering it was a weekend and busy (a busy spot int he city)"
106,Starbucks, 3 stars ,3 years ago,"Busy location with all tourists, all the time, and heavy rotation on the staff, meaning new people who don't always know what they're doing."
107,Starbucks, 5 stars ,4 years ago,"Some say it's not even good coffee, but bad coffee is better than no coffee"
108,Starbucks, 4 stars ,4 years ago,"Busy so obviusly one must wait but grear staff, food & hot drinks"
109,Starbucks, 2 stars ,3 years ago,No toilet got to pee at the Mcdo (thus McToilet) across the street
110,Starbucks, 5 stars ,2 years ago,Nice coffee... Cosy setting... Nice staff..
111,Starbucks, 1 star ,3 years ago,They got both of my orders wrong and told me they don't have the scanner to pay with the app.
112,Starbucks, 3 stars ,8 months ago,Too much ice in the frappubrainfreezeeno
113,Starbucks, 5 stars ,2 years ago,"Busy, be prepared for a wait but typical Starbucks"
114,Starbucks, 4 stars ,2 years ago,To small
115,Starbucks, 5 stars ,4 years ago,"Friendly service, can recommend the almond stars - yummy!"
116,Starbucks, 5 stars ,2 years ago,Nice store. Crowded in the morning. Nice service
117,Starbucks, 1 star ,2 years ago,Guy at the register could use a coffee himself. Super cranky
118,Starbucks, 5 stars ,4 years ago,"The coffee was very good, and the waitress very kind!"
119,Starbucks, 1 star ,2 years ago,I would never buy nothing from this pseudo cafe. All is bad
120,Starbucks, 2 stars ,3 years ago,"OK as Starbucks goes anywhere in the world, nice frappacino... 😊"
121,Starbucks, 4 stars ,2 years ago,Good but not many places to sit
122,Starbucks, 3 stars ,2 years ago,"Mediocre coffee at exquisite prices.
Friendly staff."
123,Starbucks, 1 star ,2 years ago,Starbucks uses child labour to pick coffee beans.
124,Starbucks, 5 stars ,7 years ago,"No waiting time, nice staff, free Wi-Fi."
125,Starbucks, 4 stars ,5 years ago,"Always crowded,  staff does a great job of keeping the line moving though."
126,Starbucks, 3 stars ,2 years ago,Okay but 3 stars goes to luck of toilet.
127,Starbucks, 4 stars ,3 years ago,Very busy but good quick service.
128,Starbucks, 5 stars ,5 years ago,Love this one. Staff is always friendly and work fast
129,Starbucks, 5 stars ,4 years ago,Nice and clean starbucks. Not much to say about it.
130,Starbucks, 1 star ,5 years ago,"Wait wait wait forever ,try to avoid this one or Walk to Overtoom much better there"
131,Starbucks, 5 stars ,4 years ago,I love matcha latte with coconut milk.
132,Starbucks, 4 stars ,a year ago,Very good American coffee
133,Starbucks, 3 stars ,6 years ago,"Just another Starbucks. If you like Starbucks, you will probably like this one too."
134,Starbucks, 4 stars ,4 years ago,Typical Starbucks store but great location
135,Starbucks, 5 stars ,3 years ago,Cozy and nice! Coffee was delicious :)
136,Starbucks, 3 stars ,2 years ago,"Be careful of the tables, some are not stable."
137,Starbucks, 4 stars ,2 years ago,"No WC, other than that it's your usual Starbucks."
138,Starbucks, 4 stars ,3 years ago,The usual Starbuck! But no gluten free breakfast
139,Starbucks, 5 stars ,4 years ago,Very nice decorated and friendly stuff. :)
140,Starbucks, 3 stars ,5 years ago,"Small Starbucks. I went there to get some work done, but it was hard to focus."
141,Starbucks, 3 stars ,5 years ago,"Always busy, you will be lucky to find a place to sit here"
142,Starbucks, 5 stars ,2 years ago,Found it just when I needed one. Great.
143,Starbucks, 4 stars ,2 years ago,Good service no restrooms
144,Starbucks, 1 star ,2 years ago,go to worst... sofas or singles couch are a must
145,Starbucks, 5 stars ,2 years ago,It's Starbucks... Good coffee 😊
146,Starbucks, 1 star ,2 years ago,They do not have a toilet
147,Starbucks, 5 stars ,2 years ago,Lovely store with friendly staffs
148,Starbucks, 4 stars ,3 years ago,"Good coffee, no bathrooms"
149,Starbucks, 5 stars ,4 years ago,"Clean place, great food and drinks"
150,Starbucks, 4 stars ,4 years ago,Friendly staff and quick with orders
151,Starbucks, 4 stars ,4 years ago,They don't take Starbucks cards in the Netherlands
152,Starbucks, 3 stars ,2 years ago,"It's more one Starbucks and not the ""Starbucks"""
153,Starbucks, 5 stars ,3 years ago,Nice employees and good service
154,Starbucks, 4 stars ,2 years ago,Nice place!
155,Starbucks, 5 stars ,3 years ago,One of my best Starbucks
156,Starbucks, 5 stars ,2 years ago,Love it 😍 nice service!
157,Starbucks, 5 stars ,2 years ago,Lovely place for hot beverages
158,Starbucks, 5 stars ,3 years ago,"My favorite, excellent service!"
159,Starbucks, 3 stars ,3 years ago,I'm not sure about coffe in Starbucks
160,Starbucks, 5 stars ,3 years ago,Relaxing place. Feel art. I love it.
161,Starbucks, 3 stars ,5 years ago,"Bad service, no smiley on my cup;("
162,Starbucks, 1 star ,4 years ago,Super slow. Without a toilet. Unacceptable.
163,Starbucks, 5 stars ,2 years ago,The staff here is always helpful
164,Starbucks, 5 stars ,3 years ago,My morning coffee.
165,Starbucks, 3 stars ,4 years ago,Staff can't speak Dutch. Their English is poor
166,Starbucks, 1 star ,3 years ago,"No accurate drink, dirty place."
167,Starbucks, 5 stars ,3 years ago,Love for Coffee at its peak !!
168,Starbucks, 5 stars ,3 years ago,Big starbucks quick service
169,Starbucks, 1 star ,4 years ago,Bad coffee. Weak and watery espresso.
170,Starbucks, 5 stars ,3 years ago,I love Starbucks Coffee ☕
171,Starbucks, 3 stars ,2 years ago,Its Starbucks. Nothing special!
172,Starbucks, 1 star ,4 years ago,Terrible service!! And very rude
173,Starbucks, 2 stars ,5 years ago,"Small, rather filthy and no bathrooms"
174,Starbucks, 5 stars ,5 years ago,Nice and delicious coffee.
175,Starbucks, 4 stars ,3 years ago,Again they spell my name wrong 😅
176,Starbucks, 5 stars ,4 years ago,Best one all around
177,Starbucks, 3 stars ,2 years ago,Mediocre coffee and no outlets
178,Starbucks, 5 stars ,5 years ago,Stuffs are friendly and place is very central.
179,Starbucks, 5 stars ,2 years ago,Very nice
180,Starbucks, 3 stars ,2 years ago,Hardly any places to sit.
181,Starbucks, 1 star ,2 years ago,Slowest Starbucks on the planet...🙄
182,Starbucks, 1 star ,2 years ago,There is no toilet!
183,Starbucks, 5 stars ,3 years ago,All good
184,Starbucks, 4 stars ,5 years ago,"Little too small, but ok"
185,Starbucks, 4 stars ,a year ago,Flat White was prima
186,Starbucks, 2 stars ,2 years ago,"Typical Starbucks, overpriced"
187,Starbucks, 5 stars ,5 years ago,But there's no toilet
188,Starbucks, 4 stars ,2 years ago,Environment for a nice chat
189,Starbucks, 3 stars ,2 years ago,No wc
190,Starbucks, 4 stars ,4 years ago,"Small Starbucks, but with plenty of seats."
191,Starbucks, 3 stars ,4 years ago,It's okay. Nothing special
192,Starbucks, 4 stars ,2 years ago,No toilet here.
193,Starbucks, 3 stars ,5 years ago,Central but not many seats
194,Starbucks, 3 stars ,5 years ago,Their coffee is okay
195,Starbucks, 4 stars ,2 years ago,Wow wow place to have coffee
196,Starbucks, 1 star ,3 years ago,not good coffee!
197,Starbucks, 5 stars ,4 years ago,A good place to drink a coffee
198,Starbucks, 3 stars ,3 years ago,Ok coffee
199,Starbucks, 5 stars ,7 years ago,Very nice staff.
200,Starbucks, 5 stars ,4 years ago,My Favourite place in this world
201,Starbucks, 5 stars ,4 years ago,Good service as always.
202,Starbucks, 5 stars ,5 years ago,Great American coffee
203,Starbucks, 2 stars ,3 years ago,Actually better alternatives
204,Starbucks, 3 stars ,3 years ago,Often a bit to busy.
205,Starbucks, 5 stars ,4 years ago,Just another Starbucks in another country.
206,Starbucks, 5 stars ,3 years ago,Loved it.
207,Starbucks, 5 stars ,3 years ago,Great coffee place
208,Starbucks, 5 stars ,4 years ago,Great coffee!
209,Starbucks, 5 stars ,5 years ago,Very friendly staff!
210,Starbucks, 5 stars ,a year ago,Awesome
211,Starbucks, 5 stars ,2 years ago,Like other Starbucks
212,Starbucks, 4 stars ,3 years ago,Good coffee!
213,Starbucks, 1 star ,4 years ago,A Disqusting Coffee experience
214,Starbucks, 3 stars ,2 years ago,Standard coffee place.
215,Starbucks, 4 stars ,3 years ago,Small kozy one.
216,Starbucks, 4 stars ,4 years ago,Decent small Starbucks
217,Starbucks, 5 stars ,4 years ago,Great staff...
218,Starbucks, 5 stars ,3 years ago,Even in amsterdam good
219,Starbucks, 4 stars ,5 years ago,Nice cosy place
220,Starbucks, 1 star ,2 years ago,Don't bother
221,Starbucks, 5 stars ,4 years ago,Usual deal here.
222,Starbucks, 5 stars ,5 years ago,Always lovely.
223,Starbucks, 5 stars ,3 years ago,Nice coffee.
224,Starbucks, 5 stars ,2 years ago,Nice
225,Starbucks, 5 stars ,2 years ago,Great coffee
226,Starbucks, 5 stars ,2 years ago,Good coffee
227,Starbucks, 5 stars ,2 years ago,Lovely
228,Starbucks, 2 stars ,2 years ago,Horrible coffee
229,Starbucks, 3 stars ,2 years ago,Expensive
230,Starbucks, 5 stars ,3 years ago,This is starbucks coffee.
231,Starbucks, 5 stars ,3 years ago,Bang on
232,Starbucks, 5 stars ,3 years ago,Nice environment
233,Starbucks, 4 stars ,2 years ago,It's a Starbucks.
234,Starbucks, 5 stars ,5 years ago,love the coffee
235,Starbucks, 5 stars ,3 years ago,Cool place.
236,Starbucks, 5 stars ,3 years ago,friendly staff
237,Starbucks, 5 stars ,2 years ago,It's a starbucks.
238,Starbucks, 5 stars ,5 years ago,Good
239,Starbucks, 5 stars ,3 years ago,Clean store.
240,Starbucks, 5 stars ,2 years ago,Great Starbucks
241,Starbucks, 4 stars ,4 years ago,Crowded
242,Starbucks, 5 stars ,3 years ago,Finally in Parndorf
243,Starbucks, 4 stars ,2 years ago,Nice place
244,Starbucks, 5 stars ,4 years ago,Love their cofee
245,Starbucks, 3 stars ,2 years ago,Alright...
246,Starbucks, 3 stars ,2 years ago,Just starbucks
